dateRep,day,month,year,cases,deaths,countriesAndTerritories,geoId,countryterritoryCode,popData2018,continentExp,date,iso2,iso3,cname
17/05/2020,17,5,2020,0,0,Afghanistan,AF,AFG,37172386,Asia,2020-05-17,AF,AFG,Afghanistan
16/05/2020,16,5,2020,1063,32,Afghanistan,AF,AFG,37172386,Asia,2020-05-16,AF,AFG,Afghanistan
15/05/2020,15,5,2020,113,6,Afghanistan,AF,AFG,37172386,Asia,2020-05-15,AF,AFG,Afghanistan
14/05/2020,14,5,2020,259,3,Afghanistan,AF,AFG,37172386,Asia,2020-05-14,AF,AFG,Afghanistan
13/05/2020,13,5,2020,280,5,Afghanistan,AF,AFG,37172386,Asia,2020-05-13,AF,AFG,Afghanistan
12/05/2020,12,5,2020,285,2,Afghanistan,AF,AFG,37172386,Asia,2020-05-12,AF,AFG,Afghanistan
11/05/2020,11,5,2020,369,5,Afghanistan,AF,AFG,37172386,Asia,2020-05-11,AF,AFG,Afghanistan
10/05/2020,10,5,2020,255,6,Afghanistan,AF,AFG,37172386,Asia,2020-05-10,AF,AFG,Afghanistan
09/05/2020,9,5,2020,215,3,Afghanistan,AF,AFG,37172386,Asia,2020-05-09,AF,AFG,Afghanistan
08/05/2020,8,5,2020,171,2,Afghanistan,AF,AFG,37172386,Asia,2020-05-08,AF,AFG,Afghanistan
07/05/2020,7,5,2020,168,9,Afghanistan,AF,AFG,37172386,Asia,2020-05-07,AF,AFG,Afghanistan
06/05/2020,6,5,2020,330,5,Afghanistan,AF,AFG,37172386,Asia,2020-05-06,AF,AFG,Afghanistan
05/05/2020,5,5,2020,190,5,Afghanistan,AF,AFG,37172386,Asia,2020-05-05,AF,AFG,Afghanistan
04/05/2020,4,5,2020,235,13,Afghanistan,AF,AFG,37172386,Asia,2020-05-04,AF,AFG,Afghanistan
03/05/2020,3,5,2020,134,4,Afghanistan,AF,AFG,37172386,Asia,2020-05-03,AF,AFG,Afghanistan
02/05/2020,2,5,2020,164,4,Afghanistan,AF,AFG,37172386,Asia,2020-05-02,AF,AFG,Afghanistan
01/05/2020,1,5,2020,222,4,Afghanistan,AF,AFG,37172386,Asia,2020-05-01,AF,AFG,Afghanistan
30/04/2020,30,4,2020,122,0,Afghanistan,AF,AFG,37172386,Asia,2020-04-30,AF,AFG,Afghanistan
29/04/2020,29,4,2020,124,3,Afghanistan,AF,AFG,37172386,Asia,2020-04-29,AF,AFG,Afghanistan
28/04/2020,28,4,2020,172,0,Afghanistan,AF,AFG,37172386,Asia,2020-04-28,AF,AFG,Afghanistan
27/04/2020,27,4,2020,68,10,Afghanistan,AF,AFG,37172386,Asia,2020-04-27,AF,AFG,Afghanistan
26/04/2020,26,4,2020,112,4,Afghanistan,AF,AFG,37172386,Asia,2020-04-26,AF,AFG,Afghanistan
25/04/2020,25,4,2020,70,1,Afghanistan,AF,AFG,37172386,Asia,2020-04-25,AF,AFG,Afghanistan
24/04/2020,24,4,2020,105,2,Afghanistan,AF,AFG,37172386,Asia,2020-04-24,AF,AFG,Afghanistan
23/04/2020,23,4,2020,84,4,Afghanistan,AF,AFG,37172386,Asia,2020-04-23,AF,AFG,Afghanistan
22/04/2020,22,4,2020,61,1,Afghanistan,AF,AFG,37172386,Asia,2020-04-22,AF,AFG,Afghanistan
21/04/2020,21,4,2020,35,2,Afghanistan,AF,AFG,37172386,Asia,2020-04-21,AF,AFG,Afghanistan
20/04/2020,20,4,2020,88,3,Afghanistan,AF,AFG,37172386,Asia,2020-04-20,AF,AFG,Afghanistan
19/04/2020,19,4,2020,63,0,Afghanistan,AF,AFG,37172386,Asia,2020-04-19,AF,AFG,Afghanistan
18/04/2020,18,4,2020,51,1,Afghanistan,AF,AFG,37172386,Asia,2020-04-18,AF,AFG,Afghanistan
17/04/2020,17,4,2020,10,4,Afghanistan,AF,AFG,37172386,Asia,2020-04-17,AF,AFG,Afghanistan
16/04/2020,16,4,2020,70,2,Afghanistan,AF,AFG,37172386,Asia,2020-04-16,AF,AFG,Afghanistan
15/04/2020,15,4,2020,49,2,Afghanistan,AF,AFG,37172386,Asia,2020-04-15,AF,AFG,Afghanistan
14/04/2020,14,4,2020,58,3,Afghanistan,AF,AFG,37172386,Asia,2020-04-14,AF,AFG,Afghanistan
13/04/2020,13,4,2020,52,0,Afghanistan,AF,AFG,37172386,Asia,2020-04-13,AF,AFG,Afghanistan
12/04/2020,12,4,2020,34,3,Afghanistan,AF,AFG,37172386,Asia,2020-04-12,AF,AFG,Afghanistan
11/04/2020,11,4,2020,37,0,Afghanistan,AF,AFG,37172386,Asia,2020-04-11,AF,AFG,Afghanistan
10/04/2020,10,4,2020,61,1,Afghanistan,AF,AFG,37172386,Asia,2020-04-10,AF,AFG,Afghanistan
09/04/2020,9,4,2020,56,3,Afghanistan,AF,AFG,37172386,Asia,2020-04-09,AF,AFG,Afghanistan
08/04/2020,8,4,2020,30,4,Afghanistan,AF,AFG,37172386,Asia,2020-04-08,AF,AFG,Afghanistan
07/04/2020,7,4,2020,38,0,Afghanistan,AF,AFG,37172386,Asia,2020-04-07,AF,AFG,Afghanistan
06/04/2020,6,4,2020,29,2,Afghanistan,AF,AFG,37172386,Asia,2020-04-06,AF,AFG,Afghanistan
05/04/2020,5,4,2020,35,1,Afghanistan,AF,AFG,37172386,Asia,2020-04-05,AF,AFG,Afghanistan
04/04/2020,4,4,2020,0,0,Afghanistan,AF,AFG,37172386,Asia,2020-04-04,AF,AFG,Afghanistan
03/04/2020,3,4,2020,43,0,Afghanistan,AF,AFG,37172386,Asia,2020-04-03,AF,AFG,Afghanistan
02/04/2020,2,4,2020,26,0,Afghanistan,AF,AFG,37172386,Asia,2020-04-02,AF,AFG,Afghanistan
01/04/2020,1,4,2020,25,0,Afghanistan,AF,AFG,37172386,Asia,2020-04-01,AF,AFG,Afghanistan
31/03/2020,31,3,2020,27,0,Afghanistan,AF,AFG,37172386,Asia,2020-03-31,AF,AFG,Afghanistan
30/03/2020,30,3,2020,8,1,Afghanistan,AF,AFG,37172386,Asia,2020-03-30,AF,AFG,Afghanistan
29/03/2020,29,3,2020,15,1,Afghanistan,AF,AFG,37172386,Asia,2020-03-29,AF,AFG,Afghanistan
28/03/2020,28,3,2020,16,1,Afghanistan,AF,AFG,37172386,Asia,2020-03-28,AF,AFG,Afghanistan
27/03/2020,27,3,2020,0,0,Afghanistan,AF,AFG,37172386,Asia,2020-03-27,AF,AFG,Afghanistan
26/03/2020,26,3,2020,33,0,Afghanistan,AF,AFG,37172386,Asia,2020-03-26,AF,AFG,Afghanistan
25/03/2020,25,3,2020,2,0,Afghanistan,AF,AFG,37172386,Asia,2020-03-25,AF,AFG,Afghanistan
24/03/2020,24,3,2020,6,1,Afghanistan,AF,AFG,37172386,Asia,2020-03-24,AF,AFG,Afghanistan
23/03/2020,23,3,2020,10,0,Afghanistan,AF,AFG,37172386,Asia,2020-03-23,AF,AFG,Afghanistan
22/03/2020,22,3,2020,0,0,Afghanistan,AF,AFG,37172386,Asia,2020-03-22,AF,AFG,Afghanistan
21/03/2020,21,3,2020,2,0,Afghanistan,AF,AFG,37172386,Asia,2020-03-21,AF,AFG,Afghanistan
20/03/2020,20,3,2020,0,0,Afghanistan,AF,AFG,37172386,Asia,2020-03-20,AF,AFG,Afghanistan
19/03/2020,19,3,2020,0,0,Afghanistan,AF,AFG,37172386,Asia,2020-03-19,AF,AFG,Afghanistan
18/03/2020,18,3,2020,1,0,Afghanistan,AF,AFG,37172386,Asia,2020-03-18,AF,AFG,Afghanistan
17/03/2020,17,3,2020,5,0,Afghanistan,AF,AFG,37172386,Asia,2020-03-17,AF,AFG,Afghanistan
16/03/2020,16,3,2020,6,0,Afghanistan,AF,AFG,37172386,Asia,2020-03-16,AF,AFG,Afghanistan
15/03/2020,15,3,2020,3,0,Afghanistan,AF,AFG,37172386,Asia,2020-03-15,AF,AFG,Afghanistan
11/03/2020,11,3,2020,3,0,Afghanistan,AF,AFG,37172386,Asia,2020-03-11,AF,AFG,Afghanistan
08/03/2020,8,3,2020,3,0,Afghanistan,AF,AFG,37172386,Asia,2020-03-08,AF,AFG,Afghanistan
02/03/2020,2,3,2020,0,0,Afghanistan,AF,AFG,37172386,Asia,2020-03-02,AF,AFG,Afghanistan
01/03/2020,1,3,2020,0,0,Afghanistan,AF,AFG,37172386,Asia,2020-03-01,AF,AFG,Afghanistan
29/02/2020,29,2,2020,0,0,Afghanistan,AF,AFG,37172386,Asia,2020-02-29,AF,AFG,Afghanistan
28/02/2020,28,2,2020,0,0,Afghanistan,AF,AFG,37172386,Asia,2020-02-28,AF,AFG,Afghanistan
27/02/2020,27,2,2020,0,0,Afghanistan,AF,AFG,37172386,Asia,2020-02-27,AF,AFG,Afghanistan
26/02/2020,26,2,2020,0,0,Afghanistan,AF,AFG,37172386,Asia,2020-02-26,AF,AFG,Afghanistan
25/02/2020,25,2,2020,1,0,Afghanistan,AF,AFG,37172386,Asia,2020-02-25,AF,AFG,Afghanistan
24/02/2020,24,2,2020,0,0,Afghanistan,AF,AFG,37172386,Asia,2020-02-24,AF,AFG,Afghanistan
23/02/2020,23,2,2020,0,0,Afghanistan,AF,AFG,37172386,Asia,2020-02-23,AF,AFG,Afghanistan
22/02/2020,22,2,2020,0,0,Afghanistan,AF,AFG,37172386,Asia,2020-02-22,AF,AFG,Afghanistan
21/02/2020,21,2,2020,0,0,Afghanistan,AF,AFG,37172386,Asia,2020-02-21,AF,AFG,Afghanistan
20/02/2020,20,2,2020,0,0,Afghanistan,AF,AFG,37172386,Asia,2020-02-20,AF,AFG,Afghanistan
19/02/2020,19,2,2020,0,0,Afghanistan,AF,AFG,37172386,Asia,2020-02-19,AF,AFG,Afghanistan
18/02/2020,18,2,2020,0,0,Afghanistan,AF,AFG,37172386,Asia,2020-02-18,AF,AFG,Afghanistan
17/02/2020,17,2,2020,0,0,Afghanistan,AF,AFG,37172386,Asia,2020-02-17,AF,AFG,Afghanistan
16/02/2020,16,2,2020,0,0,Afghanistan,AF,AFG,37172386,Asia,2020-02-16,AF,AFG,Afghanistan
15/02/2020,15,2,2020,0,0,Afghanistan,AF,AFG,37172386,Asia,2020-02-15,AF,AFG,Afghanistan
14/02/2020,14,2,2020,0,0,Afghanistan,AF,AFG,37172386,Asia,2020-02-14,AF,AFG,Afghanistan
13/02/2020,13,2,2020,0,0,Afghanistan,AF,AFG,37172386,Asia,2020-02-13,AF,AFG,Afghanistan
12/02/2020,12,2,2020,0,0,Afghanistan,AF,AFG,37172386,Asia,2020-02-12,AF,AFG,Afghanistan
11/02/2020,11,2,2020,0,0,Afghanistan,AF,AFG,37172386,Asia,2020-02-11,AF,AFG,Afghanistan
10/02/2020,10,2,2020,0,0,Afghanistan,AF,AFG,37172386,Asia,2020-02-10,AF,AFG,Afghanistan
09/02/2020,9,2,2020,0,0,Afghanistan,AF,AFG,37172386,Asia,2020-02-09,AF,AFG,Afghanistan
08/02/2020,8,2,2020,0,0,Afghanistan,AF,AFG,37172386,Asia,2020-02-08,AF,AFG,Afghanistan
07/02/2020,7,2,2020,0,0,Afghanistan,AF,AFG,37172386,Asia,2020-02-07,AF,AFG,Afghanistan
06/02/2020,6,2,2020,0,0,Afghanistan,AF,AFG,37172386,Asia,2020-02-06,AF,AFG,Afghanistan
05/02/2020,5,2,2020,0,0,Afghanistan,AF,AFG,37172386,Asia,2020-02-05,AF,AFG,Afghanistan
04/02/2020,4,2,2020,0,0,Afghanistan,AF,AFG,37172386,Asia,2020-02-04,AF,AFG,Afghanistan
03/02/2020,3,2,2020,0,0,Afghanistan,AF,AFG,37172386,Asia,2020-02-03,AF,AFG,Afghanistan
02/02/2020,2,2,2020,0,0,Afghanistan,AF,AFG,37172386,Asia,2020-02-02,AF,AFG,Afghanistan
01/02/2020,1,2,2020,0,0,Afghanistan,AF,AFG,37172386,Asia,2020-02-01,AF,AFG,Afghanistan
31/01/2020,31,1,2020,0,0,Afghanistan,AF,AFG,37172386,Asia,2020-01-31,AF,AFG,Afghanistan
30/01/2020,30,1,2020,0,0,Afghanistan,AF,AFG,37172386,Asia,2020-01-30,AF,AFG,Afghanistan
29/01/2020,29,1,2020,0,0,Afghanistan,AF,AFG,37172386,Asia,2020-01-29,AF,AFG,Afghanistan
28/01/2020,28,1,2020,0,0,Afghanistan,AF,AFG,37172386,Asia,2020-01-28,AF,AFG,Afghanistan
27/01/2020,27,1,2020,0,0,Afghanistan,AF,AFG,37172386,Asia,2020-01-27,AF,AFG,Afghanistan
26/01/2020,26,1,2020,0,0,Afghanistan,AF,AFG,37172386,Asia,2020-01-26,AF,AFG,Afghanistan
25/01/2020,25,1,2020,0,0,Afghanistan,AF,AFG,37172386,Asia,2020-01-25,AF,AFG,Afghanistan
24/01/2020,24,1,2020,0,0,Afghanistan,AF,AFG,37172386,Asia,2020-01-24,AF,AFG,Afghanistan
23/01/2020,23,1,2020,0,0,Afghanistan,AF,AFG,37172386,Asia,2020-01-23,AF,AFG,Afghanistan
22/01/2020,22,1,2020,0,0,Afghanistan,AF,AFG,37172386,Asia,2020-01-22,AF,AFG,Afghanistan
21/01/2020,21,1,2020,0,0,Afghanistan,AF,AFG,37172386,Asia,2020-01-21,AF,AFG,Afghanistan
20/01/2020,20,1,2020,0,0,Afghanistan,AF,AFG,37172386,Asia,2020-01-20,AF,AFG,Afghanistan
19/01/2020,19,1,2020,0,0,Afghanistan,AF,AFG,37172386,Asia,2020-01-19,AF,AFG,Afghanistan
18/01/2020,18,1,2020,0,0,Afghanistan,AF,AFG,37172386,Asia,2020-01-18,AF,AFG,Afghanistan
17/01/2020,17,1,2020,0,0,Afghanistan,AF,AFG,37172386,Asia,2020-01-17,AF,AFG,Afghanistan
16/01/2020,16,1,2020,0,0,Afghanistan,AF,AFG,37172386,Asia,2020-01-16,AF,AFG,Afghanistan
15/01/2020,15,1,2020,0,0,Afghanistan,AF,AFG,37172386,Asia,2020-01-15,AF,AFG,Afghanistan
14/01/2020,14,1,2020,0,0,Afghanistan,AF,AFG,37172386,Asia,2020-01-14,AF,AFG,Afghanistan
13/01/2020,13,1,2020,0,0,Afghanistan,AF,AFG,37172386,Asia,2020-01-13,AF,AFG,Afghanistan
12/01/2020,12,1,2020,0,0,Afghanistan,AF,AFG,37172386,Asia,2020-01-12,AF,AFG,Afghanistan
11/01/2020,11,1,2020,0,0,Afghanistan,AF,AFG,37172386,Asia,2020-01-11,AF,AFG,Afghanistan
10/01/2020,10,1,2020,0,0,Afghanistan,AF,AFG,37172386,Asia,2020-01-10,AF,AFG,Afghanistan
09/01/2020,9,1,2020,0,0,Afghanistan,AF,AFG,37172386,Asia,2020-01-09,AF,AFG,Afghanistan
08/01/2020,8,1,2020,0,0,Afghanistan,AF,AFG,37172386,Asia,2020-01-08,AF,AFG,Afghanistan
07/01/2020,7,1,2020,0,0,Afghanistan,AF,AFG,37172386,Asia,2020-01-07,AF,AFG,Afghanistan
06/01/2020,6,1,2020,0,0,Afghanistan,AF,AFG,37172386,Asia,2020-01-06,AF,AFG,Afghanistan
05/01/2020,5,1,2020,0,0,Afghanistan,AF,AFG,37172386,Asia,2020-01-05,AF,AFG,Afghanistan
04/01/2020,4,1,2020,0,0,Afghanistan,AF,AFG,37172386,Asia,2020-01-04,AF,AFG,Afghanistan
03/01/2020,3,1,2020,0,0,Afghanistan,AF,AFG,37172386,Asia,2020-01-03,AF,AFG,Afghanistan
02/01/2020,2,1,2020,0,0,Afghanistan,AF,AFG,37172386,Asia,2020-01-02,AF,AFG,Afghanistan
01/01/2020,1,1,2020,0,0,Afghanistan,AF,AFG,37172386,Asia,2020-01-01,AF,AFG,Afghanistan
31/12/2019,31,12,2019,0,0,Afghanistan,AF,AFG,37172386,Asia,2019-12-31,AF,AFG,Afghanistan
17/05/2020,17,5,2020,17,0,Albania,AL,ALB,2866376,Europe,2020-05-17,AL,ALB,Albania
16/05/2020,16,5,2020,18,0,Albania,AL,ALB,2866376,Europe,2020-05-16,AL,ALB,Albania
15/05/2020,15,5,2020,18,0,Albania,AL,ALB,2866376,Europe,2020-05-15,AL,ALB,Albania
14/05/2020,14,5,2020,4,0,Albania,AL,ALB,2866376,Europe,2020-05-14,AL,ALB,Albania
13/05/2020,13,5,2020,4,0,Albania,AL,ALB,2866376,Europe,2020-05-13,AL,ALB,Albania
12/05/2020,12,5,2020,4,0,Albania,AL,ALB,2866376,Europe,2020-05-12,AL,ALB,Albania
11/05/2020,11,5,2020,12,0,Albania,AL,ALB,2866376,Europe,2020-05-11,AL,ALB,Albania
10/05/2020,10,5,2020,6,0,Albania,AL,ALB,2866376,Europe,2020-05-10,AL,ALB,Albania
09/05/2020,9,5,2020,8,0,Albania,AL,ALB,2866376,Europe,2020-05-09,AL,ALB,Albania
08/05/2020,8,5,2020,10,0,Albania,AL,ALB,2866376,Europe,2020-05-08,AL,ALB,Albania
07/05/2020,7,5,2020,12,0,Albania,AL,ALB,2866376,Europe,2020-05-07,AL,ALB,Albania
06/05/2020,6,5,2020,17,0,Albania,AL,ALB,2866376,Europe,2020-05-06,AL,ALB,Albania
05/05/2020,5,5,2020,8,0,Albania,AL,ALB,2866376,Europe,2020-05-05,AL,ALB,Albania
04/05/2020,4,5,2020,6,0,Albania,AL,ALB,2866376,Europe,2020-05-04,AL,ALB,Albania
03/05/2020,3,5,2020,7,0,Albania,AL,ALB,2866376,Europe,2020-05-03,AL,ALB,Albania
02/05/2020,2,5,2020,9,0,Albania,AL,ALB,2866376,Europe,2020-05-02,AL,ALB,Albania
01/05/2020,1,5,2020,7,0,Albania,AL,ALB,2866376,Europe,2020-05-01,AL,ALB,Albania
30/04/2020,30,4,2020,16,1,Albania,AL,ALB,2866376,Europe,2020-04-30,AL,ALB,Albania
29/04/2020,29,4,2020,14,2,Albania,AL,ALB,2866376,Europe,2020-04-29,AL,ALB,Albania
28/04/2020,28,4,2020,10,0,Albania,AL,ALB,2866376,Europe,2020-04-28,AL,ALB,Albania
27/04/2020,27,4,2020,14,1,Albania,AL,ALB,2866376,Europe,2020-04-27,AL,ALB,Albania
26/04/2020,26,4,2020,34,0,Albania,AL,ALB,2866376,Europe,2020-04-26,AL,ALB,Albania
25/04/2020,25,4,2020,15,0,Albania,AL,ALB,2866376,Europe,2020-04-25,AL,ALB,Albania
24/04/2020,24,4,2020,29,0,Albania,AL,ALB,2866376,Europe,2020-04-24,AL,ALB,Albania
23/04/2020,23,4,2020,25,1,Albania,AL,ALB,2866376,Europe,2020-04-23,AL,ALB,Albania
22/04/2020,22,4,2020,25,0,Albania,AL,ALB,2866376,Europe,2020-04-22,AL,ALB,Albania
21/04/2020,21,4,2020,22,0,Albania,AL,ALB,2866376,Europe,2020-04-21,AL,ALB,Albania
20/04/2020,20,4,2020,14,0,Albania,AL,ALB,2866376,Europe,2020-04-20,AL,ALB,Albania
19/04/2020,19,4,2020,9,0,Albania,AL,ALB,2866376,Europe,2020-04-19,AL,ALB,Albania
18/04/2020,18,4,2020,21,0,Albania,AL,ALB,2866376,Europe,2020-04-18,AL,ALB,Albania
17/04/2020,17,4,2020,24,1,Albania,AL,ALB,2866376,Europe,2020-04-17,AL,ALB,Albania
16/04/2020,16,4,2020,19,1,Albania,AL,ALB,2866376,Europe,2020-04-16,AL,ALB,Albania
15/04/2020,15,4,2020,8,1,Albania,AL,ALB,2866376,Europe,2020-04-15,AL,ALB,Albania
14/04/2020,14,4,2020,21,0,Albania,AL,ALB,2866376,Europe,2020-04-14,AL,ALB,Albania
13/04/2020,13,4,2020,13,0,Albania,AL,ALB,2866376,Europe,2020-04-13,AL,ALB,Albania
12/04/2020,12,4,2020,17,0,Albania,AL,ALB,2866376,Europe,2020-04-12,AL,ALB,Albania
11/04/2020,11,4,2020,7,0,Albania,AL,ALB,2866376,Europe,2020-04-11,AL,ALB,Albania
10/04/2020,10,4,2020,9,1,Albania,AL,ALB,2866376,Europe,2020-04-10,AL,ALB,Albania
09/04/2020,9,4,2020,17,0,Albania,AL,ALB,2866376,Europe,2020-04-09,AL,ALB,Albania
08/04/2020,8,4,2020,6,0,Albania,AL,ALB,2866376,Europe,2020-04-08,AL,ALB,Albania
07/04/2020,7,4,2020,16,1,Albania,AL,ALB,2866376,Europe,2020-04-07,AL,ALB,Albania
06/04/2020,6,4,2020,28,2,Albania,AL,ALB,2866376,Europe,2020-04-06,AL,ALB,Albania
05/04/2020,5,4,2020,29,2,Albania,AL,ALB,2866376,Europe,2020-04-05,AL,ALB,Albania
04/04/2020,4,4,2020,27,1,Albania,AL,ALB,2866376,Europe,2020-04-04,AL,ALB,Albania
03/04/2020,3,4,2020,18,1,Albania,AL,ALB,2866376,Europe,2020-04-03,AL,ALB,Albania
02/04/2020,2,4,2020,16,0,Albania,AL,ALB,2866376,Europe,2020-04-02,AL,ALB,Albania
01/04/2020,1,4,2020,20,3,Albania,AL,ALB,2866376,Europe,2020-04-01,AL,ALB,Albania
31/03/2020,31,3,2020,11,2,Albania,AL,ALB,2866376,Europe,2020-03-31,AL,ALB,Albania
30/03/2020,30,3,2020,15,0,Albania,AL,ALB,2866376,Europe,2020-03-30,AL,ALB,Albania
29/03/2020,29,3,2020,11,1,Albania,AL,ALB,2866376,Europe,2020-03-29,AL,ALB,Albania
28/03/2020,28,3,2020,12,3,Albania,AL,ALB,2866376,Europe,2020-03-28,AL,ALB,Albania
27/03/2020,27,3,2020,28,1,Albania,AL,ALB,2866376,Europe,2020-03-27,AL,ALB,Albania
26/03/2020,26,3,2020,23,0,Albania,AL,ALB,2866376,Europe,2020-03-26,AL,ALB,Albania
25/03/2020,25,3,2020,23,1,Albania,AL,ALB,2866376,Europe,2020-03-25,AL,ALB,Albania
24/03/2020,24,3,2020,11,2,Albania,AL,ALB,2866376,Europe,2020-03-24,AL,ALB,Albania
23/03/2020,23,3,2020,13,0,Albania,AL,ALB,2866376,Europe,2020-03-23,AL,ALB,Albania
22/03/2020,22,3,2020,6,0,Albania,AL,ALB,2866376,Europe,2020-03-22,AL,ALB,Albania
21/03/2020,21,3,2020,0,0,Albania,AL,ALB,2866376,Europe,2020-03-21,AL,ALB,Albania
20/03/2020,20,3,2020,11,0,Albania,AL,ALB,2866376,Europe,2020-03-20,AL,ALB,Albania
19/03/2020,19,3,2020,4,1,Albania,AL,ALB,2866376,Europe,2020-03-19,AL,ALB,Albania
18/03/2020,18,3,2020,4,0,Albania,AL,ALB,2866376,Europe,2020-03-18,AL,ALB,Albania
17/03/2020,17,3,2020,9,0,Albania,AL,ALB,2866376,Europe,2020-03-17,AL,ALB,Albania
16/03/2020,16,3,2020,4,0,Albania,AL,ALB,2866376,Europe,2020-03-16,AL,ALB,Albania
15/03/2020,15,3,2020,5,0,Albania,AL,ALB,2866376,Europe,2020-03-15,AL,ALB,Albania
14/03/2020,14,3,2020,10,0,Albania,AL,ALB,2866376,Europe,2020-03-14,AL,ALB,Albania
13/03/2020,13,3,2020,12,0,Albania,AL,ALB,2866376,Europe,2020-03-13,AL,ALB,Albania
12/03/2020,12,3,2020,1,1,Albania,AL,ALB,2866376,Europe,2020-03-12,AL,ALB,Albania
11/03/2020,11,3,2020,4,0,Albania,AL,ALB,2866376,Europe,2020-03-11,AL,ALB,Albania
10/03/2020,10,3,2020,4,0,Albania,AL,ALB,2866376,Europe,2020-03-10,AL,ALB,Albania
09/03/2020,9,3,2020,2,0,Albania,AL,ALB,2866376,Europe,2020-03-09,AL,ALB,Albania
17/05/2020,17,5,2020,192,6,Algeria,DZ,DZA,42228429,Africa,2020-05-17,DZ,DZA,Algeria
16/05/2020,16,5,2020,187,7,Algeria,DZ,DZA,42228429,Africa,2020-05-16,DZ,DZA,Algeria
15/05/2020,15,5,2020,189,7,Algeria,DZ,DZA,42228429,Africa,2020-05-15,DZ,DZA,Algeria
14/05/2020,14,5,2020,186,7,Algeria,DZ,DZA,42228429,Africa,2020-05-14,DZ,DZA,Algeria
13/05/2020,13,5,2020,176,8,Algeria,DZ,DZA,42228429,Africa,2020-05-13,DZ,DZA,Algeria
12/05/2020,12,5,2020,168,5,Algeria,DZ,DZA,42228429,Africa,2020-05-12,DZ,DZA,Algeria
11/05/2020,11,5,2020,165,8,Algeria,DZ,DZA,42228429,Africa,2020-05-11,DZ,DZA,Algeria
10/05/2020,10,5,2020,189,6,Algeria,DZ,DZA,42228429,Africa,2020-05-10,DZ,DZA,Algeria
09/05/2020,9,5,2020,187,5,Algeria,DZ,DZA,42228429,Africa,2020-05-09,DZ,DZA,Algeria
08/05/2020,8,5,2020,185,7,Algeria,DZ,DZA,42228429,Africa,2020-05-08,DZ,DZA,Algeria
07/05/2020,7,5,2020,159,6,Algeria,DZ,DZA,42228429,Africa,2020-05-07,DZ,DZA,Algeria
06/05/2020,6,5,2020,190,5,Algeria,DZ,DZA,42228429,Africa,2020-05-06,DZ,DZA,Algeria
05/05/2020,5,5,2020,174,2,Algeria,DZ,DZA,42228429,Africa,2020-05-05,DZ,DZA,Algeria
04/05/2020,4,5,2020,179,4,Algeria,DZ,DZA,42228429,Africa,2020-05-04,DZ,DZA,Algeria
03/05/2020,3,5,2020,141,6,Algeria,DZ,DZA,42228429,Africa,2020-05-03,DZ,DZA,Algeria
02/05/2020,2,5,2020,148,3,Algeria,DZ,DZA,42228429,Africa,2020-05-02,DZ,DZA,Algeria
01/05/2020,1,5,2020,158,6,Algeria,DZ,DZA,42228429,Africa,2020-05-01,DZ,DZA,Algeria
30/04/2020,30,4,2020,199,7,Algeria,DZ,DZA,42228429,Africa,2020-04-30,DZ,DZA,Algeria
29/04/2020,29,4,2020,132,5,Algeria,DZ,DZA,42228429,Africa,2020-04-29,DZ,DZA,Algeria
28/04/2020,28,4,2020,135,7,Algeria,DZ,DZA,42228429,Africa,2020-04-28,DZ,DZA,Algeria
27/04/2020,27,4,2020,126,6,Algeria,DZ,DZA,42228429,Africa,2020-04-27,DZ,DZA,Algeria
26/04/2020,26,4,2020,129,4,Algeria,DZ,DZA,42228429,Africa,2020-04-26,DZ,DZA,Algeria
25/04/2020,25,4,2020,120,8,Algeria,DZ,DZA,42228429,Africa,2020-04-25,DZ,DZA,Algeria
24/04/2020,24,4,2020,97,5,Algeria,DZ,DZA,42228429,Africa,2020-04-24,DZ,DZA,Algeria
23/04/2020,23,4,2020,99,10,Algeria,DZ,DZA,42228429,Africa,2020-04-23,DZ,DZA,Algeria
22/04/2020,22,4,2020,93,8,Algeria,DZ,DZA,42228429,Africa,2020-04-22,DZ,DZA,Algeria
21/04/2020,21,4,2020,89,9,Algeria,DZ,DZA,42228429,Africa,2020-04-21,DZ,DZA,Algeria
20/04/2020,20,4,2020,94,8,Algeria,DZ,DZA,42228429,Africa,2020-04-20,DZ,DZA,Algeria
19/04/2020,19,4,2020,117,3,Algeria,DZ,DZA,42228429,Africa,2020-04-19,DZ,DZA,Algeria
18/04/2020,18,4,2020,150,16,Algeria,DZ,DZA,42228429,Africa,2020-04-18,DZ,DZA,Algeria
17/04/2020,17,4,2020,108,12,Algeria,DZ,DZA,42228429,Africa,2020-04-17,DZ,DZA,Algeria
16/04/2020,16,4,2020,90,11,Algeria,DZ,DZA,42228429,Africa,2020-04-16,DZ,DZA,Algeria
15/04/2020,15,4,2020,87,12,Algeria,DZ,DZA,42228429,Africa,2020-04-15,DZ,DZA,Algeria
14/04/2020,14,4,2020,69,20,Algeria,DZ,DZA,42228429,Africa,2020-04-14,DZ,DZA,Algeria
13/04/2020,13,4,2020,89,18,Algeria,DZ,DZA,42228429,Africa,2020-04-13,DZ,DZA,Algeria
12/04/2020,12,4,2020,64,19,Algeria,DZ,DZA,42228429,Africa,2020-04-12,DZ,DZA,Algeria
11/04/2020,11,4,2020,95,21,Algeria,DZ,DZA,42228429,Africa,2020-04-11,DZ,DZA,Algeria
10/04/2020,10,4,2020,94,30,Algeria,DZ,DZA,42228429,Africa,2020-04-10,DZ,DZA,Algeria
09/04/2020,9,4,2020,104,12,Algeria,DZ,DZA,42228429,Africa,2020-04-09,DZ,DZA,Algeria
08/04/2020,8,4,2020,45,20,Algeria,DZ,DZA,42228429,Africa,2020-04-08,DZ,DZA,Algeria
07/04/2020,7,4,2020,103,21,Algeria,DZ,DZA,42228429,Africa,2020-04-07,DZ,DZA,Algeria
06/04/2020,6,4,2020,69,22,Algeria,DZ,DZA,42228429,Africa,2020-04-06,DZ,DZA,Algeria
05/04/2020,5,4,2020,80,25,Algeria,DZ,DZA,42228429,Africa,2020-04-05,DZ,DZA,Algeria
04/04/2020,4,4,2020,185,42,Algeria,DZ,DZA,42228429,Africa,2020-04-04,DZ,DZA,Algeria
03/04/2020,3,4,2020,139,5,Algeria,DZ,DZA,42228429,Africa,2020-04-03,DZ,DZA,Algeria
02/04/2020,2,4,2020,131,14,Algeria,DZ,DZA,42228429,Africa,2020-04-02,DZ,DZA,Algeria
01/04/2020,1,4,2020,132,9,Algeria,DZ,DZA,42228429,Africa,2020-04-01,DZ,DZA,Algeria
31/03/2020,31,3,2020,73,4,Algeria,DZ,DZA,42228429,Africa,2020-03-31,DZ,DZA,Algeria
30/03/2020,30,3,2020,57,2,Algeria,DZ,DZA,42228429,Africa,2020-03-30,DZ,DZA,Algeria
29/03/2020,29,3,2020,45,3,Algeria,DZ,DZA,42228429,Africa,2020-03-29,DZ,DZA,Algeria
28/03/2020,28,3,2020,42,1,Algeria,DZ,DZA,42228429,Africa,2020-03-28,DZ,DZA,Algeria
27/03/2020,27,3,2020,65,4,Algeria,DZ,DZA,42228429,Africa,2020-03-27,DZ,DZA,Algeria
26/03/2020,26,3,2020,38,2,Algeria,DZ,DZA,42228429,Africa,2020-03-26,DZ,DZA,Algeria
25/03/2020,25,3,2020,34,2,Algeria,DZ,DZA,42228429,Africa,2020-03-25,DZ,DZA,Algeria
24/03/2020,24,3,2020,29,0,Algeria,DZ,DZA,42228429,Africa,2020-03-24,DZ,DZA,Algeria
23/03/2020,23,3,2020,62,2,Algeria,DZ,DZA,42228429,Africa,2020-03-23,DZ,DZA,Algeria
22/03/2020,22,3,2020,37,5,Algeria,DZ,DZA,42228429,Africa,2020-03-22,DZ,DZA,Algeria
21/03/2020,21,3,2020,12,3,Algeria,DZ,DZA,42228429,Africa,2020-03-21,DZ,DZA,Algeria
20/03/2020,20,3,2020,18,1,Algeria,DZ,DZA,42228429,Africa,2020-03-20,DZ,DZA,Algeria
19/03/2020,19,3,2020,12,1,Algeria,DZ,DZA,42228429,Africa,2020-03-19,DZ,DZA,Algeria
18/03/2020,18,3,2020,2,1,Algeria,DZ,DZA,42228429,Africa,2020-03-18,DZ,DZA,Algeria
17/03/2020,17,3,2020,10,0,Algeria,DZ,DZA,42228429,Africa,2020-03-17,DZ,DZA,Algeria
16/03/2020,16,3,2020,11,2,Algeria,DZ,DZA,42228429,Africa,2020-03-16,DZ,DZA,Algeria
15/03/2020,15,3,2020,11,0,Algeria,DZ,DZA,42228429,Africa,2020-03-15,DZ,DZA,Algeria
14/03/2020,14,3,2020,1,1,Algeria,DZ,DZA,42228429,Africa,2020-03-14,DZ,DZA,Algeria
13/03/2020,13,3,2020,5,1,Algeria,DZ,DZA,42228429,Africa,2020-03-13,DZ,DZA,Algeria
12/03/2020,12,3,2020,0,0,Algeria,DZ,DZA,42228429,Africa,2020-03-12,DZ,DZA,Algeria
09/03/2020,9,3,2020,3,0,Algeria,DZ,DZA,42228429,Africa,2020-03-09,DZ,DZA,Algeria
06/03/2020,6,3,2020,5,0,Algeria,DZ,DZA,42228429,Africa,2020-03-06,DZ,DZA,Algeria
05/03/2020,5,3,2020,7,0,Algeria,DZ,DZA,42228429,Africa,2020-03-05,DZ,DZA,Algeria
04/03/2020,4,3,2020,2,0,Algeria,DZ,DZA,42228429,Africa,2020-03-04,DZ,DZA,Algeria
02/03/2020,2,3,2020,0,0,Algeria,DZ,DZA,42228429,Africa,2020-03-02,DZ,DZA,Algeria
01/03/2020,1,3,2020,2,0,Algeria,DZ,DZA,42228429,Africa,2020-03-01,DZ,DZA,Algeria
29/02/2020,29,2,2020,0,0,Algeria,DZ,DZA,42228429,Africa,2020-02-29,DZ,DZA,Algeria
28/02/2020,28,2,2020,0,0,Algeria,DZ,DZA,42228429,Africa,2020-02-28,DZ,DZA,Algeria
27/02/2020,27,2,2020,0,0,Algeria,DZ,DZA,42228429,Africa,2020-02-27,DZ,DZA,Algeria
26/02/2020,26,2,2020,1,0,Algeria,DZ,DZA,42228429,Africa,2020-02-26,DZ,DZA,Algeria
25/02/2020,25,2,2020,0,0,Algeria,DZ,DZA,42228429,Africa,2020-02-25,DZ,DZA,Algeria
24/02/2020,24,2,2020,0,0,Algeria,DZ,DZA,42228429,Africa,2020-02-24,DZ,DZA,Algeria
23/02/2020,23,2,2020,0,0,Algeria,DZ,DZA,42228429,Africa,2020-02-23,DZ,DZA,Algeria
22/02/2020,22,2,2020,0,0,Algeria,DZ,DZA,42228429,Africa,2020-02-22,DZ,DZA,Algeria
21/02/2020,21,2,2020,0,0,Algeria,DZ,DZA,42228429,Africa,2020-02-21,DZ,DZA,Algeria
20/02/2020,20,2,2020,0,0,Algeria,DZ,DZA,42228429,Africa,2020-02-20,DZ,DZA,Algeria
19/02/2020,19,2,2020,0,0,Algeria,DZ,DZA,42228429,Africa,2020-02-19,DZ,DZA,Algeria
18/02/2020,18,2,2020,0,0,Algeria,DZ,DZA,42228429,Africa,2020-02-18,DZ,DZA,Algeria
17/02/2020,17,2,2020,0,0,Algeria,DZ,DZA,42228429,Africa,2020-02-17,DZ,DZA,Algeria
16/02/2020,16,2,2020,0,0,Algeria,DZ,DZA,42228429,Africa,2020-02-16,DZ,DZA,Algeria
15/02/2020,15,2,2020,0,0,Algeria,DZ,DZA,42228429,Africa,2020-02-15,DZ,DZA,Algeria
14/02/2020,14,2,2020,0,0,Algeria,DZ,DZA,42228429,Africa,2020-02-14,DZ,DZA,Algeria
13/02/2020,13,2,2020,0,0,Algeria,DZ,DZA,42228429,Africa,2020-02-13,DZ,DZA,Algeria
12/02/2020,12,2,2020,0,0,Algeria,DZ,DZA,42228429,Africa,2020-02-12,DZ,DZA,Algeria
11/02/2020,11,2,2020,0,0,Algeria,DZ,DZA,42228429,Africa,2020-02-11,DZ,DZA,Algeria
10/02/2020,10,2,2020,0,0,Algeria,DZ,DZA,42228429,Africa,2020-02-10,DZ,DZA,Algeria
09/02/2020,9,2,2020,0,0,Algeria,DZ,DZA,42228429,Africa,2020-02-09,DZ,DZA,Algeria
08/02/2020,8,2,2020,0,0,Algeria,DZ,DZA,42228429,Africa,2020-02-08,DZ,DZA,Algeria
07/02/2020,7,2,2020,0,0,Algeria,DZ,DZA,42228429,Africa,2020-02-07,DZ,DZA,Algeria
06/02/2020,6,2,2020,0,0,Algeria,DZ,DZA,42228429,Africa,2020-02-06,DZ,DZA,Algeria
05/02/2020,5,2,2020,0,0,Algeria,DZ,DZA,42228429,Africa,2020-02-05,DZ,DZA,Algeria
04/02/2020,4,2,2020,0,0,Algeria,DZ,DZA,42228429,Africa,2020-02-04,DZ,DZA,Algeria
03/02/2020,3,2,2020,0,0,Algeria,DZ,DZA,42228429,Africa,2020-02-03,DZ,DZA,Algeria
02/02/2020,2,2,2020,0,0,Algeria,DZ,DZA,42228429,Africa,2020-02-02,DZ,DZA,Algeria
01/02/2020,1,2,2020,0,0,Algeria,DZ,DZA,42228429,Africa,2020-02-01,DZ,DZA,Algeria
31/01/2020,31,1,2020,0,0,Algeria,DZ,DZA,42228429,Africa,2020-01-31,DZ,DZA,Algeria
30/01/2020,30,1,2020,0,0,Algeria,DZ,DZA,42228429,Africa,2020-01-30,DZ,DZA,Algeria
29/01/2020,29,1,2020,0,0,Algeria,DZ,DZA,42228429,Africa,2020-01-29,DZ,DZA,Algeria
28/01/2020,28,1,2020,0,0,Algeria,DZ,DZA,42228429,Africa,2020-01-28,DZ,DZA,Algeria
27/01/2020,27,1,2020,0,0,Algeria,DZ,DZA,42228429,Africa,2020-01-27,DZ,DZA,Algeria
26/01/2020,26,1,2020,0,0,Algeria,DZ,DZA,42228429,Africa,2020-01-26,DZ,DZA,Algeria
25/01/2020,25,1,2020,0,0,Algeria,DZ,DZA,42228429,Africa,2020-01-25,DZ,DZA,Algeria
24/01/2020,24,1,2020,0,0,Algeria,DZ,DZA,42228429,Africa,2020-01-24,DZ,DZA,Algeria
23/01/2020,23,1,2020,0,0,Algeria,DZ,DZA,42228429,Africa,2020-01-23,DZ,DZA,Algeria
22/01/2020,22,1,2020,0,0,Algeria,DZ,DZA,42228429,Africa,2020-01-22,DZ,DZA,Algeria
21/01/2020,21,1,2020,0,0,Algeria,DZ,DZA,42228429,Africa,2020-01-21,DZ,DZA,Algeria
20/01/2020,20,1,2020,0,0,Algeria,DZ,DZA,42228429,Africa,2020-01-20,DZ,DZA,Algeria
19/01/2020,19,1,2020,0,0,Algeria,DZ,DZA,42228429,Africa,2020-01-19,DZ,DZA,Algeria
18/01/2020,18,1,2020,0,0,Algeria,DZ,DZA,42228429,Africa,2020-01-18,DZ,DZA,Algeria
17/01/2020,17,1,2020,0,0,Algeria,DZ,DZA,42228429,Africa,2020-01-17,DZ,DZA,Algeria
16/01/2020,16,1,2020,0,0,Algeria,DZ,DZA,42228429,Africa,2020-01-16,DZ,DZA,Algeria
15/01/2020,15,1,2020,0,0,Algeria,DZ,DZA,42228429,Africa,2020-01-15,DZ,DZA,Algeria
14/01/2020,14,1,2020,0,0,Algeria,DZ,DZA,42228429,Africa,2020-01-14,DZ,DZA,Algeria
13/01/2020,13,1,2020,0,0,Algeria,DZ,DZA,42228429,Africa,2020-01-13,DZ,DZA,Algeria
12/01/2020,12,1,2020,0,0,Algeria,DZ,DZA,42228429,Africa,2020-01-12,DZ,DZA,Algeria
11/01/2020,11,1,2020,0,0,Algeria,DZ,DZA,42228429,Africa,2020-01-11,DZ,DZA,Algeria
10/01/2020,10,1,2020,0,0,Algeria,DZ,DZA,42228429,Africa,2020-01-10,DZ,DZA,Algeria
09/01/2020,9,1,2020,0,0,Algeria,DZ,DZA,42228429,Africa,2020-01-09,DZ,DZA,Algeria
08/01/2020,8,1,2020,0,0,Algeria,DZ,DZA,42228429,Africa,2020-01-08,DZ,DZA,Algeria
07/01/2020,7,1,2020,0,0,Algeria,DZ,DZA,42228429,Africa,2020-01-07,DZ,DZA,Algeria
06/01/2020,6,1,2020,0,0,Algeria,DZ,DZA,42228429,Africa,2020-01-06,DZ,DZA,Algeria
05/01/2020,5,1,2020,0,0,Algeria,DZ,DZA,42228429,Africa,2020-01-05,DZ,DZA,Algeria
04/01/2020,4,1,2020,0,0,Algeria,DZ,DZA,42228429,Africa,2020-01-04,DZ,DZA,Algeria
03/01/2020,3,1,2020,0,0,Algeria,DZ,DZA,42228429,Africa,2020-01-03,DZ,DZA,Algeria
02/01/2020,2,1,2020,0,0,Algeria,DZ,DZA,42228429,Africa,2020-01-02,DZ,DZA,Algeria
01/01/2020,1,1,2020,0,0,Algeria,DZ,DZA,42228429,Africa,2020-01-01,DZ,DZA,Algeria
31/12/2019,31,12,2019,0,0,Algeria,DZ,DZA,42228429,Africa,2019-12-31,DZ,DZA,Algeria
17/05/2020,17,5,2020,0,2,Andorra,AD,AND,77006,Europe,2020-05-17,AD,AND,Andorra
16/05/2020,16,5,2020,0,0,Andorra,AD,AND,77006,Europe,2020-05-16,AD,AND,Andorra
15/05/2020,15,5,2020,1,0,Andorra,AD,AND,77006,Europe,2020-05-15,AD,AND,Andorra
14/05/2020,14,5,2020,2,1,Andorra,AD,AND,77006,Europe,2020-05-14,AD,AND,Andorra
13/05/2020,13,5,2020,2,0,Andorra,AD,AND,77006,Europe,2020-05-13,AD,AND,Andorra
12/05/2020,12,5,2020,1,0,Andorra,AD,AND,77006,Europe,2020-05-12,AD,AND,Andorra
11/05/2020,11,5,2020,1,0,Andorra,AD,AND,77006,Europe,2020-05-11,AD,AND,Andorra
10/05/2020,10,5,2020,2,1,Andorra,AD,AND,77006,Europe,2020-05-10,AD,AND,Andorra
09/05/2020,9,5,2020,0,0,Andorra,AD,AND,77006,Europe,2020-05-09,AD,AND,Andorra
08/05/2020,8,5,2020,1,1,Andorra,AD,AND,77006,Europe,2020-05-08,AD,AND,Andorra
07/05/2020,7,5,2020,0,0,Andorra,AD,AND,77006,Europe,2020-05-07,AD,AND,Andorra
06/05/2020,6,5,2020,1,1,Andorra,AD,AND,77006,Europe,2020-05-06,AD,AND,Andorra
05/05/2020,5,5,2020,2,0,Andorra,AD,AND,77006,Europe,2020-05-05,AD,AND,Andorra
04/05/2020,4,5,2020,1,1,Andorra,AD,AND,77006,Europe,2020-05-04,AD,AND,Andorra
03/05/2020,3,5,2020,1,1,Andorra,AD,AND,77006,Europe,2020-05-03,AD,AND,Andorra
02/05/2020,2,5,2020,1,1,Andorra,AD,AND,77006,Europe,2020-05-02,AD,AND,Andorra
01/05/2020,1,5,2020,2,0,Andorra,AD,AND,77006,Europe,2020-05-01,AD,AND,Andorra
30/04/2020,30,4,2020,0,1,Andorra,AD,AND,77006,Europe,2020-04-30,AD,AND,Andorra
29/04/2020,29,4,2020,0,1,Andorra,AD,AND,77006,Europe,2020-04-29,AD,AND,Andorra
28/04/2020,28,4,2020,3,0,Andorra,AD,AND,77006,Europe,2020-04-28,AD,AND,Andorra
27/04/2020,27,4,2020,7,0,Andorra,AD,AND,77006,Europe,2020-04-27,AD,AND,Andorra
26/04/2020,26,4,2020,2,0,Andorra,AD,AND,77006,Europe,2020-04-26,AD,AND,Andorra
25/04/2020,25,4,2020,7,3,Andorra,AD,AND,77006,Europe,2020-04-25,AD,AND,Andorra
24/04/2020,24,4,2020,1,0,Andorra,AD,AND,77006,Europe,2020-04-24,AD,AND,Andorra
23/04/2020,23,4,2020,6,0,Andorra,AD,AND,77006,Europe,2020-04-23,AD,AND,Andorra
22/04/2020,22,4,2020,0,1,Andorra,AD,AND,77006,Europe,2020-04-22,AD,AND,Andorra
21/04/2020,21,4,2020,4,0,Andorra,AD,AND,77006,Europe,2020-04-21,AD,AND,Andorra
20/04/2020,20,4,2020,9,1,Andorra,AD,AND,77006,Europe,2020-04-20,AD,AND,Andorra
19/04/2020,19,4,2020,8,0,Andorra,AD,AND,77006,Europe,2020-04-19,AD,AND,Andorra
18/04/2020,18,4,2020,14,2,Andorra,AD,AND,77006,Europe,2020-04-18,AD,AND,Andorra
17/04/2020,17,4,2020,9,0,Andorra,AD,AND,77006,Europe,2020-04-17,AD,AND,Andorra
16/04/2020,16,4,2020,14,2,Andorra,AD,AND,77006,Europe,2020-04-16,AD,AND,Andorra
15/04/2020,15,4,2020,13,2,Andorra,AD,AND,77006,Europe,2020-04-15,AD,AND,Andorra
14/04/2020,14,4,2020,8,0,Andorra,AD,AND,77006,Europe,2020-04-14,AD,AND,Andorra
13/04/2020,13,4,2020,16,1,Andorra,AD,AND,77006,Europe,2020-04-13,AD,AND,Andorra
12/04/2020,12,4,2020,21,2,Andorra,AD,AND,77006,Europe,2020-04-12,AD,AND,Andorra
11/04/2020,11,4,2020,18,1,Andorra,AD,AND,77006,Europe,2020-04-11,AD,AND,Andorra
10/04/2020,10,4,2020,19,2,Andorra,AD,AND,77006,Europe,2020-04-10,AD,AND,Andorra
09/04/2020,9,4,2020,19,1,Andorra,AD,AND,77006,Europe,2020-04-09,AD,AND,Andorra
08/04/2020,8,4,2020,19,1,Andorra,AD,AND,77006,Europe,2020-04-08,AD,AND,Andorra
07/04/2020,7,4,2020,25,3,Andorra,AD,AND,77006,Europe,2020-04-07,AD,AND,Andorra
06/04/2020,6,4,2020,35,1,Andorra,AD,AND,77006,Europe,2020-04-06,AD,AND,Andorra
05/04/2020,5,4,2020,27,1,Andorra,AD,AND,77006,Europe,2020-04-05,AD,AND,Andorra
04/04/2020,4,4,2020,11,1,Andorra,AD,AND,77006,Europe,2020-04-04,AD,AND,Andorra
03/04/2020,3,4,2020,38,1,Andorra,AD,AND,77006,Europe,2020-04-03,AD,AND,Andorra
02/04/2020,2,4,2020,14,2,Andorra,AD,AND,77006,Europe,2020-04-02,AD,AND,Andorra
01/04/2020,1,4,2020,6,4,Andorra,AD,AND,77006,Europe,2020-04-01,AD,AND,Andorra
31/03/2020,31,3,2020,36,2,Andorra,AD,AND,77006,Europe,2020-03-31,AD,AND,Andorra
30/03/2020,30,3,2020,26,2,Andorra,AD,AND,77006,Europe,2020-03-30,AD,AND,Andorra
29/03/2020,29,3,2020,41,1,Andorra,AD,AND,77006,Europe,2020-03-29,AD,AND,Andorra
28/03/2020,28,3,2020,43,0,Andorra,AD,AND,77006,Europe,2020-03-28,AD,AND,Andorra
27/03/2020,27,3,2020,36,3,Andorra,AD,AND,77006,Europe,2020-03-27,AD,AND,Andorra
26/03/2020,26,3,2020,24,0,Andorra,AD,AND,77006,Europe,2020-03-26,AD,AND,Andorra
25/03/2020,25,3,2020,31,0,Andorra,AD,AND,77006,Europe,2020-03-25,AD,AND,Andorra
24/03/2020,24,3,2020,20,0,Andorra,AD,AND,77006,Europe,2020-03-24,AD,AND,Andorra
23/03/2020,23,3,2020,25,0,Andorra,AD,AND,77006,Europe,2020-03-23,AD,AND,Andorra
22/03/2020,22,3,2020,13,0,Andorra,AD,AND,77006,Europe,2020-03-22,AD,AND,Andorra
21/03/2020,21,3,2020,0,0,Andorra,AD,AND,77006,Europe,2020-03-21,AD,AND,Andorra
20/03/2020,20,3,2020,22,0,Andorra,AD,AND,77006,Europe,2020-03-20,AD,AND,Andorra
19/03/2020,19,3,2020,39,0,Andorra,AD,AND,77006,Europe,2020-03-19,AD,AND,Andorra
18/03/2020,18,3,2020,0,0,Andorra,AD,AND,77006,Europe,2020-03-18,AD,AND,Andorra
17/03/2020,17,3,2020,9,0,Andorra,AD,AND,77006,Europe,2020-03-17,AD,AND,Andorra
16/03/2020,16,3,2020,3,0,Andorra,AD,AND,77006,Europe,2020-03-16,AD,AND,Andorra
14/03/2020,14,3,2020,1,0,Andorra,AD,AND,77006,Europe,2020-03-14,AD,AND,Andorra
03/03/2020,3,3,2020,1,0,Andorra,AD,AND,77006,Europe,2020-03-03,AD,AND,Andorra
17/05/2020,17,5,2020,0,0,Angola,AO,AGO,30809762,Africa,2020-05-17,AO,AGO,Angola
16/05/2020,16,5,2020,0,0,Angola,AO,AGO,30809762,Africa,2020-05-16,AO,AGO,Angola
15/05/2020,15,5,2020,3,0,Angola,AO,AGO,30809762,Africa,2020-05-15,AO,AGO,Angola
14/05/2020,14,5,2020,0,0,Angola,AO,AGO,30809762,Africa,2020-05-14,AO,AGO,Angola
13/05/2020,13,5,2020,0,0,Angola,AO,AGO,30809762,Africa,2020-05-13,AO,AGO,Angola
12/05/2020,12,5,2020,0,0,Angola,AO,AGO,30809762,Africa,2020-05-12,AO,AGO,Angola
11/05/2020,11,5,2020,2,0,Angola,AO,AGO,30809762,Africa,2020-05-11,AO,AGO,Angola
10/05/2020,10,5,2020,0,0,Angola,AO,AGO,30809762,Africa,2020-05-10,AO,AGO,Angola
09/05/2020,9,5,2020,7,0,Angola,AO,AGO,30809762,Africa,2020-05-09,AO,AGO,Angola
08/05/2020,8,5,2020,0,0,Angola,AO,AGO,30809762,Africa,2020-05-08,AO,AGO,Angola
07/05/2020,7,5,2020,0,0,Angola,AO,AGO,30809762,Africa,2020-05-07,AO,AGO,Angola
06/05/2020,6,5,2020,1,0,Angola,AO,AGO,30809762,Africa,2020-05-06,AO,AGO,Angola
05/05/2020,5,5,2020,0,0,Angola,AO,AGO,30809762,Africa,2020-05-05,AO,AGO,Angola
04/05/2020,4,5,2020,0,0,Angola,AO,AGO,30809762,Africa,2020-05-04,AO,AGO,Angola
03/05/2020,3,5,2020,6,0,Angola,AO,AGO,30809762,Africa,2020-05-03,AO,AGO,Angola
02/05/2020,2,5,2020,2,0,Angola,AO,AGO,30809762,Africa,2020-05-02,AO,AGO,Angola
01/05/2020,1,5,2020,0,0,Angola,AO,AGO,30809762,Africa,2020-05-01,AO,AGO,Angola
30/04/2020,30,4,2020,0,0,Angola,AO,AGO,30809762,Africa,2020-04-30,AO,AGO,Angola
29/04/2020,29,4,2020,0,0,Angola,AO,AGO,30809762,Africa,2020-04-29,AO,AGO,Angola
28/04/2020,28,4,2020,1,0,Angola,AO,AGO,30809762,Africa,2020-04-28,AO,AGO,Angola
27/04/2020,27,4,2020,1,0,Angola,AO,AGO,30809762,Africa,2020-04-27,AO,AGO,Angola
26/04/2020,26,4,2020,0,0,Angola,AO,AGO,30809762,Africa,2020-04-26,AO,AGO,Angola
25/04/2020,25,4,2020,0,0,Angola,AO,AGO,30809762,Africa,2020-04-25,AO,AGO,Angola
24/04/2020,24,4,2020,1,0,Angola,AO,AGO,30809762,Africa,2020-04-24,AO,AGO,Angola
23/04/2020,23,4,2020,0,0,Angola,AO,AGO,30809762,Africa,2020-04-23,AO,AGO,Angola
22/04/2020,22,4,2020,0,0,Angola,AO,AGO,30809762,Africa,2020-04-22,AO,AGO,Angola
21/04/2020,21,4,2020,0,0,Angola,AO,AGO,30809762,Africa,2020-04-21,AO,AGO,Angola
20/04/2020,20,4,2020,0,0,Angola,AO,AGO,30809762,Africa,2020-04-20,AO,AGO,Angola
19/04/2020,19,4,2020,5,0,Angola,AO,AGO,30809762,Africa,2020-04-19,AO,AGO,Angola
18/04/2020,18,4,2020,0,0,Angola,AO,AGO,30809762,Africa,2020-04-18,AO,AGO,Angola
17/04/2020,17,4,2020,0,0,Angola,AO,AGO,30809762,Africa,2020-04-17,AO,AGO,Angola
16/04/2020,16,4,2020,0,0,Angola,AO,AGO,30809762,Africa,2020-04-16,AO,AGO,Angola
15/04/2020,15,4,2020,0,0,Angola,AO,AGO,30809762,Africa,2020-04-15,AO,AGO,Angola
14/04/2020,14,4,2020,0,0,Angola,AO,AGO,30809762,Africa,2020-04-14,AO,AGO,Angola
13/04/2020,13,4,2020,0,0,Angola,AO,AGO,30809762,Africa,2020-04-13,AO,AGO,Angola
12/04/2020,12,4,2020,0,0,Angola,AO,AGO,30809762,Africa,2020-04-12,AO,AGO,Angola
11/04/2020,11,4,2020,0,0,Angola,AO,AGO,30809762,Africa,2020-04-11,AO,AGO,Angola
10/04/2020,10,4,2020,0,0,Angola,AO,AGO,30809762,Africa,2020-04-10,AO,AGO,Angola
09/04/2020,9,4,2020,2,0,Angola,AO,AGO,30809762,Africa,2020-04-09,AO,AGO,Angola
08/04/2020,8,4,2020,1,0,Angola,AO,AGO,30809762,Africa,2020-04-08,AO,AGO,Angola
07/04/2020,7,4,2020,2,0,Angola,AO,AGO,30809762,Africa,2020-04-07,AO,AGO,Angola
06/04/2020,6,4,2020,4,0,Angola,AO,AGO,30809762,Africa,2020-04-06,AO,AGO,Angola
05/04/2020,5,4,2020,2,0,Angola,AO,AGO,30809762,Africa,2020-04-05,AO,AGO,Angola
04/04/2020,4,4,2020,0,0,Angola,AO,AGO,30809762,Africa,2020-04-04,AO,AGO,Angola
03/04/2020,3,4,2020,0,0,Angola,AO,AGO,30809762,Africa,2020-04-03,AO,AGO,Angola
02/04/2020,2,4,2020,1,0,Angola,AO,AGO,30809762,Africa,2020-04-02,AO,AGO,Angola
01/04/2020,1,4,2020,0,0,Angola,AO,AGO,30809762,Africa,2020-04-01,AO,AGO,Angola
31/03/2020,31,3,2020,0,0,Angola,AO,AGO,30809762,Africa,2020-03-31,AO,AGO,Angola
30/03/2020,30,3,2020,3,2,Angola,AO,AGO,30809762,Africa,2020-03-30,AO,AGO,Angola
29/03/2020,29,3,2020,0,0,Angola,AO,AGO,30809762,Africa,2020-03-29,AO,AGO,Angola
28/03/2020,28,3,2020,1,0,Angola,AO,AGO,30809762,Africa,2020-03-28,AO,AGO,Angola
27/03/2020,27,3,2020,1,0,Angola,AO,AGO,30809762,Africa,2020-03-27,AO,AGO,Angola
26/03/2020,26,3,2020,0,0,Angola,AO,AGO,30809762,Africa,2020-03-26,AO,AGO,Angola
25/03/2020,25,3,2020,0,0,Angola,AO,AGO,30809762,Africa,2020-03-25,AO,AGO,Angola
24/03/2020,24,3,2020,0,0,Angola,AO,AGO,30809762,Africa,2020-03-24,AO,AGO,Angola
23/03/2020,23,3,2020,0,0,Angola,AO,AGO,30809762,Africa,2020-03-23,AO,AGO,Angola
22/03/2020,22,3,2020,2,0,Angola,AO,AGO,30809762,Africa,2020-03-22,AO,AGO,Angola
17/05/2020,17,5,2020,0,0,Anguilla,AI,,NA,America,2020-05-17,AI,AIA,Anguilla
16/05/2020,16,5,2020,0,0,Anguilla,AI,,NA,America,2020-05-16,AI,AIA,Anguilla
15/05/2020,15,5,2020,0,0,Anguilla,AI,,NA,America,2020-05-15,AI,AIA,Anguilla
14/05/2020,14,5,2020,0,0,Anguilla,AI,,NA,America,2020-05-14,AI,AIA,Anguilla
13/05/2020,13,5,2020,0,0,Anguilla,AI,,NA,America,2020-05-13,AI,AIA,Anguilla
12/05/2020,12,5,2020,0,0,Anguilla,AI,,NA,America,2020-05-12,AI,AIA,Anguilla
11/05/2020,11,5,2020,0,0,Anguilla,AI,,NA,America,2020-05-11,AI,AIA,Anguilla
10/05/2020,10,5,2020,0,0,Anguilla,AI,,NA,America,2020-05-10,AI,AIA,Anguilla
09/05/2020,9,5,2020,0,0,Anguilla,AI,,NA,America,2020-05-09,AI,AIA,Anguilla
08/05/2020,8,5,2020,0,0,Anguilla,AI,,NA,America,2020-05-08,AI,AIA,Anguilla
07/05/2020,7,5,2020,0,0,Anguilla,AI,,NA,America,2020-05-07,AI,AIA,Anguilla
06/05/2020,6,5,2020,0,0,Anguilla,AI,,NA,America,2020-05-06,AI,AIA,Anguilla
05/05/2020,5,5,2020,0,0,Anguilla,AI,,NA,America,2020-05-05,AI,AIA,Anguilla
04/05/2020,4,5,2020,0,0,Anguilla,AI,,NA,America,2020-05-04,AI,AIA,Anguilla
03/05/2020,3,5,2020,0,0,Anguilla,AI,,NA,America,2020-05-03,AI,AIA,Anguilla
02/05/2020,2,5,2020,0,0,Anguilla,AI,,NA,America,2020-05-02,AI,AIA,Anguilla
01/05/2020,1,5,2020,0,0,Anguilla,AI,,NA,America,2020-05-01,AI,AIA,Anguilla
30/04/2020,30,4,2020,0,0,Anguilla,AI,,NA,America,2020-04-30,AI,AIA,Anguilla
29/04/2020,29,4,2020,0,0,Anguilla,AI,,NA,America,2020-04-29,AI,AIA,Anguilla
28/04/2020,28,4,2020,0,0,Anguilla,AI,,NA,America,2020-04-28,AI,AIA,Anguilla
27/04/2020,27,4,2020,0,0,Anguilla,AI,,NA,America,2020-04-27,AI,AIA,Anguilla
26/04/2020,26,4,2020,0,0,Anguilla,AI,,NA,America,2020-04-26,AI,AIA,Anguilla
25/04/2020,25,4,2020,0,0,Anguilla,AI,,NA,America,2020-04-25,AI,AIA,Anguilla
24/04/2020,24,4,2020,0,0,Anguilla,AI,,NA,America,2020-04-24,AI,AIA,Anguilla
23/04/2020,23,4,2020,0,0,Anguilla,AI,,NA,America,2020-04-23,AI,AIA,Anguilla
22/04/2020,22,4,2020,0,0,Anguilla,AI,,NA,America,2020-04-22,AI,AIA,Anguilla
21/04/2020,21,4,2020,0,0,Anguilla,AI,,NA,America,2020-04-21,AI,AIA,Anguilla
20/04/2020,20,4,2020,0,0,Anguilla,AI,,NA,America,2020-04-20,AI,AIA,Anguilla
19/04/2020,19,4,2020,0,0,Anguilla,AI,,NA,America,2020-04-19,AI,AIA,Anguilla
18/04/2020,18,4,2020,0,0,Anguilla,AI,,NA,America,2020-04-18,AI,AIA,Anguilla
17/04/2020,17,4,2020,0,0,Anguilla,AI,,NA,America,2020-04-17,AI,AIA,Anguilla
16/04/2020,16,4,2020,0,0,Anguilla,AI,,NA,America,2020-04-16,AI,AIA,Anguilla
15/04/2020,15,4,2020,0,0,Anguilla,AI,,NA,America,2020-04-15,AI,AIA,Anguilla
14/04/2020,14,4,2020,0,0,Anguilla,AI,,NA,America,2020-04-14,AI,AIA,Anguilla
13/04/2020,13,4,2020,0,0,Anguilla,AI,,NA,America,2020-04-13,AI,AIA,Anguilla
12/04/2020,12,4,2020,0,0,Anguilla,AI,,NA,America,2020-04-12,AI,AIA,Anguilla
11/04/2020,11,4,2020,0,0,Anguilla,AI,,NA,America,2020-04-11,AI,AIA,Anguilla
10/04/2020,10,4,2020,0,0,Anguilla,AI,,NA,America,2020-04-10,AI,AIA,Anguilla
09/04/2020,9,4,2020,0,0,Anguilla,AI,,NA,America,2020-04-09,AI,AIA,Anguilla
08/04/2020,8,4,2020,0,0,Anguilla,AI,,NA,America,2020-04-08,AI,AIA,Anguilla
07/04/2020,7,4,2020,0,0,Anguilla,AI,,NA,America,2020-04-07,AI,AIA,Anguilla
06/04/2020,6,4,2020,0,0,Anguilla,AI,,NA,America,2020-04-06,AI,AIA,Anguilla
05/04/2020,5,4,2020,0,0,Anguilla,AI,,NA,America,2020-04-05,AI,AIA,Anguilla
04/04/2020,4,4,2020,0,0,Anguilla,AI,,NA,America,2020-04-04,AI,AIA,Anguilla
03/04/2020,3,4,2020,1,0,Anguilla,AI,,NA,America,2020-04-03,AI,AIA,Anguilla
02/04/2020,2,4,2020,0,0,Anguilla,AI,,NA,America,2020-04-02,AI,AIA,Anguilla
01/04/2020,1,4,2020,0,0,Anguilla,AI,,NA,America,2020-04-01,AI,AIA,Anguilla
31/03/2020,31,3,2020,0,0,Anguilla,AI,,NA,America,2020-03-31,AI,AIA,Anguilla
30/03/2020,30,3,2020,0,0,Anguilla,AI,,NA,America,2020-03-30,AI,AIA,Anguilla
29/03/2020,29,3,2020,0,0,Anguilla,AI,,NA,America,2020-03-29,AI,AIA,Anguilla
28/03/2020,28,3,2020,0,0,Anguilla,AI,,NA,America,2020-03-28,AI,AIA,Anguilla
27/03/2020,27,3,2020,2,0,Anguilla,AI,,NA,America,2020-03-27,AI,AIA,Anguilla
17/05/2020,17,5,2020,0,0,Antigua_and_Barbuda,AG,ATG,96286,America,2020-05-17,AG,ATG,Antigua and Barbuda
16/05/2020,16,5,2020,0,0,Antigua_and_Barbuda,AG,ATG,96286,America,2020-05-16,AG,ATG,Antigua and Barbuda
15/05/2020,15,5,2020,0,0,Antigua_and_Barbuda,AG,ATG,96286,America,2020-05-15,AG,ATG,Antigua and Barbuda
14/05/2020,14,5,2020,0,0,Antigua_and_Barbuda,AG,ATG,96286,America,2020-05-14,AG,ATG,Antigua and Barbuda
13/05/2020,13,5,2020,0,0,Antigua_and_Barbuda,AG,ATG,96286,America,2020-05-13,AG,ATG,Antigua and Barbuda
12/05/2020,12,5,2020,0,0,Antigua_and_Barbuda,AG,ATG,96286,America,2020-05-12,AG,ATG,Antigua and Barbuda
11/05/2020,11,5,2020,0,0,Antigua_and_Barbuda,AG,ATG,96286,America,2020-05-11,AG,ATG,Antigua and Barbuda
10/05/2020,10,5,2020,0,0,Antigua_and_Barbuda,AG,ATG,96286,America,2020-05-10,AG,ATG,Antigua and Barbuda
09/05/2020,9,5,2020,0,0,Antigua_and_Barbuda,AG,ATG,96286,America,2020-05-09,AG,ATG,Antigua and Barbuda
08/05/2020,8,5,2020,0,0,Antigua_and_Barbuda,AG,ATG,96286,America,2020-05-08,AG,ATG,Antigua and Barbuda
07/05/2020,7,5,2020,0,0,Antigua_and_Barbuda,AG,ATG,96286,America,2020-05-07,AG,ATG,Antigua and Barbuda
06/05/2020,6,5,2020,0,0,Antigua_and_Barbuda,AG,ATG,96286,America,2020-05-06,AG,ATG,Antigua and Barbuda
05/05/2020,5,5,2020,0,0,Antigua_and_Barbuda,AG,ATG,96286,America,2020-05-05,AG,ATG,Antigua and Barbuda
04/05/2020,4,5,2020,0,0,Antigua_and_Barbuda,AG,ATG,96286,America,2020-05-04,AG,ATG,Antigua and Barbuda
03/05/2020,3,5,2020,0,0,Antigua_and_Barbuda,AG,ATG,96286,America,2020-05-03,AG,ATG,Antigua and Barbuda
02/05/2020,2,5,2020,1,0,Antigua_and_Barbuda,AG,ATG,96286,America,2020-05-02,AG,ATG,Antigua and Barbuda
01/05/2020,1,5,2020,0,0,Antigua_and_Barbuda,AG,ATG,96286,America,2020-05-01,AG,ATG,Antigua and Barbuda
30/04/2020,30,4,2020,0,0,Antigua_and_Barbuda,AG,ATG,96286,America,2020-04-30,AG,ATG,Antigua and Barbuda
29/04/2020,29,4,2020,0,0,Antigua_and_Barbuda,AG,ATG,96286,America,2020-04-29,AG,ATG,Antigua and Barbuda
28/04/2020,28,4,2020,0,0,Antigua_and_Barbuda,AG,ATG,96286,America,2020-04-28,AG,ATG,Antigua and Barbuda
27/04/2020,27,4,2020,0,0,Antigua_and_Barbuda,AG,ATG,96286,America,2020-04-27,AG,ATG,Antigua and Barbuda
26/04/2020,26,4,2020,0,0,Antigua_and_Barbuda,AG,ATG,96286,America,2020-04-26,AG,ATG,Antigua and Barbuda
25/04/2020,25,4,2020,0,0,Antigua_and_Barbuda,AG,ATG,96286,America,2020-04-25,AG,ATG,Antigua and Barbuda
24/04/2020,24,4,2020,0,0,Antigua_and_Barbuda,AG,ATG,96286,America,2020-04-24,AG,ATG,Antigua and Barbuda
23/04/2020,23,4,2020,0,0,Antigua_and_Barbuda,AG,ATG,96286,America,2020-04-23,AG,ATG,Antigua and Barbuda
22/04/2020,22,4,2020,1,0,Antigua_and_Barbuda,AG,ATG,96286,America,2020-04-22,AG,ATG,Antigua and Barbuda
21/04/2020,21,4,2020,0,1,Antigua_and_Barbuda,AG,ATG,96286,America,2020-04-21,AG,ATG,Antigua and Barbuda
20/04/2020,20,4,2020,0,0,Antigua_and_Barbuda,AG,ATG,96286,America,2020-04-20,AG,ATG,Antigua and Barbuda
19/04/2020,19,4,2020,0,0,Antigua_and_Barbuda,AG,ATG,96286,America,2020-04-19,AG,ATG,Antigua and Barbuda
18/04/2020,18,4,2020,0,0,Antigua_and_Barbuda,AG,ATG,96286,America,2020-04-18,AG,ATG,Antigua and Barbuda
17/04/2020,17,4,2020,0,0,Antigua_and_Barbuda,AG,ATG,96286,America,2020-04-17,AG,ATG,Antigua and Barbuda
16/04/2020,16,4,2020,0,0,Antigua_and_Barbuda,AG,ATG,96286,America,2020-04-16,AG,ATG,Antigua and Barbuda
15/04/2020,15,4,2020,0,0,Antigua_and_Barbuda,AG,ATG,96286,America,2020-04-15,AG,ATG,Antigua and Barbuda
14/04/2020,14,4,2020,2,0,Antigua_and_Barbuda,AG,ATG,96286,America,2020-04-14,AG,ATG,Antigua and Barbuda
13/04/2020,13,4,2020,0,0,Antigua_and_Barbuda,AG,ATG,96286,America,2020-04-13,AG,ATG,Antigua and Barbuda
12/04/2020,12,4,2020,0,0,Antigua_and_Barbuda,AG,ATG,96286,America,2020-04-12,AG,ATG,Antigua and Barbuda
11/04/2020,11,4,2020,2,0,Antigua_and_Barbuda,AG,ATG,96286,America,2020-04-11,AG,ATG,Antigua and Barbuda
10/04/2020,10,4,2020,4,2,Antigua_and_Barbuda,AG,ATG,96286,America,2020-04-10,AG,ATG,Antigua and Barbuda
09/04/2020,9,4,2020,0,0,Antigua_and_Barbuda,AG,ATG,96286,America,2020-04-09,AG,ATG,Antigua and Barbuda
08/04/2020,8,4,2020,0,0,Antigua_and_Barbuda,AG,ATG,96286,America,2020-04-08,AG,ATG,Antigua and Barbuda
07/04/2020,7,4,2020,0,0,Antigua_and_Barbuda,AG,ATG,96286,America,2020-04-07,AG,ATG,Antigua and Barbuda
06/04/2020,6,4,2020,0,0,Antigua_and_Barbuda,AG,ATG,96286,America,2020-04-06,AG,ATG,Antigua and Barbuda
05/04/2020,5,4,2020,0,0,Antigua_and_Barbuda,AG,ATG,96286,America,2020-04-05,AG,ATG,Antigua and Barbuda
04/04/2020,4,4,2020,6,0,Antigua_and_Barbuda,AG,ATG,96286,America,2020-04-04,AG,ATG,Antigua and Barbuda
03/04/2020,3,4,2020,2,0,Antigua_and_Barbuda,AG,ATG,96286,America,2020-04-03,AG,ATG,Antigua and Barbuda
02/04/2020,2,4,2020,0,0,Antigua_and_Barbuda,AG,ATG,96286,America,2020-04-02,AG,ATG,Antigua and Barbuda
01/04/2020,1,4,2020,0,0,Antigua_and_Barbuda,AG,ATG,96286,America,2020-04-01,AG,ATG,Antigua and Barbuda
31/03/2020,31,3,2020,0,0,Antigua_and_Barbuda,AG,ATG,96286,America,2020-03-31,AG,ATG,Antigua and Barbuda
30/03/2020,30,3,2020,0,0,Antigua_and_Barbuda,AG,ATG,96286,America,2020-03-30,AG,ATG,Antigua and Barbuda
29/03/2020,29,3,2020,0,0,Antigua_and_Barbuda,AG,ATG,96286,America,2020-03-29,AG,ATG,Antigua and Barbuda
28/03/2020,28,3,2020,0,0,Antigua_and_Barbuda,AG,ATG,96286,America,2020-03-28,AG,ATG,Antigua and Barbuda
27/03/2020,27,3,2020,4,0,Antigua_and_Barbuda,AG,ATG,96286,America,2020-03-27,AG,ATG,Antigua and Barbuda
26/03/2020,26,3,2020,0,0,Antigua_and_Barbuda,AG,ATG,96286,America,2020-03-26,AG,ATG,Antigua and Barbuda
25/03/2020,25,3,2020,2,0,Antigua_and_Barbuda,AG,ATG,96286,America,2020-03-25,AG,ATG,Antigua and Barbuda
24/03/2020,24,3,2020,0,0,Antigua_and_Barbuda,AG,ATG,96286,America,2020-03-24,AG,ATG,Antigua and Barbuda
23/03/2020,23,3,2020,0,0,Antigua_and_Barbuda,AG,ATG,96286,America,2020-03-23,AG,ATG,Antigua and Barbuda
22/03/2020,22,3,2020,0,0,Antigua_and_Barbuda,AG,ATG,96286,America,2020-03-22,AG,ATG,Antigua and Barbuda
21/03/2020,21,3,2020,0,0,Antigua_and_Barbuda,AG,ATG,96286,America,2020-03-21,AG,ATG,Antigua and Barbuda
15/03/2020,15,3,2020,1,0,Antigua_and_Barbuda,AG,ATG,96286,America,2020-03-15,AG,ATG,Antigua and Barbuda
17/05/2020,17,5,2020,326,7,Argentina,AR,ARG,44494502,America,2020-05-17,AR,ARG,Argentina
16/05/2020,16,5,2020,345,3,Argentina,AR,ARG,44494502,America,2020-05-16,AR,ARG,Argentina
15/05/2020,15,5,2020,255,24,Argentina,AR,ARG,44494502,America,2020-05-15,AR,ARG,Argentina
14/05/2020,14,5,2020,316,10,Argentina,AR,ARG,44494502,America,2020-05-14,AR,ARG,Argentina
13/05/2020,13,5,2020,529,14,Argentina,AR,ARG,44494502,America,2020-05-13,AR,ARG,Argentina
12/05/2020,12,5,2020,245,5,Argentina,AR,ARG,44494502,America,2020-05-12,AR,ARG,Argentina
11/05/2020,11,5,2020,13,0,Argentina,AR,ARG,44494502,America,2020-05-11,AR,ARG,Argentina
10/05/2020,10,5,2020,165,7,Argentina,AR,ARG,44494502,America,2020-05-10,AR,ARG,Argentina
09/05/2020,9,5,2020,240,11,Argentina,AR,ARG,44494502,America,2020-05-09,AR,ARG,Argentina
08/05/2020,8,5,2020,163,9,Argentina,AR,ARG,44494502,America,2020-05-08,AR,ARG,Argentina
07/05/2020,7,5,2020,188,9,Argentina,AR,ARG,44494502,America,2020-05-07,AR,ARG,Argentina
06/05/2020,6,5,2020,133,4,Argentina,AR,ARG,44494502,America,2020-05-06,AR,ARG,Argentina
05/05/2020,5,5,2020,104,14,Argentina,AR,ARG,44494502,America,2020-05-05,AR,ARG,Argentina
04/05/2020,4,5,2020,102,9,Argentina,AR,ARG,44494502,America,2020-05-04,AR,ARG,Argentina
03/05/2020,3,5,2020,149,12,Argentina,AR,ARG,44494502,America,2020-05-03,AR,ARG,Argentina
02/05/2020,2,5,2020,104,7,Argentina,AR,ARG,44494502,America,2020-05-02,AR,ARG,Argentina
01/05/2020,1,5,2020,143,4,Argentina,AR,ARG,44494502,America,2020-05-01,AR,ARG,Argentina
30/04/2020,30,4,2020,158,7,Argentina,AR,ARG,44494502,America,2020-04-30,AR,ARG,Argentina
29/04/2020,29,4,2020,124,10,Argentina,AR,ARG,44494502,America,2020-04-29,AR,ARG,Argentina
28/04/2020,28,4,2020,223,11,Argentina,AR,ARG,44494502,America,2020-04-28,AR,ARG,Argentina
27/04/2020,27,4,2020,0,1,Argentina,AR,ARG,44494502,America,2020-04-27,AR,ARG,Argentina
26/04/2020,26,4,2020,344,18,Argentina,AR,ARG,44494502,America,2020-04-26,AR,ARG,Argentina
25/04/2020,25,4,2020,0,2,Argentina,AR,ARG,44494502,America,2020-04-25,AR,ARG,Argentina
24/04/2020,24,4,2020,147,6,Argentina,AR,ARG,44494502,America,2020-04-24,AR,ARG,Argentina
23/04/2020,23,4,2020,144,8,Argentina,AR,ARG,44494502,America,2020-04-23,AR,ARG,Argentina
22/04/2020,22,4,2020,112,9,Argentina,AR,ARG,44494502,America,2020-04-22,AR,ARG,Argentina
21/04/2020,21,4,2020,90,8,Argentina,AR,ARG,44494502,America,2020-04-21,AR,ARG,Argentina
20/04/2020,20,4,2020,102,2,Argentina,AR,ARG,44494502,America,2020-04-20,AR,ARG,Argentina
19/04/2020,19,4,2020,170,10,Argentina,AR,ARG,44494502,America,2020-04-19,AR,ARG,Argentina
18/04/2020,18,4,2020,98,7,Argentina,AR,ARG,44494502,America,2020-04-18,AR,ARG,Argentina
17/04/2020,17,4,2020,128,6,Argentina,AR,ARG,44494502,America,2020-04-17,AR,ARG,Argentina
16/04/2020,16,4,2020,0,4,Argentina,AR,ARG,44494502,America,2020-04-16,AR,ARG,Argentina
15/04/2020,15,4,2020,160,7,Argentina,AR,ARG,44494502,America,2020-04-15,AR,ARG,Argentina
14/04/2020,14,4,2020,69,3,Argentina,AR,ARG,44494502,America,2020-04-14,AR,ARG,Argentina
13/04/2020,13,4,2020,66,6,Argentina,AR,ARG,44494502,America,2020-04-13,AR,ARG,Argentina
12/04/2020,12,4,2020,162,7,Argentina,AR,ARG,44494502,America,2020-04-12,AR,ARG,Argentina
11/04/2020,11,4,2020,81,3,Argentina,AR,ARG,44494502,America,2020-04-11,AR,ARG,Argentina
10/04/2020,10,4,2020,99,14,Argentina,AR,ARG,44494502,America,2020-04-10,AR,ARG,Argentina
09/04/2020,9,4,2020,80,5,Argentina,AR,ARG,44494502,America,2020-04-09,AR,ARG,Argentina
08/04/2020,8,4,2020,87,7,Argentina,AR,ARG,44494502,America,2020-04-08,AR,ARG,Argentina
07/04/2020,7,4,2020,74,7,Argentina,AR,ARG,44494502,America,2020-04-07,AR,ARG,Argentina
06/04/2020,6,4,2020,103,3,Argentina,AR,ARG,44494502,America,2020-04-06,AR,ARG,Argentina
05/04/2020,5,4,2020,186,6,Argentina,AR,ARG,44494502,America,2020-04-05,AR,ARG,Argentina
04/04/2020,4,4,2020,132,3,Argentina,AR,ARG,44494502,America,2020-04-04,AR,ARG,Argentina
03/04/2020,3,4,2020,0,3,Argentina,AR,ARG,44494502,America,2020-04-03,AR,ARG,Argentina
02/04/2020,2,4,2020,167,7,Argentina,AR,ARG,44494502,America,2020-04-02,AR,ARG,Argentina
01/04/2020,1,4,2020,0,0,Argentina,AR,ARG,44494502,America,2020-04-01,AR,ARG,Argentina
31/03/2020,31,3,2020,146,4,Argentina,AR,ARG,44494502,America,2020-03-31,AR,ARG,Argentina
30/03/2020,30,3,2020,75,1,Argentina,AR,ARG,44494502,America,2020-03-30,AR,ARG,Argentina
29/03/2020,29,3,2020,55,2,Argentina,AR,ARG,44494502,America,2020-03-29,AR,ARG,Argentina
28/03/2020,28,3,2020,101,5,Argentina,AR,ARG,44494502,America,2020-03-28,AR,ARG,Argentina
27/03/2020,27,3,2020,87,4,Argentina,AR,ARG,44494502,America,2020-03-27,AR,ARG,Argentina
26/03/2020,26,3,2020,115,2,Argentina,AR,ARG,44494502,America,2020-03-26,AR,ARG,Argentina
25/03/2020,25,3,2020,86,2,Argentina,AR,ARG,44494502,America,2020-03-25,AR,ARG,Argentina
24/03/2020,24,3,2020,35,0,Argentina,AR,ARG,44494502,America,2020-03-24,AR,ARG,Argentina
23/03/2020,23,3,2020,41,0,Argentina,AR,ARG,44494502,America,2020-03-23,AR,ARG,Argentina
22/03/2020,22,3,2020,67,1,Argentina,AR,ARG,44494502,America,2020-03-22,AR,ARG,Argentina
21/03/2020,21,3,2020,30,0,Argentina,AR,ARG,44494502,America,2020-03-21,AR,ARG,Argentina
20/03/2020,20,3,2020,31,1,Argentina,AR,ARG,44494502,America,2020-03-20,AR,ARG,Argentina
19/03/2020,19,3,2020,18,0,Argentina,AR,ARG,44494502,America,2020-03-19,AR,ARG,Argentina
18/03/2020,18,3,2020,14,0,Argentina,AR,ARG,44494502,America,2020-03-18,AR,ARG,Argentina
17/03/2020,17,3,2020,9,0,Argentina,AR,ARG,44494502,America,2020-03-17,AR,ARG,Argentina
16/03/2020,16,3,2020,11,0,Argentina,AR,ARG,44494502,America,2020-03-16,AR,ARG,Argentina
15/03/2020,15,3,2020,11,0,Argentina,AR,ARG,44494502,America,2020-03-15,AR,ARG,Argentina
14/03/2020,14,3,2020,3,1,Argentina,AR,ARG,44494502,America,2020-03-14,AR,ARG,Argentina
13/03/2020,13,3,2020,12,0,Argentina,AR,ARG,44494502,America,2020-03-13,AR,ARG,Argentina
11/03/2020,11,3,2020,7,0,Argentina,AR,ARG,44494502,America,2020-03-11,AR,ARG,Argentina
09/03/2020,9,3,2020,3,0,Argentina,AR,ARG,44494502,America,2020-03-09,AR,ARG,Argentina
08/03/2020,8,3,2020,1,1,Argentina,AR,ARG,44494502,America,2020-03-08,AR,ARG,Argentina
07/03/2020,7,3,2020,6,0,Argentina,AR,ARG,44494502,America,2020-03-07,AR,ARG,Argentina
06/03/2020,6,3,2020,1,0,Argentina,AR,ARG,44494502,America,2020-03-06,AR,ARG,Argentina
04/03/2020,4,3,2020,1,0,Argentina,AR,ARG,44494502,America,2020-03-04,AR,ARG,Argentina
17/05/2020,17,5,2020,239,3,Armenia,AM,ARM,2951776,Europe,2020-05-17,AM,ARM,Armenia
16/05/2020,16,5,2020,184,3,Armenia,AM,ARM,2951776,Europe,2020-05-16,AM,ARM,Armenia
15/05/2020,15,5,2020,142,1,Armenia,AM,ARM,2951776,Europe,2020-05-15,AM,ARM,Armenia
14/05/2020,14,5,2020,180,1,Armenia,AM,ARM,2951776,Europe,2020-05-14,AM,ARM,Armenia
13/05/2020,13,5,2020,146,1,Armenia,AM,ARM,2951776,Europe,2020-05-13,AM,ARM,Armenia
12/05/2020,12,5,2020,79,1,Armenia,AM,ARM,2951776,Europe,2020-05-12,AM,ARM,Armenia
11/05/2020,11,5,2020,138,1,Armenia,AM,ARM,2951776,Europe,2020-05-11,AM,ARM,Armenia
10/05/2020,10,5,2020,146,1,Armenia,AM,ARM,2951776,Europe,2020-05-10,AM,ARM,Armenia
09/05/2020,9,5,2020,145,1,Armenia,AM,ARM,2951776,Europe,2020-05-09,AM,ARM,Armenia
08/05/2020,8,5,2020,102,2,Armenia,AM,ARM,2951776,Europe,2020-05-08,AM,ARM,Armenia
07/05/2020,7,5,2020,163,0,Armenia,AM,ARM,2951776,Europe,2020-05-07,AM,ARM,Armenia
06/05/2020,6,5,2020,112,1,Armenia,AM,ARM,2951776,Europe,2020-05-06,AM,ARM,Armenia
05/05/2020,5,5,2020,121,4,Armenia,AM,ARM,2951776,Europe,2020-05-05,AM,ARM,Armenia
04/05/2020,4,5,2020,113,2,Armenia,AM,ARM,2951776,Europe,2020-05-04,AM,ARM,Armenia
03/05/2020,3,5,2020,125,0,Armenia,AM,ARM,2951776,Europe,2020-05-03,AM,ARM,Armenia
02/05/2020,2,5,2020,82,1,Armenia,AM,ARM,2951776,Europe,2020-05-02,AM,ARM,Armenia
01/05/2020,1,5,2020,134,2,Armenia,AM,ARM,2951776,Europe,2020-05-01,AM,ARM,Armenia
30/04/2020,30,4,2020,0,0,Armenia,AM,ARM,2951776,Europe,2020-04-30,AM,ARM,Armenia
29/04/2020,29,4,2020,65,0,Armenia,AM,ARM,2951776,Europe,2020-04-29,AM,ARM,Armenia
28/04/2020,28,4,2020,59,1,Armenia,AM,ARM,2951776,Europe,2020-04-28,AM,ARM,Armenia
27/04/2020,27,4,2020,62,1,Armenia,AM,ARM,2951776,Europe,2020-04-27,AM,ARM,Armenia
26/04/2020,26,4,2020,69,0,Armenia,AM,ARM,2951776,Europe,2020-04-26,AM,ARM,Armenia
25/04/2020,25,4,2020,81,1,Armenia,AM,ARM,2951776,Europe,2020-04-25,AM,ARM,Armenia
24/04/2020,24,4,2020,73,3,Armenia,AM,ARM,2951776,Europe,2020-04-24,AM,ARM,Armenia
23/04/2020,23,4,2020,50,0,Armenia,AM,ARM,2951776,Europe,2020-04-23,AM,ARM,Armenia
22/04/2020,22,4,2020,72,0,Armenia,AM,ARM,2951776,Europe,2020-04-22,AM,ARM,Armenia
21/04/2020,21,4,2020,62,2,Armenia,AM,ARM,2951776,Europe,2020-04-21,AM,ARM,Armenia
20/04/2020,20,4,2020,48,2,Armenia,AM,ARM,2951776,Europe,2020-04-20,AM,ARM,Armenia
19/04/2020,19,4,2020,43,0,Armenia,AM,ARM,2951776,Europe,2020-04-19,AM,ARM,Armenia
18/04/2020,18,4,2020,47,1,Armenia,AM,ARM,2951776,Europe,2020-04-18,AM,ARM,Armenia
17/04/2020,17,4,2020,42,1,Armenia,AM,ARM,2951776,Europe,2020-04-17,AM,ARM,Armenia
16/04/2020,16,4,2020,48,1,Armenia,AM,ARM,2951776,Europe,2020-04-16,AM,ARM,Armenia
15/04/2020,15,4,2020,72,3,Armenia,AM,ARM,2951776,Europe,2020-04-15,AM,ARM,Armenia
14/04/2020,14,4,2020,26,1,Armenia,AM,ARM,2951776,Europe,2020-04-14,AM,ARM,Armenia
13/04/2020,13,4,2020,46,0,Armenia,AM,ARM,2951776,Europe,2020-04-13,AM,ARM,Armenia
12/04/2020,12,4,2020,30,2,Armenia,AM,ARM,2951776,Europe,2020-04-12,AM,ARM,Armenia
11/04/2020,11,4,2020,16,1,Armenia,AM,ARM,2951776,Europe,2020-04-11,AM,ARM,Armenia
10/04/2020,10,4,2020,40,1,Armenia,AM,ARM,2951776,Europe,2020-04-10,AM,ARM,Armenia
09/04/2020,9,4,2020,28,1,Armenia,AM,ARM,2951776,Europe,2020-04-09,AM,ARM,Armenia
08/04/2020,8,4,2020,20,0,Armenia,AM,ARM,2951776,Europe,2020-04-08,AM,ARM,Armenia
07/04/2020,7,4,2020,11,1,Armenia,AM,ARM,2951776,Europe,2020-04-07,AM,ARM,Armenia
06/04/2020,6,4,2020,52,0,Armenia,AM,ARM,2951776,Europe,2020-04-06,AM,ARM,Armenia
05/04/2020,5,4,2020,34,0,Armenia,AM,ARM,2951776,Europe,2020-04-05,AM,ARM,Armenia
04/04/2020,4,4,2020,73,3,Armenia,AM,ARM,2951776,Europe,2020-04-04,AM,ARM,Armenia
03/04/2020,3,4,2020,92,1,Armenia,AM,ARM,2951776,Europe,2020-04-03,AM,ARM,Armenia
02/04/2020,2,4,2020,39,0,Armenia,AM,ARM,2951776,Europe,2020-04-02,AM,ARM,Armenia
01/04/2020,1,4,2020,50,0,Armenia,AM,ARM,2951776,Europe,2020-04-01,AM,ARM,Armenia
31/03/2020,31,3,2020,58,0,Armenia,AM,ARM,2951776,Europe,2020-03-31,AM,ARM,Armenia
30/03/2020,30,3,2020,0,0,Armenia,AM,ARM,2951776,Europe,2020-03-30,AM,ARM,Armenia
29/03/2020,29,3,2020,52,2,Armenia,AM,ARM,2951776,Europe,2020-03-29,AM,ARM,Armenia
28/03/2020,28,3,2020,43,0,Armenia,AM,ARM,2951776,Europe,2020-03-28,AM,ARM,Armenia
27/03/2020,27,3,2020,39,1,Armenia,AM,ARM,2951776,Europe,2020-03-27,AM,ARM,Armenia
26/03/2020,26,3,2020,25,0,Armenia,AM,ARM,2951776,Europe,2020-03-26,AM,ARM,Armenia
25/03/2020,25,3,2020,71,0,Armenia,AM,ARM,2951776,Europe,2020-03-25,AM,ARM,Armenia
24/03/2020,24,3,2020,4,0,Armenia,AM,ARM,2951776,Europe,2020-03-24,AM,ARM,Armenia
23/03/2020,23,3,2020,30,0,Armenia,AM,ARM,2951776,Europe,2020-03-23,AM,ARM,Armenia
22/03/2020,22,3,2020,24,0,Armenia,AM,ARM,2951776,Europe,2020-03-22,AM,ARM,Armenia
21/03/2020,21,3,2020,14,0,Armenia,AM,ARM,2951776,Europe,2020-03-21,AM,ARM,Armenia
20/03/2020,20,3,2020,7,0,Armenia,AM,ARM,2951776,Europe,2020-03-20,AM,ARM,Armenia
19/03/2020,19,3,2020,37,0,Armenia,AM,ARM,2951776,Europe,2020-03-19,AM,ARM,Armenia
18/03/2020,18,3,2020,26,0,Armenia,AM,ARM,2951776,Europe,2020-03-18,AM,ARM,Armenia
17/03/2020,17,3,2020,22,0,Armenia,AM,ARM,2951776,Europe,2020-03-17,AM,ARM,Armenia
16/03/2020,16,3,2020,10,0,Armenia,AM,ARM,2951776,Europe,2020-03-16,AM,ARM,Armenia
15/03/2020,15,3,2020,7,0,Armenia,AM,ARM,2951776,Europe,2020-03-15,AM,ARM,Armenia
14/03/2020,14,3,2020,7,0,Armenia,AM,ARM,2951776,Europe,2020-03-14,AM,ARM,Armenia
13/03/2020,13,3,2020,2,0,Armenia,AM,ARM,2951776,Europe,2020-03-13,AM,ARM,Armenia
12/03/2020,12,3,2020,3,0,Armenia,AM,ARM,2951776,Europe,2020-03-12,AM,ARM,Armenia
02/03/2020,2,3,2020,0,0,Armenia,AM,ARM,2951776,Europe,2020-03-02,AM,ARM,Armenia
01/03/2020,1,3,2020,1,0,Armenia,AM,ARM,2951776,Europe,2020-03-01,AM,ARM,Armenia
29/02/2020,29,2,2020,0,0,Armenia,AM,ARM,2951776,Europe,2020-02-29,AM,ARM,Armenia
28/02/2020,28,2,2020,0,0,Armenia,AM,ARM,2951776,Europe,2020-02-28,AM,ARM,Armenia
27/02/2020,27,2,2020,0,0,Armenia,AM,ARM,2951776,Europe,2020-02-27,AM,ARM,Armenia
26/02/2020,26,2,2020,0,0,Armenia,AM,ARM,2951776,Europe,2020-02-26,AM,ARM,Armenia
25/02/2020,25,2,2020,0,0,Armenia,AM,ARM,2951776,Europe,2020-02-25,AM,ARM,Armenia
24/02/2020,24,2,2020,0,0,Armenia,AM,ARM,2951776,Europe,2020-02-24,AM,ARM,Armenia
23/02/2020,23,2,2020,0,0,Armenia,AM,ARM,2951776,Europe,2020-02-23,AM,ARM,Armenia
22/02/2020,22,2,2020,0,0,Armenia,AM,ARM,2951776,Europe,2020-02-22,AM,ARM,Armenia
21/02/2020,21,2,2020,0,0,Armenia,AM,ARM,2951776,Europe,2020-02-21,AM,ARM,Armenia
20/02/2020,20,2,2020,0,0,Armenia,AM,ARM,2951776,Europe,2020-02-20,AM,ARM,Armenia
19/02/2020,19,2,2020,0,0,Armenia,AM,ARM,2951776,Europe,2020-02-19,AM,ARM,Armenia
18/02/2020,18,2,2020,0,0,Armenia,AM,ARM,2951776,Europe,2020-02-18,AM,ARM,Armenia
17/02/2020,17,2,2020,0,0,Armenia,AM,ARM,2951776,Europe,2020-02-17,AM,ARM,Armenia
16/02/2020,16,2,2020,0,0,Armenia,AM,ARM,2951776,Europe,2020-02-16,AM,ARM,Armenia
15/02/2020,15,2,2020,0,0,Armenia,AM,ARM,2951776,Europe,2020-02-15,AM,ARM,Armenia
14/02/2020,14,2,2020,0,0,Armenia,AM,ARM,2951776,Europe,2020-02-14,AM,ARM,Armenia
13/02/2020,13,2,2020,0,0,Armenia,AM,ARM,2951776,Europe,2020-02-13,AM,ARM,Armenia
12/02/2020,12,2,2020,0,0,Armenia,AM,ARM,2951776,Europe,2020-02-12,AM,ARM,Armenia
11/02/2020,11,2,2020,0,0,Armenia,AM,ARM,2951776,Europe,2020-02-11,AM,ARM,Armenia
10/02/2020,10,2,2020,0,0,Armenia,AM,ARM,2951776,Europe,2020-02-10,AM,ARM,Armenia
09/02/2020,9,2,2020,0,0,Armenia,AM,ARM,2951776,Europe,2020-02-09,AM,ARM,Armenia
08/02/2020,8,2,2020,0,0,Armenia,AM,ARM,2951776,Europe,2020-02-08,AM,ARM,Armenia
07/02/2020,7,2,2020,0,0,Armenia,AM,ARM,2951776,Europe,2020-02-07,AM,ARM,Armenia
06/02/2020,6,2,2020,0,0,Armenia,AM,ARM,2951776,Europe,2020-02-06,AM,ARM,Armenia
05/02/2020,5,2,2020,0,0,Armenia,AM,ARM,2951776,Europe,2020-02-05,AM,ARM,Armenia
04/02/2020,4,2,2020,0,0,Armenia,AM,ARM,2951776,Europe,2020-02-04,AM,ARM,Armenia
03/02/2020,3,2,2020,0,0,Armenia,AM,ARM,2951776,Europe,2020-02-03,AM,ARM,Armenia
02/02/2020,2,2,2020,0,0,Armenia,AM,ARM,2951776,Europe,2020-02-02,AM,ARM,Armenia
01/02/2020,1,2,2020,0,0,Armenia,AM,ARM,2951776,Europe,2020-02-01,AM,ARM,Armenia
31/01/2020,31,1,2020,0,0,Armenia,AM,ARM,2951776,Europe,2020-01-31,AM,ARM,Armenia
30/01/2020,30,1,2020,0,0,Armenia,AM,ARM,2951776,Europe,2020-01-30,AM,ARM,Armenia
29/01/2020,29,1,2020,0,0,Armenia,AM,ARM,2951776,Europe,2020-01-29,AM,ARM,Armenia
28/01/2020,28,1,2020,0,0,Armenia,AM,ARM,2951776,Europe,2020-01-28,AM,ARM,Armenia
27/01/2020,27,1,2020,0,0,Armenia,AM,ARM,2951776,Europe,2020-01-27,AM,ARM,Armenia
26/01/2020,26,1,2020,0,0,Armenia,AM,ARM,2951776,Europe,2020-01-26,AM,ARM,Armenia
25/01/2020,25,1,2020,0,0,Armenia,AM,ARM,2951776,Europe,2020-01-25,AM,ARM,Armenia
24/01/2020,24,1,2020,0,0,Armenia,AM,ARM,2951776,Europe,2020-01-24,AM,ARM,Armenia
23/01/2020,23,1,2020,0,0,Armenia,AM,ARM,2951776,Europe,2020-01-23,AM,ARM,Armenia
22/01/2020,22,1,2020,0,0,Armenia,AM,ARM,2951776,Europe,2020-01-22,AM,ARM,Armenia
21/01/2020,21,1,2020,0,0,Armenia,AM,ARM,2951776,Europe,2020-01-21,AM,ARM,Armenia
20/01/2020,20,1,2020,0,0,Armenia,AM,ARM,2951776,Europe,2020-01-20,AM,ARM,Armenia
19/01/2020,19,1,2020,0,0,Armenia,AM,ARM,2951776,Europe,2020-01-19,AM,ARM,Armenia
18/01/2020,18,1,2020,0,0,Armenia,AM,ARM,2951776,Europe,2020-01-18,AM,ARM,Armenia
17/01/2020,17,1,2020,0,0,Armenia,AM,ARM,2951776,Europe,2020-01-17,AM,ARM,Armenia
16/01/2020,16,1,2020,0,0,Armenia,AM,ARM,2951776,Europe,2020-01-16,AM,ARM,Armenia
15/01/2020,15,1,2020,0,0,Armenia,AM,ARM,2951776,Europe,2020-01-15,AM,ARM,Armenia
14/01/2020,14,1,2020,0,0,Armenia,AM,ARM,2951776,Europe,2020-01-14,AM,ARM,Armenia
13/01/2020,13,1,2020,0,0,Armenia,AM,ARM,2951776,Europe,2020-01-13,AM,ARM,Armenia
12/01/2020,12,1,2020,0,0,Armenia,AM,ARM,2951776,Europe,2020-01-12,AM,ARM,Armenia
11/01/2020,11,1,2020,0,0,Armenia,AM,ARM,2951776,Europe,2020-01-11,AM,ARM,Armenia
10/01/2020,10,1,2020,0,0,Armenia,AM,ARM,2951776,Europe,2020-01-10,AM,ARM,Armenia
09/01/2020,9,1,2020,0,0,Armenia,AM,ARM,2951776,Europe,2020-01-09,AM,ARM,Armenia
08/01/2020,8,1,2020,0,0,Armenia,AM,ARM,2951776,Europe,2020-01-08,AM,ARM,Armenia
07/01/2020,7,1,2020,0,0,Armenia,AM,ARM,2951776,Europe,2020-01-07,AM,ARM,Armenia
06/01/2020,6,1,2020,0,0,Armenia,AM,ARM,2951776,Europe,2020-01-06,AM,ARM,Armenia
05/01/2020,5,1,2020,0,0,Armenia,AM,ARM,2951776,Europe,2020-01-05,AM,ARM,Armenia
04/01/2020,4,1,2020,0,0,Armenia,AM,ARM,2951776,Europe,2020-01-04,AM,ARM,Armenia
03/01/2020,3,1,2020,0,0,Armenia,AM,ARM,2951776,Europe,2020-01-03,AM,ARM,Armenia
02/01/2020,2,1,2020,0,0,Armenia,AM,ARM,2951776,Europe,2020-01-02,AM,ARM,Armenia
01/01/2020,1,1,2020,0,0,Armenia,AM,ARM,2951776,Europe,2020-01-01,AM,ARM,Armenia
31/12/2019,31,12,2019,0,0,Armenia,AM,ARM,2951776,Europe,2019-12-31,AM,ARM,Armenia
17/05/2020,17,5,2020,0,0,Aruba,AW,ABW,105845,America,2020-05-17,AW,ABW,Aruba
16/05/2020,16,5,2020,0,0,Aruba,AW,ABW,105845,America,2020-05-16,AW,ABW,Aruba
15/05/2020,15,5,2020,0,0,Aruba,AW,ABW,105845,America,2020-05-15,AW,ABW,Aruba
14/05/2020,14,5,2020,0,0,Aruba,AW,ABW,105845,America,2020-05-14,AW,ABW,Aruba
13/05/2020,13,5,2020,0,0,Aruba,AW,ABW,105845,America,2020-05-13,AW,ABW,Aruba
12/05/2020,12,5,2020,0,0,Aruba,AW,ABW,105845,America,2020-05-12,AW,ABW,Aruba
11/05/2020,11,5,2020,0,0,Aruba,AW,ABW,105845,America,2020-05-11,AW,ABW,Aruba
10/05/2020,10,5,2020,0,0,Aruba,AW,ABW,105845,America,2020-05-10,AW,ABW,Aruba
09/05/2020,9,5,2020,0,0,Aruba,AW,ABW,105845,America,2020-05-09,AW,ABW,Aruba
08/05/2020,8,5,2020,0,1,Aruba,AW,ABW,105845,America,2020-05-08,AW,ABW,Aruba
07/05/2020,7,5,2020,1,0,Aruba,AW,ABW,105845,America,2020-05-07,AW,ABW,Aruba
06/05/2020,6,5,2020,0,0,Aruba,AW,ABW,105845,America,2020-05-06,AW,ABW,Aruba
05/05/2020,5,5,2020,0,0,Aruba,AW,ABW,105845,America,2020-05-05,AW,ABW,Aruba
04/05/2020,4,5,2020,0,0,Aruba,AW,ABW,105845,America,2020-05-04,AW,ABW,Aruba
03/05/2020,3,5,2020,0,0,Aruba,AW,ABW,105845,America,2020-05-03,AW,ABW,Aruba
02/05/2020,2,5,2020,0,0,Aruba,AW,ABW,105845,America,2020-05-02,AW,ABW,Aruba
01/05/2020,1,5,2020,0,0,Aruba,AW,ABW,105845,America,2020-05-01,AW,ABW,Aruba
30/04/2020,30,4,2020,0,0,Aruba,AW,ABW,105845,America,2020-04-30,AW,ABW,Aruba
29/04/2020,29,4,2020,0,0,Aruba,AW,ABW,105845,America,2020-04-29,AW,ABW,Aruba
28/04/2020,28,4,2020,0,0,Aruba,AW,ABW,105845,America,2020-04-28,AW,ABW,Aruba
27/04/2020,27,4,2020,0,0,Aruba,AW,ABW,105845,America,2020-04-27,AW,ABW,Aruba
26/04/2020,26,4,2020,0,0,Aruba,AW,ABW,105845,America,2020-04-26,AW,ABW,Aruba
25/04/2020,25,4,2020,0,0,Aruba,AW,ABW,105845,America,2020-04-25,AW,ABW,Aruba
24/04/2020,24,4,2020,0,0,Aruba,AW,ABW,105845,America,2020-04-24,AW,ABW,Aruba
23/04/2020,23,4,2020,3,0,Aruba,AW,ABW,105845,America,2020-04-23,AW,ABW,Aruba
22/04/2020,22,4,2020,0,0,Aruba,AW,ABW,105845,America,2020-04-22,AW,ABW,Aruba
21/04/2020,21,4,2020,0,0,Aruba,AW,ABW,105845,America,2020-04-21,AW,ABW,Aruba
20/04/2020,20,4,2020,1,0,Aruba,AW,ABW,105845,America,2020-04-20,AW,ABW,Aruba
19/04/2020,19,4,2020,0,0,Aruba,AW,ABW,105845,America,2020-04-19,AW,ABW,Aruba
18/04/2020,18,4,2020,1,1,Aruba,AW,ABW,105845,America,2020-04-18,AW,ABW,Aruba
17/04/2020,17,4,2020,2,0,Aruba,AW,ABW,105845,America,2020-04-17,AW,ABW,Aruba
16/04/2020,16,4,2020,1,1,Aruba,AW,ABW,105845,America,2020-04-16,AW,ABW,Aruba
15/04/2020,15,4,2020,0,0,Aruba,AW,ABW,105845,America,2020-04-15,AW,ABW,Aruba
14/04/2020,14,4,2020,0,0,Aruba,AW,ABW,105845,America,2020-04-14,AW,ABW,Aruba
13/04/2020,13,4,2020,0,0,Aruba,AW,ABW,105845,America,2020-04-13,AW,ABW,Aruba
12/04/2020,12,4,2020,6,0,Aruba,AW,ABW,105845,America,2020-04-12,AW,ABW,Aruba
11/04/2020,11,4,2020,4,0,Aruba,AW,ABW,105845,America,2020-04-11,AW,ABW,Aruba
10/04/2020,10,4,2020,5,0,Aruba,AW,ABW,105845,America,2020-04-10,AW,ABW,Aruba
09/04/2020,9,4,2020,3,0,Aruba,AW,ABW,105845,America,2020-04-09,AW,ABW,Aruba
08/04/2020,8,4,2020,3,0,Aruba,AW,ABW,105845,America,2020-04-08,AW,ABW,Aruba
07/04/2020,7,4,2020,7,0,Aruba,AW,ABW,105845,America,2020-04-07,AW,ABW,Aruba
06/04/2020,6,4,2020,0,0,Aruba,AW,ABW,105845,America,2020-04-06,AW,ABW,Aruba
05/04/2020,5,4,2020,2,0,Aruba,AW,ABW,105845,America,2020-04-05,AW,ABW,Aruba
04/04/2020,4,4,2020,2,0,Aruba,AW,ABW,105845,America,2020-04-04,AW,ABW,Aruba
03/04/2020,3,4,2020,5,0,Aruba,AW,ABW,105845,America,2020-04-03,AW,ABW,Aruba
02/04/2020,2,4,2020,0,0,Aruba,AW,ABW,105845,America,2020-04-02,AW,ABW,Aruba
01/04/2020,1,4,2020,5,0,Aruba,AW,ABW,105845,America,2020-04-01,AW,ABW,Aruba
30/03/2020,30,3,2020,22,0,Aruba,AW,ABW,105845,America,2020-03-30,AW,ABW,Aruba
29/03/2020,29,3,2020,0,0,Aruba,AW,ABW,105845,America,2020-03-29,AW,ABW,Aruba
28/03/2020,28,3,2020,0,0,Aruba,AW,ABW,105845,America,2020-03-28,AW,ABW,Aruba
27/03/2020,27,3,2020,9,0,Aruba,AW,ABW,105845,America,2020-03-27,AW,ABW,Aruba
26/03/2020,26,3,2020,2,0,Aruba,AW,ABW,105845,America,2020-03-26,AW,ABW,Aruba
25/03/2020,25,3,2020,5,0,Aruba,AW,ABW,105845,America,2020-03-25,AW,ABW,Aruba
24/03/2020,24,3,2020,8,0,Aruba,AW,ABW,105845,America,2020-03-24,AW,ABW,Aruba
20/03/2020,20,3,2020,2,0,Aruba,AW,ABW,105845,America,2020-03-20,AW,ABW,Aruba
13/03/2020,13,3,2020,2,0,Aruba,AW,ABW,105845,America,2020-03-13,AW,ABW,Aruba
17/05/2020,17,5,2020,17,0,Australia,AU,AUS,24992369,Oceania,2020-05-17,AU,AUS,Australia
16/05/2020,16,5,2020,30,0,Australia,AU,AUS,24992369,Oceania,2020-05-16,AU,AUS,Australia
15/05/2020,15,5,2020,14,0,Australia,AU,AUS,24992369,Oceania,2020-05-15,AU,AUS,Australia
14/05/2020,14,5,2020,11,1,Australia,AU,AUS,24992369,Oceania,2020-05-14,AU,AUS,Australia
13/05/2020,13,5,2020,16,0,Australia,AU,AUS,24992369,Oceania,2020-05-13,AU,AUS,Australia
12/05/2020,12,5,2020,7,0,Australia,AU,AUS,24992369,Oceania,2020-05-12,AU,AUS,Australia
11/05/2020,11,5,2020,12,0,Australia,AU,AUS,24992369,Oceania,2020-05-11,AU,AUS,Australia
10/05/2020,10,5,2020,15,0,Australia,AU,AUS,24992369,Oceania,2020-05-10,AU,AUS,Australia
09/05/2020,9,5,2020,18,0,Australia,AU,AUS,24992369,Oceania,2020-05-09,AU,AUS,Australia
08/05/2020,8,5,2020,21,0,Australia,AU,AUS,24992369,Oceania,2020-05-08,AU,AUS,Australia
07/05/2020,7,5,2020,26,1,Australia,AU,AUS,24992369,Oceania,2020-05-07,AU,AUS,Australia
06/05/2020,6,5,2020,24,1,Australia,AU,AUS,24992369,Oceania,2020-05-06,AU,AUS,Australia
05/05/2020,5,5,2020,24,0,Australia,AU,AUS,24992369,Oceania,2020-05-05,AU,AUS,Australia
04/05/2020,4,5,2020,18,2,Australia,AU,AUS,24992369,Oceania,2020-05-04,AU,AUS,Australia
03/05/2020,3,5,2020,16,0,Australia,AU,AUS,24992369,Oceania,2020-05-03,AU,AUS,Australia
02/05/2020,2,5,2020,5,1,Australia,AU,AUS,24992369,Oceania,2020-05-02,AU,AUS,Australia
01/05/2020,1,5,2020,16,2,Australia,AU,AUS,24992369,Oceania,2020-05-01,AU,AUS,Australia
30/04/2020,30,4,2020,8,2,Australia,AU,AUS,24992369,Oceania,2020-04-30,AU,AUS,Australia
29/04/2020,29,4,2020,13,4,Australia,AU,AUS,24992369,Oceania,2020-04-29,AU,AUS,Australia
28/04/2020,28,4,2020,12,1,Australia,AU,AUS,24992369,Oceania,2020-04-28,AU,AUS,Australia
27/04/2020,27,4,2020,10,2,Australia,AU,AUS,24992369,Oceania,2020-04-27,AU,AUS,Australia
26/04/2020,26,4,2020,16,2,Australia,AU,AUS,24992369,Oceania,2020-04-26,AU,AUS,Australia
25/04/2020,25,4,2020,20,4,Australia,AU,AUS,24992369,Oceania,2020-04-25,AU,AUS,Australia
24/04/2020,24,4,2020,13,1,Australia,AU,AUS,24992369,Oceania,2020-04-24,AU,AUS,Australia
23/04/2020,23,4,2020,7,0,Australia,AU,AUS,24992369,Oceania,2020-04-23,AU,AUS,Australia
22/04/2020,22,4,2020,22,3,Australia,AU,AUS,24992369,Oceania,2020-04-22,AU,AUS,Australia
21/04/2020,21,4,2020,13,1,Australia,AU,AUS,24992369,Oceania,2020-04-21,AU,AUS,Australia
20/04/2020,20,4,2020,26,1,Australia,AU,AUS,24992369,Oceania,2020-04-20,AU,AUS,Australia
19/04/2020,19,4,2020,53,2,Australia,AU,AUS,24992369,Oceania,2020-04-19,AU,AUS,Australia
18/04/2020,18,4,2020,36,4,Australia,AU,AUS,24992369,Oceania,2020-04-18,AU,AUS,Australia
17/04/2020,17,4,2020,39,0,Australia,AU,AUS,24992369,Oceania,2020-04-17,AU,AUS,Australia
16/04/2020,16,4,2020,42,2,Australia,AU,AUS,24992369,Oceania,2020-04-16,AU,AUS,Australia
15/04/2020,15,4,2020,50,0,Australia,AU,AUS,24992369,Oceania,2020-04-15,AU,AUS,Australia
14/04/2020,14,4,2020,44,0,Australia,AU,AUS,24992369,Oceania,2020-04-14,AU,AUS,Australia
13/04/2020,13,4,2020,33,4,Australia,AU,AUS,24992369,Oceania,2020-04-13,AU,AUS,Australia
12/04/2020,12,4,2020,51,3,Australia,AU,AUS,24992369,Oceania,2020-04-12,AU,AUS,Australia
11/04/2020,11,4,2020,86,2,Australia,AU,AUS,24992369,Oceania,2020-04-11,AU,AUS,Australia
10/04/2020,10,4,2020,100,2,Australia,AU,AUS,24992369,Oceania,2020-04-10,AU,AUS,Australia
09/04/2020,9,4,2020,96,5,Australia,AU,AUS,24992369,Oceania,2020-04-09,AU,AUS,Australia
08/04/2020,8,4,2020,112,3,Australia,AU,AUS,24992369,Oceania,2020-04-08,AU,AUS,Australia
07/04/2020,7,4,2020,100,6,Australia,AU,AUS,24992369,Oceania,2020-04-07,AU,AUS,Australia
06/04/2020,6,4,2020,57,2,Australia,AU,AUS,24992369,Oceania,2020-04-06,AU,AUS,Australia
05/04/2020,5,4,2020,139,4,Australia,AU,AUS,24992369,Oceania,2020-04-05,AU,AUS,Australia
04/04/2020,4,4,2020,324,7,Australia,AU,AUS,24992369,Oceania,2020-04-04,AU,AUS,Australia
03/04/2020,3,4,2020,248,2,Australia,AU,AUS,24992369,Oceania,2020-04-03,AU,AUS,Australia
02/04/2020,2,4,2020,269,1,Australia,AU,AUS,24992369,Oceania,2020-04-02,AU,AUS,Australia
01/04/2020,1,4,2020,150,1,Australia,AU,AUS,24992369,Oceania,2020-04-01,AU,AUS,Australia
31/03/2020,31,3,2020,464,3,Australia,AU,AUS,24992369,Oceania,2020-03-31,AU,AUS,Australia
30/03/2020,30,3,2020,284,2,Australia,AU,AUS,24992369,Oceania,2020-03-30,AU,AUS,Australia
29/03/2020,29,3,2020,431,1,Australia,AU,AUS,24992369,Oceania,2020-03-29,AU,AUS,Australia
28/03/2020,28,3,2020,212,0,Australia,AU,AUS,24992369,Oceania,2020-03-28,AU,AUS,Australia
27/03/2020,27,3,2020,367,2,Australia,AU,AUS,24992369,Oceania,2020-03-27,AU,AUS,Australia
26/03/2020,26,3,2020,376,3,Australia,AU,AUS,24992369,Oceania,2020-03-26,AU,AUS,Australia
25/03/2020,25,3,2020,600,1,Australia,AU,AUS,24992369,Oceania,2020-03-25,AU,AUS,Australia
24/03/2020,24,3,2020,114,0,Australia,AU,AUS,24992369,Oceania,2020-03-24,AU,AUS,Australia
23/03/2020,23,3,2020,611,0,Australia,AU,AUS,24992369,Oceania,2020-03-23,AU,AUS,Australia
22/03/2020,22,3,2020,224,0,Australia,AU,AUS,24992369,Oceania,2020-03-22,AU,AUS,Australia
21/03/2020,21,3,2020,165,1,Australia,AU,AUS,24992369,Oceania,2020-03-21,AU,AUS,Australia
20/03/2020,20,3,2020,144,0,Australia,AU,AUS,24992369,Oceania,2020-03-20,AU,AUS,Australia
19/03/2020,19,3,2020,111,1,Australia,AU,AUS,24992369,Oceania,2020-03-19,AU,AUS,Australia
18/03/2020,18,3,2020,79,0,Australia,AU,AUS,24992369,Oceania,2020-03-18,AU,AUS,Australia
17/03/2020,17,3,2020,77,0,Australia,AU,AUS,24992369,Oceania,2020-03-17,AU,AUS,Australia
16/03/2020,16,3,2020,49,2,Australia,AU,AUS,24992369,Oceania,2020-03-16,AU,AUS,Australia
15/03/2020,15,3,2020,52,0,Australia,AU,AUS,24992369,Oceania,2020-03-15,AU,AUS,Australia
14/03/2020,14,3,2020,41,0,Australia,AU,AUS,24992369,Oceania,2020-03-14,AU,AUS,Australia
13/03/2020,13,3,2020,30,0,Australia,AU,AUS,24992369,Oceania,2020-03-13,AU,AUS,Australia
12/03/2020,12,3,2020,14,0,Australia,AU,AUS,24992369,Oceania,2020-03-12,AU,AUS,Australia
11/03/2020,11,3,2020,12,0,Australia,AU,AUS,24992369,Oceania,2020-03-11,AU,AUS,Australia
10/03/2020,10,3,2020,20,0,Australia,AU,AUS,24992369,Oceania,2020-03-10,AU,AUS,Australia
09/03/2020,9,3,2020,6,0,Australia,AU,AUS,24992369,Oceania,2020-03-09,AU,AUS,Australia
08/03/2020,8,3,2020,11,1,Australia,AU,AUS,24992369,Oceania,2020-03-08,AU,AUS,Australia
07/03/2020,7,3,2020,4,0,Australia,AU,AUS,24992369,Oceania,2020-03-07,AU,AUS,Australia
06/03/2020,6,3,2020,7,0,Australia,AU,AUS,24992369,Oceania,2020-03-06,AU,AUS,Australia
05/03/2020,5,3,2020,11,1,Australia,AU,AUS,24992369,Oceania,2020-03-05,AU,AUS,Australia
04/03/2020,4,3,2020,8,0,Australia,AU,AUS,24992369,Oceania,2020-03-04,AU,AUS,Australia
03/03/2020,3,3,2020,4,0,Australia,AU,AUS,24992369,Oceania,2020-03-03,AU,AUS,Australia
02/03/2020,2,3,2020,3,0,Australia,AU,AUS,24992369,Oceania,2020-03-02,AU,AUS,Australia
01/03/2020,1,3,2020,1,1,Australia,AU,AUS,24992369,Oceania,2020-03-01,AU,AUS,Australia
29/02/2020,29,2,2020,2,0,Australia,AU,AUS,24992369,Oceania,2020-02-29,AU,AUS,Australia
28/02/2020,28,2,2020,0,0,Australia,AU,AUS,24992369,Oceania,2020-02-28,AU,AUS,Australia
27/02/2020,27,2,2020,1,0,Australia,AU,AUS,24992369,Oceania,2020-02-27,AU,AUS,Australia
26/02/2020,26,2,2020,0,0,Australia,AU,AUS,24992369,Oceania,2020-02-26,AU,AUS,Australia
25/02/2020,25,2,2020,0,0,Australia,AU,AUS,24992369,Oceania,2020-02-25,AU,AUS,Australia
24/02/2020,24,2,2020,0,0,Australia,AU,AUS,24992369,Oceania,2020-02-24,AU,AUS,Australia
23/02/2020,23,2,2020,1,0,Australia,AU,AUS,24992369,Oceania,2020-02-23,AU,AUS,Australia
22/02/2020,22,2,2020,4,0,Australia,AU,AUS,24992369,Oceania,2020-02-22,AU,AUS,Australia
21/02/2020,21,2,2020,2,0,Australia,AU,AUS,24992369,Oceania,2020-02-21,AU,AUS,Australia
20/02/2020,20,2,2020,0,0,Australia,AU,AUS,24992369,Oceania,2020-02-20,AU,AUS,Australia
19/02/2020,19,2,2020,0,0,Australia,AU,AUS,24992369,Oceania,2020-02-19,AU,AUS,Australia
18/02/2020,18,2,2020,0,0,Australia,AU,AUS,24992369,Oceania,2020-02-18,AU,AUS,Australia
17/02/2020,17,2,2020,0,0,Australia,AU,AUS,24992369,Oceania,2020-02-17,AU,AUS,Australia
16/02/2020,16,2,2020,0,0,Australia,AU,AUS,24992369,Oceania,2020-02-16,AU,AUS,Australia
15/02/2020,15,2,2020,0,0,Australia,AU,AUS,24992369,Oceania,2020-02-15,AU,AUS,Australia
14/02/2020,14,2,2020,1,0,Australia,AU,AUS,24992369,Oceania,2020-02-14,AU,AUS,Australia
13/02/2020,13,2,2020,0,0,Australia,AU,AUS,24992369,Oceania,2020-02-13,AU,AUS,Australia
12/02/2020,12,2,2020,0,0,Australia,AU,AUS,24992369,Oceania,2020-02-12,AU,AUS,Australia
11/02/2020,11,2,2020,0,0,Australia,AU,AUS,24992369,Oceania,2020-02-11,AU,AUS,Australia
10/02/2020,10,2,2020,0,0,Australia,AU,AUS,24992369,Oceania,2020-02-10,AU,AUS,Australia
09/02/2020,9,2,2020,0,0,Australia,AU,AUS,24992369,Oceania,2020-02-09,AU,AUS,Australia
08/02/2020,8,2,2020,0,0,Australia,AU,AUS,24992369,Oceania,2020-02-08,AU,AUS,Australia
07/02/2020,7,2,2020,1,0,Australia,AU,AUS,24992369,Oceania,2020-02-07,AU,AUS,Australia
06/02/2020,6,2,2020,1,0,Australia,AU,AUS,24992369,Oceania,2020-02-06,AU,AUS,Australia
05/02/2020,5,2,2020,1,0,Australia,AU,AUS,24992369,Oceania,2020-02-05,AU,AUS,Australia
04/02/2020,4,2,2020,0,0,Australia,AU,AUS,24992369,Oceania,2020-02-04,AU,AUS,Australia
03/02/2020,3,2,2020,0,0,Australia,AU,AUS,24992369,Oceania,2020-02-03,AU,AUS,Australia
02/02/2020,2,2,2020,2,0,Australia,AU,AUS,24992369,Oceania,2020-02-02,AU,AUS,Australia
01/02/2020,1,2,2020,2,0,Australia,AU,AUS,24992369,Oceania,2020-02-01,AU,AUS,Australia
31/01/2020,31,1,2020,1,0,Australia,AU,AUS,24992369,Oceania,2020-01-31,AU,AUS,Australia
30/01/2020,30,1,2020,2,0,Australia,AU,AUS,24992369,Oceania,2020-01-30,AU,AUS,Australia
29/01/2020,29,1,2020,0,0,Australia,AU,AUS,24992369,Oceania,2020-01-29,AU,AUS,Australia
28/01/2020,28,1,2020,0,0,Australia,AU,AUS,24992369,Oceania,2020-01-28,AU,AUS,Australia
27/01/2020,27,1,2020,0,0,Australia,AU,AUS,24992369,Oceania,2020-01-27,AU,AUS,Australia
26/01/2020,26,1,2020,3,0,Australia,AU,AUS,24992369,Oceania,2020-01-26,AU,AUS,Australia
25/01/2020,25,1,2020,1,0,Australia,AU,AUS,24992369,Oceania,2020-01-25,AU,AUS,Australia
24/01/2020,24,1,2020,0,0,Australia,AU,AUS,24992369,Oceania,2020-01-24,AU,AUS,Australia
23/01/2020,23,1,2020,0,0,Australia,AU,AUS,24992369,Oceania,2020-01-23,AU,AUS,Australia
22/01/2020,22,1,2020,0,0,Australia,AU,AUS,24992369,Oceania,2020-01-22,AU,AUS,Australia
21/01/2020,21,1,2020,0,0,Australia,AU,AUS,24992369,Oceania,2020-01-21,AU,AUS,Australia
20/01/2020,20,1,2020,0,0,Australia,AU,AUS,24992369,Oceania,2020-01-20,AU,AUS,Australia
19/01/2020,19,1,2020,0,0,Australia,AU,AUS,24992369,Oceania,2020-01-19,AU,AUS,Australia
18/01/2020,18,1,2020,0,0,Australia,AU,AUS,24992369,Oceania,2020-01-18,AU,AUS,Australia
17/01/2020,17,1,2020,0,0,Australia,AU,AUS,24992369,Oceania,2020-01-17,AU,AUS,Australia
16/01/2020,16,1,2020,0,0,Australia,AU,AUS,24992369,Oceania,2020-01-16,AU,AUS,Australia
15/01/2020,15,1,2020,0,0,Australia,AU,AUS,24992369,Oceania,2020-01-15,AU,AUS,Australia
14/01/2020,14,1,2020,0,0,Australia,AU,AUS,24992369,Oceania,2020-01-14,AU,AUS,Australia
13/01/2020,13,1,2020,0,0,Australia,AU,AUS,24992369,Oceania,2020-01-13,AU,AUS,Australia
12/01/2020,12,1,2020,0,0,Australia,AU,AUS,24992369,Oceania,2020-01-12,AU,AUS,Australia
11/01/2020,11,1,2020,0,0,Australia,AU,AUS,24992369,Oceania,2020-01-11,AU,AUS,Australia
10/01/2020,10,1,2020,0,0,Australia,AU,AUS,24992369,Oceania,2020-01-10,AU,AUS,Australia
09/01/2020,9,1,2020,0,0,Australia,AU,AUS,24992369,Oceania,2020-01-09,AU,AUS,Australia
08/01/2020,8,1,2020,0,0,Australia,AU,AUS,24992369,Oceania,2020-01-08,AU,AUS,Australia
07/01/2020,7,1,2020,0,0,Australia,AU,AUS,24992369,Oceania,2020-01-07,AU,AUS,Australia
06/01/2020,6,1,2020,0,0,Australia,AU,AUS,24992369,Oceania,2020-01-06,AU,AUS,Australia
05/01/2020,5,1,2020,0,0,Australia,AU,AUS,24992369,Oceania,2020-01-05,AU,AUS,Australia
04/01/2020,4,1,2020,0,0,Australia,AU,AUS,24992369,Oceania,2020-01-04,AU,AUS,Australia
03/01/2020,3,1,2020,0,0,Australia,AU,AUS,24992369,Oceania,2020-01-03,AU,AUS,Australia
02/01/2020,2,1,2020,0,0,Australia,AU,AUS,24992369,Oceania,2020-01-02,AU,AUS,Australia
01/01/2020,1,1,2020,0,0,Australia,AU,AUS,24992369,Oceania,2020-01-01,AU,AUS,Australia
31/12/2019,31,12,2019,0,0,Australia,AU,AUS,24992369,Oceania,2019-12-31,AU,AUS,Australia
17/05/2020,17,5,2020,72,0,Austria,AT,AUT,8847037,Europe,2020-05-17,AT,AUT,Austria
16/05/2020,16,5,2020,63,2,Austria,AT,AUT,8847037,Europe,2020-05-16,AT,AUT,Austria
15/05/2020,15,5,2020,41,2,Austria,AT,AUT,8847037,Europe,2020-05-15,AT,AUT,Austria
14/05/2020,14,5,2020,54,1,Austria,AT,AUT,8847037,Europe,2020-05-14,AT,AUT,Austria
13/05/2020,13,5,2020,36,3,Austria,AT,AUT,8847037,Europe,2020-05-13,AT,AUT,Austria
12/05/2020,12,5,2020,87,2,Austria,AT,AUT,8847037,Europe,2020-05-12,AT,AUT,Austria
11/05/2020,11,5,2020,10,3,Austria,AT,AUT,8847037,Europe,2020-05-11,AT,AUT,Austria
10/05/2020,10,5,2020,42,1,Austria,AT,AUT,8847037,Europe,2020-05-10,AT,AUT,Austria
09/05/2020,9,5,2020,62,5,Austria,AT,AUT,8847037,Europe,2020-05-09,AT,AUT,Austria
08/05/2020,8,5,2020,22,1,Austria,AT,AUT,8847037,Europe,2020-05-08,AT,AUT,Austria
07/05/2020,7,5,2020,65,2,Austria,AT,AUT,8847037,Europe,2020-05-07,AT,AUT,Austria
06/05/2020,6,5,2020,17,6,Austria,AT,AUT,8847037,Europe,2020-05-06,AT,AUT,Austria
05/05/2020,5,5,2020,31,2,Austria,AT,AUT,8847037,Europe,2020-05-05,AT,AUT,Austria
04/05/2020,4,5,2020,68,2,Austria,AT,AUT,8847037,Europe,2020-05-04,AT,AUT,Austria
03/05/2020,3,5,2020,12,7,Austria,AT,AUT,8847037,Europe,2020-05-03,AT,AUT,Austria
02/05/2020,2,5,2020,34,5,Austria,AT,AUT,8847037,Europe,2020-05-02,AT,AUT,Austria
01/05/2020,1,5,2020,60,4,Austria,AT,AUT,8847037,Europe,2020-05-01,AT,AUT,Austria
30/04/2020,30,4,2020,50,11,Austria,AT,AUT,8847037,Europe,2020-04-30,AT,AUT,Austria
29/04/2020,29,4,2020,58,20,Austria,AT,AUT,8847037,Europe,2020-04-29,AT,AUT,Austria
28/04/2020,28,4,2020,67,7,Austria,AT,AUT,8847037,Europe,2020-04-28,AT,AUT,Austria
27/04/2020,27,4,2020,55,6,Austria,AT,AUT,8847037,Europe,2020-04-27,AT,AUT,Austria
26/04/2020,26,4,2020,66,23,Austria,AT,AUT,8847037,Europe,2020-04-26,AT,AUT,Austria
25/04/2020,25,4,2020,83,5,Austria,AT,AUT,8847037,Europe,2020-04-25,AT,AUT,Austria
24/04/2020,24,4,2020,61,14,Austria,AT,AUT,8847037,Europe,2020-04-24,AT,AUT,Austria
23/04/2020,23,4,2020,91,31,Austria,AT,AUT,8847037,Europe,2020-04-23,AT,AUT,Austria
22/04/2020,22,4,2020,50,1,Austria,AT,AUT,8847037,Europe,2020-04-22,AT,AUT,Austria
21/04/2020,21,4,2020,73,10,Austria,AT,AUT,8847037,Europe,2020-04-21,AT,AUT,Austria
20/04/2020,20,4,2020,48,9,Austria,AT,AUT,8847037,Europe,2020-04-20,AT,AUT,Austria
19/04/2020,19,4,2020,59,12,Austria,AT,AUT,8847037,Europe,2020-04-19,AT,AUT,Austria
18/04/2020,18,4,2020,155,21,Austria,AT,AUT,8847037,Europe,2020-04-18,AT,AUT,Austria
17/04/2020,17,4,2020,78,17,Austria,AT,AUT,8847037,Europe,2020-04-17,AT,AUT,Austria
16/04/2020,16,4,2020,136,9,Austria,AT,AUT,8847037,Europe,2020-04-16,AT,AUT,Austria
15/04/2020,15,4,2020,191,16,Austria,AT,AUT,8847037,Europe,2020-04-15,AT,AUT,Austria
14/04/2020,14,4,2020,106,18,Austria,AT,AUT,8847037,Europe,2020-04-14,AT,AUT,Austria
13/04/2020,13,4,2020,130,13,Austria,AT,AUT,8847037,Europe,2020-04-13,AT,AUT,Austria
12/04/2020,12,4,2020,247,18,Austria,AT,AUT,8847037,Europe,2020-04-12,AT,AUT,Austria
11/04/2020,11,4,2020,312,24,Austria,AT,AUT,8847037,Europe,2020-04-11,AT,AUT,Austria
10/04/2020,10,4,2020,279,22,Austria,AT,AUT,8847037,Europe,2020-04-10,AT,AUT,Austria
09/04/2020,9,4,2020,329,30,Austria,AT,AUT,8847037,Europe,2020-04-09,AT,AUT,Austria
08/04/2020,8,4,2020,343,23,Austria,AT,AUT,8847037,Europe,2020-04-08,AT,AUT,Austria
07/04/2020,7,4,2020,314,16,Austria,AT,AUT,8847037,Europe,2020-04-07,AT,AUT,Austria
06/04/2020,6,4,2020,217,18,Austria,AT,AUT,8847037,Europe,2020-04-06,AT,AUT,Austria
05/04/2020,5,4,2020,241,18,Austria,AT,AUT,8847037,Europe,2020-04-05,AT,AUT,Austria
04/04/2020,4,4,2020,396,10,Austria,AT,AUT,8847037,Europe,2020-04-04,AT,AUT,Austria
03/04/2020,3,4,2020,418,12,Austria,AT,AUT,8847037,Europe,2020-04-03,AT,AUT,Austria
02/04/2020,2,4,2020,529,18,Austria,AT,AUT,8847037,Europe,2020-04-02,AT,AUT,Austria
01/04/2020,1,4,2020,564,20,Austria,AT,AUT,8847037,Europe,2020-04-01,AT,AUT,Austria
31/03/2020,31,3,2020,805,22,Austria,AT,AUT,8847037,Europe,2020-03-31,AT,AUT,Austria
30/03/2020,30,3,2020,522,18,Austria,AT,AUT,8847037,Europe,2020-03-30,AT,AUT,Austria
29/03/2020,29,3,2020,594,0,Austria,AT,AUT,8847037,Europe,2020-03-29,AT,AUT,Austria
28/03/2020,28,3,2020,668,16,Austria,AT,AUT,8847037,Europe,2020-03-28,AT,AUT,Austria
27/03/2020,27,3,2020,1141,18,Austria,AT,AUT,8847037,Europe,2020-03-27,AT,AUT,Austria
26/03/2020,26,3,2020,606,4,Austria,AT,AUT,8847037,Europe,2020-03-26,AT,AUT,Austria
25/03/2020,25,3,2020,796,5,Austria,AT,AUT,8847037,Europe,2020-03-25,AT,AUT,Austria
24/03/2020,24,3,2020,855,9,Austria,AT,AUT,8847037,Europe,2020-03-24,AT,AUT,Austria
23/03/2020,23,3,2020,607,8,Austria,AT,AUT,8847037,Europe,2020-03-23,AT,AUT,Austria
22/03/2020,22,3,2020,375,2,Austria,AT,AUT,8847037,Europe,2020-03-22,AT,AUT,Austria
21/03/2020,21,3,2020,453,0,Austria,AT,AUT,8847037,Europe,2020-03-21,AT,AUT,Austria
20/03/2020,20,3,2020,550,2,Austria,AT,AUT,8847037,Europe,2020-03-20,AT,AUT,Austria
19/03/2020,19,3,2020,314,1,Austria,AT,AUT,8847037,Europe,2020-03-19,AT,AUT,Austria
18/03/2020,18,3,2020,316,0,Austria,AT,AUT,8847037,Europe,2020-03-18,AT,AUT,Austria
17/03/2020,17,3,2020,156,2,Austria,AT,AUT,8847037,Europe,2020-03-17,AT,AUT,Austria
16/03/2020,16,3,2020,205,0,Austria,AT,AUT,8847037,Europe,2020-03-16,AT,AUT,Austria
15/03/2020,15,3,2020,151,0,Austria,AT,AUT,8847037,Europe,2020-03-15,AT,AUT,Austria
14/03/2020,14,3,2020,143,0,Austria,AT,AUT,8847037,Europe,2020-03-14,AT,AUT,Austria
13/03/2020,13,3,2020,115,1,Austria,AT,AUT,8847037,Europe,2020-03-13,AT,AUT,Austria
12/03/2020,12,3,2020,64,0,Austria,AT,AUT,8847037,Europe,2020-03-12,AT,AUT,Austria
11/03/2020,11,3,2020,51,0,Austria,AT,AUT,8847037,Europe,2020-03-11,AT,AUT,Austria
10/03/2020,10,3,2020,29,0,Austria,AT,AUT,8847037,Europe,2020-03-10,AT,AUT,Austria
09/03/2020,9,3,2020,3,0,Austria,AT,AUT,8847037,Europe,2020-03-09,AT,AUT,Austria
08/03/2020,8,3,2020,25,0,Austria,AT,AUT,8847037,Europe,2020-03-08,AT,AUT,Austria
07/03/2020,7,3,2020,33,0,Austria,AT,AUT,8847037,Europe,2020-03-07,AT,AUT,Austria
06/03/2020,6,3,2020,12,0,Austria,AT,AUT,8847037,Europe,2020-03-06,AT,AUT,Austria
05/03/2020,5,3,2020,5,0,Austria,AT,AUT,8847037,Europe,2020-03-05,AT,AUT,Austria
04/03/2020,4,3,2020,6,0,Austria,AT,AUT,8847037,Europe,2020-03-04,AT,AUT,Austria
03/03/2020,3,3,2020,4,0,Austria,AT,AUT,8847037,Europe,2020-03-03,AT,AUT,Austria
02/03/2020,2,3,2020,4,0,Austria,AT,AUT,8847037,Europe,2020-03-02,AT,AUT,Austria
01/03/2020,1,3,2020,3,0,Austria,AT,AUT,8847037,Europe,2020-03-01,AT,AUT,Austria
29/02/2020,29,2,2020,2,0,Austria,AT,AUT,8847037,Europe,2020-02-29,AT,AUT,Austria
28/02/2020,28,2,2020,3,0,Austria,AT,AUT,8847037,Europe,2020-02-28,AT,AUT,Austria
27/02/2020,27,2,2020,0,0,Austria,AT,AUT,8847037,Europe,2020-02-27,AT,AUT,Austria
26/02/2020,26,2,2020,2,0,Austria,AT,AUT,8847037,Europe,2020-02-26,AT,AUT,Austria
25/02/2020,25,2,2020,0,0,Austria,AT,AUT,8847037,Europe,2020-02-25,AT,AUT,Austria
24/02/2020,24,2,2020,0,0,Austria,AT,AUT,8847037,Europe,2020-02-24,AT,AUT,Austria
23/02/2020,23,2,2020,0,0,Austria,AT,AUT,8847037,Europe,2020-02-23,AT,AUT,Austria
22/02/2020,22,2,2020,0,0,Austria,AT,AUT,8847037,Europe,2020-02-22,AT,AUT,Austria
21/02/2020,21,2,2020,0,0,Austria,AT,AUT,8847037,Europe,2020-02-21,AT,AUT,Austria
20/02/2020,20,2,2020,0,0,Austria,AT,AUT,8847037,Europe,2020-02-20,AT,AUT,Austria
19/02/2020,19,2,2020,0,0,Austria,AT,AUT,8847037,Europe,2020-02-19,AT,AUT,Austria
18/02/2020,18,2,2020,0,0,Austria,AT,AUT,8847037,Europe,2020-02-18,AT,AUT,Austria
17/02/2020,17,2,2020,0,0,Austria,AT,AUT,8847037,Europe,2020-02-17,AT,AUT,Austria
16/02/2020,16,2,2020,0,0,Austria,AT,AUT,8847037,Europe,2020-02-16,AT,AUT,Austria
15/02/2020,15,2,2020,0,0,Austria,AT,AUT,8847037,Europe,2020-02-15,AT,AUT,Austria
14/02/2020,14,2,2020,0,0,Austria,AT,AUT,8847037,Europe,2020-02-14,AT,AUT,Austria
13/02/2020,13,2,2020,0,0,Austria,AT,AUT,8847037,Europe,2020-02-13,AT,AUT,Austria
12/02/2020,12,2,2020,0,0,Austria,AT,AUT,8847037,Europe,2020-02-12,AT,AUT,Austria
11/02/2020,11,2,2020,0,0,Austria,AT,AUT,8847037,Europe,2020-02-11,AT,AUT,Austria
10/02/2020,10,2,2020,0,0,Austria,AT,AUT,8847037,Europe,2020-02-10,AT,AUT,Austria
09/02/2020,9,2,2020,0,0,Austria,AT,AUT,8847037,Europe,2020-02-09,AT,AUT,Austria
08/02/2020,8,2,2020,0,0,Austria,AT,AUT,8847037,Europe,2020-02-08,AT,AUT,Austria
07/02/2020,7,2,2020,0,0,Austria,AT,AUT,8847037,Europe,2020-02-07,AT,AUT,Austria
06/02/2020,6,2,2020,0,0,Austria,AT,AUT,8847037,Europe,2020-02-06,AT,AUT,Austria
05/02/2020,5,2,2020,0,0,Austria,AT,AUT,8847037,Europe,2020-02-05,AT,AUT,Austria
04/02/2020,4,2,2020,0,0,Austria,AT,AUT,8847037,Europe,2020-02-04,AT,AUT,Austria
03/02/2020,3,2,2020,0,0,Austria,AT,AUT,8847037,Europe,2020-02-03,AT,AUT,Austria
02/02/2020,2,2,2020,0,0,Austria,AT,AUT,8847037,Europe,2020-02-02,AT,AUT,Austria
01/02/2020,1,2,2020,0,0,Austria,AT,AUT,8847037,Europe,2020-02-01,AT,AUT,Austria
31/01/2020,31,1,2020,0,0,Austria,AT,AUT,8847037,Europe,2020-01-31,AT,AUT,Austria
30/01/2020,30,1,2020,0,0,Austria,AT,AUT,8847037,Europe,2020-01-30,AT,AUT,Austria
29/01/2020,29,1,2020,0,0,Austria,AT,AUT,8847037,Europe,2020-01-29,AT,AUT,Austria
28/01/2020,28,1,2020,0,0,Austria,AT,AUT,8847037,Europe,2020-01-28,AT,AUT,Austria
27/01/2020,27,1,2020,0,0,Austria,AT,AUT,8847037,Europe,2020-01-27,AT,AUT,Austria
26/01/2020,26,1,2020,0,0,Austria,AT,AUT,8847037,Europe,2020-01-26,AT,AUT,Austria
25/01/2020,25,1,2020,0,0,Austria,AT,AUT,8847037,Europe,2020-01-25,AT,AUT,Austria
24/01/2020,24,1,2020,0,0,Austria,AT,AUT,8847037,Europe,2020-01-24,AT,AUT,Austria
23/01/2020,23,1,2020,0,0,Austria,AT,AUT,8847037,Europe,2020-01-23,AT,AUT,Austria
22/01/2020,22,1,2020,0,0,Austria,AT,AUT,8847037,Europe,2020-01-22,AT,AUT,Austria
21/01/2020,21,1,2020,0,0,Austria,AT,AUT,8847037,Europe,2020-01-21,AT,AUT,Austria
20/01/2020,20,1,2020,0,0,Austria,AT,AUT,8847037,Europe,2020-01-20,AT,AUT,Austria
19/01/2020,19,1,2020,0,0,Austria,AT,AUT,8847037,Europe,2020-01-19,AT,AUT,Austria
18/01/2020,18,1,2020,0,0,Austria,AT,AUT,8847037,Europe,2020-01-18,AT,AUT,Austria
17/01/2020,17,1,2020,0,0,Austria,AT,AUT,8847037,Europe,2020-01-17,AT,AUT,Austria
16/01/2020,16,1,2020,0,0,Austria,AT,AUT,8847037,Europe,2020-01-16,AT,AUT,Austria
15/01/2020,15,1,2020,0,0,Austria,AT,AUT,8847037,Europe,2020-01-15,AT,AUT,Austria
14/01/2020,14,1,2020,0,0,Austria,AT,AUT,8847037,Europe,2020-01-14,AT,AUT,Austria
13/01/2020,13,1,2020,0,0,Austria,AT,AUT,8847037,Europe,2020-01-13,AT,AUT,Austria
12/01/2020,12,1,2020,0,0,Austria,AT,AUT,8847037,Europe,2020-01-12,AT,AUT,Austria
11/01/2020,11,1,2020,0,0,Austria,AT,AUT,8847037,Europe,2020-01-11,AT,AUT,Austria
10/01/2020,10,1,2020,0,0,Austria,AT,AUT,8847037,Europe,2020-01-10,AT,AUT,Austria
09/01/2020,9,1,2020,0,0,Austria,AT,AUT,8847037,Europe,2020-01-09,AT,AUT,Austria
08/01/2020,8,1,2020,0,0,Austria,AT,AUT,8847037,Europe,2020-01-08,AT,AUT,Austria
07/01/2020,7,1,2020,0,0,Austria,AT,AUT,8847037,Europe,2020-01-07,AT,AUT,Austria
06/01/2020,6,1,2020,0,0,Austria,AT,AUT,8847037,Europe,2020-01-06,AT,AUT,Austria
05/01/2020,5,1,2020,0,0,Austria,AT,AUT,8847037,Europe,2020-01-05,AT,AUT,Austria
04/01/2020,4,1,2020,0,0,Austria,AT,AUT,8847037,Europe,2020-01-04,AT,AUT,Austria
03/01/2020,3,1,2020,0,0,Austria,AT,AUT,8847037,Europe,2020-01-03,AT,AUT,Austria
02/01/2020,2,1,2020,0,0,Austria,AT,AUT,8847037,Europe,2020-01-02,AT,AUT,Austria
01/01/2020,1,1,2020,0,0,Austria,AT,AUT,8847037,Europe,2020-01-01,AT,AUT,Austria
31/12/2019,31,12,2019,0,0,Austria,AT,AUT,8847037,Europe,2019-12-31,AT,AUT,Austria
17/05/2020,17,5,2020,158,0,Azerbaijan,AZ,AZE,9942334,Europe,2020-05-17,AZ,AZE,Azerbaijan
16/05/2020,16,5,2020,101,1,Azerbaijan,AZ,AZE,9942334,Europe,2020-05-16,AZ,AZE,Azerbaijan
15/05/2020,15,5,2020,121,0,Azerbaijan,AZ,AZE,9942334,Europe,2020-05-15,AZ,AZE,Azerbaijan
14/05/2020,14,5,2020,65,2,Azerbaijan,AZ,AZE,9942334,Europe,2020-05-14,AZ,AZE,Azerbaijan
13/05/2020,13,5,2020,104,1,Azerbaijan,AZ,AZE,9942334,Europe,2020-05-13,AZ,AZE,Azerbaijan
12/05/2020,12,5,2020,70,0,Azerbaijan,AZ,AZE,9942334,Europe,2020-05-12,AZ,AZE,Azerbaijan
11/05/2020,11,5,2020,97,1,Azerbaijan,AZ,AZE,9942334,Europe,2020-05-11,AZ,AZE,Azerbaijan
10/05/2020,10,5,2020,143,3,Azerbaijan,AZ,AZE,9942334,Europe,2020-05-10,AZ,AZE,Azerbaijan
09/05/2020,9,5,2020,75,0,Azerbaijan,AZ,AZE,9942334,Europe,2020-05-09,AZ,AZE,Azerbaijan
08/05/2020,8,5,2020,77,0,Azerbaijan,AZ,AZE,9942334,Europe,2020-05-08,AZ,AZE,Azerbaijan
07/05/2020,7,5,2020,67,2,Azerbaijan,AZ,AZE,9942334,Europe,2020-05-07,AZ,AZE,Azerbaijan
06/05/2020,6,5,2020,76,0,Azerbaijan,AZ,AZE,9942334,Europe,2020-05-06,AZ,AZE,Azerbaijan
05/05/2020,5,5,2020,52,1,Azerbaijan,AZ,AZE,9942334,Europe,2020-05-05,AZ,AZE,Azerbaijan
04/05/2020,4,5,2020,38,0,Azerbaijan,AZ,AZE,9942334,Europe,2020-05-04,AZ,AZE,Azerbaijan
03/05/2020,3,5,2020,40,0,Azerbaijan,AZ,AZE,9942334,Europe,2020-05-03,AZ,AZE,Azerbaijan
02/05/2020,2,5,2020,50,1,Azerbaijan,AZ,AZE,9942334,Europe,2020-05-02,AZ,AZE,Azerbaijan
01/05/2020,1,5,2020,38,1,Azerbaijan,AZ,AZE,9942334,Europe,2020-05-01,AZ,AZE,Azerbaijan
30/04/2020,30,4,2020,49,1,Azerbaijan,AZ,AZE,9942334,Europe,2020-04-30,AZ,AZE,Azerbaijan
29/04/2020,29,4,2020,39,0,Azerbaijan,AZ,AZE,9942334,Europe,2020-04-29,AZ,AZE,Azerbaijan
28/04/2020,28,4,2020,33,1,Azerbaijan,AZ,AZE,9942334,Europe,2020-04-28,AZ,AZE,Azerbaijan
27/04/2020,27,4,2020,28,0,Azerbaijan,AZ,AZE,9942334,Europe,2020-04-27,AZ,AZE,Azerbaijan
26/04/2020,26,4,2020,25,0,Azerbaijan,AZ,AZE,9942334,Europe,2020-04-26,AZ,AZE,Azerbaijan
25/04/2020,25,4,2020,44,1,Azerbaijan,AZ,AZE,9942334,Europe,2020-04-25,AZ,AZE,Azerbaijan
24/04/2020,24,4,2020,30,0,Azerbaijan,AZ,AZE,9942334,Europe,2020-04-24,AZ,AZE,Azerbaijan
23/04/2020,23,4,2020,38,0,Azerbaijan,AZ,AZE,9942334,Europe,2020-04-23,AZ,AZE,Azerbaijan
22/04/2020,22,4,2020,44,1,Azerbaijan,AZ,AZE,9942334,Europe,2020-04-22,AZ,AZE,Azerbaijan
21/04/2020,21,4,2020,38,0,Azerbaijan,AZ,AZE,9942334,Europe,2020-04-21,AZ,AZE,Azerbaijan
20/04/2020,20,4,2020,25,1,Azerbaijan,AZ,AZE,9942334,Europe,2020-04-20,AZ,AZE,Azerbaijan
19/04/2020,19,4,2020,33,3,Azerbaijan,AZ,AZE,9942334,Europe,2020-04-19,AZ,AZE,Azerbaijan
18/04/2020,18,4,2020,57,0,Azerbaijan,AZ,AZE,9942334,Europe,2020-04-18,AZ,AZE,Azerbaijan
17/04/2020,17,4,2020,30,2,Azerbaijan,AZ,AZE,9942334,Europe,2020-04-17,AZ,AZE,Azerbaijan
16/04/2020,16,4,2020,56,0,Azerbaijan,AZ,AZE,9942334,Europe,2020-04-16,AZ,AZE,Azerbaijan
15/04/2020,15,4,2020,49,1,Azerbaijan,AZ,AZE,9942334,Europe,2020-04-15,AZ,AZE,Azerbaijan
14/04/2020,14,4,2020,50,1,Azerbaijan,AZ,AZE,9942334,Europe,2020-04-14,AZ,AZE,Azerbaijan
13/04/2020,13,4,2020,40,0,Azerbaijan,AZ,AZE,9942334,Europe,2020-04-13,AZ,AZE,Azerbaijan
12/04/2020,12,4,2020,67,1,Azerbaijan,AZ,AZE,9942334,Europe,2020-04-12,AZ,AZE,Azerbaijan
11/04/2020,11,4,2020,65,1,Azerbaijan,AZ,AZE,9942334,Europe,2020-04-11,AZ,AZE,Azerbaijan
10/04/2020,10,4,2020,104,1,Azerbaijan,AZ,AZE,9942334,Europe,2020-04-10,AZ,AZE,Azerbaijan
09/04/2020,9,4,2020,105,0,Azerbaijan,AZ,AZE,9942334,Europe,2020-04-09,AZ,AZE,Azerbaijan
08/04/2020,8,4,2020,76,1,Azerbaijan,AZ,AZE,9942334,Europe,2020-04-08,AZ,AZE,Azerbaijan
07/04/2020,7,4,2020,57,0,Azerbaijan,AZ,AZE,9942334,Europe,2020-04-07,AZ,AZE,Azerbaijan
06/04/2020,6,4,2020,63,2,Azerbaijan,AZ,AZE,9942334,Europe,2020-04-06,AZ,AZE,Azerbaijan
05/04/2020,5,4,2020,78,0,Azerbaijan,AZ,AZE,9942334,Europe,2020-04-05,AZ,AZE,Azerbaijan
04/04/2020,4,4,2020,43,0,Azerbaijan,AZ,AZE,9942334,Europe,2020-04-04,AZ,AZE,Azerbaijan
03/04/2020,3,4,2020,41,0,Azerbaijan,AZ,AZE,9942334,Europe,2020-04-03,AZ,AZE,Azerbaijan
02/04/2020,2,4,2020,61,0,Azerbaijan,AZ,AZE,9942334,Europe,2020-04-02,AZ,AZE,Azerbaijan
01/04/2020,1,4,2020,25,1,Azerbaijan,AZ,AZE,9942334,Europe,2020-04-01,AZ,AZE,Azerbaijan
31/03/2020,31,3,2020,64,0,Azerbaijan,AZ,AZE,9942334,Europe,2020-03-31,AZ,AZE,Azerbaijan
30/03/2020,30,3,2020,27,0,Azerbaijan,AZ,AZE,9942334,Europe,2020-03-30,AZ,AZE,Azerbaijan
29/03/2020,29,3,2020,17,1,Azerbaijan,AZ,AZE,9942334,Europe,2020-03-29,AZ,AZE,Azerbaijan
28/03/2020,28,3,2020,43,0,Azerbaijan,AZ,AZE,9942334,Europe,2020-03-28,AZ,AZE,Azerbaijan
27/03/2020,27,3,2020,29,1,Azerbaijan,AZ,AZE,9942334,Europe,2020-03-27,AZ,AZE,Azerbaijan
26/03/2020,26,3,2020,6,1,Azerbaijan,AZ,AZE,9942334,Europe,2020-03-26,AZ,AZE,Azerbaijan
25/03/2020,25,3,2020,15,0,Azerbaijan,AZ,AZE,9942334,Europe,2020-03-25,AZ,AZE,Azerbaijan
24/03/2020,24,3,2020,7,0,Azerbaijan,AZ,AZE,9942334,Europe,2020-03-24,AZ,AZE,Azerbaijan
23/03/2020,23,3,2020,12,0,Azerbaijan,AZ,AZE,9942334,Europe,2020-03-23,AZ,AZE,Azerbaijan
22/03/2020,22,3,2020,9,0,Azerbaijan,AZ,AZE,9942334,Europe,2020-03-22,AZ,AZE,Azerbaijan
21/03/2020,21,3,2020,0,1,Azerbaijan,AZ,AZE,9942334,Europe,2020-03-21,AZ,AZE,Azerbaijan
20/03/2020,20,3,2020,10,0,Azerbaijan,AZ,AZE,9942334,Europe,2020-03-20,AZ,AZE,Azerbaijan
19/03/2020,19,3,2020,6,0,Azerbaijan,AZ,AZE,9942334,Europe,2020-03-19,AZ,AZE,Azerbaijan
18/03/2020,18,3,2020,9,0,Azerbaijan,AZ,AZE,9942334,Europe,2020-03-18,AZ,AZE,Azerbaijan
17/03/2020,17,3,2020,0,0,Azerbaijan,AZ,AZE,9942334,Europe,2020-03-17,AZ,AZE,Azerbaijan
16/03/2020,16,3,2020,0,0,Azerbaijan,AZ,AZE,9942334,Europe,2020-03-16,AZ,AZE,Azerbaijan
15/03/2020,15,3,2020,6,0,Azerbaijan,AZ,AZE,9942334,Europe,2020-03-15,AZ,AZE,Azerbaijan
13/03/2020,13,3,2020,0,0,Azerbaijan,AZ,AZE,9942334,Europe,2020-03-13,AZ,AZE,Azerbaijan
12/03/2020,12,3,2020,2,0,Azerbaijan,AZ,AZE,9942334,Europe,2020-03-12,AZ,AZE,Azerbaijan
11/03/2020,11,3,2020,2,0,Azerbaijan,AZ,AZE,9942334,Europe,2020-03-11,AZ,AZE,Azerbaijan
07/03/2020,7,3,2020,3,0,Azerbaijan,AZ,AZE,9942334,Europe,2020-03-07,AZ,AZE,Azerbaijan
06/03/2020,6,3,2020,3,0,Azerbaijan,AZ,AZE,9942334,Europe,2020-03-06,AZ,AZE,Azerbaijan
02/03/2020,2,3,2020,2,0,Azerbaijan,AZ,AZE,9942334,Europe,2020-03-02,AZ,AZE,Azerbaijan
01/03/2020,1,3,2020,0,0,Azerbaijan,AZ,AZE,9942334,Europe,2020-03-01,AZ,AZE,Azerbaijan
29/02/2020,29,2,2020,1,0,Azerbaijan,AZ,AZE,9942334,Europe,2020-02-29,AZ,AZE,Azerbaijan
28/02/2020,28,2,2020,0,0,Azerbaijan,AZ,AZE,9942334,Europe,2020-02-28,AZ,AZE,Azerbaijan
27/02/2020,27,2,2020,0,0,Azerbaijan,AZ,AZE,9942334,Europe,2020-02-27,AZ,AZE,Azerbaijan
26/02/2020,26,2,2020,0,0,Azerbaijan,AZ,AZE,9942334,Europe,2020-02-26,AZ,AZE,Azerbaijan
25/02/2020,25,2,2020,0,0,Azerbaijan,AZ,AZE,9942334,Europe,2020-02-25,AZ,AZE,Azerbaijan
24/02/2020,24,2,2020,0,0,Azerbaijan,AZ,AZE,9942334,Europe,2020-02-24,AZ,AZE,Azerbaijan
23/02/2020,23,2,2020,0,0,Azerbaijan,AZ,AZE,9942334,Europe,2020-02-23,AZ,AZE,Azerbaijan
22/02/2020,22,2,2020,0,0,Azerbaijan,AZ,AZE,9942334,Europe,2020-02-22,AZ,AZE,Azerbaijan
21/02/2020,21,2,2020,0,0,Azerbaijan,AZ,AZE,9942334,Europe,2020-02-21,AZ,AZE,Azerbaijan
20/02/2020,20,2,2020,0,0,Azerbaijan,AZ,AZE,9942334,Europe,2020-02-20,AZ,AZE,Azerbaijan
19/02/2020,19,2,2020,0,0,Azerbaijan,AZ,AZE,9942334,Europe,2020-02-19,AZ,AZE,Azerbaijan
18/02/2020,18,2,2020,0,0,Azerbaijan,AZ,AZE,9942334,Europe,2020-02-18,AZ,AZE,Azerbaijan
