dateRep,day,month,year,cases,deaths,countriesAndTerritories,geoId,countryterritoryCode,popData2018,continentExp,date,iso2
17/05/2020,17,5,2020,0,0,Afghanistan,AF,AFG,37172386,Asia,2020-05-17,AF
16/05/2020,16,5,2020,1063,32,Afghanistan,AF,AFG,37172386,Asia,2020-05-16,AF
15/05/2020,15,5,2020,113,6,Afghanistan,AF,AFG,37172386,Asia,2020-05-15,AF
14/05/2020,14,5,2020,259,3,Afghanistan,AF,AFG,37172386,Asia,2020-05-14,AF
13/05/2020,13,5,2020,280,5,Afghanistan,AF,AFG,37172386,Asia,2020-05-13,AF
12/05/2020,12,5,2020,285,2,Afghanistan,AF,AFG,37172386,Asia,2020-05-12,AF
11/05/2020,11,5,2020,369,5,Afghanistan,AF,AFG,37172386,Asia,2020-05-11,AF
10/05/2020,10,5,2020,255,6,Afghanistan,AF,AFG,37172386,Asia,2020-05-10,AF
09/05/2020,9,5,2020,215,3,Afghanistan,AF,AFG,37172386,Asia,2020-05-09,AF
08/05/2020,8,5,2020,171,2,Afghanistan,AF,AFG,37172386,Asia,2020-05-08,AF
07/05/2020,7,5,2020,168,9,Afghanistan,AF,AFG,37172386,Asia,2020-05-07,AF
06/05/2020,6,5,2020,330,5,Afghanistan,AF,AFG,37172386,Asia,2020-05-06,AF
05/05/2020,5,5,2020,190,5,Afghanistan,AF,AFG,37172386,Asia,2020-05-05,AF
04/05/2020,4,5,2020,235,13,Afghanistan,AF,AFG,37172386,Asia,2020-05-04,AF
03/05/2020,3,5,2020,134,4,Afghanistan,AF,AFG,37172386,Asia,2020-05-03,AF
02/05/2020,2,5,2020,164,4,Afghanistan,AF,AFG,37172386,Asia,2020-05-02,AF
01/05/2020,1,5,2020,222,4,Afghanistan,AF,AFG,37172386,Asia,2020-05-01,AF
30/04/2020,30,4,2020,122,0,Afghanistan,AF,AFG,37172386,Asia,2020-04-30,AF
29/04/2020,29,4,2020,124,3,Afghanistan,AF,AFG,37172386,Asia,2020-04-29,AF
28/04/2020,28,4,2020,172,0,Afghanistan,AF,AFG,37172386,Asia,2020-04-28,AF
27/04/2020,27,4,2020,68,10,Afghanistan,AF,AFG,37172386,Asia,2020-04-27,AF
26/04/2020,26,4,2020,112,4,Afghanistan,AF,AFG,37172386,Asia,2020-04-26,AF
25/04/2020,25,4,2020,70,1,Afghanistan,AF,AFG,37172386,Asia,2020-04-25,AF
24/04/2020,24,4,2020,105,2,Afghanistan,AF,AFG,37172386,Asia,2020-04-24,AF
23/04/2020,23,4,2020,84,4,Afghanistan,AF,AFG,37172386,Asia,2020-04-23,AF
22/04/2020,22,4,2020,61,1,Afghanistan,AF,AFG,37172386,Asia,2020-04-22,AF
21/04/2020,21,4,2020,35,2,Afghanistan,AF,AFG,37172386,Asia,2020-04-21,AF
20/04/2020,20,4,2020,88,3,Afghanistan,AF,AFG,37172386,Asia,2020-04-20,AF
19/04/2020,19,4,2020,63,0,Afghanistan,AF,AFG,37172386,Asia,2020-04-19,AF
18/04/2020,18,4,2020,51,1,Afghanistan,AF,AFG,37172386,Asia,2020-04-18,AF
17/04/2020,17,4,2020,10,4,Afghanistan,AF,AFG,37172386,Asia,2020-04-17,AF
16/04/2020,16,4,2020,70,2,Afghanistan,AF,AFG,37172386,Asia,2020-04-16,AF
15/04/2020,15,4,2020,49,2,Afghanistan,AF,AFG,37172386,Asia,2020-04-15,AF
14/04/2020,14,4,2020,58,3,Afghanistan,AF,AFG,37172386,Asia,2020-04-14,AF
13/04/2020,13,4,2020,52,0,Afghanistan,AF,AFG,37172386,Asia,2020-04-13,AF
12/04/2020,12,4,2020,34,3,Afghanistan,AF,AFG,37172386,Asia,2020-04-12,AF
11/04/2020,11,4,2020,37,0,Afghanistan,AF,AFG,37172386,Asia,2020-04-11,AF
10/04/2020,10,4,2020,61,1,Afghanistan,AF,AFG,37172386,Asia,2020-04-10,AF
09/04/2020,9,4,2020,56,3,Afghanistan,AF,AFG,37172386,Asia,2020-04-09,AF
08/04/2020,8,4,2020,30,4,Afghanistan,AF,AFG,37172386,Asia,2020-04-08,AF
07/04/2020,7,4,2020,38,0,Afghanistan,AF,AFG,37172386,Asia,2020-04-07,AF
06/04/2020,6,4,2020,29,2,Afghanistan,AF,AFG,37172386,Asia,2020-04-06,AF
05/04/2020,5,4,2020,35,1,Afghanistan,AF,AFG,37172386,Asia,2020-04-05,AF
04/04/2020,4,4,2020,0,0,Afghanistan,AF,AFG,37172386,Asia,2020-04-04,AF
03/04/2020,3,4,2020,43,0,Afghanistan,AF,AFG,37172386,Asia,2020-04-03,AF
02/04/2020,2,4,2020,26,0,Afghanistan,AF,AFG,37172386,Asia,2020-04-02,AF
01/04/2020,1,4,2020,25,0,Afghanistan,AF,AFG,37172386,Asia,2020-04-01,AF
31/03/2020,31,3,2020,27,0,Afghanistan,AF,AFG,37172386,Asia,2020-03-31,AF
30/03/2020,30,3,2020,8,1,Afghanistan,AF,AFG,37172386,Asia,2020-03-30,AF
29/03/2020,29,3,2020,15,1,Afghanistan,AF,AFG,37172386,Asia,2020-03-29,AF
28/03/2020,28,3,2020,16,1,Afghanistan,AF,AFG,37172386,Asia,2020-03-28,AF
27/03/2020,27,3,2020,0,0,Afghanistan,AF,AFG,37172386,Asia,2020-03-27,AF
26/03/2020,26,3,2020,33,0,Afghanistan,AF,AFG,37172386,Asia,2020-03-26,AF
25/03/2020,25,3,2020,2,0,Afghanistan,AF,AFG,37172386,Asia,2020-03-25,AF
24/03/2020,24,3,2020,6,1,Afghanistan,AF,AFG,37172386,Asia,2020-03-24,AF
23/03/2020,23,3,2020,10,0,Afghanistan,AF,AFG,37172386,Asia,2020-03-23,AF
22/03/2020,22,3,2020,0,0,Afghanistan,AF,AFG,37172386,Asia,2020-03-22,AF
21/03/2020,21,3,2020,2,0,Afghanistan,AF,AFG,37172386,Asia,2020-03-21,AF
20/03/2020,20,3,2020,0,0,Afghanistan,AF,AFG,37172386,Asia,2020-03-20,AF
19/03/2020,19,3,2020,0,0,Afghanistan,AF,AFG,37172386,Asia,2020-03-19,AF
18/03/2020,18,3,2020,1,0,Afghanistan,AF,AFG,37172386,Asia,2020-03-18,AF
17/03/2020,17,3,2020,5,0,Afghanistan,AF,AFG,37172386,Asia,2020-03-17,AF
16/03/2020,16,3,2020,6,0,Afghanistan,AF,AFG,37172386,Asia,2020-03-16,AF
15/03/2020,15,3,2020,3,0,Afghanistan,AF,AFG,37172386,Asia,2020-03-15,AF
11/03/2020,11,3,2020,3,0,Afghanistan,AF,AFG,37172386,Asia,2020-03-11,AF
08/03/2020,8,3,2020,3,0,Afghanistan,AF,AFG,37172386,Asia,2020-03-08,AF
02/03/2020,2,3,2020,0,0,Afghanistan,AF,AFG,37172386,Asia,2020-03-02,AF
01/03/2020,1,3,2020,0,0,Afghanistan,AF,AFG,37172386,Asia,2020-03-01,AF
29/02/2020,29,2,2020,0,0,Afghanistan,AF,AFG,37172386,Asia,2020-02-29,AF
28/02/2020,28,2,2020,0,0,Afghanistan,AF,AFG,37172386,Asia,2020-02-28,AF
27/02/2020,27,2,2020,0,0,Afghanistan,AF,AFG,37172386,Asia,2020-02-27,AF
26/02/2020,26,2,2020,0,0,Afghanistan,AF,AFG,37172386,Asia,2020-02-26,AF
25/02/2020,25,2,2020,1,0,Afghanistan,AF,AFG,37172386,Asia,2020-02-25,AF
24/02/2020,24,2,2020,0,0,Afghanistan,AF,AFG,37172386,Asia,2020-02-24,AF
23/02/2020,23,2,2020,0,0,Afghanistan,AF,AFG,37172386,Asia,2020-02-23,AF
22/02/2020,22,2,2020,0,0,Afghanistan,AF,AFG,37172386,Asia,2020-02-22,AF
21/02/2020,21,2,2020,0,0,Afghanistan,AF,AFG,37172386,Asia,2020-02-21,AF
20/02/2020,20,2,2020,0,0,Afghanistan,AF,AFG,37172386,Asia,2020-02-20,AF
19/02/2020,19,2,2020,0,0,Afghanistan,AF,AFG,37172386,Asia,2020-02-19,AF
18/02/2020,18,2,2020,0,0,Afghanistan,AF,AFG,37172386,Asia,2020-02-18,AF
17/02/2020,17,2,2020,0,0,Afghanistan,AF,AFG,37172386,Asia,2020-02-17,AF
16/02/2020,16,2,2020,0,0,Afghanistan,AF,AFG,37172386,Asia,2020-02-16,AF
15/02/2020,15,2,2020,0,0,Afghanistan,AF,AFG,37172386,Asia,2020-02-15,AF
14/02/2020,14,2,2020,0,0,Afghanistan,AF,AFG,37172386,Asia,2020-02-14,AF
13/02/2020,13,2,2020,0,0,Afghanistan,AF,AFG,37172386,Asia,2020-02-13,AF
12/02/2020,12,2,2020,0,0,Afghanistan,AF,AFG,37172386,Asia,2020-02-12,AF
11/02/2020,11,2,2020,0,0,Afghanistan,AF,AFG,37172386,Asia,2020-02-11,AF
10/02/2020,10,2,2020,0,0,Afghanistan,AF,AFG,37172386,Asia,2020-02-10,AF
09/02/2020,9,2,2020,0,0,Afghanistan,AF,AFG,37172386,Asia,2020-02-09,AF
08/02/2020,8,2,2020,0,0,Afghanistan,AF,AFG,37172386,Asia,2020-02-08,AF
07/02/2020,7,2,2020,0,0,Afghanistan,AF,AFG,37172386,Asia,2020-02-07,AF
06/02/2020,6,2,2020,0,0,Afghanistan,AF,AFG,37172386,Asia,2020-02-06,AF
05/02/2020,5,2,2020,0,0,Afghanistan,AF,AFG,37172386,Asia,2020-02-05,AF
04/02/2020,4,2,2020,0,0,Afghanistan,AF,AFG,37172386,Asia,2020-02-04,AF
03/02/2020,3,2,2020,0,0,Afghanistan,AF,AFG,37172386,Asia,2020-02-03,AF
02/02/2020,2,2,2020,0,0,Afghanistan,AF,AFG,37172386,Asia,2020-02-02,AF
01/02/2020,1,2,2020,0,0,Afghanistan,AF,AFG,37172386,Asia,2020-02-01,AF
31/01/2020,31,1,2020,0,0,Afghanistan,AF,AFG,37172386,Asia,2020-01-31,AF
30/01/2020,30,1,2020,0,0,Afghanistan,AF,AFG,37172386,Asia,2020-01-30,AF
29/01/2020,29,1,2020,0,0,Afghanistan,AF,AFG,37172386,Asia,2020-01-29,AF
28/01/2020,28,1,2020,0,0,Afghanistan,AF,AFG,37172386,Asia,2020-01-28,AF
27/01/2020,27,1,2020,0,0,Afghanistan,AF,AFG,37172386,Asia,2020-01-27,AF
26/01/2020,26,1,2020,0,0,Afghanistan,AF,AFG,37172386,Asia,2020-01-26,AF
25/01/2020,25,1,2020,0,0,Afghanistan,AF,AFG,37172386,Asia,2020-01-25,AF
24/01/2020,24,1,2020,0,0,Afghanistan,AF,AFG,37172386,Asia,2020-01-24,AF
23/01/2020,23,1,2020,0,0,Afghanistan,AF,AFG,37172386,Asia,2020-01-23,AF
22/01/2020,22,1,2020,0,0,Afghanistan,AF,AFG,37172386,Asia,2020-01-22,AF
21/01/2020,21,1,2020,0,0,Afghanistan,AF,AFG,37172386,Asia,2020-01-21,AF
20/01/2020,20,1,2020,0,0,Afghanistan,AF,AFG,37172386,Asia,2020-01-20,AF
19/01/2020,19,1,2020,0,0,Afghanistan,AF,AFG,37172386,Asia,2020-01-19,AF
18/01/2020,18,1,2020,0,0,Afghanistan,AF,AFG,37172386,Asia,2020-01-18,AF
17/01/2020,17,1,2020,0,0,Afghanistan,AF,AFG,37172386,Asia,2020-01-17,AF
16/01/2020,16,1,2020,0,0,Afghanistan,AF,AFG,37172386,Asia,2020-01-16,AF
15/01/2020,15,1,2020,0,0,Afghanistan,AF,AFG,37172386,Asia,2020-01-15,AF
14/01/2020,14,1,2020,0,0,Afghanistan,AF,AFG,37172386,Asia,2020-01-14,AF
13/01/2020,13,1,2020,0,0,Afghanistan,AF,AFG,37172386,Asia,2020-01-13,AF
12/01/2020,12,1,2020,0,0,Afghanistan,AF,AFG,37172386,Asia,2020-01-12,AF
11/01/2020,11,1,2020,0,0,Afghanistan,AF,AFG,37172386,Asia,2020-01-11,AF
10/01/2020,10,1,2020,0,0,Afghanistan,AF,AFG,37172386,Asia,2020-01-10,AF
09/01/2020,9,1,2020,0,0,Afghanistan,AF,AFG,37172386,Asia,2020-01-09,AF
08/01/2020,8,1,2020,0,0,Afghanistan,AF,AFG,37172386,Asia,2020-01-08,AF
07/01/2020,7,1,2020,0,0,Afghanistan,AF,AFG,37172386,Asia,2020-01-07,AF
06/01/2020,6,1,2020,0,0,Afghanistan,AF,AFG,37172386,Asia,2020-01-06,AF
05/01/2020,5,1,2020,0,0,Afghanistan,AF,AFG,37172386,Asia,2020-01-05,AF
04/01/2020,4,1,2020,0,0,Afghanistan,AF,AFG,37172386,Asia,2020-01-04,AF
03/01/2020,3,1,2020,0,0,Afghanistan,AF,AFG,37172386,Asia,2020-01-03,AF
02/01/2020,2,1,2020,0,0,Afghanistan,AF,AFG,37172386,Asia,2020-01-02,AF
01/01/2020,1,1,2020,0,0,Afghanistan,AF,AFG,37172386,Asia,2020-01-01,AF
31/12/2019,31,12,2019,0,0,Afghanistan,AF,AFG,37172386,Asia,2019-12-31,AF
17/05/2020,17,5,2020,17,0,Albania,AL,ALB,2866376,Europe,2020-05-17,AL
16/05/2020,16,5,2020,18,0,Albania,AL,ALB,2866376,Europe,2020-05-16,AL
15/05/2020,15,5,2020,18,0,Albania,AL,ALB,2866376,Europe,2020-05-15,AL
14/05/2020,14,5,2020,4,0,Albania,AL,ALB,2866376,Europe,2020-05-14,AL
13/05/2020,13,5,2020,4,0,Albania,AL,ALB,2866376,Europe,2020-05-13,AL
12/05/2020,12,5,2020,4,0,Albania,AL,ALB,2866376,Europe,2020-05-12,AL
11/05/2020,11,5,2020,12,0,Albania,AL,ALB,2866376,Europe,2020-05-11,AL
10/05/2020,10,5,2020,6,0,Albania,AL,ALB,2866376,Europe,2020-05-10,AL
09/05/2020,9,5,2020,8,0,Albania,AL,ALB,2866376,Europe,2020-05-09,AL
08/05/2020,8,5,2020,10,0,Albania,AL,ALB,2866376,Europe,2020-05-08,AL
07/05/2020,7,5,2020,12,0,Albania,AL,ALB,2866376,Europe,2020-05-07,AL
06/05/2020,6,5,2020,17,0,Albania,AL,ALB,2866376,Europe,2020-05-06,AL
05/05/2020,5,5,2020,8,0,Albania,AL,ALB,2866376,Europe,2020-05-05,AL
04/05/2020,4,5,2020,6,0,Albania,AL,ALB,2866376,Europe,2020-05-04,AL
03/05/2020,3,5,2020,7,0,Albania,AL,ALB,2866376,Europe,2020-05-03,AL
02/05/2020,2,5,2020,9,0,Albania,AL,ALB,2866376,Europe,2020-05-02,AL
01/05/2020,1,5,2020,7,0,Albania,AL,ALB,2866376,Europe,2020-05-01,AL
30/04/2020,30,4,2020,16,1,Albania,AL,ALB,2866376,Europe,2020-04-30,AL
29/04/2020,29,4,2020,14,2,Albania,AL,ALB,2866376,Europe,2020-04-29,AL
28/04/2020,28,4,2020,10,0,Albania,AL,ALB,2866376,Europe,2020-04-28,AL
27/04/2020,27,4,2020,14,1,Albania,AL,ALB,2866376,Europe,2020-04-27,AL
26/04/2020,26,4,2020,34,0,Albania,AL,ALB,2866376,Europe,2020-04-26,AL
25/04/2020,25,4,2020,15,0,Albania,AL,ALB,2866376,Europe,2020-04-25,AL
24/04/2020,24,4,2020,29,0,Albania,AL,ALB,2866376,Europe,2020-04-24,AL
23/04/2020,23,4,2020,25,1,Albania,AL,ALB,2866376,Europe,2020-04-23,AL
22/04/2020,22,4,2020,25,0,Albania,AL,ALB,2866376,Europe,2020-04-22,AL
21/04/2020,21,4,2020,22,0,Albania,AL,ALB,2866376,Europe,2020-04-21,AL
20/04/2020,20,4,2020,14,0,Albania,AL,ALB,2866376,Europe,2020-04-20,AL
19/04/2020,19,4,2020,9,0,Albania,AL,ALB,2866376,Europe,2020-04-19,AL
18/04/2020,18,4,2020,21,0,Albania,AL,ALB,2866376,Europe,2020-04-18,AL
17/04/2020,17,4,2020,24,1,Albania,AL,ALB,2866376,Europe,2020-04-17,AL
16/04/2020,16,4,2020,19,1,Albania,AL,ALB,2866376,Europe,2020-04-16,AL
15/04/2020,15,4,2020,8,1,Albania,AL,ALB,2866376,Europe,2020-04-15,AL
14/04/2020,14,4,2020,21,0,Albania,AL,ALB,2866376,Europe,2020-04-14,AL
13/04/2020,13,4,2020,13,0,Albania,AL,ALB,2866376,Europe,2020-04-13,AL
12/04/2020,12,4,2020,17,0,Albania,AL,ALB,2866376,Europe,2020-04-12,AL
11/04/2020,11,4,2020,7,0,Albania,AL,ALB,2866376,Europe,2020-04-11,AL
10/04/2020,10,4,2020,9,1,Albania,AL,ALB,2866376,Europe,2020-04-10,AL
09/04/2020,9,4,2020,17,0,Albania,AL,ALB,2866376,Europe,2020-04-09,AL
08/04/2020,8,4,2020,6,0,Albania,AL,ALB,2866376,Europe,2020-04-08,AL
07/04/2020,7,4,2020,16,1,Albania,AL,ALB,2866376,Europe,2020-04-07,AL
06/04/2020,6,4,2020,28,2,Albania,AL,ALB,2866376,Europe,2020-04-06,AL
05/04/2020,5,4,2020,29,2,Albania,AL,ALB,2866376,Europe,2020-04-05,AL
04/04/2020,4,4,2020,27,1,Albania,AL,ALB,2866376,Europe,2020-04-04,AL
03/04/2020,3,4,2020,18,1,Albania,AL,ALB,2866376,Europe,2020-04-03,AL
02/04/2020,2,4,2020,16,0,Albania,AL,ALB,2866376,Europe,2020-04-02,AL
01/04/2020,1,4,2020,20,3,Albania,AL,ALB,2866376,Europe,2020-04-01,AL
31/03/2020,31,3,2020,11,2,Albania,AL,ALB,2866376,Europe,2020-03-31,AL
30/03/2020,30,3,2020,15,0,Albania,AL,ALB,2866376,Europe,2020-03-30,AL
29/03/2020,29,3,2020,11,1,Albania,AL,ALB,2866376,Europe,2020-03-29,AL
28/03/2020,28,3,2020,12,3,Albania,AL,ALB,2866376,Europe,2020-03-28,AL
27/03/2020,27,3,2020,28,1,Albania,AL,ALB,2866376,Europe,2020-03-27,AL
26/03/2020,26,3,2020,23,0,Albania,AL,ALB,2866376,Europe,2020-03-26,AL
25/03/2020,25,3,2020,23,1,Albania,AL,ALB,2866376,Europe,2020-03-25,AL
24/03/2020,24,3,2020,11,2,Albania,AL,ALB,2866376,Europe,2020-03-24,AL
23/03/2020,23,3,2020,13,0,Albania,AL,ALB,2866376,Europe,2020-03-23,AL
22/03/2020,22,3,2020,6,0,Albania,AL,ALB,2866376,Europe,2020-03-22,AL
21/03/2020,21,3,2020,0,0,Albania,AL,ALB,2866376,Europe,2020-03-21,AL
20/03/2020,20,3,2020,11,0,Albania,AL,ALB,2866376,Europe,2020-03-20,AL
19/03/2020,19,3,2020,4,1,Albania,AL,ALB,2866376,Europe,2020-03-19,AL
18/03/2020,18,3,2020,4,0,Albania,AL,ALB,2866376,Europe,2020-03-18,AL
17/03/2020,17,3,2020,9,0,Albania,AL,ALB,2866376,Europe,2020-03-17,AL
16/03/2020,16,3,2020,4,0,Albania,AL,ALB,2866376,Europe,2020-03-16,AL
15/03/2020,15,3,2020,5,0,Albania,AL,ALB,2866376,Europe,2020-03-15,AL
14/03/2020,14,3,2020,10,0,Albania,AL,ALB,2866376,Europe,2020-03-14,AL
13/03/2020,13,3,2020,12,0,Albania,AL,ALB,2866376,Europe,2020-03-13,AL
12/03/2020,12,3,2020,1,1,Albania,AL,ALB,2866376,Europe,2020-03-12,AL
11/03/2020,11,3,2020,4,0,Albania,AL,ALB,2866376,Europe,2020-03-11,AL
10/03/2020,10,3,2020,4,0,Albania,AL,ALB,2866376,Europe,2020-03-10,AL
09/03/2020,9,3,2020,2,0,Albania,AL,ALB,2866376,Europe,2020-03-09,AL
17/05/2020,17,5,2020,192,6,Algeria,DZ,DZA,42228429,Africa,2020-05-17,DZ
16/05/2020,16,5,2020,187,7,Algeria,DZ,DZA,42228429,Africa,2020-05-16,DZ
15/05/2020,15,5,2020,189,7,Algeria,DZ,DZA,42228429,Africa,2020-05-15,DZ
14/05/2020,14,5,2020,186,7,Algeria,DZ,DZA,42228429,Africa,2020-05-14,DZ
13/05/2020,13,5,2020,176,8,Algeria,DZ,DZA,42228429,Africa,2020-05-13,DZ
12/05/2020,12,5,2020,168,5,Algeria,DZ,DZA,42228429,Africa,2020-05-12,DZ
11/05/2020,11,5,2020,165,8,Algeria,DZ,DZA,42228429,Africa,2020-05-11,DZ
10/05/2020,10,5,2020,189,6,Algeria,DZ,DZA,42228429,Africa,2020-05-10,DZ
09/05/2020,9,5,2020,187,5,Algeria,DZ,DZA,42228429,Africa,2020-05-09,DZ
08/05/2020,8,5,2020,185,7,Algeria,DZ,DZA,42228429,Africa,2020-05-08,DZ
07/05/2020,7,5,2020,159,6,Algeria,DZ,DZA,42228429,Africa,2020-05-07,DZ
06/05/2020,6,5,2020,190,5,Algeria,DZ,DZA,42228429,Africa,2020-05-06,DZ
05/05/2020,5,5,2020,174,2,Algeria,DZ,DZA,42228429,Africa,2020-05-05,DZ
04/05/2020,4,5,2020,179,4,Algeria,DZ,DZA,42228429,Africa,2020-05-04,DZ
03/05/2020,3,5,2020,141,6,Algeria,DZ,DZA,42228429,Africa,2020-05-03,DZ
02/05/2020,2,5,2020,148,3,Algeria,DZ,DZA,42228429,Africa,2020-05-02,DZ
01/05/2020,1,5,2020,158,6,Algeria,DZ,DZA,42228429,Africa,2020-05-01,DZ
30/04/2020,30,4,2020,199,7,Algeria,DZ,DZA,42228429,Africa,2020-04-30,DZ
29/04/2020,29,4,2020,132,5,Algeria,DZ,DZA,42228429,Africa,2020-04-29,DZ
28/04/2020,28,4,2020,135,7,Algeria,DZ,DZA,42228429,Africa,2020-04-28,DZ
27/04/2020,27,4,2020,126,6,Algeria,DZ,DZA,42228429,Africa,2020-04-27,DZ
26/04/2020,26,4,2020,129,4,Algeria,DZ,DZA,42228429,Africa,2020-04-26,DZ
25/04/2020,25,4,2020,120,8,Algeria,DZ,DZA,42228429,Africa,2020-04-25,DZ
24/04/2020,24,4,2020,97,5,Algeria,DZ,DZA,42228429,Africa,2020-04-24,DZ
23/04/2020,23,4,2020,99,10,Algeria,DZ,DZA,42228429,Africa,2020-04-23,DZ
22/04/2020,22,4,2020,93,8,Algeria,DZ,DZA,42228429,Africa,2020-04-22,DZ
21/04/2020,21,4,2020,89,9,Algeria,DZ,DZA,42228429,Africa,2020-04-21,DZ
20/04/2020,20,4,2020,94,8,Algeria,DZ,DZA,42228429,Africa,2020-04-20,DZ
19/04/2020,19,4,2020,117,3,Algeria,DZ,DZA,42228429,Africa,2020-04-19,DZ
18/04/2020,18,4,2020,150,16,Algeria,DZ,DZA,42228429,Africa,2020-04-18,DZ
17/04/2020,17,4,2020,108,12,Algeria,DZ,DZA,42228429,Africa,2020-04-17,DZ
16/04/2020,16,4,2020,90,11,Algeria,DZ,DZA,42228429,Africa,2020-04-16,DZ
15/04/2020,15,4,2020,87,12,Algeria,DZ,DZA,42228429,Africa,2020-04-15,DZ
14/04/2020,14,4,2020,69,20,Algeria,DZ,DZA,42228429,Africa,2020-04-14,DZ
13/04/2020,13,4,2020,89,18,Algeria,DZ,DZA,42228429,Africa,2020-04-13,DZ
12/04/2020,12,4,2020,64,19,Algeria,DZ,DZA,42228429,Africa,2020-04-12,DZ
11/04/2020,11,4,2020,95,21,Algeria,DZ,DZA,42228429,Africa,2020-04-11,DZ
10/04/2020,10,4,2020,94,30,Algeria,DZ,DZA,42228429,Africa,2020-04-10,DZ
09/04/2020,9,4,2020,104,12,Algeria,DZ,DZA,42228429,Africa,2020-04-09,DZ
08/04/2020,8,4,2020,45,20,Algeria,DZ,DZA,42228429,Africa,2020-04-08,DZ
07/04/2020,7,4,2020,103,21,Algeria,DZ,DZA,42228429,Africa,2020-04-07,DZ
06/04/2020,6,4,2020,69,22,Algeria,DZ,DZA,42228429,Africa,2020-04-06,DZ
05/04/2020,5,4,2020,80,25,Algeria,DZ,DZA,42228429,Africa,2020-04-05,DZ
04/04/2020,4,4,2020,185,42,Algeria,DZ,DZA,42228429,Africa,2020-04-04,DZ
03/04/2020,3,4,2020,139,5,Algeria,DZ,DZA,42228429,Africa,2020-04-03,DZ
02/04/2020,2,4,2020,131,14,Algeria,DZ,DZA,42228429,Africa,2020-04-02,DZ
01/04/2020,1,4,2020,132,9,Algeria,DZ,DZA,42228429,Africa,2020-04-01,DZ
31/03/2020,31,3,2020,73,4,Algeria,DZ,DZA,42228429,Africa,2020-03-31,DZ
30/03/2020,30,3,2020,57,2,Algeria,DZ,DZA,42228429,Africa,2020-03-30,DZ
29/03/2020,29,3,2020,45,3,Algeria,DZ,DZA,42228429,Africa,2020-03-29,DZ
28/03/2020,28,3,2020,42,1,Algeria,DZ,DZA,42228429,Africa,2020-03-28,DZ
27/03/2020,27,3,2020,65,4,Algeria,DZ,DZA,42228429,Africa,2020-03-27,DZ
26/03/2020,26,3,2020,38,2,Algeria,DZ,DZA,42228429,Africa,2020-03-26,DZ
25/03/2020,25,3,2020,34,2,Algeria,DZ,DZA,42228429,Africa,2020-03-25,DZ
24/03/2020,24,3,2020,29,0,Algeria,DZ,DZA,42228429,Africa,2020-03-24,DZ
23/03/2020,23,3,2020,62,2,Algeria,DZ,DZA,42228429,Africa,2020-03-23,DZ
22/03/2020,22,3,2020,37,5,Algeria,DZ,DZA,42228429,Africa,2020-03-22,DZ
21/03/2020,21,3,2020,12,3,Algeria,DZ,DZA,42228429,Africa,2020-03-21,DZ
20/03/2020,20,3,2020,18,1,Algeria,DZ,DZA,42228429,Africa,2020-03-20,DZ
19/03/2020,19,3,2020,12,1,Algeria,DZ,DZA,42228429,Africa,2020-03-19,DZ
18/03/2020,18,3,2020,2,1,Algeria,DZ,DZA,42228429,Africa,2020-03-18,DZ
17/03/2020,17,3,2020,10,0,Algeria,DZ,DZA,42228429,Africa,2020-03-17,DZ
16/03/2020,16,3,2020,11,2,Algeria,DZ,DZA,42228429,Africa,2020-03-16,DZ
15/03/2020,15,3,2020,11,0,Algeria,DZ,DZA,42228429,Africa,2020-03-15,DZ
14/03/2020,14,3,2020,1,1,Algeria,DZ,DZA,42228429,Africa,2020-03-14,DZ
13/03/2020,13,3,2020,5,1,Algeria,DZ,DZA,42228429,Africa,2020-03-13,DZ
12/03/2020,12,3,2020,0,0,Algeria,DZ,DZA,42228429,Africa,2020-03-12,DZ
09/03/2020,9,3,2020,3,0,Algeria,DZ,DZA,42228429,Africa,2020-03-09,DZ
06/03/2020,6,3,2020,5,0,Algeria,DZ,DZA,42228429,Africa,2020-03-06,DZ
05/03/2020,5,3,2020,7,0,Algeria,DZ,DZA,42228429,Africa,2020-03-05,DZ
04/03/2020,4,3,2020,2,0,Algeria,DZ,DZA,42228429,Africa,2020-03-04,DZ
02/03/2020,2,3,2020,0,0,Algeria,DZ,DZA,42228429,Africa,2020-03-02,DZ
01/03/2020,1,3,2020,2,0,Algeria,DZ,DZA,42228429,Africa,2020-03-01,DZ
29/02/2020,29,2,2020,0,0,Algeria,DZ,DZA,42228429,Africa,2020-02-29,DZ
28/02/2020,28,2,2020,0,0,Algeria,DZ,DZA,42228429,Africa,2020-02-28,DZ
27/02/2020,27,2,2020,0,0,Algeria,DZ,DZA,42228429,Africa,2020-02-27,DZ
26/02/2020,26,2,2020,1,0,Algeria,DZ,DZA,42228429,Africa,2020-02-26,DZ
25/02/2020,25,2,2020,0,0,Algeria,DZ,DZA,42228429,Africa,2020-02-25,DZ
24/02/2020,24,2,2020,0,0,Algeria,DZ,DZA,42228429,Africa,2020-02-24,DZ
23/02/2020,23,2,2020,0,0,Algeria,DZ,DZA,42228429,Africa,2020-02-23,DZ
22/02/2020,22,2,2020,0,0,Algeria,DZ,DZA,42228429,Africa,2020-02-22,DZ
21/02/2020,21,2,2020,0,0,Algeria,DZ,DZA,42228429,Africa,2020-02-21,DZ
20/02/2020,20,2,2020,0,0,Algeria,DZ,DZA,42228429,Africa,2020-02-20,DZ
19/02/2020,19,2,2020,0,0,Algeria,DZ,DZA,42228429,Africa,2020-02-19,DZ
18/02/2020,18,2,2020,0,0,Algeria,DZ,DZA,42228429,Africa,2020-02-18,DZ
17/02/2020,17,2,2020,0,0,Algeria,DZ,DZA,42228429,Africa,2020-02-17,DZ
16/02/2020,16,2,2020,0,0,Algeria,DZ,DZA,42228429,Africa,2020-02-16,DZ
15/02/2020,15,2,2020,0,0,Algeria,DZ,DZA,42228429,Africa,2020-02-15,DZ
14/02/2020,14,2,2020,0,0,Algeria,DZ,DZA,42228429,Africa,2020-02-14,DZ
13/02/2020,13,2,2020,0,0,Algeria,DZ,DZA,42228429,Africa,2020-02-13,DZ
12/02/2020,12,2,2020,0,0,Algeria,DZ,DZA,42228429,Africa,2020-02-12,DZ
11/02/2020,11,2,2020,0,0,Algeria,DZ,DZA,42228429,Africa,2020-02-11,DZ
10/02/2020,10,2,2020,0,0,Algeria,DZ,DZA,42228429,Africa,2020-02-10,DZ
09/02/2020,9,2,2020,0,0,Algeria,DZ,DZA,42228429,Africa,2020-02-09,DZ
08/02/2020,8,2,2020,0,0,Algeria,DZ,DZA,42228429,Africa,2020-02-08,DZ
07/02/2020,7,2,2020,0,0,Algeria,DZ,DZA,42228429,Africa,2020-02-07,DZ
06/02/2020,6,2,2020,0,0,Algeria,DZ,DZA,42228429,Africa,2020-02-06,DZ
05/02/2020,5,2,2020,0,0,Algeria,DZ,DZA,42228429,Africa,2020-02-05,DZ
04/02/2020,4,2,2020,0,0,Algeria,DZ,DZA,42228429,Africa,2020-02-04,DZ
03/02/2020,3,2,2020,0,0,Algeria,DZ,DZA,42228429,Africa,2020-02-03,DZ
02/02/2020,2,2,2020,0,0,Algeria,DZ,DZA,42228429,Africa,2020-02-02,DZ
01/02/2020,1,2,2020,0,0,Algeria,DZ,DZA,42228429,Africa,2020-02-01,DZ
31/01/2020,31,1,2020,0,0,Algeria,DZ,DZA,42228429,Africa,2020-01-31,DZ
30/01/2020,30,1,2020,0,0,Algeria,DZ,DZA,42228429,Africa,2020-01-30,DZ
29/01/2020,29,1,2020,0,0,Algeria,DZ,DZA,42228429,Africa,2020-01-29,DZ
28/01/2020,28,1,2020,0,0,Algeria,DZ,DZA,42228429,Africa,2020-01-28,DZ
27/01/2020,27,1,2020,0,0,Algeria,DZ,DZA,42228429,Africa,2020-01-27,DZ
26/01/2020,26,1,2020,0,0,Algeria,DZ,DZA,42228429,Africa,2020-01-26,DZ
25/01/2020,25,1,2020,0,0,Algeria,DZ,DZA,42228429,Africa,2020-01-25,DZ
24/01/2020,24,1,2020,0,0,Algeria,DZ,DZA,42228429,Africa,2020-01-24,DZ
23/01/2020,23,1,2020,0,0,Algeria,DZ,DZA,42228429,Africa,2020-01-23,DZ
22/01/2020,22,1,2020,0,0,Algeria,DZ,DZA,42228429,Africa,2020-01-22,DZ
21/01/2020,21,1,2020,0,0,Algeria,DZ,DZA,42228429,Africa,2020-01-21,DZ
20/01/2020,20,1,2020,0,0,Algeria,DZ,DZA,42228429,Africa,2020-01-20,DZ
19/01/2020,19,1,2020,0,0,Algeria,DZ,DZA,42228429,Africa,2020-01-19,DZ
18/01/2020,18,1,2020,0,0,Algeria,DZ,DZA,42228429,Africa,2020-01-18,DZ
17/01/2020,17,1,2020,0,0,Algeria,DZ,DZA,42228429,Africa,2020-01-17,DZ
16/01/2020,16,1,2020,0,0,Algeria,DZ,DZA,42228429,Africa,2020-01-16,DZ
15/01/2020,15,1,2020,0,0,Algeria,DZ,DZA,42228429,Africa,2020-01-15,DZ
14/01/2020,14,1,2020,0,0,Algeria,DZ,DZA,42228429,Africa,2020-01-14,DZ
13/01/2020,13,1,2020,0,0,Algeria,DZ,DZA,42228429,Africa,2020-01-13,DZ
12/01/2020,12,1,2020,0,0,Algeria,DZ,DZA,42228429,Africa,2020-01-12,DZ
11/01/2020,11,1,2020,0,0,Algeria,DZ,DZA,42228429,Africa,2020-01-11,DZ
10/01/2020,10,1,2020,0,0,Algeria,DZ,DZA,42228429,Africa,2020-01-10,DZ
09/01/2020,9,1,2020,0,0,Algeria,DZ,DZA,42228429,Africa,2020-01-09,DZ
08/01/2020,8,1,2020,0,0,Algeria,DZ,DZA,42228429,Africa,2020-01-08,DZ
07/01/2020,7,1,2020,0,0,Algeria,DZ,DZA,42228429,Africa,2020-01-07,DZ
06/01/2020,6,1,2020,0,0,Algeria,DZ,DZA,42228429,Africa,2020-01-06,DZ
05/01/2020,5,1,2020,0,0,Algeria,DZ,DZA,42228429,Africa,2020-01-05,DZ
04/01/2020,4,1,2020,0,0,Algeria,DZ,DZA,42228429,Africa,2020-01-04,DZ
03/01/2020,3,1,2020,0,0,Algeria,DZ,DZA,42228429,Africa,2020-01-03,DZ
02/01/2020,2,1,2020,0,0,Algeria,DZ,DZA,42228429,Africa,2020-01-02,DZ
01/01/2020,1,1,2020,0,0,Algeria,DZ,DZA,42228429,Africa,2020-01-01,DZ
31/12/2019,31,12,2019,0,0,Algeria,DZ,DZA,42228429,Africa,2019-12-31,DZ
17/05/2020,17,5,2020,0,2,Andorra,AD,AND,77006,Europe,2020-05-17,AD
16/05/2020,16,5,2020,0,0,Andorra,AD,AND,77006,Europe,2020-05-16,AD
15/05/2020,15,5,2020,1,0,Andorra,AD,AND,77006,Europe,2020-05-15,AD
14/05/2020,14,5,2020,2,1,Andorra,AD,AND,77006,Europe,2020-05-14,AD
13/05/2020,13,5,2020,2,0,Andorra,AD,AND,77006,Europe,2020-05-13,AD
12/05/2020,12,5,2020,1,0,Andorra,AD,AND,77006,Europe,2020-05-12,AD
11/05/2020,11,5,2020,1,0,Andorra,AD,AND,77006,Europe,2020-05-11,AD
10/05/2020,10,5,2020,2,1,Andorra,AD,AND,77006,Europe,2020-05-10,AD
09/05/2020,9,5,2020,0,0,Andorra,AD,AND,77006,Europe,2020-05-09,AD
08/05/2020,8,5,2020,1,1,Andorra,AD,AND,77006,Europe,2020-05-08,AD
07/05/2020,7,5,2020,0,0,Andorra,AD,AND,77006,Europe,2020-05-07,AD
06/05/2020,6,5,2020,1,1,Andorra,AD,AND,77006,Europe,2020-05-06,AD
05/05/2020,5,5,2020,2,0,Andorra,AD,AND,77006,Europe,2020-05-05,AD
04/05/2020,4,5,2020,1,1,Andorra,AD,AND,77006,Europe,2020-05-04,AD
03/05/2020,3,5,2020,1,1,Andorra,AD,AND,77006,Europe,2020-05-03,AD
02/05/2020,2,5,2020,1,1,Andorra,AD,AND,77006,Europe,2020-05-02,AD
01/05/2020,1,5,2020,2,0,Andorra,AD,AND,77006,Europe,2020-05-01,AD
30/04/2020,30,4,2020,0,1,Andorra,AD,AND,77006,Europe,2020-04-30,AD
29/04/2020,29,4,2020,0,1,Andorra,AD,AND,77006,Europe,2020-04-29,AD
28/04/2020,28,4,2020,3,0,Andorra,AD,AND,77006,Europe,2020-04-28,AD
27/04/2020,27,4,2020,7,0,Andorra,AD,AND,77006,Europe,2020-04-27,AD
26/04/2020,26,4,2020,2,0,Andorra,AD,AND,77006,Europe,2020-04-26,AD
25/04/2020,25,4,2020,7,3,Andorra,AD,AND,77006,Europe,2020-04-25,AD
24/04/2020,24,4,2020,1,0,Andorra,AD,AND,77006,Europe,2020-04-24,AD
23/04/2020,23,4,2020,6,0,Andorra,AD,AND,77006,Europe,2020-04-23,AD
22/04/2020,22,4,2020,0,1,Andorra,AD,AND,77006,Europe,2020-04-22,AD
21/04/2020,21,4,2020,4,0,Andorra,AD,AND,77006,Europe,2020-04-21,AD
20/04/2020,20,4,2020,9,1,Andorra,AD,AND,77006,Europe,2020-04-20,AD
19/04/2020,19,4,2020,8,0,Andorra,AD,AND,77006,Europe,2020-04-19,AD
18/04/2020,18,4,2020,14,2,Andorra,AD,AND,77006,Europe,2020-04-18,AD
17/04/2020,17,4,2020,9,0,Andorra,AD,AND,77006,Europe,2020-04-17,AD
16/04/2020,16,4,2020,14,2,Andorra,AD,AND,77006,Europe,2020-04-16,AD
15/04/2020,15,4,2020,13,2,Andorra,AD,AND,77006,Europe,2020-04-15,AD
14/04/2020,14,4,2020,8,0,Andorra,AD,AND,77006,Europe,2020-04-14,AD
13/04/2020,13,4,2020,16,1,Andorra,AD,AND,77006,Europe,2020-04-13,AD
12/04/2020,12,4,2020,21,2,Andorra,AD,AND,77006,Europe,2020-04-12,AD
11/04/2020,11,4,2020,18,1,Andorra,AD,AND,77006,Europe,2020-04-11,AD
10/04/2020,10,4,2020,19,2,Andorra,AD,AND,77006,Europe,2020-04-10,AD
09/04/2020,9,4,2020,19,1,Andorra,AD,AND,77006,Europe,2020-04-09,AD
08/04/2020,8,4,2020,19,1,Andorra,AD,AND,77006,Europe,2020-04-08,AD
07/04/2020,7,4,2020,25,3,Andorra,AD,AND,77006,Europe,2020-04-07,AD
06/04/2020,6,4,2020,35,1,Andorra,AD,AND,77006,Europe,2020-04-06,AD
05/04/2020,5,4,2020,27,1,Andorra,AD,AND,77006,Europe,2020-04-05,AD
04/04/2020,4,4,2020,11,1,Andorra,AD,AND,77006,Europe,2020-04-04,AD
03/04/2020,3,4,2020,38,1,Andorra,AD,AND,77006,Europe,2020-04-03,AD
02/04/2020,2,4,2020,14,2,Andorra,AD,AND,77006,Europe,2020-04-02,AD
01/04/2020,1,4,2020,6,4,Andorra,AD,AND,77006,Europe,2020-04-01,AD
31/03/2020,31,3,2020,36,2,Andorra,AD,AND,77006,Europe,2020-03-31,AD
30/03/2020,30,3,2020,26,2,Andorra,AD,AND,77006,Europe,2020-03-30,AD
29/03/2020,29,3,2020,41,1,Andorra,AD,AND,77006,Europe,2020-03-29,AD
28/03/2020,28,3,2020,43,0,Andorra,AD,AND,77006,Europe,2020-03-28,AD
27/03/2020,27,3,2020,36,3,Andorra,AD,AND,77006,Europe,2020-03-27,AD
26/03/2020,26,3,2020,24,0,Andorra,AD,AND,77006,Europe,2020-03-26,AD
25/03/2020,25,3,2020,31,0,Andorra,AD,AND,77006,Europe,2020-03-25,AD
24/03/2020,24,3,2020,20,0,Andorra,AD,AND,77006,Europe,2020-03-24,AD
23/03/2020,23,3,2020,25,0,Andorra,AD,AND,77006,Europe,2020-03-23,AD
22/03/2020,22,3,2020,13,0,Andorra,AD,AND,77006,Europe,2020-03-22,AD
21/03/2020,21,3,2020,0,0,Andorra,AD,AND,77006,Europe,2020-03-21,AD
20/03/2020,20,3,2020,22,0,Andorra,AD,AND,77006,Europe,2020-03-20,AD
19/03/2020,19,3,2020,39,0,Andorra,AD,AND,77006,Europe,2020-03-19,AD
18/03/2020,18,3,2020,0,0,Andorra,AD,AND,77006,Europe,2020-03-18,AD
17/03/2020,17,3,2020,9,0,Andorra,AD,AND,77006,Europe,2020-03-17,AD
16/03/2020,16,3,2020,3,0,Andorra,AD,AND,77006,Europe,2020-03-16,AD
14/03/2020,14,3,2020,1,0,Andorra,AD,AND,77006,Europe,2020-03-14,AD
03/03/2020,3,3,2020,1,0,Andorra,AD,AND,77006,Europe,2020-03-03,AD
17/05/2020,17,5,2020,0,0,Angola,AO,AGO,30809762,Africa,2020-05-17,AO
16/05/2020,16,5,2020,0,0,Angola,AO,AGO,30809762,Africa,2020-05-16,AO
15/05/2020,15,5,2020,3,0,Angola,AO,AGO,30809762,Africa,2020-05-15,AO
14/05/2020,14,5,2020,0,0,Angola,AO,AGO,30809762,Africa,2020-05-14,AO
13/05/2020,13,5,2020,0,0,Angola,AO,AGO,30809762,Africa,2020-05-13,AO
12/05/2020,12,5,2020,0,0,Angola,AO,AGO,30809762,Africa,2020-05-12,AO
11/05/2020,11,5,2020,2,0,Angola,AO,AGO,30809762,Africa,2020-05-11,AO
10/05/2020,10,5,2020,0,0,Angola,AO,AGO,30809762,Africa,2020-05-10,AO
09/05/2020,9,5,2020,7,0,Angola,AO,AGO,30809762,Africa,2020-05-09,AO
08/05/2020,8,5,2020,0,0,Angola,AO,AGO,30809762,Africa,2020-05-08,AO
07/05/2020,7,5,2020,0,0,Angola,AO,AGO,30809762,Africa,2020-05-07,AO
06/05/2020,6,5,2020,1,0,Angola,AO,AGO,30809762,Africa,2020-05-06,AO
05/05/2020,5,5,2020,0,0,Angola,AO,AGO,30809762,Africa,2020-05-05,AO
04/05/2020,4,5,2020,0,0,Angola,AO,AGO,30809762,Africa,2020-05-04,AO
03/05/2020,3,5,2020,6,0,Angola,AO,AGO,30809762,Africa,2020-05-03,AO
02/05/2020,2,5,2020,2,0,Angola,AO,AGO,30809762,Africa,2020-05-02,AO
01/05/2020,1,5,2020,0,0,Angola,AO,AGO,30809762,Africa,2020-05-01,AO
30/04/2020,30,4,2020,0,0,Angola,AO,AGO,30809762,Africa,2020-04-30,AO
29/04/2020,29,4,2020,0,0,Angola,AO,AGO,30809762,Africa,2020-04-29,AO
28/04/2020,28,4,2020,1,0,Angola,AO,AGO,30809762,Africa,2020-04-28,AO
27/04/2020,27,4,2020,1,0,Angola,AO,AGO,30809762,Africa,2020-04-27,AO
26/04/2020,26,4,2020,0,0,Angola,AO,AGO,30809762,Africa,2020-04-26,AO
25/04/2020,25,4,2020,0,0,Angola,AO,AGO,30809762,Africa,2020-04-25,AO
24/04/2020,24,4,2020,1,0,Angola,AO,AGO,30809762,Africa,2020-04-24,AO
23/04/2020,23,4,2020,0,0,Angola,AO,AGO,30809762,Africa,2020-04-23,AO
22/04/2020,22,4,2020,0,0,Angola,AO,AGO,30809762,Africa,2020-04-22,AO
21/04/2020,21,4,2020,0,0,Angola,AO,AGO,30809762,Africa,2020-04-21,AO
20/04/2020,20,4,2020,0,0,Angola,AO,AGO,30809762,Africa,2020-04-20,AO
19/04/2020,19,4,2020,5,0,Angola,AO,AGO,30809762,Africa,2020-04-19,AO
18/04/2020,18,4,2020,0,0,Angola,AO,AGO,30809762,Africa,2020-04-18,AO
17/04/2020,17,4,2020,0,0,Angola,AO,AGO,30809762,Africa,2020-04-17,AO
16/04/2020,16,4,2020,0,0,Angola,AO,AGO,30809762,Africa,2020-04-16,AO
15/04/2020,15,4,2020,0,0,Angola,AO,AGO,30809762,Africa,2020-04-15,AO
14/04/2020,14,4,2020,0,0,Angola,AO,AGO,30809762,Africa,2020-04-14,AO
13/04/2020,13,4,2020,0,0,Angola,AO,AGO,30809762,Africa,2020-04-13,AO
12/04/2020,12,4,2020,0,0,Angola,AO,AGO,30809762,Africa,2020-04-12,AO
11/04/2020,11,4,2020,0,0,Angola,AO,AGO,30809762,Africa,2020-04-11,AO
10/04/2020,10,4,2020,0,0,Angola,AO,AGO,30809762,Africa,2020-04-10,AO
09/04/2020,9,4,2020,2,0,Angola,AO,AGO,30809762,Africa,2020-04-09,AO
08/04/2020,8,4,2020,1,0,Angola,AO,AGO,30809762,Africa,2020-04-08,AO
07/04/2020,7,4,2020,2,0,Angola,AO,AGO,30809762,Africa,2020-04-07,AO
06/04/2020,6,4,2020,4,0,Angola,AO,AGO,30809762,Africa,2020-04-06,AO
05/04/2020,5,4,2020,2,0,Angola,AO,AGO,30809762,Africa,2020-04-05,AO
04/04/2020,4,4,2020,0,0,Angola,AO,AGO,30809762,Africa,2020-04-04,AO
03/04/2020,3,4,2020,0,0,Angola,AO,AGO,30809762,Africa,2020-04-03,AO
02/04/2020,2,4,2020,1,0,Angola,AO,AGO,30809762,Africa,2020-04-02,AO
01/04/2020,1,4,2020,0,0,Angola,AO,AGO,30809762,Africa,2020-04-01,AO
31/03/2020,31,3,2020,0,0,Angola,AO,AGO,30809762,Africa,2020-03-31,AO
30/03/2020,30,3,2020,3,2,Angola,AO,AGO,30809762,Africa,2020-03-30,AO
29/03/2020,29,3,2020,0,0,Angola,AO,AGO,30809762,Africa,2020-03-29,AO
28/03/2020,28,3,2020,1,0,Angola,AO,AGO,30809762,Africa,2020-03-28,AO
27/03/2020,27,3,2020,1,0,Angola,AO,AGO,30809762,Africa,2020-03-27,AO
26/03/2020,26,3,2020,0,0,Angola,AO,AGO,30809762,Africa,2020-03-26,AO
25/03/2020,25,3,2020,0,0,Angola,AO,AGO,30809762,Africa,2020-03-25,AO
24/03/2020,24,3,2020,0,0,Angola,AO,AGO,30809762,Africa,2020-03-24,AO
23/03/2020,23,3,2020,0,0,Angola,AO,AGO,30809762,Africa,2020-03-23,AO
22/03/2020,22,3,2020,2,0,Angola,AO,AGO,30809762,Africa,2020-03-22,AO
17/05/2020,17,5,2020,0,0,Anguilla,AI,,NA,America,2020-05-17,AI
16/05/2020,16,5,2020,0,0,Anguilla,AI,,NA,America,2020-05-16,AI
15/05/2020,15,5,2020,0,0,Anguilla,AI,,NA,America,2020-05-15,AI
14/05/2020,14,5,2020,0,0,Anguilla,AI,,NA,America,2020-05-14,AI
13/05/2020,13,5,2020,0,0,Anguilla,AI,,NA,America,2020-05-13,AI
12/05/2020,12,5,2020,0,0,Anguilla,AI,,NA,America,2020-05-12,AI
11/05/2020,11,5,2020,0,0,Anguilla,AI,,NA,America,2020-05-11,AI
10/05/2020,10,5,2020,0,0,Anguilla,AI,,NA,America,2020-05-10,AI
09/05/2020,9,5,2020,0,0,Anguilla,AI,,NA,America,2020-05-09,AI
08/05/2020,8,5,2020,0,0,Anguilla,AI,,NA,America,2020-05-08,AI
07/05/2020,7,5,2020,0,0,Anguilla,AI,,NA,America,2020-05-07,AI
06/05/2020,6,5,2020,0,0,Anguilla,AI,,NA,America,2020-05-06,AI
05/05/2020,5,5,2020,0,0,Anguilla,AI,,NA,America,2020-05-05,AI
04/05/2020,4,5,2020,0,0,Anguilla,AI,,NA,America,2020-05-04,AI
03/05/2020,3,5,2020,0,0,Anguilla,AI,,NA,America,2020-05-03,AI
02/05/2020,2,5,2020,0,0,Anguilla,AI,,NA,America,2020-05-02,AI
01/05/2020,1,5,2020,0,0,Anguilla,AI,,NA,America,2020-05-01,AI
30/04/2020,30,4,2020,0,0,Anguilla,AI,,NA,America,2020-04-30,AI
29/04/2020,29,4,2020,0,0,Anguilla,AI,,NA,America,2020-04-29,AI
28/04/2020,28,4,2020,0,0,Anguilla,AI,,NA,America,2020-04-28,AI
27/04/2020,27,4,2020,0,0,Anguilla,AI,,NA,America,2020-04-27,AI
26/04/2020,26,4,2020,0,0,Anguilla,AI,,NA,America,2020-04-26,AI
25/04/2020,25,4,2020,0,0,Anguilla,AI,,NA,America,2020-04-25,AI
24/04/2020,24,4,2020,0,0,Anguilla,AI,,NA,America,2020-04-24,AI
23/04/2020,23,4,2020,0,0,Anguilla,AI,,NA,America,2020-04-23,AI
22/04/2020,22,4,2020,0,0,Anguilla,AI,,NA,America,2020-04-22,AI
21/04/2020,21,4,2020,0,0,Anguilla,AI,,NA,America,2020-04-21,AI
20/04/2020,20,4,2020,0,0,Anguilla,AI,,NA,America,2020-04-20,AI
19/04/2020,19,4,2020,0,0,Anguilla,AI,,NA,America,2020-04-19,AI
18/04/2020,18,4,2020,0,0,Anguilla,AI,,NA,America,2020-04-18,AI
17/04/2020,17,4,2020,0,0,Anguilla,AI,,NA,America,2020-04-17,AI
16/04/2020,16,4,2020,0,0,Anguilla,AI,,NA,America,2020-04-16,AI
15/04/2020,15,4,2020,0,0,Anguilla,AI,,NA,America,2020-04-15,AI
14/04/2020,14,4,2020,0,0,Anguilla,AI,,NA,America,2020-04-14,AI
13/04/2020,13,4,2020,0,0,Anguilla,AI,,NA,America,2020-04-13,AI
12/04/2020,12,4,2020,0,0,Anguilla,AI,,NA,America,2020-04-12,AI
11/04/2020,11,4,2020,0,0,Anguilla,AI,,NA,America,2020-04-11,AI
10/04/2020,10,4,2020,0,0,Anguilla,AI,,NA,America,2020-04-10,AI
09/04/2020,9,4,2020,0,0,Anguilla,AI,,NA,America,2020-04-09,AI
08/04/2020,8,4,2020,0,0,Anguilla,AI,,NA,America,2020-04-08,AI
07/04/2020,7,4,2020,0,0,Anguilla,AI,,NA,America,2020-04-07,AI
06/04/2020,6,4,2020,0,0,Anguilla,AI,,NA,America,2020-04-06,AI
05/04/2020,5,4,2020,0,0,Anguilla,AI,,NA,America,2020-04-05,AI
04/04/2020,4,4,2020,0,0,Anguilla,AI,,NA,America,2020-04-04,AI
03/04/2020,3,4,2020,1,0,Anguilla,AI,,NA,America,2020-04-03,AI
02/04/2020,2,4,2020,0,0,Anguilla,AI,,NA,America,2020-04-02,AI
01/04/2020,1,4,2020,0,0,Anguilla,AI,,NA,America,2020-04-01,AI
31/03/2020,31,3,2020,0,0,Anguilla,AI,,NA,America,2020-03-31,AI
30/03/2020,30,3,2020,0,0,Anguilla,AI,,NA,America,2020-03-30,AI
29/03/2020,29,3,2020,0,0,Anguilla,AI,,NA,America,2020-03-29,AI
28/03/2020,28,3,2020,0,0,Anguilla,AI,,NA,America,2020-03-28,AI
27/03/2020,27,3,2020,2,0,Anguilla,AI,,NA,America,2020-03-27,AI
17/05/2020,17,5,2020,0,0,Antigua_and_Barbuda,AG,ATG,96286,America,2020-05-17,AG
16/05/2020,16,5,2020,0,0,Antigua_and_Barbuda,AG,ATG,96286,America,2020-05-16,AG
15/05/2020,15,5,2020,0,0,Antigua_and_Barbuda,AG,ATG,96286,America,2020-05-15,AG
14/05/2020,14,5,2020,0,0,Antigua_and_Barbuda,AG,ATG,96286,America,2020-05-14,AG
13/05/2020,13,5,2020,0,0,Antigua_and_Barbuda,AG,ATG,96286,America,2020-05-13,AG
12/05/2020,12,5,2020,0,0,Antigua_and_Barbuda,AG,ATG,96286,America,2020-05-12,AG
11/05/2020,11,5,2020,0,0,Antigua_and_Barbuda,AG,ATG,96286,America,2020-05-11,AG
10/05/2020,10,5,2020,0,0,Antigua_and_Barbuda,AG,ATG,96286,America,2020-05-10,AG
09/05/2020,9,5,2020,0,0,Antigua_and_Barbuda,AG,ATG,96286,America,2020-05-09,AG
08/05/2020,8,5,2020,0,0,Antigua_and_Barbuda,AG,ATG,96286,America,2020-05-08,AG
07/05/2020,7,5,2020,0,0,Antigua_and_Barbuda,AG,ATG,96286,America,2020-05-07,AG
06/05/2020,6,5,2020,0,0,Antigua_and_Barbuda,AG,ATG,96286,America,2020-05-06,AG
05/05/2020,5,5,2020,0,0,Antigua_and_Barbuda,AG,ATG,96286,America,2020-05-05,AG
04/05/2020,4,5,2020,0,0,Antigua_and_Barbuda,AG,ATG,96286,America,2020-05-04,AG
03/05/2020,3,5,2020,0,0,Antigua_and_Barbuda,AG,ATG,96286,America,2020-05-03,AG
02/05/2020,2,5,2020,1,0,Antigua_and_Barbuda,AG,ATG,96286,America,2020-05-02,AG
01/05/2020,1,5,2020,0,0,Antigua_and_Barbuda,AG,ATG,96286,America,2020-05-01,AG
30/04/2020,30,4,2020,0,0,Antigua_and_Barbuda,AG,ATG,96286,America,2020-04-30,AG
29/04/2020,29,4,2020,0,0,Antigua_and_Barbuda,AG,ATG,96286,America,2020-04-29,AG
28/04/2020,28,4,2020,0,0,Antigua_and_Barbuda,AG,ATG,96286,America,2020-04-28,AG
27/04/2020,27,4,2020,0,0,Antigua_and_Barbuda,AG,ATG,96286,America,2020-04-27,AG
26/04/2020,26,4,2020,0,0,Antigua_and_Barbuda,AG,ATG,96286,America,2020-04-26,AG
25/04/2020,25,4,2020,0,0,Antigua_and_Barbuda,AG,ATG,96286,America,2020-04-25,AG
24/04/2020,24,4,2020,0,0,Antigua_and_Barbuda,AG,ATG,96286,America,2020-04-24,AG
23/04/2020,23,4,2020,0,0,Antigua_and_Barbuda,AG,ATG,96286,America,2020-04-23,AG
22/04/2020,22,4,2020,1,0,Antigua_and_Barbuda,AG,ATG,96286,America,2020-04-22,AG
21/04/2020,21,4,2020,0,1,Antigua_and_Barbuda,AG,ATG,96286,America,2020-04-21,AG
20/04/2020,20,4,2020,0,0,Antigua_and_Barbuda,AG,ATG,96286,America,2020-04-20,AG
19/04/2020,19,4,2020,0,0,Antigua_and_Barbuda,AG,ATG,96286,America,2020-04-19,AG
18/04/2020,18,4,2020,0,0,Antigua_and_Barbuda,AG,ATG,96286,America,2020-04-18,AG
17/04/2020,17,4,2020,0,0,Antigua_and_Barbuda,AG,ATG,96286,America,2020-04-17,AG
16/04/2020,16,4,2020,0,0,Antigua_and_Barbuda,AG,ATG,96286,America,2020-04-16,AG
15/04/2020,15,4,2020,0,0,Antigua_and_Barbuda,AG,ATG,96286,America,2020-04-15,AG
14/04/2020,14,4,2020,2,0,Antigua_and_Barbuda,AG,ATG,96286,America,2020-04-14,AG
13/04/2020,13,4,2020,0,0,Antigua_and_Barbuda,AG,ATG,96286,America,2020-04-13,AG
12/04/2020,12,4,2020,0,0,Antigua_and_Barbuda,AG,ATG,96286,America,2020-04-12,AG
11/04/2020,11,4,2020,2,0,Antigua_and_Barbuda,AG,ATG,96286,America,2020-04-11,AG
10/04/2020,10,4,2020,4,2,Antigua_and_Barbuda,AG,ATG,96286,America,2020-04-10,AG
09/04/2020,9,4,2020,0,0,Antigua_and_Barbuda,AG,ATG,96286,America,2020-04-09,AG
08/04/2020,8,4,2020,0,0,Antigua_and_Barbuda,AG,ATG,96286,America,2020-04-08,AG
07/04/2020,7,4,2020,0,0,Antigua_and_Barbuda,AG,ATG,96286,America,2020-04-07,AG
06/04/2020,6,4,2020,0,0,Antigua_and_Barbuda,AG,ATG,96286,America,2020-04-06,AG
05/04/2020,5,4,2020,0,0,Antigua_and_Barbuda,AG,ATG,96286,America,2020-04-05,AG
04/04/2020,4,4,2020,6,0,Antigua_and_Barbuda,AG,ATG,96286,America,2020-04-04,AG
03/04/2020,3,4,2020,2,0,Antigua_and_Barbuda,AG,ATG,96286,America,2020-04-03,AG
02/04/2020,2,4,2020,0,0,Antigua_and_Barbuda,AG,ATG,96286,America,2020-04-02,AG
01/04/2020,1,4,2020,0,0,Antigua_and_Barbuda,AG,ATG,96286,America,2020-04-01,AG
31/03/2020,31,3,2020,0,0,Antigua_and_Barbuda,AG,ATG,96286,America,2020-03-31,AG
30/03/2020,30,3,2020,0,0,Antigua_and_Barbuda,AG,ATG,96286,America,2020-03-30,AG
29/03/2020,29,3,2020,0,0,Antigua_and_Barbuda,AG,ATG,96286,America,2020-03-29,AG
28/03/2020,28,3,2020,0,0,Antigua_and_Barbuda,AG,ATG,96286,America,2020-03-28,AG
27/03/2020,27,3,2020,4,0,Antigua_and_Barbuda,AG,ATG,96286,America,2020-03-27,AG
26/03/2020,26,3,2020,0,0,Antigua_and_Barbuda,AG,ATG,96286,America,2020-03-26,AG
25/03/2020,25,3,2020,2,0,Antigua_and_Barbuda,AG,ATG,96286,America,2020-03-25,AG
24/03/2020,24,3,2020,0,0,Antigua_and_Barbuda,AG,ATG,96286,America,2020-03-24,AG
23/03/2020,23,3,2020,0,0,Antigua_and_Barbuda,AG,ATG,96286,America,2020-03-23,AG
22/03/2020,22,3,2020,0,0,Antigua_and_Barbuda,AG,ATG,96286,America,2020-03-22,AG
21/03/2020,21,3,2020,0,0,Antigua_and_Barbuda,AG,ATG,96286,America,2020-03-21,AG
15/03/2020,15,3,2020,1,0,Antigua_and_Barbuda,AG,ATG,96286,America,2020-03-15,AG
17/05/2020,17,5,2020,326,7,Argentina,AR,ARG,44494502,America,2020-05-17,AR
16/05/2020,16,5,2020,345,3,Argentina,AR,ARG,44494502,America,2020-05-16,AR
15/05/2020,15,5,2020,255,24,Argentina,AR,ARG,44494502,America,2020-05-15,AR
14/05/2020,14,5,2020,316,10,Argentina,AR,ARG,44494502,America,2020-05-14,AR
13/05/2020,13,5,2020,529,14,Argentina,AR,ARG,44494502,America,2020-05-13,AR
12/05/2020,12,5,2020,245,5,Argentina,AR,ARG,44494502,America,2020-05-12,AR
11/05/2020,11,5,2020,13,0,Argentina,AR,ARG,44494502,America,2020-05-11,AR
10/05/2020,10,5,2020,165,7,Argentina,AR,ARG,44494502,America,2020-05-10,AR
09/05/2020,9,5,2020,240,11,Argentina,AR,ARG,44494502,America,2020-05-09,AR
08/05/2020,8,5,2020,163,9,Argentina,AR,ARG,44494502,America,2020-05-08,AR
07/05/2020,7,5,2020,188,9,Argentina,AR,ARG,44494502,America,2020-05-07,AR
06/05/2020,6,5,2020,133,4,Argentina,AR,ARG,44494502,America,2020-05-06,AR
05/05/2020,5,5,2020,104,14,Argentina,AR,ARG,44494502,America,2020-05-05,AR
04/05/2020,4,5,2020,102,9,Argentina,AR,ARG,44494502,America,2020-05-04,AR
03/05/2020,3,5,2020,149,12,Argentina,AR,ARG,44494502,America,2020-05-03,AR
02/05/2020,2,5,2020,104,7,Argentina,AR,ARG,44494502,America,2020-05-02,AR
01/05/2020,1,5,2020,143,4,Argentina,AR,ARG,44494502,America,2020-05-01,AR
30/04/2020,30,4,2020,158,7,Argentina,AR,ARG,44494502,America,2020-04-30,AR
29/04/2020,29,4,2020,124,10,Argentina,AR,ARG,44494502,America,2020-04-29,AR
28/04/2020,28,4,2020,223,11,Argentina,AR,ARG,44494502,America,2020-04-28,AR
27/04/2020,27,4,2020,0,1,Argentina,AR,ARG,44494502,America,2020-04-27,AR
26/04/2020,26,4,2020,344,18,Argentina,AR,ARG,44494502,America,2020-04-26,AR
25/04/2020,25,4,2020,0,2,Argentina,AR,ARG,44494502,America,2020-04-25,AR
24/04/2020,24,4,2020,147,6,Argentina,AR,ARG,44494502,America,2020-04-24,AR
23/04/2020,23,4,2020,144,8,Argentina,AR,ARG,44494502,America,2020-04-23,AR
22/04/2020,22,4,2020,112,9,Argentina,AR,ARG,44494502,America,2020-04-22,AR
21/04/2020,21,4,2020,90,8,Argentina,AR,ARG,44494502,America,2020-04-21,AR
20/04/2020,20,4,2020,102,2,Argentina,AR,ARG,44494502,America,2020-04-20,AR
19/04/2020,19,4,2020,170,10,Argentina,AR,ARG,44494502,America,2020-04-19,AR
18/04/2020,18,4,2020,98,7,Argentina,AR,ARG,44494502,America,2020-04-18,AR
17/04/2020,17,4,2020,128,6,Argentina,AR,ARG,44494502,America,2020-04-17,AR
16/04/2020,16,4,2020,0,4,Argentina,AR,ARG,44494502,America,2020-04-16,AR
15/04/2020,15,4,2020,160,7,Argentina,AR,ARG,44494502,America,2020-04-15,AR
14/04/2020,14,4,2020,69,3,Argentina,AR,ARG,44494502,America,2020-04-14,AR
13/04/2020,13,4,2020,66,6,Argentina,AR,ARG,44494502,America,2020-04-13,AR
12/04/2020,12,4,2020,162,7,Argentina,AR,ARG,44494502,America,2020-04-12,AR
11/04/2020,11,4,2020,81,3,Argentina,AR,ARG,44494502,America,2020-04-11,AR
10/04/2020,10,4,2020,99,14,Argentina,AR,ARG,44494502,America,2020-04-10,AR
09/04/2020,9,4,2020,80,5,Argentina,AR,ARG,44494502,America,2020-04-09,AR
08/04/2020,8,4,2020,87,7,Argentina,AR,ARG,44494502,America,2020-04-08,AR
07/04/2020,7,4,2020,74,7,Argentina,AR,ARG,44494502,America,2020-04-07,AR
06/04/2020,6,4,2020,103,3,Argentina,AR,ARG,44494502,America,2020-04-06,AR
05/04/2020,5,4,2020,186,6,Argentina,AR,ARG,44494502,America,2020-04-05,AR
04/04/2020,4,4,2020,132,3,Argentina,AR,ARG,44494502,America,2020-04-04,AR
03/04/2020,3,4,2020,0,3,Argentina,AR,ARG,44494502,America,2020-04-03,AR
02/04/2020,2,4,2020,167,7,Argentina,AR,ARG,44494502,America,2020-04-02,AR
01/04/2020,1,4,2020,0,0,Argentina,AR,ARG,44494502,America,2020-04-01,AR
31/03/2020,31,3,2020,146,4,Argentina,AR,ARG,44494502,America,2020-03-31,AR
30/03/2020,30,3,2020,75,1,Argentina,AR,ARG,44494502,America,2020-03-30,AR
29/03/2020,29,3,2020,55,2,Argentina,AR,ARG,44494502,America,2020-03-29,AR
28/03/2020,28,3,2020,101,5,Argentina,AR,ARG,44494502,America,2020-03-28,AR
27/03/2020,27,3,2020,87,4,Argentina,AR,ARG,44494502,America,2020-03-27,AR
26/03/2020,26,3,2020,115,2,Argentina,AR,ARG,44494502,America,2020-03-26,AR
25/03/2020,25,3,2020,86,2,Argentina,AR,ARG,44494502,America,2020-03-25,AR
24/03/2020,24,3,2020,35,0,Argentina,AR,ARG,44494502,America,2020-03-24,AR
23/03/2020,23,3,2020,41,0,Argentina,AR,ARG,44494502,America,2020-03-23,AR
22/03/2020,22,3,2020,67,1,Argentina,AR,ARG,44494502,America,2020-03-22,AR
21/03/2020,21,3,2020,30,0,Argentina,AR,ARG,44494502,America,2020-03-21,AR
20/03/2020,20,3,2020,31,1,Argentina,AR,ARG,44494502,America,2020-03-20,AR
19/03/2020,19,3,2020,18,0,Argentina,AR,ARG,44494502,America,2020-03-19,AR
18/03/2020,18,3,2020,14,0,Argentina,AR,ARG,44494502,America,2020-03-18,AR
17/03/2020,17,3,2020,9,0,Argentina,AR,ARG,44494502,America,2020-03-17,AR
16/03/2020,16,3,2020,11,0,Argentina,AR,ARG,44494502,America,2020-03-16,AR
15/03/2020,15,3,2020,11,0,Argentina,AR,ARG,44494502,America,2020-03-15,AR
14/03/2020,14,3,2020,3,1,Argentina,AR,ARG,44494502,America,2020-03-14,AR
13/03/2020,13,3,2020,12,0,Argentina,AR,ARG,44494502,America,2020-03-13,AR
11/03/2020,11,3,2020,7,0,Argentina,AR,ARG,44494502,America,2020-03-11,AR
09/03/2020,9,3,2020,3,0,Argentina,AR,ARG,44494502,America,2020-03-09,AR
08/03/2020,8,3,2020,1,1,Argentina,AR,ARG,44494502,America,2020-03-08,AR
07/03/2020,7,3,2020,6,0,Argentina,AR,ARG,44494502,America,2020-03-07,AR
06/03/2020,6,3,2020,1,0,Argentina,AR,ARG,44494502,America,2020-03-06,AR
04/03/2020,4,3,2020,1,0,Argentina,AR,ARG,44494502,America,2020-03-04,AR
17/05/2020,17,5,2020,239,3,Armenia,AM,ARM,2951776,Europe,2020-05-17,AM
16/05/2020,16,5,2020,184,3,Armenia,AM,ARM,2951776,Europe,2020-05-16,AM
15/05/2020,15,5,2020,142,1,Armenia,AM,ARM,2951776,Europe,2020-05-15,AM
14/05/2020,14,5,2020,180,1,Armenia,AM,ARM,2951776,Europe,2020-05-14,AM
13/05/2020,13,5,2020,146,1,Armenia,AM,ARM,2951776,Europe,2020-05-13,AM
12/05/2020,12,5,2020,79,1,Armenia,AM,ARM,2951776,Europe,2020-05-12,AM
11/05/2020,11,5,2020,138,1,Armenia,AM,ARM,2951776,Europe,2020-05-11,AM
10/05/2020,10,5,2020,146,1,Armenia,AM,ARM,2951776,Europe,2020-05-10,AM
09/05/2020,9,5,2020,145,1,Armenia,AM,ARM,2951776,Europe,2020-05-09,AM
08/05/2020,8,5,2020,102,2,Armenia,AM,ARM,2951776,Europe,2020-05-08,AM
07/05/2020,7,5,2020,163,0,Armenia,AM,ARM,2951776,Europe,2020-05-07,AM
06/05/2020,6,5,2020,112,1,Armenia,AM,ARM,2951776,Europe,2020-05-06,AM
05/05/2020,5,5,2020,121,4,Armenia,AM,ARM,2951776,Europe,2020-05-05,AM
04/05/2020,4,5,2020,113,2,Armenia,AM,ARM,2951776,Europe,2020-05-04,AM
03/05/2020,3,5,2020,125,0,Armenia,AM,ARM,2951776,Europe,2020-05-03,AM
02/05/2020,2,5,2020,82,1,Armenia,AM,ARM,2951776,Europe,2020-05-02,AM
01/05/2020,1,5,2020,134,2,Armenia,AM,ARM,2951776,Europe,2020-05-01,AM
30/04/2020,30,4,2020,0,0,Armenia,AM,ARM,2951776,Europe,2020-04-30,AM
29/04/2020,29,4,2020,65,0,Armenia,AM,ARM,2951776,Europe,2020-04-29,AM
28/04/2020,28,4,2020,59,1,Armenia,AM,ARM,2951776,Europe,2020-04-28,AM
27/04/2020,27,4,2020,62,1,Armenia,AM,ARM,2951776,Europe,2020-04-27,AM
26/04/2020,26,4,2020,69,0,Armenia,AM,ARM,2951776,Europe,2020-04-26,AM
25/04/2020,25,4,2020,81,1,Armenia,AM,ARM,2951776,Europe,2020-04-25,AM
24/04/2020,24,4,2020,73,3,Armenia,AM,ARM,2951776,Europe,2020-04-24,AM
23/04/2020,23,4,2020,50,0,Armenia,AM,ARM,2951776,Europe,2020-04-23,AM
22/04/2020,22,4,2020,72,0,Armenia,AM,ARM,2951776,Europe,2020-04-22,AM
21/04/2020,21,4,2020,62,2,Armenia,AM,ARM,2951776,Europe,2020-04-21,AM
20/04/2020,20,4,2020,48,2,Armenia,AM,ARM,2951776,Europe,2020-04-20,AM
19/04/2020,19,4,2020,43,0,Armenia,AM,ARM,2951776,Europe,2020-04-19,AM
18/04/2020,18,4,2020,47,1,Armenia,AM,ARM,2951776,Europe,2020-04-18,AM
17/04/2020,17,4,2020,42,1,Armenia,AM,ARM,2951776,Europe,2020-04-17,AM
16/04/2020,16,4,2020,48,1,Armenia,AM,ARM,2951776,Europe,2020-04-16,AM
15/04/2020,15,4,2020,72,3,Armenia,AM,ARM,2951776,Europe,2020-04-15,AM
14/04/2020,14,4,2020,26,1,Armenia,AM,ARM,2951776,Europe,2020-04-14,AM
13/04/2020,13,4,2020,46,0,Armenia,AM,ARM,2951776,Europe,2020-04-13,AM
12/04/2020,12,4,2020,30,2,Armenia,AM,ARM,2951776,Europe,2020-04-12,AM
11/04/2020,11,4,2020,16,1,Armenia,AM,ARM,2951776,Europe,2020-04-11,AM
10/04/2020,10,4,2020,40,1,Armenia,AM,ARM,2951776,Europe,2020-04-10,AM
09/04/2020,9,4,2020,28,1,Armenia,AM,ARM,2951776,Europe,2020-04-09,AM
08/04/2020,8,4,2020,20,0,Armenia,AM,ARM,2951776,Europe,2020-04-08,AM
07/04/2020,7,4,2020,11,1,Armenia,AM,ARM,2951776,Europe,2020-04-07,AM
06/04/2020,6,4,2020,52,0,Armenia,AM,ARM,2951776,Europe,2020-04-06,AM
05/04/2020,5,4,2020,34,0,Armenia,AM,ARM,2951776,Europe,2020-04-05,AM
04/04/2020,4,4,2020,73,3,Armenia,AM,ARM,2951776,Europe,2020-04-04,AM
03/04/2020,3,4,2020,92,1,Armenia,AM,ARM,2951776,Europe,2020-04-03,AM
02/04/2020,2,4,2020,39,0,Armenia,AM,ARM,2951776,Europe,2020-04-02,AM
01/04/2020,1,4,2020,50,0,Armenia,AM,ARM,2951776,Europe,2020-04-01,AM
31/03/2020,31,3,2020,58,0,Armenia,AM,ARM,2951776,Europe,2020-03-31,AM
30/03/2020,30,3,2020,0,0,Armenia,AM,ARM,2951776,Europe,2020-03-30,AM
29/03/2020,29,3,2020,52,2,Armenia,AM,ARM,2951776,Europe,2020-03-29,AM
28/03/2020,28,3,2020,43,0,Armenia,AM,ARM,2951776,Europe,2020-03-28,AM
27/03/2020,27,3,2020,39,1,Armenia,AM,ARM,2951776,Europe,2020-03-27,AM
26/03/2020,26,3,2020,25,0,Armenia,AM,ARM,2951776,Europe,2020-03-26,AM
25/03/2020,25,3,2020,71,0,Armenia,AM,ARM,2951776,Europe,2020-03-25,AM
24/03/2020,24,3,2020,4,0,Armenia,AM,ARM,2951776,Europe,2020-03-24,AM
23/03/2020,23,3,2020,30,0,Armenia,AM,ARM,2951776,Europe,2020-03-23,AM
22/03/2020,22,3,2020,24,0,Armenia,AM,ARM,2951776,Europe,2020-03-22,AM
21/03/2020,21,3,2020,14,0,Armenia,AM,ARM,2951776,Europe,2020-03-21,AM
20/03/2020,20,3,2020,7,0,Armenia,AM,ARM,2951776,Europe,2020-03-20,AM
19/03/2020,19,3,2020,37,0,Armenia,AM,ARM,2951776,Europe,2020-03-19,AM
18/03/2020,18,3,2020,26,0,Armenia,AM,ARM,2951776,Europe,2020-03-18,AM
17/03/2020,17,3,2020,22,0,Armenia,AM,ARM,2951776,Europe,2020-03-17,AM
16/03/2020,16,3,2020,10,0,Armenia,AM,ARM,2951776,Europe,2020-03-16,AM
15/03/2020,15,3,2020,7,0,Armenia,AM,ARM,2951776,Europe,2020-03-15,AM
14/03/2020,14,3,2020,7,0,Armenia,AM,ARM,2951776,Europe,2020-03-14,AM
13/03/2020,13,3,2020,2,0,Armenia,AM,ARM,2951776,Europe,2020-03-13,AM
12/03/2020,12,3,2020,3,0,Armenia,AM,ARM,2951776,Europe,2020-03-12,AM
02/03/2020,2,3,2020,0,0,Armenia,AM,ARM,2951776,Europe,2020-03-02,AM
01/03/2020,1,3,2020,1,0,Armenia,AM,ARM,2951776,Europe,2020-03-01,AM
29/02/2020,29,2,2020,0,0,Armenia,AM,ARM,2951776,Europe,2020-02-29,AM
28/02/2020,28,2,2020,0,0,Armenia,AM,ARM,2951776,Europe,2020-02-28,AM
27/02/2020,27,2,2020,0,0,Armenia,AM,ARM,2951776,Europe,2020-02-27,AM
26/02/2020,26,2,2020,0,0,Armenia,AM,ARM,2951776,Europe,2020-02-26,AM
25/02/2020,25,2,2020,0,0,Armenia,AM,ARM,2951776,Europe,2020-02-25,AM
24/02/2020,24,2,2020,0,0,Armenia,AM,ARM,2951776,Europe,2020-02-24,AM
23/02/2020,23,2,2020,0,0,Armenia,AM,ARM,2951776,Europe,2020-02-23,AM
22/02/2020,22,2,2020,0,0,Armenia,AM,ARM,2951776,Europe,2020-02-22,AM
21/02/2020,21,2,2020,0,0,Armenia,AM,ARM,2951776,Europe,2020-02-21,AM
20/02/2020,20,2,2020,0,0,Armenia,AM,ARM,2951776,Europe,2020-02-20,AM
19/02/2020,19,2,2020,0,0,Armenia,AM,ARM,2951776,Europe,2020-02-19,AM
18/02/2020,18,2,2020,0,0,Armenia,AM,ARM,2951776,Europe,2020-02-18,AM
17/02/2020,17,2,2020,0,0,Armenia,AM,ARM,2951776,Europe,2020-02-17,AM
16/02/2020,16,2,2020,0,0,Armenia,AM,ARM,2951776,Europe,2020-02-16,AM
15/02/2020,15,2,2020,0,0,Armenia,AM,ARM,2951776,Europe,2020-02-15,AM
14/02/2020,14,2,2020,0,0,Armenia,AM,ARM,2951776,Europe,2020-02-14,AM
13/02/2020,13,2,2020,0,0,Armenia,AM,ARM,2951776,Europe,2020-02-13,AM
12/02/2020,12,2,2020,0,0,Armenia,AM,ARM,2951776,Europe,2020-02-12,AM
11/02/2020,11,2,2020,0,0,Armenia,AM,ARM,2951776,Europe,2020-02-11,AM
10/02/2020,10,2,2020,0,0,Armenia,AM,ARM,2951776,Europe,2020-02-10,AM
09/02/2020,9,2,2020,0,0,Armenia,AM,ARM,2951776,Europe,2020-02-09,AM
08/02/2020,8,2,2020,0,0,Armenia,AM,ARM,2951776,Europe,2020-02-08,AM
07/02/2020,7,2,2020,0,0,Armenia,AM,ARM,2951776,Europe,2020-02-07,AM
06/02/2020,6,2,2020,0,0,Armenia,AM,ARM,2951776,Europe,2020-02-06,AM
05/02/2020,5,2,2020,0,0,Armenia,AM,ARM,2951776,Europe,2020-02-05,AM
04/02/2020,4,2,2020,0,0,Armenia,AM,ARM,2951776,Europe,2020-02-04,AM
03/02/2020,3,2,2020,0,0,Armenia,AM,ARM,2951776,Europe,2020-02-03,AM
02/02/2020,2,2,2020,0,0,Armenia,AM,ARM,2951776,Europe,2020-02-02,AM
01/02/2020,1,2,2020,0,0,Armenia,AM,ARM,2951776,Europe,2020-02-01,AM
31/01/2020,31,1,2020,0,0,Armenia,AM,ARM,2951776,Europe,2020-01-31,AM
30/01/2020,30,1,2020,0,0,Armenia,AM,ARM,2951776,Europe,2020-01-30,AM
29/01/2020,29,1,2020,0,0,Armenia,AM,ARM,2951776,Europe,2020-01-29,AM
28/01/2020,28,1,2020,0,0,Armenia,AM,ARM,2951776,Europe,2020-01-28,AM
27/01/2020,27,1,2020,0,0,Armenia,AM,ARM,2951776,Europe,2020-01-27,AM
26/01/2020,26,1,2020,0,0,Armenia,AM,ARM,2951776,Europe,2020-01-26,AM
25/01/2020,25,1,2020,0,0,Armenia,AM,ARM,2951776,Europe,2020-01-25,AM
24/01/2020,24,1,2020,0,0,Armenia,AM,ARM,2951776,Europe,2020-01-24,AM
23/01/2020,23,1,2020,0,0,Armenia,AM,ARM,2951776,Europe,2020-01-23,AM
22/01/2020,22,1,2020,0,0,Armenia,AM,ARM,2951776,Europe,2020-01-22,AM
21/01/2020,21,1,2020,0,0,Armenia,AM,ARM,2951776,Europe,2020-01-21,AM
20/01/2020,20,1,2020,0,0,Armenia,AM,ARM,2951776,Europe,2020-01-20,AM
19/01/2020,19,1,2020,0,0,Armenia,AM,ARM,2951776,Europe,2020-01-19,AM
18/01/2020,18,1,2020,0,0,Armenia,AM,ARM,2951776,Europe,2020-01-18,AM
17/01/2020,17,1,2020,0,0,Armenia,AM,ARM,2951776,Europe,2020-01-17,AM
16/01/2020,16,1,2020,0,0,Armenia,AM,ARM,2951776,Europe,2020-01-16,AM
15/01/2020,15,1,2020,0,0,Armenia,AM,ARM,2951776,Europe,2020-01-15,AM
14/01/2020,14,1,2020,0,0,Armenia,AM,ARM,2951776,Europe,2020-01-14,AM
13/01/2020,13,1,2020,0,0,Armenia,AM,ARM,2951776,Europe,2020-01-13,AM
12/01/2020,12,1,2020,0,0,Armenia,AM,ARM,2951776,Europe,2020-01-12,AM
11/01/2020,11,1,2020,0,0,Armenia,AM,ARM,2951776,Europe,2020-01-11,AM
10/01/2020,10,1,2020,0,0,Armenia,AM,ARM,2951776,Europe,2020-01-10,AM
09/01/2020,9,1,2020,0,0,Armenia,AM,ARM,2951776,Europe,2020-01-09,AM
08/01/2020,8,1,2020,0,0,Armenia,AM,ARM,2951776,Europe,2020-01-08,AM
07/01/2020,7,1,2020,0,0,Armenia,AM,ARM,2951776,Europe,2020-01-07,AM
06/01/2020,6,1,2020,0,0,Armenia,AM,ARM,2951776,Europe,2020-01-06,AM
05/01/2020,5,1,2020,0,0,Armenia,AM,ARM,2951776,Europe,2020-01-05,AM
04/01/2020,4,1,2020,0,0,Armenia,AM,ARM,2951776,Europe,2020-01-04,AM
03/01/2020,3,1,2020,0,0,Armenia,AM,ARM,2951776,Europe,2020-01-03,AM
02/01/2020,2,1,2020,0,0,Armenia,AM,ARM,2951776,Europe,2020-01-02,AM
01/01/2020,1,1,2020,0,0,Armenia,AM,ARM,2951776,Europe,2020-01-01,AM
31/12/2019,31,12,2019,0,0,Armenia,AM,ARM,2951776,Europe,2019-12-31,AM
17/05/2020,17,5,2020,0,0,Aruba,AW,ABW,105845,America,2020-05-17,AW
16/05/2020,16,5,2020,0,0,Aruba,AW,ABW,105845,America,2020-05-16,AW
15/05/2020,15,5,2020,0,0,Aruba,AW,ABW,105845,America,2020-05-15,AW
14/05/2020,14,5,2020,0,0,Aruba,AW,ABW,105845,America,2020-05-14,AW
13/05/2020,13,5,2020,0,0,Aruba,AW,ABW,105845,America,2020-05-13,AW
12/05/2020,12,5,2020,0,0,Aruba,AW,ABW,105845,America,2020-05-12,AW
11/05/2020,11,5,2020,0,0,Aruba,AW,ABW,105845,America,2020-05-11,AW
10/05/2020,10,5,2020,0,0,Aruba,AW,ABW,105845,America,2020-05-10,AW
09/05/2020,9,5,2020,0,0,Aruba,AW,ABW,105845,America,2020-05-09,AW
08/05/2020,8,5,2020,0,1,Aruba,AW,ABW,105845,America,2020-05-08,AW
07/05/2020,7,5,2020,1,0,Aruba,AW,ABW,105845,America,2020-05-07,AW
06/05/2020,6,5,2020,0,0,Aruba,AW,ABW,105845,America,2020-05-06,AW
05/05/2020,5,5,2020,0,0,Aruba,AW,ABW,105845,America,2020-05-05,AW
04/05/2020,4,5,2020,0,0,Aruba,AW,ABW,105845,America,2020-05-04,AW
03/05/2020,3,5,2020,0,0,Aruba,AW,ABW,105845,America,2020-05-03,AW
02/05/2020,2,5,2020,0,0,Aruba,AW,ABW,105845,America,2020-05-02,AW
01/05/2020,1,5,2020,0,0,Aruba,AW,ABW,105845,America,2020-05-01,AW
30/04/2020,30,4,2020,0,0,Aruba,AW,ABW,105845,America,2020-04-30,AW
29/04/2020,29,4,2020,0,0,Aruba,AW,ABW,105845,America,2020-04-29,AW
28/04/2020,28,4,2020,0,0,Aruba,AW,ABW,105845,America,2020-04-28,AW
27/04/2020,27,4,2020,0,0,Aruba,AW,ABW,105845,America,2020-04-27,AW
26/04/2020,26,4,2020,0,0,Aruba,AW,ABW,105845,America,2020-04-26,AW
25/04/2020,25,4,2020,0,0,Aruba,AW,ABW,105845,America,2020-04-25,AW
24/04/2020,24,4,2020,0,0,Aruba,AW,ABW,105845,America,2020-04-24,AW
23/04/2020,23,4,2020,3,0,Aruba,AW,ABW,105845,America,2020-04-23,AW
22/04/2020,22,4,2020,0,0,Aruba,AW,ABW,105845,America,2020-04-22,AW
21/04/2020,21,4,2020,0,0,Aruba,AW,ABW,105845,America,2020-04-21,AW
20/04/2020,20,4,2020,1,0,Aruba,AW,ABW,105845,America,2020-04-20,AW
19/04/2020,19,4,2020,0,0,Aruba,AW,ABW,105845,America,2020-04-19,AW
18/04/2020,18,4,2020,1,1,Aruba,AW,ABW,105845,America,2020-04-18,AW
17/04/2020,17,4,2020,2,0,Aruba,AW,ABW,105845,America,2020-04-17,AW
16/04/2020,16,4,2020,1,1,Aruba,AW,ABW,105845,America,2020-04-16,AW
15/04/2020,15,4,2020,0,0,Aruba,AW,ABW,105845,America,2020-04-15,AW
14/04/2020,14,4,2020,0,0,Aruba,AW,ABW,105845,America,2020-04-14,AW
13/04/2020,13,4,2020,0,0,Aruba,AW,ABW,105845,America,2020-04-13,AW
12/04/2020,12,4,2020,6,0,Aruba,AW,ABW,105845,America,2020-04-12,AW
11/04/2020,11,4,2020,4,0,Aruba,AW,ABW,105845,America,2020-04-11,AW
10/04/2020,10,4,2020,5,0,Aruba,AW,ABW,105845,America,2020-04-10,AW
09/04/2020,9,4,2020,3,0,Aruba,AW,ABW,105845,America,2020-04-09,AW
08/04/2020,8,4,2020,3,0,Aruba,AW,ABW,105845,America,2020-04-08,AW
07/04/2020,7,4,2020,7,0,Aruba,AW,ABW,105845,America,2020-04-07,AW
06/04/2020,6,4,2020,0,0,Aruba,AW,ABW,105845,America,2020-04-06,AW
05/04/2020,5,4,2020,2,0,Aruba,AW,ABW,105845,America,2020-04-05,AW
04/04/2020,4,4,2020,2,0,Aruba,AW,ABW,105845,America,2020-04-04,AW
03/04/2020,3,4,2020,5,0,Aruba,AW,ABW,105845,America,2020-04-03,AW
02/04/2020,2,4,2020,0,0,Aruba,AW,ABW,105845,America,2020-04-02,AW
01/04/2020,1,4,2020,5,0,Aruba,AW,ABW,105845,America,2020-04-01,AW
30/03/2020,30,3,2020,22,0,Aruba,AW,ABW,105845,America,2020-03-30,AW
29/03/2020,29,3,2020,0,0,Aruba,AW,ABW,105845,America,2020-03-29,AW
28/03/2020,28,3,2020,0,0,Aruba,AW,ABW,105845,America,2020-03-28,AW
27/03/2020,27,3,2020,9,0,Aruba,AW,ABW,105845,America,2020-03-27,AW
26/03/2020,26,3,2020,2,0,Aruba,AW,ABW,105845,America,2020-03-26,AW
25/03/2020,25,3,2020,5,0,Aruba,AW,ABW,105845,America,2020-03-25,AW
24/03/2020,24,3,2020,8,0,Aruba,AW,ABW,105845,America,2020-03-24,AW
20/03/2020,20,3,2020,2,0,Aruba,AW,ABW,105845,America,2020-03-20,AW
13/03/2020,13,3,2020,2,0,Aruba,AW,ABW,105845,America,2020-03-13,AW
17/05/2020,17,5,2020,17,0,Australia,AU,AUS,24992369,Oceania,2020-05-17,AU
16/05/2020,16,5,2020,30,0,Australia,AU,AUS,24992369,Oceania,2020-05-16,AU
15/05/2020,15,5,2020,14,0,Australia,AU,AUS,24992369,Oceania,2020-05-15,AU
14/05/2020,14,5,2020,11,1,Australia,AU,AUS,24992369,Oceania,2020-05-14,AU
13/05/2020,13,5,2020,16,0,Australia,AU,AUS,24992369,Oceania,2020-05-13,AU
12/05/2020,12,5,2020,7,0,Australia,AU,AUS,24992369,Oceania,2020-05-12,AU
11/05/2020,11,5,2020,12,0,Australia,AU,AUS,24992369,Oceania,2020-05-11,AU
10/05/2020,10,5,2020,15,0,Australia,AU,AUS,24992369,Oceania,2020-05-10,AU
09/05/2020,9,5,2020,18,0,Australia,AU,AUS,24992369,Oceania,2020-05-09,AU
08/05/2020,8,5,2020,21,0,Australia,AU,AUS,24992369,Oceania,2020-05-08,AU
07/05/2020,7,5,2020,26,1,Australia,AU,AUS,24992369,Oceania,2020-05-07,AU
06/05/2020,6,5,2020,24,1,Australia,AU,AUS,24992369,Oceania,2020-05-06,AU
05/05/2020,5,5,2020,24,0,Australia,AU,AUS,24992369,Oceania,2020-05-05,AU
04/05/2020,4,5,2020,18,2,Australia,AU,AUS,24992369,Oceania,2020-05-04,AU
03/05/2020,3,5,2020,16,0,Australia,AU,AUS,24992369,Oceania,2020-05-03,AU
02/05/2020,2,5,2020,5,1,Australia,AU,AUS,24992369,Oceania,2020-05-02,AU
01/05/2020,1,5,2020,16,2,Australia,AU,AUS,24992369,Oceania,2020-05-01,AU
30/04/2020,30,4,2020,8,2,Australia,AU,AUS,24992369,Oceania,2020-04-30,AU
29/04/2020,29,4,2020,13,4,Australia,AU,AUS,24992369,Oceania,2020-04-29,AU
28/04/2020,28,4,2020,12,1,Australia,AU,AUS,24992369,Oceania,2020-04-28,AU
27/04/2020,27,4,2020,10,2,Australia,AU,AUS,24992369,Oceania,2020-04-27,AU
26/04/2020,26,4,2020,16,2,Australia,AU,AUS,24992369,Oceania,2020-04-26,AU
25/04/2020,25,4,2020,20,4,Australia,AU,AUS,24992369,Oceania,2020-04-25,AU
24/04/2020,24,4,2020,13,1,Australia,AU,AUS,24992369,Oceania,2020-04-24,AU
23/04/2020,23,4,2020,7,0,Australia,AU,AUS,24992369,Oceania,2020-04-23,AU
22/04/2020,22,4,2020,22,3,Australia,AU,AUS,24992369,Oceania,2020-04-22,AU
21/04/2020,21,4,2020,13,1,Australia,AU,AUS,24992369,Oceania,2020-04-21,AU
20/04/2020,20,4,2020,26,1,Australia,AU,AUS,24992369,Oceania,2020-04-20,AU
19/04/2020,19,4,2020,53,2,Australia,AU,AUS,24992369,Oceania,2020-04-19,AU
18/04/2020,18,4,2020,36,4,Australia,AU,AUS,24992369,Oceania,2020-04-18,AU
17/04/2020,17,4,2020,39,0,Australia,AU,AUS,24992369,Oceania,2020-04-17,AU
16/04/2020,16,4,2020,42,2,Australia,AU,AUS,24992369,Oceania,2020-04-16,AU
15/04/2020,15,4,2020,50,0,Australia,AU,AUS,24992369,Oceania,2020-04-15,AU
14/04/2020,14,4,2020,44,0,Australia,AU,AUS,24992369,Oceania,2020-04-14,AU
13/04/2020,13,4,2020,33,4,Australia,AU,AUS,24992369,Oceania,2020-04-13,AU
12/04/2020,12,4,2020,51,3,Australia,AU,AUS,24992369,Oceania,2020-04-12,AU
11/04/2020,11,4,2020,86,2,Australia,AU,AUS,24992369,Oceania,2020-04-11,AU
10/04/2020,10,4,2020,100,2,Australia,AU,AUS,24992369,Oceania,2020-04-10,AU
09/04/2020,9,4,2020,96,5,Australia,AU,AUS,24992369,Oceania,2020-04-09,AU
08/04/2020,8,4,2020,112,3,Australia,AU,AUS,24992369,Oceania,2020-04-08,AU
07/04/2020,7,4,2020,100,6,Australia,AU,AUS,24992369,Oceania,2020-04-07,AU
06/04/2020,6,4,2020,57,2,Australia,AU,AUS,24992369,Oceania,2020-04-06,AU
05/04/2020,5,4,2020,139,4,Australia,AU,AUS,24992369,Oceania,2020-04-05,AU
04/04/2020,4,4,2020,324,7,Australia,AU,AUS,24992369,Oceania,2020-04-04,AU
03/04/2020,3,4,2020,248,2,Australia,AU,AUS,24992369,Oceania,2020-04-03,AU
02/04/2020,2,4,2020,269,1,Australia,AU,AUS,24992369,Oceania,2020-04-02,AU
01/04/2020,1,4,2020,150,1,Australia,AU,AUS,24992369,Oceania,2020-04-01,AU
31/03/2020,31,3,2020,464,3,Australia,AU,AUS,24992369,Oceania,2020-03-31,AU
30/03/2020,30,3,2020,284,2,Australia,AU,AUS,24992369,Oceania,2020-03-30,AU
29/03/2020,29,3,2020,431,1,Australia,AU,AUS,24992369,Oceania,2020-03-29,AU
28/03/2020,28,3,2020,212,0,Australia,AU,AUS,24992369,Oceania,2020-03-28,AU
27/03/2020,27,3,2020,367,2,Australia,AU,AUS,24992369,Oceania,2020-03-27,AU
26/03/2020,26,3,2020,376,3,Australia,AU,AUS,24992369,Oceania,2020-03-26,AU
25/03/2020,25,3,2020,600,1,Australia,AU,AUS,24992369,Oceania,2020-03-25,AU
24/03/2020,24,3,2020,114,0,Australia,AU,AUS,24992369,Oceania,2020-03-24,AU
23/03/2020,23,3,2020,611,0,Australia,AU,AUS,24992369,Oceania,2020-03-23,AU
22/03/2020,22,3,2020,224,0,Australia,AU,AUS,24992369,Oceania,2020-03-22,AU
21/03/2020,21,3,2020,165,1,Australia,AU,AUS,24992369,Oceania,2020-03-21,AU
20/03/2020,20,3,2020,144,0,Australia,AU,AUS,24992369,Oceania,2020-03-20,AU
19/03/2020,19,3,2020,111,1,Australia,AU,AUS,24992369,Oceania,2020-03-19,AU
18/03/2020,18,3,2020,79,0,Australia,AU,AUS,24992369,Oceania,2020-03-18,AU
17/03/2020,17,3,2020,77,0,Australia,AU,AUS,24992369,Oceania,2020-03-17,AU
16/03/2020,16,3,2020,49,2,Australia,AU,AUS,24992369,Oceania,2020-03-16,AU
15/03/2020,15,3,2020,52,0,Australia,AU,AUS,24992369,Oceania,2020-03-15,AU
14/03/2020,14,3,2020,41,0,Australia,AU,AUS,24992369,Oceania,2020-03-14,AU
13/03/2020,13,3,2020,30,0,Australia,AU,AUS,24992369,Oceania,2020-03-13,AU
12/03/2020,12,3,2020,14,0,Australia,AU,AUS,24992369,Oceania,2020-03-12,AU
11/03/2020,11,3,2020,12,0,Australia,AU,AUS,24992369,Oceania,2020-03-11,AU
10/03/2020,10,3,2020,20,0,Australia,AU,AUS,24992369,Oceania,2020-03-10,AU
09/03/2020,9,3,2020,6,0,Australia,AU,AUS,24992369,Oceania,2020-03-09,AU
08/03/2020,8,3,2020,11,1,Australia,AU,AUS,24992369,Oceania,2020-03-08,AU
07/03/2020,7,3,2020,4,0,Australia,AU,AUS,24992369,Oceania,2020-03-07,AU
06/03/2020,6,3,2020,7,0,Australia,AU,AUS,24992369,Oceania,2020-03-06,AU
05/03/2020,5,3,2020,11,1,Australia,AU,AUS,24992369,Oceania,2020-03-05,AU
04/03/2020,4,3,2020,8,0,Australia,AU,AUS,24992369,Oceania,2020-03-04,AU
03/03/2020,3,3,2020,4,0,Australia,AU,AUS,24992369,Oceania,2020-03-03,AU
02/03/2020,2,3,2020,3,0,Australia,AU,AUS,24992369,Oceania,2020-03-02,AU
01/03/2020,1,3,2020,1,1,Australia,AU,AUS,24992369,Oceania,2020-03-01,AU
29/02/2020,29,2,2020,2,0,Australia,AU,AUS,24992369,Oceania,2020-02-29,AU
28/02/2020,28,2,2020,0,0,Australia,AU,AUS,24992369,Oceania,2020-02-28,AU
27/02/2020,27,2,2020,1,0,Australia,AU,AUS,24992369,Oceania,2020-02-27,AU
26/02/2020,26,2,2020,0,0,Australia,AU,AUS,24992369,Oceania,2020-02-26,AU
25/02/2020,25,2,2020,0,0,Australia,AU,AUS,24992369,Oceania,2020-02-25,AU
24/02/2020,24,2,2020,0,0,Australia,AU,AUS,24992369,Oceania,2020-02-24,AU
23/02/2020,23,2,2020,1,0,Australia,AU,AUS,24992369,Oceania,2020-02-23,AU
22/02/2020,22,2,2020,4,0,Australia,AU,AUS,24992369,Oceania,2020-02-22,AU
21/02/2020,21,2,2020,2,0,Australia,AU,AUS,24992369,Oceania,2020-02-21,AU
20/02/2020,20,2,2020,0,0,Australia,AU,AUS,24992369,Oceania,2020-02-20,AU
19/02/2020,19,2,2020,0,0,Australia,AU,AUS,24992369,Oceania,2020-02-19,AU
18/02/2020,18,2,2020,0,0,Australia,AU,AUS,24992369,Oceania,2020-02-18,AU
17/02/2020,17,2,2020,0,0,Australia,AU,AUS,24992369,Oceania,2020-02-17,AU
16/02/2020,16,2,2020,0,0,Australia,AU,AUS,24992369,Oceania,2020-02-16,AU
15/02/2020,15,2,2020,0,0,Australia,AU,AUS,24992369,Oceania,2020-02-15,AU
14/02/2020,14,2,2020,1,0,Australia,AU,AUS,24992369,Oceania,2020-02-14,AU
13/02/2020,13,2,2020,0,0,Australia,AU,AUS,24992369,Oceania,2020-02-13,AU
12/02/2020,12,2,2020,0,0,Australia,AU,AUS,24992369,Oceania,2020-02-12,AU
11/02/2020,11,2,2020,0,0,Australia,AU,AUS,24992369,Oceania,2020-02-11,AU
10/02/2020,10,2,2020,0,0,Australia,AU,AUS,24992369,Oceania,2020-02-10,AU
09/02/2020,9,2,2020,0,0,Australia,AU,AUS,24992369,Oceania,2020-02-09,AU
08/02/2020,8,2,2020,0,0,Australia,AU,AUS,24992369,Oceania,2020-02-08,AU
07/02/2020,7,2,2020,1,0,Australia,AU,AUS,24992369,Oceania,2020-02-07,AU
06/02/2020,6,2,2020,1,0,Australia,AU,AUS,24992369,Oceania,2020-02-06,AU
05/02/2020,5,2,2020,1,0,Australia,AU,AUS,24992369,Oceania,2020-02-05,AU
04/02/2020,4,2,2020,0,0,Australia,AU,AUS,24992369,Oceania,2020-02-04,AU
03/02/2020,3,2,2020,0,0,Australia,AU,AUS,24992369,Oceania,2020-02-03,AU
02/02/2020,2,2,2020,2,0,Australia,AU,AUS,24992369,Oceania,2020-02-02,AU
01/02/2020,1,2,2020,2,0,Australia,AU,AUS,24992369,Oceania,2020-02-01,AU
31/01/2020,31,1,2020,1,0,Australia,AU,AUS,24992369,Oceania,2020-01-31,AU
30/01/2020,30,1,2020,2,0,Australia,AU,AUS,24992369,Oceania,2020-01-30,AU
29/01/2020,29,1,2020,0,0,Australia,AU,AUS,24992369,Oceania,2020-01-29,AU
28/01/2020,28,1,2020,0,0,Australia,AU,AUS,24992369,Oceania,2020-01-28,AU
27/01/2020,27,1,2020,0,0,Australia,AU,AUS,24992369,Oceania,2020-01-27,AU
26/01/2020,26,1,2020,3,0,Australia,AU,AUS,24992369,Oceania,2020-01-26,AU
25/01/2020,25,1,2020,1,0,Australia,AU,AUS,24992369,Oceania,2020-01-25,AU
24/01/2020,24,1,2020,0,0,Australia,AU,AUS,24992369,Oceania,2020-01-24,AU
23/01/2020,23,1,2020,0,0,Australia,AU,AUS,24992369,Oceania,2020-01-23,AU
22/01/2020,22,1,2020,0,0,Australia,AU,AUS,24992369,Oceania,2020-01-22,AU
21/01/2020,21,1,2020,0,0,Australia,AU,AUS,24992369,Oceania,2020-01-21,AU
20/01/2020,20,1,2020,0,0,Australia,AU,AUS,24992369,Oceania,2020-01-20,AU
19/01/2020,19,1,2020,0,0,Australia,AU,AUS,24992369,Oceania,2020-01-19,AU
18/01/2020,18,1,2020,0,0,Australia,AU,AUS,24992369,Oceania,2020-01-18,AU
17/01/2020,17,1,2020,0,0,Australia,AU,AUS,24992369,Oceania,2020-01-17,AU
16/01/2020,16,1,2020,0,0,Australia,AU,AUS,24992369,Oceania,2020-01-16,AU
15/01/2020,15,1,2020,0,0,Australia,AU,AUS,24992369,Oceania,2020-01-15,AU
14/01/2020,14,1,2020,0,0,Australia,AU,AUS,24992369,Oceania,2020-01-14,AU
13/01/2020,13,1,2020,0,0,Australia,AU,AUS,24992369,Oceania,2020-01-13,AU
12/01/2020,12,1,2020,0,0,Australia,AU,AUS,24992369,Oceania,2020-01-12,AU
11/01/2020,11,1,2020,0,0,Australia,AU,AUS,24992369,Oceania,2020-01-11,AU
10/01/2020,10,1,2020,0,0,Australia,AU,AUS,24992369,Oceania,2020-01-10,AU
09/01/2020,9,1,2020,0,0,Australia,AU,AUS,24992369,Oceania,2020-01-09,AU
08/01/2020,8,1,2020,0,0,Australia,AU,AUS,24992369,Oceania,2020-01-08,AU
07/01/2020,7,1,2020,0,0,Australia,AU,AUS,24992369,Oceania,2020-01-07,AU
06/01/2020,6,1,2020,0,0,Australia,AU,AUS,24992369,Oceania,2020-01-06,AU
05/01/2020,5,1,2020,0,0,Australia,AU,AUS,24992369,Oceania,2020-01-05,AU
04/01/2020,4,1,2020,0,0,Australia,AU,AUS,24992369,Oceania,2020-01-04,AU
03/01/2020,3,1,2020,0,0,Australia,AU,AUS,24992369,Oceania,2020-01-03,AU
02/01/2020,2,1,2020,0,0,Australia,AU,AUS,24992369,Oceania,2020-01-02,AU
01/01/2020,1,1,2020,0,0,Australia,AU,AUS,24992369,Oceania,2020-01-01,AU
31/12/2019,31,12,2019,0,0,Australia,AU,AUS,24992369,Oceania,2019-12-31,AU
17/05/2020,17,5,2020,72,0,Austria,AT,AUT,8847037,Europe,2020-05-17,AT
16/05/2020,16,5,2020,63,2,Austria,AT,AUT,8847037,Europe,2020-05-16,AT
15/05/2020,15,5,2020,41,2,Austria,AT,AUT,8847037,Europe,2020-05-15,AT
14/05/2020,14,5,2020,54,1,Austria,AT,AUT,8847037,Europe,2020-05-14,AT
13/05/2020,13,5,2020,36,3,Austria,AT,AUT,8847037,Europe,2020-05-13,AT
12/05/2020,12,5,2020,87,2,Austria,AT,AUT,8847037,Europe,2020-05-12,AT
11/05/2020,11,5,2020,10,3,Austria,AT,AUT,8847037,Europe,2020-05-11,AT
10/05/2020,10,5,2020,42,1,Austria,AT,AUT,8847037,Europe,2020-05-10,AT
09/05/2020,9,5,2020,62,5,Austria,AT,AUT,8847037,Europe,2020-05-09,AT
08/05/2020,8,5,2020,22,1,Austria,AT,AUT,8847037,Europe,2020-05-08,AT
07/05/2020,7,5,2020,65,2,Austria,AT,AUT,8847037,Europe,2020-05-07,AT
06/05/2020,6,5,2020,17,6,Austria,AT,AUT,8847037,Europe,2020-05-06,AT
05/05/2020,5,5,2020,31,2,Austria,AT,AUT,8847037,Europe,2020-05-05,AT
04/05/2020,4,5,2020,68,2,Austria,AT,AUT,8847037,Europe,2020-05-04,AT
03/05/2020,3,5,2020,12,7,Austria,AT,AUT,8847037,Europe,2020-05-03,AT
02/05/2020,2,5,2020,34,5,Austria,AT,AUT,8847037,Europe,2020-05-02,AT
01/05/2020,1,5,2020,60,4,Austria,AT,AUT,8847037,Europe,2020-05-01,AT
30/04/2020,30,4,2020,50,11,Austria,AT,AUT,8847037,Europe,2020-04-30,AT
29/04/2020,29,4,2020,58,20,Austria,AT,AUT,8847037,Europe,2020-04-29,AT
28/04/2020,28,4,2020,67,7,Austria,AT,AUT,8847037,Europe,2020-04-28,AT
27/04/2020,27,4,2020,55,6,Austria,AT,AUT,8847037,Europe,2020-04-27,AT
26/04/2020,26,4,2020,66,23,Austria,AT,AUT,8847037,Europe,2020-04-26,AT
25/04/2020,25,4,2020,83,5,Austria,AT,AUT,8847037,Europe,2020-04-25,AT
24/04/2020,24,4,2020,61,14,Austria,AT,AUT,8847037,Europe,2020-04-24,AT
23/04/2020,23,4,2020,91,31,Austria,AT,AUT,8847037,Europe,2020-04-23,AT
22/04/2020,22,4,2020,50,1,Austria,AT,AUT,8847037,Europe,2020-04-22,AT
21/04/2020,21,4,2020,73,10,Austria,AT,AUT,8847037,Europe,2020-04-21,AT
20/04/2020,20,4,2020,48,9,Austria,AT,AUT,8847037,Europe,2020-04-20,AT
19/04/2020,19,4,2020,59,12,Austria,AT,AUT,8847037,Europe,2020-04-19,AT
18/04/2020,18,4,2020,155,21,Austria,AT,AUT,8847037,Europe,2020-04-18,AT
17/04/2020,17,4,2020,78,17,Austria,AT,AUT,8847037,Europe,2020-04-17,AT
16/04/2020,16,4,2020,136,9,Austria,AT,AUT,8847037,Europe,2020-04-16,AT
15/04/2020,15,4,2020,191,16,Austria,AT,AUT,8847037,Europe,2020-04-15,AT
14/04/2020,14,4,2020,106,18,Austria,AT,AUT,8847037,Europe,2020-04-14,AT
13/04/2020,13,4,2020,130,13,Austria,AT,AUT,8847037,Europe,2020-04-13,AT
12/04/2020,12,4,2020,247,18,Austria,AT,AUT,8847037,Europe,2020-04-12,AT
11/04/2020,11,4,2020,312,24,Austria,AT,AUT,8847037,Europe,2020-04-11,AT
10/04/2020,10,4,2020,279,22,Austria,AT,AUT,8847037,Europe,2020-04-10,AT
09/04/2020,9,4,2020,329,30,Austria,AT,AUT,8847037,Europe,2020-04-09,AT
08/04/2020,8,4,2020,343,23,Austria,AT,AUT,8847037,Europe,2020-04-08,AT
07/04/2020,7,4,2020,314,16,Austria,AT,AUT,8847037,Europe,2020-04-07,AT
06/04/2020,6,4,2020,217,18,Austria,AT,AUT,8847037,Europe,2020-04-06,AT
05/04/2020,5,4,2020,241,18,Austria,AT,AUT,8847037,Europe,2020-04-05,AT
04/04/2020,4,4,2020,396,10,Austria,AT,AUT,8847037,Europe,2020-04-04,AT
03/04/2020,3,4,2020,418,12,Austria,AT,AUT,8847037,Europe,2020-04-03,AT
02/04/2020,2,4,2020,529,18,Austria,AT,AUT,8847037,Europe,2020-04-02,AT
01/04/2020,1,4,2020,564,20,Austria,AT,AUT,8847037,Europe,2020-04-01,AT
31/03/2020,31,3,2020,805,22,Austria,AT,AUT,8847037,Europe,2020-03-31,AT
30/03/2020,30,3,2020,522,18,Austria,AT,AUT,8847037,Europe,2020-03-30,AT
29/03/2020,29,3,2020,594,0,Austria,AT,AUT,8847037,Europe,2020-03-29,AT
28/03/2020,28,3,2020,668,16,Austria,AT,AUT,8847037,Europe,2020-03-28,AT
27/03/2020,27,3,2020,1141,18,Austria,AT,AUT,8847037,Europe,2020-03-27,AT
26/03/2020,26,3,2020,606,4,Austria,AT,AUT,8847037,Europe,2020-03-26,AT
25/03/2020,25,3,2020,796,5,Austria,AT,AUT,8847037,Europe,2020-03-25,AT
24/03/2020,24,3,2020,855,9,Austria,AT,AUT,8847037,Europe,2020-03-24,AT
23/03/2020,23,3,2020,607,8,Austria,AT,AUT,8847037,Europe,2020-03-23,AT
22/03/2020,22,3,2020,375,2,Austria,AT,AUT,8847037,Europe,2020-03-22,AT
21/03/2020,21,3,2020,453,0,Austria,AT,AUT,8847037,Europe,2020-03-21,AT
20/03/2020,20,3,2020,550,2,Austria,AT,AUT,8847037,Europe,2020-03-20,AT
19/03/2020,19,3,2020,314,1,Austria,AT,AUT,8847037,Europe,2020-03-19,AT
18/03/2020,18,3,2020,316,0,Austria,AT,AUT,8847037,Europe,2020-03-18,AT
17/03/2020,17,3,2020,156,2,Austria,AT,AUT,8847037,Europe,2020-03-17,AT
16/03/2020,16,3,2020,205,0,Austria,AT,AUT,8847037,Europe,2020-03-16,AT
15/03/2020,15,3,2020,151,0,Austria,AT,AUT,8847037,Europe,2020-03-15,AT
14/03/2020,14,3,2020,143,0,Austria,AT,AUT,8847037,Europe,2020-03-14,AT
13/03/2020,13,3,2020,115,1,Austria,AT,AUT,8847037,Europe,2020-03-13,AT
12/03/2020,12,3,2020,64,0,Austria,AT,AUT,8847037,Europe,2020-03-12,AT
11/03/2020,11,3,2020,51,0,Austria,AT,AUT,8847037,Europe,2020-03-11,AT
10/03/2020,10,3,2020,29,0,Austria,AT,AUT,8847037,Europe,2020-03-10,AT
09/03/2020,9,3,2020,3,0,Austria,AT,AUT,8847037,Europe,2020-03-09,AT
08/03/2020,8,3,2020,25,0,Austria,AT,AUT,8847037,Europe,2020-03-08,AT
07/03/2020,7,3,2020,33,0,Austria,AT,AUT,8847037,Europe,2020-03-07,AT
06/03/2020,6,3,2020,12,0,Austria,AT,AUT,8847037,Europe,2020-03-06,AT
05/03/2020,5,3,2020,5,0,Austria,AT,AUT,8847037,Europe,2020-03-05,AT
04/03/2020,4,3,2020,6,0,Austria,AT,AUT,8847037,Europe,2020-03-04,AT
03/03/2020,3,3,2020,4,0,Austria,AT,AUT,8847037,Europe,2020-03-03,AT
02/03/2020,2,3,2020,4,0,Austria,AT,AUT,8847037,Europe,2020-03-02,AT
01/03/2020,1,3,2020,3,0,Austria,AT,AUT,8847037,Europe,2020-03-01,AT
29/02/2020,29,2,2020,2,0,Austria,AT,AUT,8847037,Europe,2020-02-29,AT
28/02/2020,28,2,2020,3,0,Austria,AT,AUT,8847037,Europe,2020-02-28,AT
27/02/2020,27,2,2020,0,0,Austria,AT,AUT,8847037,Europe,2020-02-27,AT
26/02/2020,26,2,2020,2,0,Austria,AT,AUT,8847037,Europe,2020-02-26,AT
25/02/2020,25,2,2020,0,0,Austria,AT,AUT,8847037,Europe,2020-02-25,AT
24/02/2020,24,2,2020,0,0,Austria,AT,AUT,8847037,Europe,2020-02-24,AT
23/02/2020,23,2,2020,0,0,Austria,AT,AUT,8847037,Europe,2020-02-23,AT
22/02/2020,22,2,2020,0,0,Austria,AT,AUT,8847037,Europe,2020-02-22,AT
21/02/2020,21,2,2020,0,0,Austria,AT,AUT,8847037,Europe,2020-02-21,AT
20/02/2020,20,2,2020,0,0,Austria,AT,AUT,8847037,Europe,2020-02-20,AT
19/02/2020,19,2,2020,0,0,Austria,AT,AUT,8847037,Europe,2020-02-19,AT
18/02/2020,18,2,2020,0,0,Austria,AT,AUT,8847037,Europe,2020-02-18,AT
17/02/2020,17,2,2020,0,0,Austria,AT,AUT,8847037,Europe,2020-02-17,AT
16/02/2020,16,2,2020,0,0,Austria,AT,AUT,8847037,Europe,2020-02-16,AT
15/02/2020,15,2,2020,0,0,Austria,AT,AUT,8847037,Europe,2020-02-15,AT
14/02/2020,14,2,2020,0,0,Austria,AT,AUT,8847037,Europe,2020-02-14,AT
13/02/2020,13,2,2020,0,0,Austria,AT,AUT,8847037,Europe,2020-02-13,AT
12/02/2020,12,2,2020,0,0,Austria,AT,AUT,8847037,Europe,2020-02-12,AT
11/02/2020,11,2,2020,0,0,Austria,AT,AUT,8847037,Europe,2020-02-11,AT
10/02/2020,10,2,2020,0,0,Austria,AT,AUT,8847037,Europe,2020-02-10,AT
09/02/2020,9,2,2020,0,0,Austria,AT,AUT,8847037,Europe,2020-02-09,AT
08/02/2020,8,2,2020,0,0,Austria,AT,AUT,8847037,Europe,2020-02-08,AT
07/02/2020,7,2,2020,0,0,Austria,AT,AUT,8847037,Europe,2020-02-07,AT
06/02/2020,6,2,2020,0,0,Austria,AT,AUT,8847037,Europe,2020-02-06,AT
05/02/2020,5,2,2020,0,0,Austria,AT,AUT,8847037,Europe,2020-02-05,AT
04/02/2020,4,2,2020,0,0,Austria,AT,AUT,8847037,Europe,2020-02-04,AT
03/02/2020,3,2,2020,0,0,Austria,AT,AUT,8847037,Europe,2020-02-03,AT
02/02/2020,2,2,2020,0,0,Austria,AT,AUT,8847037,Europe,2020-02-02,AT
01/02/2020,1,2,2020,0,0,Austria,AT,AUT,8847037,Europe,2020-02-01,AT
31/01/2020,31,1,2020,0,0,Austria,AT,AUT,8847037,Europe,2020-01-31,AT
30/01/2020,30,1,2020,0,0,Austria,AT,AUT,8847037,Europe,2020-01-30,AT
29/01/2020,29,1,2020,0,0,Austria,AT,AUT,8847037,Europe,2020-01-29,AT
28/01/2020,28,1,2020,0,0,Austria,AT,AUT,8847037,Europe,2020-01-28,AT
27/01/2020,27,1,2020,0,0,Austria,AT,AUT,8847037,Europe,2020-01-27,AT
26/01/2020,26,1,2020,0,0,Austria,AT,AUT,8847037,Europe,2020-01-26,AT
25/01/2020,25,1,2020,0,0,Austria,AT,AUT,8847037,Europe,2020-01-25,AT
24/01/2020,24,1,2020,0,0,Austria,AT,AUT,8847037,Europe,2020-01-24,AT
23/01/2020,23,1,2020,0,0,Austria,AT,AUT,8847037,Europe,2020-01-23,AT
22/01/2020,22,1,2020,0,0,Austria,AT,AUT,8847037,Europe,2020-01-22,AT
21/01/2020,21,1,2020,0,0,Austria,AT,AUT,8847037,Europe,2020-01-21,AT
20/01/2020,20,1,2020,0,0,Austria,AT,AUT,8847037,Europe,2020-01-20,AT
19/01/2020,19,1,2020,0,0,Austria,AT,AUT,8847037,Europe,2020-01-19,AT
18/01/2020,18,1,2020,0,0,Austria,AT,AUT,8847037,Europe,2020-01-18,AT
17/01/2020,17,1,2020,0,0,Austria,AT,AUT,8847037,Europe,2020-01-17,AT
16/01/2020,16,1,2020,0,0,Austria,AT,AUT,8847037,Europe,2020-01-16,AT
15/01/2020,15,1,2020,0,0,Austria,AT,AUT,8847037,Europe,2020-01-15,AT
14/01/2020,14,1,2020,0,0,Austria,AT,AUT,8847037,Europe,2020-01-14,AT
13/01/2020,13,1,2020,0,0,Austria,AT,AUT,8847037,Europe,2020-01-13,AT
12/01/2020,12,1,2020,0,0,Austria,AT,AUT,8847037,Europe,2020-01-12,AT
11/01/2020,11,1,2020,0,0,Austria,AT,AUT,8847037,Europe,2020-01-11,AT
10/01/2020,10,1,2020,0,0,Austria,AT,AUT,8847037,Europe,2020-01-10,AT
09/01/2020,9,1,2020,0,0,Austria,AT,AUT,8847037,Europe,2020-01-09,AT
08/01/2020,8,1,2020,0,0,Austria,AT,AUT,8847037,Europe,2020-01-08,AT
07/01/2020,7,1,2020,0,0,Austria,AT,AUT,8847037,Europe,2020-01-07,AT
06/01/2020,6,1,2020,0,0,Austria,AT,AUT,8847037,Europe,2020-01-06,AT
05/01/2020,5,1,2020,0,0,Austria,AT,AUT,8847037,Europe,2020-01-05,AT
04/01/2020,4,1,2020,0,0,Austria,AT,AUT,8847037,Europe,2020-01-04,AT
03/01/2020,3,1,2020,0,0,Austria,AT,AUT,8847037,Europe,2020-01-03,AT
02/01/2020,2,1,2020,0,0,Austria,AT,AUT,8847037,Europe,2020-01-02,AT
01/01/2020,1,1,2020,0,0,Austria,AT,AUT,8847037,Europe,2020-01-01,AT
31/12/2019,31,12,2019,0,0,Austria,AT,AUT,8847037,Europe,2019-12-31,AT
17/05/2020,17,5,2020,158,0,Azerbaijan,AZ,AZE,9942334,Europe,2020-05-17,AZ
16/05/2020,16,5,2020,101,1,Azerbaijan,AZ,AZE,9942334,Europe,2020-05-16,AZ
15/05/2020,15,5,2020,121,0,Azerbaijan,AZ,AZE,9942334,Europe,2020-05-15,AZ
14/05/2020,14,5,2020,65,2,Azerbaijan,AZ,AZE,9942334,Europe,2020-05-14,AZ
13/05/2020,13,5,2020,104,1,Azerbaijan,AZ,AZE,9942334,Europe,2020-05-13,AZ
12/05/2020,12,5,2020,70,0,Azerbaijan,AZ,AZE,9942334,Europe,2020-05-12,AZ
11/05/2020,11,5,2020,97,1,Azerbaijan,AZ,AZE,9942334,Europe,2020-05-11,AZ
10/05/2020,10,5,2020,143,3,Azerbaijan,AZ,AZE,9942334,Europe,2020-05-10,AZ
09/05/2020,9,5,2020,75,0,Azerbaijan,AZ,AZE,9942334,Europe,2020-05-09,AZ
08/05/2020,8,5,2020,77,0,Azerbaijan,AZ,AZE,9942334,Europe,2020-05-08,AZ
07/05/2020,7,5,2020,67,2,Azerbaijan,AZ,AZE,9942334,Europe,2020-05-07,AZ
06/05/2020,6,5,2020,76,0,Azerbaijan,AZ,AZE,9942334,Europe,2020-05-06,AZ
05/05/2020,5,5,2020,52,1,Azerbaijan,AZ,AZE,9942334,Europe,2020-05-05,AZ
04/05/2020,4,5,2020,38,0,Azerbaijan,AZ,AZE,9942334,Europe,2020-05-04,AZ
03/05/2020,3,5,2020,40,0,Azerbaijan,AZ,AZE,9942334,Europe,2020-05-03,AZ
02/05/2020,2,5,2020,50,1,Azerbaijan,AZ,AZE,9942334,Europe,2020-05-02,AZ
01/05/2020,1,5,2020,38,1,Azerbaijan,AZ,AZE,9942334,Europe,2020-05-01,AZ
30/04/2020,30,4,2020,49,1,Azerbaijan,AZ,AZE,9942334,Europe,2020-04-30,AZ
29/04/2020,29,4,2020,39,0,Azerbaijan,AZ,AZE,9942334,Europe,2020-04-29,AZ
28/04/2020,28,4,2020,33,1,Azerbaijan,AZ,AZE,9942334,Europe,2020-04-28,AZ
27/04/2020,27,4,2020,28,0,Azerbaijan,AZ,AZE,9942334,Europe,2020-04-27,AZ
26/04/2020,26,4,2020,25,0,Azerbaijan,AZ,AZE,9942334,Europe,2020-04-26,AZ
25/04/2020,25,4,2020,44,1,Azerbaijan,AZ,AZE,9942334,Europe,2020-04-25,AZ
24/04/2020,24,4,2020,30,0,Azerbaijan,AZ,AZE,9942334,Europe,2020-04-24,AZ
23/04/2020,23,4,2020,38,0,Azerbaijan,AZ,AZE,9942334,Europe,2020-04-23,AZ
22/04/2020,22,4,2020,44,1,Azerbaijan,AZ,AZE,9942334,Europe,2020-04-22,AZ
21/04/2020,21,4,2020,38,0,Azerbaijan,AZ,AZE,9942334,Europe,2020-04-21,AZ
20/04/2020,20,4,2020,25,1,Azerbaijan,AZ,AZE,9942334,Europe,2020-04-20,AZ
19/04/2020,19,4,2020,33,3,Azerbaijan,AZ,AZE,9942334,Europe,2020-04-19,AZ
18/04/2020,18,4,2020,57,0,Azerbaijan,AZ,AZE,9942334,Europe,2020-04-18,AZ
17/04/2020,17,4,2020,30,2,Azerbaijan,AZ,AZE,9942334,Europe,2020-04-17,AZ
16/04/2020,16,4,2020,56,0,Azerbaijan,AZ,AZE,9942334,Europe,2020-04-16,AZ
15/04/2020,15,4,2020,49,1,Azerbaijan,AZ,AZE,9942334,Europe,2020-04-15,AZ
14/04/2020,14,4,2020,50,1,Azerbaijan,AZ,AZE,9942334,Europe,2020-04-14,AZ
13/04/2020,13,4,2020,40,0,Azerbaijan,AZ,AZE,9942334,Europe,2020-04-13,AZ
12/04/2020,12,4,2020,67,1,Azerbaijan,AZ,AZE,9942334,Europe,2020-04-12,AZ
11/04/2020,11,4,2020,65,1,Azerbaijan,AZ,AZE,9942334,Europe,2020-04-11,AZ
10/04/2020,10,4,2020,104,1,Azerbaijan,AZ,AZE,9942334,Europe,2020-04-10,AZ
09/04/2020,9,4,2020,105,0,Azerbaijan,AZ,AZE,9942334,Europe,2020-04-09,AZ
08/04/2020,8,4,2020,76,1,Azerbaijan,AZ,AZE,9942334,Europe,2020-04-08,AZ
07/04/2020,7,4,2020,57,0,Azerbaijan,AZ,AZE,9942334,Europe,2020-04-07,AZ
06/04/2020,6,4,2020,63,2,Azerbaijan,AZ,AZE,9942334,Europe,2020-04-06,AZ
05/04/2020,5,4,2020,78,0,Azerbaijan,AZ,AZE,9942334,Europe,2020-04-05,AZ
04/04/2020,4,4,2020,43,0,Azerbaijan,AZ,AZE,9942334,Europe,2020-04-04,AZ
03/04/2020,3,4,2020,41,0,Azerbaijan,AZ,AZE,9942334,Europe,2020-04-03,AZ
02/04/2020,2,4,2020,61,0,Azerbaijan,AZ,AZE,9942334,Europe,2020-04-02,AZ
01/04/2020,1,4,2020,25,1,Azerbaijan,AZ,AZE,9942334,Europe,2020-04-01,AZ
31/03/2020,31,3,2020,64,0,Azerbaijan,AZ,AZE,9942334,Europe,2020-03-31,AZ
30/03/2020,30,3,2020,27,0,Azerbaijan,AZ,AZE,9942334,Europe,2020-03-30,AZ
29/03/2020,29,3,2020,17,1,Azerbaijan,AZ,AZE,9942334,Europe,2020-03-29,AZ
28/03/2020,28,3,2020,43,0,Azerbaijan,AZ,AZE,9942334,Europe,2020-03-28,AZ
27/03/2020,27,3,2020,29,1,Azerbaijan,AZ,AZE,9942334,Europe,2020-03-27,AZ
26/03/2020,26,3,2020,6,1,Azerbaijan,AZ,AZE,9942334,Europe,2020-03-26,AZ
25/03/2020,25,3,2020,15,0,Azerbaijan,AZ,AZE,9942334,Europe,2020-03-25,AZ
24/03/2020,24,3,2020,7,0,Azerbaijan,AZ,AZE,9942334,Europe,2020-03-24,AZ
23/03/2020,23,3,2020,12,0,Azerbaijan,AZ,AZE,9942334,Europe,2020-03-23,AZ
22/03/2020,22,3,2020,9,0,Azerbaijan,AZ,AZE,9942334,Europe,2020-03-22,AZ
21/03/2020,21,3,2020,0,1,Azerbaijan,AZ,AZE,9942334,Europe,2020-03-21,AZ
20/03/2020,20,3,2020,10,0,Azerbaijan,AZ,AZE,9942334,Europe,2020-03-20,AZ
19/03/2020,19,3,2020,6,0,Azerbaijan,AZ,AZE,9942334,Europe,2020-03-19,AZ
18/03/2020,18,3,2020,9,0,Azerbaijan,AZ,AZE,9942334,Europe,2020-03-18,AZ
17/03/2020,17,3,2020,0,0,Azerbaijan,AZ,AZE,9942334,Europe,2020-03-17,AZ
16/03/2020,16,3,2020,0,0,Azerbaijan,AZ,AZE,9942334,Europe,2020-03-16,AZ
15/03/2020,15,3,2020,6,0,Azerbaijan,AZ,AZE,9942334,Europe,2020-03-15,AZ
13/03/2020,13,3,2020,0,0,Azerbaijan,AZ,AZE,9942334,Europe,2020-03-13,AZ
12/03/2020,12,3,2020,2,0,Azerbaijan,AZ,AZE,9942334,Europe,2020-03-12,AZ
11/03/2020,11,3,2020,2,0,Azerbaijan,AZ,AZE,9942334,Europe,2020-03-11,AZ
07/03/2020,7,3,2020,3,0,Azerbaijan,AZ,AZE,9942334,Europe,2020-03-07,AZ
06/03/2020,6,3,2020,3,0,Azerbaijan,AZ,AZE,9942334,Europe,2020-03-06,AZ
02/03/2020,2,3,2020,2,0,Azerbaijan,AZ,AZE,9942334,Europe,2020-03-02,AZ
01/03/2020,1,3,2020,0,0,Azerbaijan,AZ,AZE,9942334,Europe,2020-03-01,AZ
29/02/2020,29,2,2020,1,0,Azerbaijan,AZ,AZE,9942334,Europe,2020-02-29,AZ
28/02/2020,28,2,2020,0,0,Azerbaijan,AZ,AZE,9942334,Europe,2020-02-28,AZ
27/02/2020,27,2,2020,0,0,Azerbaijan,AZ,AZE,9942334,Europe,2020-02-27,AZ
26/02/2020,26,2,2020,0,0,Azerbaijan,AZ,AZE,9942334,Europe,2020-02-26,AZ
25/02/2020,25,2,2020,0,0,Azerbaijan,AZ,AZE,9942334,Europe,2020-02-25,AZ
24/02/2020,24,2,2020,0,0,Azerbaijan,AZ,AZE,9942334,Europe,2020-02-24,AZ
23/02/2020,23,2,2020,0,0,Azerbaijan,AZ,AZE,9942334,Europe,2020-02-23,AZ
22/02/2020,22,2,2020,0,0,Azerbaijan,AZ,AZE,9942334,Europe,2020-02-22,AZ
21/02/2020,21,2,2020,0,0,Azerbaijan,AZ,AZE,9942334,Europe,2020-02-21,AZ
20/02/2020,20,2,2020,0,0,Azerbaijan,AZ,AZE,9942334,Europe,2020-02-20,AZ
19/02/2020,19,2,2020,0,0,Azerbaijan,AZ,AZE,9942334,Europe,2020-02-19,AZ
18/02/2020,18,2,2020,0,0,Azerbaijan,AZ,AZE,9942334,Europe,2020-02-18,AZ
17/02/2020,17,2,2020,0,0,Azerbaijan,AZ,AZE,9942334,Europe,2020-02-17,AZ
16/02/2020,16,2,2020,0,0,Azerbaijan,AZ,AZE,9942334,Europe,2020-02-16,AZ
15/02/2020,15,2,2020,0,0,Azerbaijan,AZ,AZE,9942334,Europe,2020-02-15,AZ
14/02/2020,14,2,2020,0,0,Azerbaijan,AZ,AZE,9942334,Europe,2020-02-14,AZ
13/02/2020,13,2,2020,0,0,Azerbaijan,AZ,AZE,9942334,Europe,2020-02-13,AZ
12/02/2020,12,2,2020,0,0,Azerbaijan,AZ,AZE,9942334,Europe,2020-02-12,AZ
11/02/2020,11,2,2020,0,0,Azerbaijan,AZ,AZE,9942334,Europe,2020-02-11,AZ
10/02/2020,10,2,2020,0,0,Azerbaijan,AZ,AZE,9942334,Europe,2020-02-10,AZ
09/02/2020,9,2,2020,0,0,Azerbaijan,AZ,AZE,9942334,Europe,2020-02-09,AZ
08/02/2020,8,2,2020,0,0,Azerbaijan,AZ,AZE,9942334,Europe,2020-02-08,AZ
07/02/2020,7,2,2020,0,0,Azerbaijan,AZ,AZE,9942334,Europe,2020-02-07,AZ
06/02/2020,6,2,2020,0,0,Azerbaijan,AZ,AZE,9942334,Europe,2020-02-06,AZ
05/02/2020,5,2,2020,0,0,Azerbaijan,AZ,AZE,9942334,Europe,2020-02-05,AZ
04/02/2020,4,2,2020,0,0,Azerbaijan,AZ,AZE,9942334,Europe,2020-02-04,AZ
03/02/2020,3,2,2020,0,0,Azerbaijan,AZ,AZE,9942334,Europe,2020-02-03,AZ
02/02/2020,2,2,2020,0,0,Azerbaijan,AZ,AZE,9942334,Europe,2020-02-02,AZ
01/02/2020,1,2,2020,0,0,Azerbaijan,AZ,AZE,9942334,Europe,2020-02-01,AZ
31/01/2020,31,1,2020,0,0,Azerbaijan,AZ,AZE,9942334,Europe,2020-01-31,AZ
30/01/2020,30,1,2020,0,0,Azerbaijan,AZ,AZE,9942334,Europe,2020-01-30,AZ
29/01/2020,29,1,2020,0,0,Azerbaijan,AZ,AZE,9942334,Europe,2020-01-29,AZ
28/01/2020,28,1,2020,0,0,Azerbaijan,AZ,AZE,9942334,Europe,2020-01-28,AZ
27/01/2020,27,1,2020,0,0,Azerbaijan,AZ,AZE,9942334,Europe,2020-01-27,AZ
26/01/2020,26,1,2020,0,0,Azerbaijan,AZ,AZE,9942334,Europe,2020-01-26,AZ
25/01/2020,25,1,2020,0,0,Azerbaijan,AZ,AZE,9942334,Europe,2020-01-25,AZ
24/01/2020,24,1,2020,0,0,Azerbaijan,AZ,AZE,9942334,Europe,2020-01-24,AZ
23/01/2020,23,1,2020,0,0,Azerbaijan,AZ,AZE,9942334,Europe,2020-01-23,AZ
22/01/2020,22,1,2020,0,0,Azerbaijan,AZ,AZE,9942334,Europe,2020-01-22,AZ
21/01/2020,21,1,2020,0,0,Azerbaijan,AZ,AZE,9942334,Europe,2020-01-21,AZ
20/01/2020,20,1,2020,0,0,Azerbaijan,AZ,AZE,9942334,Europe,2020-01-20,AZ
19/01/2020,19,1,2020,0,0,Azerbaijan,AZ,AZE,9942334,Europe,2020-01-19,AZ
18/01/2020,18,1,2020,0,0,Azerbaijan,AZ,AZE,9942334,Europe,2020-01-18,AZ
17/01/2020,17,1,2020,0,0,Azerbaijan,AZ,AZE,9942334,Europe,2020-01-17,AZ
16/01/2020,16,1,2020,0,0,Azerbaijan,AZ,AZE,9942334,Europe,2020-01-16,AZ
15/01/2020,15,1,2020,0,0,Azerbaijan,AZ,AZE,9942334,Europe,2020-01-15,AZ
14/01/2020,14,1,2020,0,0,Azerbaijan,AZ,AZE,9942334,Europe,2020-01-14,AZ
13/01/2020,13,1,2020,0,0,Azerbaijan,AZ,AZE,9942334,Europe,2020-01-13,AZ
12/01/2020,12,1,2020,0,0,Azerbaijan,AZ,AZE,9942334,Europe,2020-01-12,AZ
11/01/2020,11,1,2020,0,0,Azerbaijan,AZ,AZE,9942334,Europe,2020-01-11,AZ
10/01/2020,10,1,2020,0,0,Azerbaijan,AZ,AZE,9942334,Europe,2020-01-10,AZ
09/01/2020,9,1,2020,0,0,Azerbaijan,AZ,AZE,9942334,Europe,2020-01-09,AZ
08/01/2020,8,1,2020,0,0,Azerbaijan,AZ,AZE,9942334,Europe,2020-01-08,AZ
07/01/2020,7,1,2020,0,0,Azerbaijan,AZ,AZE,9942334,Europe,2020-01-07,AZ
06/01/2020,6,1,2020,0,0,Azerbaijan,AZ,AZE,9942334,Europe,2020-01-06,AZ
05/01/2020,5,1,2020,0,0,Azerbaijan,AZ,AZE,9942334,Europe,2020-01-05,AZ
04/01/2020,4,1,2020,0,0,Azerbaijan,AZ,AZE,9942334,Europe,2020-01-04,AZ
03/01/2020,3,1,2020,0,0,Azerbaijan,AZ,AZE,9942334,Europe,2020-01-03,AZ
02/01/2020,2,1,2020,0,0,Azerbaijan,AZ,AZE,9942334,Europe,2020-01-02,AZ
01/01/2020,1,1,2020,0,0,Azerbaijan,AZ,AZE,9942334,Europe,2020-01-01,AZ
31/12/2019,31,12,2019,0,0,Azerbaijan,AZ,AZE,9942334,Europe,2019-12-31,AZ
17/05/2020,17,5,2020,0,0,Bahamas,BS,BHS,385640,America,2020-05-17,BS
16/05/2020,16,5,2020,0,0,Bahamas,BS,BHS,385640,America,2020-05-16,BS
15/05/2020,15,5,2020,2,0,Bahamas,BS,BHS,385640,America,2020-05-15,BS
14/05/2020,14,5,2020,1,0,Bahamas,BS,BHS,385640,America,2020-05-14,BS
13/05/2020,13,5,2020,0,0,Bahamas,BS,BHS,385640,America,2020-05-13,BS
12/05/2020,12,5,2020,1,0,Bahamas,BS,BHS,385640,America,2020-05-12,BS
11/05/2020,11,5,2020,0,0,Bahamas,BS,BHS,385640,America,2020-05-11,BS
10/05/2020,10,5,2020,0,0,Bahamas,BS,BHS,385640,America,2020-05-10,BS
09/05/2020,9,5,2020,0,0,Bahamas,BS,BHS,385640,America,2020-05-09,BS
08/05/2020,8,5,2020,0,0,Bahamas,BS,BHS,385640,America,2020-05-08,BS
07/05/2020,7,5,2020,3,0,Bahamas,BS,BHS,385640,America,2020-05-07,BS
06/05/2020,6,5,2020,6,0,Bahamas,BS,BHS,385640,America,2020-05-06,BS
05/05/2020,5,5,2020,0,0,Bahamas,BS,BHS,385640,America,2020-05-05,BS
04/05/2020,4,5,2020,0,0,Bahamas,BS,BHS,385640,America,2020-05-04,BS
03/05/2020,3,5,2020,1,0,Bahamas,BS,BHS,385640,America,2020-05-03,BS
02/05/2020,2,5,2020,1,0,Bahamas,BS,BHS,385640,America,2020-05-02,BS
01/05/2020,1,5,2020,1,0,Bahamas,BS,BHS,385640,America,2020-05-01,BS
30/04/2020,30,4,2020,0,0,Bahamas,BS,BHS,385640,America,2020-04-30,BS
29/04/2020,29,4,2020,0,0,Bahamas,BS,BHS,385640,America,2020-04-29,BS
28/04/2020,28,4,2020,0,0,Bahamas,BS,BHS,385640,America,2020-04-28,BS
27/04/2020,27,4,2020,2,0,Bahamas,BS,BHS,385640,America,2020-04-27,BS
26/04/2020,26,4,2020,5,0,Bahamas,BS,BHS,385640,America,2020-04-26,BS
25/04/2020,25,4,2020,1,0,Bahamas,BS,BHS,385640,America,2020-04-25,BS
24/04/2020,24,4,2020,2,2,Bahamas,BS,BHS,385640,America,2020-04-24,BS
23/04/2020,23,4,2020,5,0,Bahamas,BS,BHS,385640,America,2020-04-23,BS
22/04/2020,22,4,2020,1,0,Bahamas,BS,BHS,385640,America,2020-04-22,BS
21/04/2020,21,4,2020,4,0,Bahamas,BS,BHS,385640,America,2020-04-21,BS
20/04/2020,20,4,2020,2,0,Bahamas,BS,BHS,385640,America,2020-04-20,BS
19/04/2020,19,4,2020,3,0,Bahamas,BS,BHS,385640,America,2020-04-19,BS
18/04/2020,18,4,2020,1,0,Bahamas,BS,BHS,385640,America,2020-04-18,BS
17/04/2020,17,4,2020,1,1,Bahamas,BS,BHS,385640,America,2020-04-17,BS
16/04/2020,16,4,2020,4,0,Bahamas,BS,BHS,385640,America,2020-04-16,BS
15/04/2020,15,4,2020,0,0,Bahamas,BS,BHS,385640,America,2020-04-15,BS
14/04/2020,14,4,2020,2,0,Bahamas,BS,BHS,385640,America,2020-04-14,BS
13/04/2020,13,4,2020,1,0,Bahamas,BS,BHS,385640,America,2020-04-13,BS
12/04/2020,12,4,2020,4,0,Bahamas,BS,BHS,385640,America,2020-04-12,BS
11/04/2020,11,4,2020,1,0,Bahamas,BS,BHS,385640,America,2020-04-11,BS
10/04/2020,10,4,2020,1,1,Bahamas,BS,BHS,385640,America,2020-04-10,BS
09/04/2020,9,4,2020,4,1,Bahamas,BS,BHS,385640,America,2020-04-09,BS
08/04/2020,8,4,2020,3,1,Bahamas,BS,BHS,385640,America,2020-04-08,BS
07/04/2020,7,4,2020,4,0,Bahamas,BS,BHS,385640,America,2020-04-07,BS
06/04/2020,6,4,2020,1,1,Bahamas,BS,BHS,385640,America,2020-04-06,BS
05/04/2020,5,4,2020,4,1,Bahamas,BS,BHS,385640,America,2020-04-05,BS
04/04/2020,4,4,2020,0,2,Bahamas,BS,BHS,385640,America,2020-04-04,BS
03/04/2020,3,4,2020,3,0,Bahamas,BS,BHS,385640,America,2020-04-03,BS
02/04/2020,2,4,2020,6,1,Bahamas,BS,BHS,385640,America,2020-04-02,BS
01/04/2020,1,4,2020,1,0,Bahamas,BS,BHS,385640,America,2020-04-01,BS
31/03/2020,31,3,2020,0,0,Bahamas,BS,BHS,385640,America,2020-03-31,BS
30/03/2020,30,3,2020,3,0,Bahamas,BS,BHS,385640,America,2020-03-30,BS
29/03/2020,29,3,2020,2,0,Bahamas,BS,BHS,385640,America,2020-03-29,BS
28/03/2020,28,3,2020,0,0,Bahamas,BS,BHS,385640,America,2020-03-28,BS
27/03/2020,27,3,2020,4,0,Bahamas,BS,BHS,385640,America,2020-03-27,BS
26/03/2020,26,3,2020,1,0,Bahamas,BS,BHS,385640,America,2020-03-26,BS
25/03/2020,25,3,2020,0,0,Bahamas,BS,BHS,385640,America,2020-03-25,BS
24/03/2020,24,3,2020,0,0,Bahamas,BS,BHS,385640,America,2020-03-24,BS
23/03/2020,23,3,2020,0,0,Bahamas,BS,BHS,385640,America,2020-03-23,BS
22/03/2020,22,3,2020,0,0,Bahamas,BS,BHS,385640,America,2020-03-22,BS
21/03/2020,21,3,2020,1,0,Bahamas,BS,BHS,385640,America,2020-03-21,BS
20/03/2020,20,3,2020,2,0,Bahamas,BS,BHS,385640,America,2020-03-20,BS
17/03/2020,17,3,2020,0,0,Bahamas,BS,BHS,385640,America,2020-03-17,BS
16/03/2020,16,3,2020,1,0,Bahamas,BS,BHS,385640,America,2020-03-16,BS
17/05/2020,17,5,2020,164,0,Bahrain,BH,BHR,1569439,Asia,2020-05-17,BH
16/05/2020,16,5,2020,385,2,Bahrain,BH,BHR,1569439,Asia,2020-05-16,BH
15/05/2020,15,5,2020,382,0,Bahrain,BH,BHR,1569439,Asia,2020-05-15,BH
14/05/2020,14,5,2020,285,1,Bahrain,BH,BHR,1569439,Asia,2020-05-14,BH
13/05/2020,13,5,2020,295,1,Bahrain,BH,BHR,1569439,Asia,2020-05-13,BH
12/05/2020,12,5,2020,295,0,Bahrain,BH,BHR,1569439,Asia,2020-05-12,BH
11/05/2020,11,5,2020,167,0,Bahrain,BH,BHR,1569439,Asia,2020-05-11,BH
10/05/2020,10,5,2020,330,0,Bahrain,BH,BHR,1569439,Asia,2020-05-10,BH
09/05/2020,9,5,2020,245,0,Bahrain,BH,BHR,1569439,Asia,2020-05-09,BH
08/05/2020,8,5,2020,265,0,Bahrain,BH,BHR,1569439,Asia,2020-05-08,BH
07/05/2020,7,5,2020,214,0,Bahrain,BH,BHR,1569439,Asia,2020-05-07,BH
06/05/2020,6,5,2020,187,0,Bahrain,BH,BHR,1569439,Asia,2020-05-06,BH
05/05/2020,5,5,2020,150,0,Bahrain,BH,BHR,1569439,Asia,2020-05-05,BH
04/05/2020,4,5,2020,99,0,Bahrain,BH,BHR,1569439,Asia,2020-05-04,BH
03/05/2020,3,5,2020,114,0,Bahrain,BH,BHR,1569439,Asia,2020-05-03,BH
02/05/2020,2,5,2020,130,0,Bahrain,BH,BHR,1569439,Asia,2020-05-02,BH
01/05/2020,1,5,2020,119,0,Bahrain,BH,BHR,1569439,Asia,2020-05-01,BH
30/04/2020,30,4,2020,110,0,Bahrain,BH,BHR,1569439,Asia,2020-04-30,BH
29/04/2020,29,4,2020,88,0,Bahrain,BH,BHR,1569439,Asia,2020-04-29,BH
28/04/2020,28,4,2020,76,0,Bahrain,BH,BHR,1569439,Asia,2020-04-28,BH
27/04/2020,27,4,2020,58,0,Bahrain,BH,BHR,1569439,Asia,2020-04-27,BH
26/04/2020,26,4,2020,71,0,Bahrain,BH,BHR,1569439,Asia,2020-04-26,BH
25/04/2020,25,4,2020,301,0,Bahrain,BH,BHR,1569439,Asia,2020-04-25,BH
24/04/2020,24,4,2020,210,1,Bahrain,BH,BHR,1569439,Asia,2020-04-24,BH
23/04/2020,23,4,2020,34,0,Bahrain,BH,BHR,1569439,Asia,2020-04-23,BH
22/04/2020,22,4,2020,66,0,Bahrain,BH,BHR,1569439,Asia,2020-04-22,BH
21/04/2020,21,4,2020,34,0,Bahrain,BH,BHR,1569439,Asia,2020-04-21,BH
20/04/2020,20,4,2020,100,0,Bahrain,BH,BHR,1569439,Asia,2020-04-20,BH
19/04/2020,19,4,2020,29,0,Bahrain,BH,BHR,1569439,Asia,2020-04-19,BH
18/04/2020,18,4,2020,44,0,Bahrain,BH,BHR,1569439,Asia,2020-04-18,BH
17/04/2020,17,4,2020,27,0,Bahrain,BH,BHR,1569439,Asia,2020-04-17,BH
16/04/2020,16,4,2020,145,0,Bahrain,BH,BHR,1569439,Asia,2020-04-16,BH
15/04/2020,15,4,2020,167,0,Bahrain,BH,BHR,1569439,Asia,2020-04-15,BH
14/04/2020,14,4,2020,225,1,Bahrain,BH,BHR,1569439,Asia,2020-04-14,BH
13/04/2020,13,4,2020,96,0,Bahrain,BH,BHR,1569439,Asia,2020-04-13,BH
12/04/2020,12,4,2020,42,0,Bahrain,BH,BHR,1569439,Asia,2020-04-12,BH
11/04/2020,11,4,2020,111,1,Bahrain,BH,BHR,1569439,Asia,2020-04-11,BH
10/04/2020,10,4,2020,64,0,Bahrain,BH,BHR,1569439,Asia,2020-04-10,BH
09/04/2020,9,4,2020,12,0,Bahrain,BH,BHR,1569439,Asia,2020-04-09,BH
08/04/2020,8,4,2020,55,1,Bahrain,BH,BHR,1569439,Asia,2020-04-08,BH
07/04/2020,7,4,2020,56,0,Bahrain,BH,BHR,1569439,Asia,2020-04-07,BH
06/04/2020,6,4,2020,12,0,Bahrain,BH,BHR,1569439,Asia,2020-04-06,BH
05/04/2020,5,4,2020,45,0,Bahrain,BH,BHR,1569439,Asia,2020-04-05,BH
04/04/2020,4,4,2020,0,0,Bahrain,BH,BHR,1569439,Asia,2020-04-04,BH
03/04/2020,3,4,2020,74,0,Bahrain,BH,BHR,1569439,Asia,2020-04-03,BH
02/04/2020,2,4,2020,2,0,Bahrain,BH,BHR,1569439,Asia,2020-04-02,BH
01/04/2020,1,4,2020,52,0,Bahrain,BH,BHR,1569439,Asia,2020-04-01,BH
31/03/2020,31,3,2020,15,0,Bahrain,BH,BHR,1569439,Asia,2020-03-31,BH
30/03/2020,30,3,2020,27,0,Bahrain,BH,BHR,1569439,Asia,2020-03-30,BH
29/03/2020,29,3,2020,7,0,Bahrain,BH,BHR,1569439,Asia,2020-03-29,BH
28/03/2020,28,3,2020,8,0,Bahrain,BH,BHR,1569439,Asia,2020-03-28,BH
27/03/2020,27,3,2020,39,1,Bahrain,BH,BHR,1569439,Asia,2020-03-27,BH
26/03/2020,26,3,2020,29,0,Bahrain,BH,BHR,1569439,Asia,2020-03-26,BH
25/03/2020,25,3,2020,51,1,Bahrain,BH,BHR,1569439,Asia,2020-03-25,BH
24/03/2020,24,3,2020,5,0,Bahrain,BH,BHR,1569439,Asia,2020-03-24,BH
23/03/2020,23,3,2020,28,1,Bahrain,BH,BHR,1569439,Asia,2020-03-23,BH
22/03/2020,22,3,2020,21,0,Bahrain,BH,BHR,1569439,Asia,2020-03-22,BH
21/03/2020,21,3,2020,16,0,Bahrain,BH,BHR,1569439,Asia,2020-03-21,BH
20/03/2020,20,3,2020,13,0,Bahrain,BH,BHR,1569439,Asia,2020-03-20,BH
19/03/2020,19,3,2020,19,0,Bahrain,BH,BHR,1569439,Asia,2020-03-19,BH
18/03/2020,18,3,2020,16,0,Bahrain,BH,BHR,1569439,Asia,2020-03-18,BH
17/03/2020,17,3,2020,7,1,Bahrain,BH,BHR,1569439,Asia,2020-03-17,BH
16/03/2020,16,3,2020,3,0,Bahrain,BH,BHR,1569439,Asia,2020-03-16,BH
15/03/2020,15,3,2020,1,0,Bahrain,BH,BHR,1569439,Asia,2020-03-15,BH
14/03/2020,14,3,2020,48,0,Bahrain,BH,BHR,1569439,Asia,2020-03-14,BH
13/03/2020,13,3,2020,0,0,Bahrain,BH,BHR,1569439,Asia,2020-03-13,BH
12/03/2020,12,3,2020,52,0,Bahrain,BH,BHR,1569439,Asia,2020-03-12,BH
11/03/2020,11,3,2020,1,0,Bahrain,BH,BHR,1569439,Asia,2020-03-11,BH
10/03/2020,10,3,2020,30,0,Bahrain,BH,BHR,1569439,Asia,2020-03-10,BH
09/03/2020,9,3,2020,16,0,Bahrain,BH,BHR,1569439,Asia,2020-03-09,BH
08/03/2020,8,3,2020,7,0,Bahrain,BH,BHR,1569439,Asia,2020-03-08,BH
07/03/2020,7,3,2020,4,0,Bahrain,BH,BHR,1569439,Asia,2020-03-07,BH
06/03/2020,6,3,2020,0,0,Bahrain,BH,BHR,1569439,Asia,2020-03-06,BH
05/03/2020,5,3,2020,3,0,Bahrain,BH,BHR,1569439,Asia,2020-03-05,BH
04/03/2020,4,3,2020,2,0,Bahrain,BH,BHR,1569439,Asia,2020-03-04,BH
02/03/2020,2,3,2020,6,0,Bahrain,BH,BHR,1569439,Asia,2020-03-02,BH
01/03/2020,1,3,2020,3,0,Bahrain,BH,BHR,1569439,Asia,2020-03-01,BH
29/02/2020,29,2,2020,5,0,Bahrain,BH,BHR,1569439,Asia,2020-02-29,BH
28/02/2020,28,2,2020,0,0,Bahrain,BH,BHR,1569439,Asia,2020-02-28,BH
27/02/2020,27,2,2020,10,0,Bahrain,BH,BHR,1569439,Asia,2020-02-27,BH
26/02/2020,26,2,2020,21,0,Bahrain,BH,BHR,1569439,Asia,2020-02-26,BH
25/02/2020,25,2,2020,1,0,Bahrain,BH,BHR,1569439,Asia,2020-02-25,BH
24/02/2020,24,2,2020,1,0,Bahrain,BH,BHR,1569439,Asia,2020-02-24,BH
23/02/2020,23,2,2020,0,0,Bahrain,BH,BHR,1569439,Asia,2020-02-23,BH
22/02/2020,22,2,2020,0,0,Bahrain,BH,BHR,1569439,Asia,2020-02-22,BH
21/02/2020,21,2,2020,0,0,Bahrain,BH,BHR,1569439,Asia,2020-02-21,BH
20/02/2020,20,2,2020,0,0,Bahrain,BH,BHR,1569439,Asia,2020-02-20,BH
19/02/2020,19,2,2020,0,0,Bahrain,BH,BHR,1569439,Asia,2020-02-19,BH
18/02/2020,18,2,2020,0,0,Bahrain,BH,BHR,1569439,Asia,2020-02-18,BH
17/02/2020,17,2,2020,0,0,Bahrain,BH,BHR,1569439,Asia,2020-02-17,BH
16/02/2020,16,2,2020,0,0,Bahrain,BH,BHR,1569439,Asia,2020-02-16,BH
15/02/2020,15,2,2020,0,0,Bahrain,BH,BHR,1569439,Asia,2020-02-15,BH
14/02/2020,14,2,2020,0,0,Bahrain,BH,BHR,1569439,Asia,2020-02-14,BH
13/02/2020,13,2,2020,0,0,Bahrain,BH,BHR,1569439,Asia,2020-02-13,BH
12/02/2020,12,2,2020,0,0,Bahrain,BH,BHR,1569439,Asia,2020-02-12,BH
11/02/2020,11,2,2020,0,0,Bahrain,BH,BHR,1569439,Asia,2020-02-11,BH
10/02/2020,10,2,2020,0,0,Bahrain,BH,BHR,1569439,Asia,2020-02-10,BH
09/02/2020,9,2,2020,0,0,Bahrain,BH,BHR,1569439,Asia,2020-02-09,BH
08/02/2020,8,2,2020,0,0,Bahrain,BH,BHR,1569439,Asia,2020-02-08,BH
07/02/2020,7,2,2020,0,0,Bahrain,BH,BHR,1569439,Asia,2020-02-07,BH
06/02/2020,6,2,2020,0,0,Bahrain,BH,BHR,1569439,Asia,2020-02-06,BH
05/02/2020,5,2,2020,0,0,Bahrain,BH,BHR,1569439,Asia,2020-02-05,BH
04/02/2020,4,2,2020,0,0,Bahrain,BH,BHR,1569439,Asia,2020-02-04,BH
03/02/2020,3,2,2020,0,0,Bahrain,BH,BHR,1569439,Asia,2020-02-03,BH
02/02/2020,2,2,2020,0,0,Bahrain,BH,BHR,1569439,Asia,2020-02-02,BH
01/02/2020,1,2,2020,0,0,Bahrain,BH,BHR,1569439,Asia,2020-02-01,BH
31/01/2020,31,1,2020,0,0,Bahrain,BH,BHR,1569439,Asia,2020-01-31,BH
30/01/2020,30,1,2020,0,0,Bahrain,BH,BHR,1569439,Asia,2020-01-30,BH
29/01/2020,29,1,2020,0,0,Bahrain,BH,BHR,1569439,Asia,2020-01-29,BH
28/01/2020,28,1,2020,0,0,Bahrain,BH,BHR,1569439,Asia,2020-01-28,BH
27/01/2020,27,1,2020,0,0,Bahrain,BH,BHR,1569439,Asia,2020-01-27,BH
26/01/2020,26,1,2020,0,0,Bahrain,BH,BHR,1569439,Asia,2020-01-26,BH
25/01/2020,25,1,2020,0,0,Bahrain,BH,BHR,1569439,Asia,2020-01-25,BH
24/01/2020,24,1,2020,0,0,Bahrain,BH,BHR,1569439,Asia,2020-01-24,BH
23/01/2020,23,1,2020,0,0,Bahrain,BH,BHR,1569439,Asia,2020-01-23,BH
22/01/2020,22,1,2020,0,0,Bahrain,BH,BHR,1569439,Asia,2020-01-22,BH
21/01/2020,21,1,2020,0,0,Bahrain,BH,BHR,1569439,Asia,2020-01-21,BH
20/01/2020,20,1,2020,0,0,Bahrain,BH,BHR,1569439,Asia,2020-01-20,BH
19/01/2020,19,1,2020,0,0,Bahrain,BH,BHR,1569439,Asia,2020-01-19,BH
18/01/2020,18,1,2020,0,0,Bahrain,BH,BHR,1569439,Asia,2020-01-18,BH
17/01/2020,17,1,2020,0,0,Bahrain,BH,BHR,1569439,Asia,2020-01-17,BH
16/01/2020,16,1,2020,0,0,Bahrain,BH,BHR,1569439,Asia,2020-01-16,BH
15/01/2020,15,1,2020,0,0,Bahrain,BH,BHR,1569439,Asia,2020-01-15,BH
