records.dateRep,records.day,records.month,records.year,records.cases,records.deaths,records.countriesAndTerritories,records.geoId,records.countryterritoryCode,records.popData2018,date,iso2,iso3,cname
13/04/2020,13,4,2020,52,0,Afghanistan,AF,AFG,37172386,2020-04-13,AF,AFG,Afghanistan
12/04/2020,12,4,2020,34,3,Afghanistan,AF,AFG,37172386,2020-04-12,AF,AFG,Afghanistan
11/04/2020,11,4,2020,37,0,Afghanistan,AF,AFG,37172386,2020-04-11,AF,AFG,Afghanistan
10/04/2020,10,4,2020,61,1,Afghanistan,AF,AFG,37172386,2020-04-10,AF,AFG,Afghanistan
09/04/2020,9,4,2020,56,3,Afghanistan,AF,AFG,37172386,2020-04-09,AF,AFG,Afghanistan
08/04/2020,8,4,2020,30,4,Afghanistan,AF,AFG,37172386,2020-04-08,AF,AFG,Afghanistan
07/04/2020,7,4,2020,38,0,Afghanistan,AF,AFG,37172386,2020-04-07,AF,AFG,Afghanistan
06/04/2020,6,4,2020,29,2,Afghanistan,AF,AFG,37172386,2020-04-06,AF,AFG,Afghanistan
05/04/2020,5,4,2020,35,1,Afghanistan,AF,AFG,37172386,2020-04-05,AF,AFG,Afghanistan
04/04/2020,4,4,2020,0,0,Afghanistan,AF,AFG,37172386,2020-04-04,AF,AFG,Afghanistan
03/04/2020,3,4,2020,43,0,Afghanistan,AF,AFG,37172386,2020-04-03,AF,AFG,Afghanistan
02/04/2020,2,4,2020,26,0,Afghanistan,AF,AFG,37172386,2020-04-02,AF,AFG,Afghanistan
01/04/2020,1,4,2020,25,0,Afghanistan,AF,AFG,37172386,2020-04-01,AF,AFG,Afghanistan
31/03/2020,31,3,2020,27,0,Afghanistan,AF,AFG,37172386,2020-03-31,AF,AFG,Afghanistan
30/03/2020,30,3,2020,8,1,Afghanistan,AF,AFG,37172386,2020-03-30,AF,AFG,Afghanistan
29/03/2020,29,3,2020,15,1,Afghanistan,AF,AFG,37172386,2020-03-29,AF,AFG,Afghanistan
28/03/2020,28,3,2020,16,1,Afghanistan,AF,AFG,37172386,2020-03-28,AF,AFG,Afghanistan
27/03/2020,27,3,2020,0,0,Afghanistan,AF,AFG,37172386,2020-03-27,AF,AFG,Afghanistan
26/03/2020,26,3,2020,33,0,Afghanistan,AF,AFG,37172386,2020-03-26,AF,AFG,Afghanistan
25/03/2020,25,3,2020,2,0,Afghanistan,AF,AFG,37172386,2020-03-25,AF,AFG,Afghanistan
24/03/2020,24,3,2020,6,1,Afghanistan,AF,AFG,37172386,2020-03-24,AF,AFG,Afghanistan
23/03/2020,23,3,2020,10,0,Afghanistan,AF,AFG,37172386,2020-03-23,AF,AFG,Afghanistan
22/03/2020,22,3,2020,0,0,Afghanistan,AF,AFG,37172386,2020-03-22,AF,AFG,Afghanistan
21/03/2020,21,3,2020,2,0,Afghanistan,AF,AFG,37172386,2020-03-21,AF,AFG,Afghanistan
20/03/2020,20,3,2020,0,0,Afghanistan,AF,AFG,37172386,2020-03-20,AF,AFG,Afghanistan
19/03/2020,19,3,2020,0,0,Afghanistan,AF,AFG,37172386,2020-03-19,AF,AFG,Afghanistan
18/03/2020,18,3,2020,1,0,Afghanistan,AF,AFG,37172386,2020-03-18,AF,AFG,Afghanistan
17/03/2020,17,3,2020,5,0,Afghanistan,AF,AFG,37172386,2020-03-17,AF,AFG,Afghanistan
16/03/2020,16,3,2020,6,0,Afghanistan,AF,AFG,37172386,2020-03-16,AF,AFG,Afghanistan
15/03/2020,15,3,2020,3,0,Afghanistan,AF,AFG,37172386,2020-03-15,AF,AFG,Afghanistan
11/03/2020,11,3,2020,3,0,Afghanistan,AF,AFG,37172386,2020-03-11,AF,AFG,Afghanistan
08/03/2020,8,3,2020,3,0,Afghanistan,AF,AFG,37172386,2020-03-08,AF,AFG,Afghanistan
02/03/2020,2,3,2020,0,0,Afghanistan,AF,AFG,37172386,2020-03-02,AF,AFG,Afghanistan
01/03/2020,1,3,2020,0,0,Afghanistan,AF,AFG,37172386,2020-03-01,AF,AFG,Afghanistan
29/02/2020,29,2,2020,0,0,Afghanistan,AF,AFG,37172386,2020-02-29,AF,AFG,Afghanistan
28/02/2020,28,2,2020,0,0,Afghanistan,AF,AFG,37172386,2020-02-28,AF,AFG,Afghanistan
27/02/2020,27,2,2020,0,0,Afghanistan,AF,AFG,37172386,2020-02-27,AF,AFG,Afghanistan
26/02/2020,26,2,2020,0,0,Afghanistan,AF,AFG,37172386,2020-02-26,AF,AFG,Afghanistan
25/02/2020,25,2,2020,1,0,Afghanistan,AF,AFG,37172386,2020-02-25,AF,AFG,Afghanistan
24/02/2020,24,2,2020,0,0,Afghanistan,AF,AFG,37172386,2020-02-24,AF,AFG,Afghanistan
23/02/2020,23,2,2020,0,0,Afghanistan,AF,AFG,37172386,2020-02-23,AF,AFG,Afghanistan
22/02/2020,22,2,2020,0,0,Afghanistan,AF,AFG,37172386,2020-02-22,AF,AFG,Afghanistan
21/02/2020,21,2,2020,0,0,Afghanistan,AF,AFG,37172386,2020-02-21,AF,AFG,Afghanistan
20/02/2020,20,2,2020,0,0,Afghanistan,AF,AFG,37172386,2020-02-20,AF,AFG,Afghanistan
19/02/2020,19,2,2020,0,0,Afghanistan,AF,AFG,37172386,2020-02-19,AF,AFG,Afghanistan
18/02/2020,18,2,2020,0,0,Afghanistan,AF,AFG,37172386,2020-02-18,AF,AFG,Afghanistan
17/02/2020,17,2,2020,0,0,Afghanistan,AF,AFG,37172386,2020-02-17,AF,AFG,Afghanistan
16/02/2020,16,2,2020,0,0,Afghanistan,AF,AFG,37172386,2020-02-16,AF,AFG,Afghanistan
15/02/2020,15,2,2020,0,0,Afghanistan,AF,AFG,37172386,2020-02-15,AF,AFG,Afghanistan
14/02/2020,14,2,2020,0,0,Afghanistan,AF,AFG,37172386,2020-02-14,AF,AFG,Afghanistan
13/02/2020,13,2,2020,0,0,Afghanistan,AF,AFG,37172386,2020-02-13,AF,AFG,Afghanistan
12/02/2020,12,2,2020,0,0,Afghanistan,AF,AFG,37172386,2020-02-12,AF,AFG,Afghanistan
11/02/2020,11,2,2020,0,0,Afghanistan,AF,AFG,37172386,2020-02-11,AF,AFG,Afghanistan
10/02/2020,10,2,2020,0,0,Afghanistan,AF,AFG,37172386,2020-02-10,AF,AFG,Afghanistan
09/02/2020,9,2,2020,0,0,Afghanistan,AF,AFG,37172386,2020-02-09,AF,AFG,Afghanistan
08/02/2020,8,2,2020,0,0,Afghanistan,AF,AFG,37172386,2020-02-08,AF,AFG,Afghanistan
07/02/2020,7,2,2020,0,0,Afghanistan,AF,AFG,37172386,2020-02-07,AF,AFG,Afghanistan
06/02/2020,6,2,2020,0,0,Afghanistan,AF,AFG,37172386,2020-02-06,AF,AFG,Afghanistan
05/02/2020,5,2,2020,0,0,Afghanistan,AF,AFG,37172386,2020-02-05,AF,AFG,Afghanistan
04/02/2020,4,2,2020,0,0,Afghanistan,AF,AFG,37172386,2020-02-04,AF,AFG,Afghanistan
03/02/2020,3,2,2020,0,0,Afghanistan,AF,AFG,37172386,2020-02-03,AF,AFG,Afghanistan
02/02/2020,2,2,2020,0,0,Afghanistan,AF,AFG,37172386,2020-02-02,AF,AFG,Afghanistan
01/02/2020,1,2,2020,0,0,Afghanistan,AF,AFG,37172386,2020-02-01,AF,AFG,Afghanistan
31/01/2020,31,1,2020,0,0,Afghanistan,AF,AFG,37172386,2020-01-31,AF,AFG,Afghanistan
30/01/2020,30,1,2020,0,0,Afghanistan,AF,AFG,37172386,2020-01-30,AF,AFG,Afghanistan
29/01/2020,29,1,2020,0,0,Afghanistan,AF,AFG,37172386,2020-01-29,AF,AFG,Afghanistan
28/01/2020,28,1,2020,0,0,Afghanistan,AF,AFG,37172386,2020-01-28,AF,AFG,Afghanistan
27/01/2020,27,1,2020,0,0,Afghanistan,AF,AFG,37172386,2020-01-27,AF,AFG,Afghanistan
26/01/2020,26,1,2020,0,0,Afghanistan,AF,AFG,37172386,2020-01-26,AF,AFG,Afghanistan
25/01/2020,25,1,2020,0,0,Afghanistan,AF,AFG,37172386,2020-01-25,AF,AFG,Afghanistan
24/01/2020,24,1,2020,0,0,Afghanistan,AF,AFG,37172386,2020-01-24,AF,AFG,Afghanistan
23/01/2020,23,1,2020,0,0,Afghanistan,AF,AFG,37172386,2020-01-23,AF,AFG,Afghanistan
22/01/2020,22,1,2020,0,0,Afghanistan,AF,AFG,37172386,2020-01-22,AF,AFG,Afghanistan
21/01/2020,21,1,2020,0,0,Afghanistan,AF,AFG,37172386,2020-01-21,AF,AFG,Afghanistan
20/01/2020,20,1,2020,0,0,Afghanistan,AF,AFG,37172386,2020-01-20,AF,AFG,Afghanistan
19/01/2020,19,1,2020,0,0,Afghanistan,AF,AFG,37172386,2020-01-19,AF,AFG,Afghanistan
18/01/2020,18,1,2020,0,0,Afghanistan,AF,AFG,37172386,2020-01-18,AF,AFG,Afghanistan
17/01/2020,17,1,2020,0,0,Afghanistan,AF,AFG,37172386,2020-01-17,AF,AFG,Afghanistan
16/01/2020,16,1,2020,0,0,Afghanistan,AF,AFG,37172386,2020-01-16,AF,AFG,Afghanistan
15/01/2020,15,1,2020,0,0,Afghanistan,AF,AFG,37172386,2020-01-15,AF,AFG,Afghanistan
14/01/2020,14,1,2020,0,0,Afghanistan,AF,AFG,37172386,2020-01-14,AF,AFG,Afghanistan
13/01/2020,13,1,2020,0,0,Afghanistan,AF,AFG,37172386,2020-01-13,AF,AFG,Afghanistan
12/01/2020,12,1,2020,0,0,Afghanistan,AF,AFG,37172386,2020-01-12,AF,AFG,Afghanistan
11/01/2020,11,1,2020,0,0,Afghanistan,AF,AFG,37172386,2020-01-11,AF,AFG,Afghanistan
10/01/2020,10,1,2020,0,0,Afghanistan,AF,AFG,37172386,2020-01-10,AF,AFG,Afghanistan
09/01/2020,9,1,2020,0,0,Afghanistan,AF,AFG,37172386,2020-01-09,AF,AFG,Afghanistan
08/01/2020,8,1,2020,0,0,Afghanistan,AF,AFG,37172386,2020-01-08,AF,AFG,Afghanistan
07/01/2020,7,1,2020,0,0,Afghanistan,AF,AFG,37172386,2020-01-07,AF,AFG,Afghanistan
06/01/2020,6,1,2020,0,0,Afghanistan,AF,AFG,37172386,2020-01-06,AF,AFG,Afghanistan
05/01/2020,5,1,2020,0,0,Afghanistan,AF,AFG,37172386,2020-01-05,AF,AFG,Afghanistan
04/01/2020,4,1,2020,0,0,Afghanistan,AF,AFG,37172386,2020-01-04,AF,AFG,Afghanistan
03/01/2020,3,1,2020,0,0,Afghanistan,AF,AFG,37172386,2020-01-03,AF,AFG,Afghanistan
02/01/2020,2,1,2020,0,0,Afghanistan,AF,AFG,37172386,2020-01-02,AF,AFG,Afghanistan
01/01/2020,1,1,2020,0,0,Afghanistan,AF,AFG,37172386,2020-01-01,AF,AFG,Afghanistan
31/12/2019,31,12,2019,0,0,Afghanistan,AF,AFG,37172386,2019-12-31,AF,AFG,Afghanistan
13/04/2020,13,4,2020,13,0,Albania,AL,ALB,2866376,2020-04-13,AL,ALB,Albania
12/04/2020,12,4,2020,17,0,Albania,AL,ALB,2866376,2020-04-12,AL,ALB,Albania
11/04/2020,11,4,2020,7,0,Albania,AL,ALB,2866376,2020-04-11,AL,ALB,Albania
10/04/2020,10,4,2020,9,1,Albania,AL,ALB,2866376,2020-04-10,AL,ALB,Albania
09/04/2020,9,4,2020,17,0,Albania,AL,ALB,2866376,2020-04-09,AL,ALB,Albania
08/04/2020,8,4,2020,6,0,Albania,AL,ALB,2866376,2020-04-08,AL,ALB,Albania
07/04/2020,7,4,2020,16,1,Albania,AL,ALB,2866376,2020-04-07,AL,ALB,Albania
06/04/2020,6,4,2020,28,2,Albania,AL,ALB,2866376,2020-04-06,AL,ALB,Albania
05/04/2020,5,4,2020,29,2,Albania,AL,ALB,2866376,2020-04-05,AL,ALB,Albania
04/04/2020,4,4,2020,27,1,Albania,AL,ALB,2866376,2020-04-04,AL,ALB,Albania
03/04/2020,3,4,2020,18,1,Albania,AL,ALB,2866376,2020-04-03,AL,ALB,Albania
02/04/2020,2,4,2020,16,0,Albania,AL,ALB,2866376,2020-04-02,AL,ALB,Albania
01/04/2020,1,4,2020,20,3,Albania,AL,ALB,2866376,2020-04-01,AL,ALB,Albania
31/03/2020,31,3,2020,11,2,Albania,AL,ALB,2866376,2020-03-31,AL,ALB,Albania
30/03/2020,30,3,2020,15,0,Albania,AL,ALB,2866376,2020-03-30,AL,ALB,Albania
29/03/2020,29,3,2020,11,1,Albania,AL,ALB,2866376,2020-03-29,AL,ALB,Albania
28/03/2020,28,3,2020,12,3,Albania,AL,ALB,2866376,2020-03-28,AL,ALB,Albania
27/03/2020,27,3,2020,28,1,Albania,AL,ALB,2866376,2020-03-27,AL,ALB,Albania
26/03/2020,26,3,2020,23,0,Albania,AL,ALB,2866376,2020-03-26,AL,ALB,Albania
25/03/2020,25,3,2020,23,1,Albania,AL,ALB,2866376,2020-03-25,AL,ALB,Albania
24/03/2020,24,3,2020,11,2,Albania,AL,ALB,2866376,2020-03-24,AL,ALB,Albania
23/03/2020,23,3,2020,13,0,Albania,AL,ALB,2866376,2020-03-23,AL,ALB,Albania
22/03/2020,22,3,2020,6,0,Albania,AL,ALB,2866376,2020-03-22,AL,ALB,Albania
21/03/2020,21,3,2020,0,0,Albania,AL,ALB,2866376,2020-03-21,AL,ALB,Albania
20/03/2020,20,3,2020,11,0,Albania,AL,ALB,2866376,2020-03-20,AL,ALB,Albania
19/03/2020,19,3,2020,4,1,Albania,AL,ALB,2866376,2020-03-19,AL,ALB,Albania
18/03/2020,18,3,2020,4,0,Albania,AL,ALB,2866376,2020-03-18,AL,ALB,Albania
17/03/2020,17,3,2020,9,0,Albania,AL,ALB,2866376,2020-03-17,AL,ALB,Albania
16/03/2020,16,3,2020,4,0,Albania,AL,ALB,2866376,2020-03-16,AL,ALB,Albania
15/03/2020,15,3,2020,5,0,Albania,AL,ALB,2866376,2020-03-15,AL,ALB,Albania
14/03/2020,14,3,2020,10,0,Albania,AL,ALB,2866376,2020-03-14,AL,ALB,Albania
13/03/2020,13,3,2020,12,0,Albania,AL,ALB,2866376,2020-03-13,AL,ALB,Albania
12/03/2020,12,3,2020,1,1,Albania,AL,ALB,2866376,2020-03-12,AL,ALB,Albania
11/03/2020,11,3,2020,4,0,Albania,AL,ALB,2866376,2020-03-11,AL,ALB,Albania
10/03/2020,10,3,2020,4,0,Albania,AL,ALB,2866376,2020-03-10,AL,ALB,Albania
09/03/2020,9,3,2020,2,0,Albania,AL,ALB,2866376,2020-03-09,AL,ALB,Albania
13/04/2020,13,4,2020,89,18,Algeria,DZ,DZA,42228429,2020-04-13,DZ,DZA,Algeria
12/04/2020,12,4,2020,64,19,Algeria,DZ,DZA,42228429,2020-04-12,DZ,DZA,Algeria
11/04/2020,11,4,2020,95,21,Algeria,DZ,DZA,42228429,2020-04-11,DZ,DZA,Algeria
10/04/2020,10,4,2020,94,30,Algeria,DZ,DZA,42228429,2020-04-10,DZ,DZA,Algeria
09/04/2020,9,4,2020,104,11,Algeria,DZ,DZA,42228429,2020-04-09,DZ,DZA,Algeria
08/04/2020,8,4,2020,45,21,Algeria,DZ,DZA,42228429,2020-04-08,DZ,DZA,Algeria
07/04/2020,7,4,2020,103,21,Algeria,DZ,DZA,42228429,2020-04-07,DZ,DZA,Algeria
06/04/2020,6,4,2020,20,22,Algeria,DZ,DZA,42228429,2020-04-06,DZ,DZA,Algeria
05/04/2020,5,4,2020,314,47,Algeria,DZ,DZA,42228429,2020-04-05,DZ,DZA,Algeria
04/04/2020,4,4,2020,139,25,Algeria,DZ,DZA,42228429,2020-04-04,DZ,DZA,Algeria
03/04/2020,3,4,2020,0,0,Algeria,DZ,DZA,42228429,2020-04-03,DZ,DZA,Algeria
02/04/2020,2,4,2020,263,23,Algeria,DZ,DZA,42228429,2020-04-02,DZ,DZA,Algeria
01/04/2020,1,4,2020,73,4,Algeria,DZ,DZA,42228429,2020-04-01,DZ,DZA,Algeria
31/03/2020,31,3,2020,57,2,Algeria,DZ,DZA,42228429,2020-03-31,DZ,DZA,Algeria
30/03/2020,30,3,2020,45,3,Algeria,DZ,DZA,42228429,2020-03-30,DZ,DZA,Algeria
29/03/2020,29,3,2020,104,5,Algeria,DZ,DZA,42228429,2020-03-29,DZ,DZA,Algeria
28/03/2020,28,3,2020,0,0,Algeria,DZ,DZA,42228429,2020-03-28,DZ,DZA,Algeria
27/03/2020,27,3,2020,41,4,Algeria,DZ,DZA,42228429,2020-03-27,DZ,DZA,Algeria
26/03/2020,26,3,2020,33,0,Algeria,DZ,DZA,42228429,2020-03-26,DZ,DZA,Algeria
25/03/2020,25,3,2020,42,0,Algeria,DZ,DZA,42228429,2020-03-25,DZ,DZA,Algeria
24/03/2020,24,3,2020,87,2,Algeria,DZ,DZA,42228429,2020-03-24,DZ,DZA,Algeria
23/03/2020,23,3,2020,8,5,Algeria,DZ,DZA,42228429,2020-03-23,DZ,DZA,Algeria
22/03/2020,22,3,2020,0,0,Algeria,DZ,DZA,42228429,2020-03-22,DZ,DZA,Algeria
21/03/2020,21,3,2020,12,3,Algeria,DZ,DZA,42228429,2020-03-21,DZ,DZA,Algeria
20/03/2020,20,3,2020,9,1,Algeria,DZ,DZA,42228429,2020-03-20,DZ,DZA,Algeria
19/03/2020,19,3,2020,13,1,Algeria,DZ,DZA,42228429,2020-03-19,DZ,DZA,Algeria
18/03/2020,18,3,2020,0,1,Algeria,DZ,DZA,42228429,2020-03-18,DZ,DZA,Algeria
17/03/2020,17,3,2020,12,0,Algeria,DZ,DZA,42228429,2020-03-17,DZ,DZA,Algeria
16/03/2020,16,3,2020,11,2,Algeria,DZ,DZA,42228429,2020-03-16,DZ,DZA,Algeria
15/03/2020,15,3,2020,11,0,Algeria,DZ,DZA,42228429,2020-03-15,DZ,DZA,Algeria
14/03/2020,14,3,2020,2,1,Algeria,DZ,DZA,42228429,2020-03-14,DZ,DZA,Algeria
13/03/2020,13,3,2020,4,1,Algeria,DZ,DZA,42228429,2020-03-13,DZ,DZA,Algeria
12/03/2020,12,3,2020,0,0,Algeria,DZ,DZA,42228429,2020-03-12,DZ,DZA,Algeria
09/03/2020,9,3,2020,3,0,Algeria,DZ,DZA,42228429,2020-03-09,DZ,DZA,Algeria
06/03/2020,6,3,2020,5,0,Algeria,DZ,DZA,42228429,2020-03-06,DZ,DZA,Algeria
05/03/2020,5,3,2020,7,0,Algeria,DZ,DZA,42228429,2020-03-05,DZ,DZA,Algeria
04/03/2020,4,3,2020,2,0,Algeria,DZ,DZA,42228429,2020-03-04,DZ,DZA,Algeria
02/03/2020,2,3,2020,2,0,Algeria,DZ,DZA,42228429,2020-03-02,DZ,DZA,Algeria
01/03/2020,1,3,2020,0,0,Algeria,DZ,DZA,42228429,2020-03-01,DZ,DZA,Algeria
29/02/2020,29,2,2020,0,0,Algeria,DZ,DZA,42228429,2020-02-29,DZ,DZA,Algeria
28/02/2020,28,2,2020,0,0,Algeria,DZ,DZA,42228429,2020-02-28,DZ,DZA,Algeria
27/02/2020,27,2,2020,0,0,Algeria,DZ,DZA,42228429,2020-02-27,DZ,DZA,Algeria
26/02/2020,26,2,2020,1,0,Algeria,DZ,DZA,42228429,2020-02-26,DZ,DZA,Algeria
25/02/2020,25,2,2020,0,0,Algeria,DZ,DZA,42228429,2020-02-25,DZ,DZA,Algeria
24/02/2020,24,2,2020,0,0,Algeria,DZ,DZA,42228429,2020-02-24,DZ,DZA,Algeria
23/02/2020,23,2,2020,0,0,Algeria,DZ,DZA,42228429,2020-02-23,DZ,DZA,Algeria
22/02/2020,22,2,2020,0,0,Algeria,DZ,DZA,42228429,2020-02-22,DZ,DZA,Algeria
21/02/2020,21,2,2020,0,0,Algeria,DZ,DZA,42228429,2020-02-21,DZ,DZA,Algeria
20/02/2020,20,2,2020,0,0,Algeria,DZ,DZA,42228429,2020-02-20,DZ,DZA,Algeria
19/02/2020,19,2,2020,0,0,Algeria,DZ,DZA,42228429,2020-02-19,DZ,DZA,Algeria
18/02/2020,18,2,2020,0,0,Algeria,DZ,DZA,42228429,2020-02-18,DZ,DZA,Algeria
17/02/2020,17,2,2020,0,0,Algeria,DZ,DZA,42228429,2020-02-17,DZ,DZA,Algeria
16/02/2020,16,2,2020,0,0,Algeria,DZ,DZA,42228429,2020-02-16,DZ,DZA,Algeria
15/02/2020,15,2,2020,0,0,Algeria,DZ,DZA,42228429,2020-02-15,DZ,DZA,Algeria
14/02/2020,14,2,2020,0,0,Algeria,DZ,DZA,42228429,2020-02-14,DZ,DZA,Algeria
13/02/2020,13,2,2020,0,0,Algeria,DZ,DZA,42228429,2020-02-13,DZ,DZA,Algeria
12/02/2020,12,2,2020,0,0,Algeria,DZ,DZA,42228429,2020-02-12,DZ,DZA,Algeria
11/02/2020,11,2,2020,0,0,Algeria,DZ,DZA,42228429,2020-02-11,DZ,DZA,Algeria
10/02/2020,10,2,2020,0,0,Algeria,DZ,DZA,42228429,2020-02-10,DZ,DZA,Algeria
09/02/2020,9,2,2020,0,0,Algeria,DZ,DZA,42228429,2020-02-09,DZ,DZA,Algeria
08/02/2020,8,2,2020,0,0,Algeria,DZ,DZA,42228429,2020-02-08,DZ,DZA,Algeria
07/02/2020,7,2,2020,0,0,Algeria,DZ,DZA,42228429,2020-02-07,DZ,DZA,Algeria
06/02/2020,6,2,2020,0,0,Algeria,DZ,DZA,42228429,2020-02-06,DZ,DZA,Algeria
05/02/2020,5,2,2020,0,0,Algeria,DZ,DZA,42228429,2020-02-05,DZ,DZA,Algeria
04/02/2020,4,2,2020,0,0,Algeria,DZ,DZA,42228429,2020-02-04,DZ,DZA,Algeria
03/02/2020,3,2,2020,0,0,Algeria,DZ,DZA,42228429,2020-02-03,DZ,DZA,Algeria
02/02/2020,2,2,2020,0,0,Algeria,DZ,DZA,42228429,2020-02-02,DZ,DZA,Algeria
01/02/2020,1,2,2020,0,0,Algeria,DZ,DZA,42228429,2020-02-01,DZ,DZA,Algeria
31/01/2020,31,1,2020,0,0,Algeria,DZ,DZA,42228429,2020-01-31,DZ,DZA,Algeria
30/01/2020,30,1,2020,0,0,Algeria,DZ,DZA,42228429,2020-01-30,DZ,DZA,Algeria
29/01/2020,29,1,2020,0,0,Algeria,DZ,DZA,42228429,2020-01-29,DZ,DZA,Algeria
28/01/2020,28,1,2020,0,0,Algeria,DZ,DZA,42228429,2020-01-28,DZ,DZA,Algeria
27/01/2020,27,1,2020,0,0,Algeria,DZ,DZA,42228429,2020-01-27,DZ,DZA,Algeria
26/01/2020,26,1,2020,0,0,Algeria,DZ,DZA,42228429,2020-01-26,DZ,DZA,Algeria
25/01/2020,25,1,2020,0,0,Algeria,DZ,DZA,42228429,2020-01-25,DZ,DZA,Algeria
24/01/2020,24,1,2020,0,0,Algeria,DZ,DZA,42228429,2020-01-24,DZ,DZA,Algeria
23/01/2020,23,1,2020,0,0,Algeria,DZ,DZA,42228429,2020-01-23,DZ,DZA,Algeria
22/01/2020,22,1,2020,0,0,Algeria,DZ,DZA,42228429,2020-01-22,DZ,DZA,Algeria
21/01/2020,21,1,2020,0,0,Algeria,DZ,DZA,42228429,2020-01-21,DZ,DZA,Algeria
20/01/2020,20,1,2020,0,0,Algeria,DZ,DZA,42228429,2020-01-20,DZ,DZA,Algeria
19/01/2020,19,1,2020,0,0,Algeria,DZ,DZA,42228429,2020-01-19,DZ,DZA,Algeria
18/01/2020,18,1,2020,0,0,Algeria,DZ,DZA,42228429,2020-01-18,DZ,DZA,Algeria
17/01/2020,17,1,2020,0,0,Algeria,DZ,DZA,42228429,2020-01-17,DZ,DZA,Algeria
16/01/2020,16,1,2020,0,0,Algeria,DZ,DZA,42228429,2020-01-16,DZ,DZA,Algeria
15/01/2020,15,1,2020,0,0,Algeria,DZ,DZA,42228429,2020-01-15,DZ,DZA,Algeria
14/01/2020,14,1,2020,0,0,Algeria,DZ,DZA,42228429,2020-01-14,DZ,DZA,Algeria
13/01/2020,13,1,2020,0,0,Algeria,DZ,DZA,42228429,2020-01-13,DZ,DZA,Algeria
12/01/2020,12,1,2020,0,0,Algeria,DZ,DZA,42228429,2020-01-12,DZ,DZA,Algeria
11/01/2020,11,1,2020,0,0,Algeria,DZ,DZA,42228429,2020-01-11,DZ,DZA,Algeria
10/01/2020,10,1,2020,0,0,Algeria,DZ,DZA,42228429,2020-01-10,DZ,DZA,Algeria
09/01/2020,9,1,2020,0,0,Algeria,DZ,DZA,42228429,2020-01-09,DZ,DZA,Algeria
08/01/2020,8,1,2020,0,0,Algeria,DZ,DZA,42228429,2020-01-08,DZ,DZA,Algeria
07/01/2020,7,1,2020,0,0,Algeria,DZ,DZA,42228429,2020-01-07,DZ,DZA,Algeria
06/01/2020,6,1,2020,0,0,Algeria,DZ,DZA,42228429,2020-01-06,DZ,DZA,Algeria
05/01/2020,5,1,2020,0,0,Algeria,DZ,DZA,42228429,2020-01-05,DZ,DZA,Algeria
04/01/2020,4,1,2020,0,0,Algeria,DZ,DZA,42228429,2020-01-04,DZ,DZA,Algeria
03/01/2020,3,1,2020,0,0,Algeria,DZ,DZA,42228429,2020-01-03,DZ,DZA,Algeria
02/01/2020,2,1,2020,0,0,Algeria,DZ,DZA,42228429,2020-01-02,DZ,DZA,Algeria
01/01/2020,1,1,2020,0,0,Algeria,DZ,DZA,42228429,2020-01-01,DZ,DZA,Algeria
31/12/2019,31,12,2019,0,0,Algeria,DZ,DZA,42228429,2019-12-31,DZ,DZA,Algeria
13/04/2020,13,4,2020,16,1,Andorra,AD,AND,77006,2020-04-13,AD,AND,Andorra
12/04/2020,12,4,2020,21,2,Andorra,AD,AND,77006,2020-04-12,AD,AND,Andorra
11/04/2020,11,4,2020,18,1,Andorra,AD,AND,77006,2020-04-11,AD,AND,Andorra
10/04/2020,10,4,2020,19,2,Andorra,AD,AND,77006,2020-04-10,AD,AND,Andorra
09/04/2020,9,4,2020,19,1,Andorra,AD,AND,77006,2020-04-09,AD,AND,Andorra
08/04/2020,8,4,2020,19,1,Andorra,AD,AND,77006,2020-04-08,AD,AND,Andorra
07/04/2020,7,4,2020,25,3,Andorra,AD,AND,77006,2020-04-07,AD,AND,Andorra
06/04/2020,6,4,2020,35,1,Andorra,AD,AND,77006,2020-04-06,AD,AND,Andorra
05/04/2020,5,4,2020,27,1,Andorra,AD,AND,77006,2020-04-05,AD,AND,Andorra
04/04/2020,4,4,2020,11,1,Andorra,AD,AND,77006,2020-04-04,AD,AND,Andorra
03/04/2020,3,4,2020,38,1,Andorra,AD,AND,77006,2020-04-03,AD,AND,Andorra
02/04/2020,2,4,2020,14,2,Andorra,AD,AND,77006,2020-04-02,AD,AND,Andorra
01/04/2020,1,4,2020,6,4,Andorra,AD,AND,77006,2020-04-01,AD,AND,Andorra
31/03/2020,31,3,2020,36,2,Andorra,AD,AND,77006,2020-03-31,AD,AND,Andorra
30/03/2020,30,3,2020,26,2,Andorra,AD,AND,77006,2020-03-30,AD,AND,Andorra
29/03/2020,29,3,2020,41,1,Andorra,AD,AND,77006,2020-03-29,AD,AND,Andorra
28/03/2020,28,3,2020,43,0,Andorra,AD,AND,77006,2020-03-28,AD,AND,Andorra
27/03/2020,27,3,2020,36,3,Andorra,AD,AND,77006,2020-03-27,AD,AND,Andorra
26/03/2020,26,3,2020,24,0,Andorra,AD,AND,77006,2020-03-26,AD,AND,Andorra
25/03/2020,25,3,2020,31,0,Andorra,AD,AND,77006,2020-03-25,AD,AND,Andorra
24/03/2020,24,3,2020,20,0,Andorra,AD,AND,77006,2020-03-24,AD,AND,Andorra
23/03/2020,23,3,2020,25,0,Andorra,AD,AND,77006,2020-03-23,AD,AND,Andorra
22/03/2020,22,3,2020,13,0,Andorra,AD,AND,77006,2020-03-22,AD,AND,Andorra
21/03/2020,21,3,2020,0,0,Andorra,AD,AND,77006,2020-03-21,AD,AND,Andorra
20/03/2020,20,3,2020,22,0,Andorra,AD,AND,77006,2020-03-20,AD,AND,Andorra
19/03/2020,19,3,2020,39,0,Andorra,AD,AND,77006,2020-03-19,AD,AND,Andorra
18/03/2020,18,3,2020,0,0,Andorra,AD,AND,77006,2020-03-18,AD,AND,Andorra
17/03/2020,17,3,2020,9,0,Andorra,AD,AND,77006,2020-03-17,AD,AND,Andorra
16/03/2020,16,3,2020,3,0,Andorra,AD,AND,77006,2020-03-16,AD,AND,Andorra
14/03/2020,14,3,2020,1,0,Andorra,AD,AND,77006,2020-03-14,AD,AND,Andorra
03/03/2020,3,3,2020,1,0,Andorra,AD,AND,77006,2020-03-03,AD,AND,Andorra
13/04/2020,13,4,2020,0,0,Angola,AO,AGO,30809762,2020-04-13,AO,AGO,Angola
12/04/2020,12,4,2020,0,0,Angola,AO,AGO,30809762,2020-04-12,AO,AGO,Angola
11/04/2020,11,4,2020,0,0,Angola,AO,AGO,30809762,2020-04-11,AO,AGO,Angola
10/04/2020,10,4,2020,0,0,Angola,AO,AGO,30809762,2020-04-10,AO,AGO,Angola
09/04/2020,9,4,2020,2,0,Angola,AO,AGO,30809762,2020-04-09,AO,AGO,Angola
08/04/2020,8,4,2020,1,0,Angola,AO,AGO,30809762,2020-04-08,AO,AGO,Angola
07/04/2020,7,4,2020,2,0,Angola,AO,AGO,30809762,2020-04-07,AO,AGO,Angola
06/04/2020,6,4,2020,4,0,Angola,AO,AGO,30809762,2020-04-06,AO,AGO,Angola
05/04/2020,5,4,2020,2,0,Angola,AO,AGO,30809762,2020-04-05,AO,AGO,Angola
04/04/2020,4,4,2020,0,0,Angola,AO,AGO,30809762,2020-04-04,AO,AGO,Angola
03/04/2020,3,4,2020,0,0,Angola,AO,AGO,30809762,2020-04-03,AO,AGO,Angola
02/04/2020,2,4,2020,1,0,Angola,AO,AGO,30809762,2020-04-02,AO,AGO,Angola
01/04/2020,1,4,2020,0,0,Angola,AO,AGO,30809762,2020-04-01,AO,AGO,Angola
31/03/2020,31,3,2020,0,0,Angola,AO,AGO,30809762,2020-03-31,AO,AGO,Angola
30/03/2020,30,3,2020,3,2,Angola,AO,AGO,30809762,2020-03-30,AO,AGO,Angola
29/03/2020,29,3,2020,0,0,Angola,AO,AGO,30809762,2020-03-29,AO,AGO,Angola
28/03/2020,28,3,2020,1,0,Angola,AO,AGO,30809762,2020-03-28,AO,AGO,Angola
27/03/2020,27,3,2020,1,0,Angola,AO,AGO,30809762,2020-03-27,AO,AGO,Angola
26/03/2020,26,3,2020,0,0,Angola,AO,AGO,30809762,2020-03-26,AO,AGO,Angola
25/03/2020,25,3,2020,0,0,Angola,AO,AGO,30809762,2020-03-25,AO,AGO,Angola
24/03/2020,24,3,2020,0,0,Angola,AO,AGO,30809762,2020-03-24,AO,AGO,Angola
23/03/2020,23,3,2020,0,0,Angola,AO,AGO,30809762,2020-03-23,AO,AGO,Angola
22/03/2020,22,3,2020,2,0,Angola,AO,AGO,30809762,2020-03-22,AO,AGO,Angola
13/04/2020,13,4,2020,0,0,Anguilla,AI,,NA,2020-04-13,AI,AIA,Anguilla
12/04/2020,12,4,2020,0,0,Anguilla,AI,,NA,2020-04-12,AI,AIA,Anguilla
11/04/2020,11,4,2020,0,0,Anguilla,AI,,NA,2020-04-11,AI,AIA,Anguilla
10/04/2020,10,4,2020,0,0,Anguilla,AI,,NA,2020-04-10,AI,AIA,Anguilla
09/04/2020,9,4,2020,0,0,Anguilla,AI,,NA,2020-04-09,AI,AIA,Anguilla
08/04/2020,8,4,2020,0,0,Anguilla,AI,,NA,2020-04-08,AI,AIA,Anguilla
07/04/2020,7,4,2020,0,0,Anguilla,AI,,NA,2020-04-07,AI,AIA,Anguilla
06/04/2020,6,4,2020,0,0,Anguilla,AI,,NA,2020-04-06,AI,AIA,Anguilla
05/04/2020,5,4,2020,0,0,Anguilla,AI,,NA,2020-04-05,AI,AIA,Anguilla
04/04/2020,4,4,2020,0,0,Anguilla,AI,,NA,2020-04-04,AI,AIA,Anguilla
03/04/2020,3,4,2020,1,0,Anguilla,AI,,NA,2020-04-03,AI,AIA,Anguilla
02/04/2020,2,4,2020,0,0,Anguilla,AI,,NA,2020-04-02,AI,AIA,Anguilla
01/04/2020,1,4,2020,0,0,Anguilla,AI,,NA,2020-04-01,AI,AIA,Anguilla
31/03/2020,31,3,2020,0,0,Anguilla,AI,,NA,2020-03-31,AI,AIA,Anguilla
30/03/2020,30,3,2020,0,0,Anguilla,AI,,NA,2020-03-30,AI,AIA,Anguilla
29/03/2020,29,3,2020,0,0,Anguilla,AI,,NA,2020-03-29,AI,AIA,Anguilla
28/03/2020,28,3,2020,0,0,Anguilla,AI,,NA,2020-03-28,AI,AIA,Anguilla
27/03/2020,27,3,2020,2,0,Anguilla,AI,,NA,2020-03-27,AI,AIA,Anguilla
13/04/2020,13,4,2020,0,0,Antigua_and_Barbuda,AG,ATG,96286,2020-04-13,AG,ATG,Antigua and Barbuda
12/04/2020,12,4,2020,0,0,Antigua_and_Barbuda,AG,ATG,96286,2020-04-12,AG,ATG,Antigua and Barbuda
11/04/2020,11,4,2020,2,0,Antigua_and_Barbuda,AG,ATG,96286,2020-04-11,AG,ATG,Antigua and Barbuda
10/04/2020,10,4,2020,4,2,Antigua_and_Barbuda,AG,ATG,96286,2020-04-10,AG,ATG,Antigua and Barbuda
09/04/2020,9,4,2020,0,0,Antigua_and_Barbuda,AG,ATG,96286,2020-04-09,AG,ATG,Antigua and Barbuda
08/04/2020,8,4,2020,0,0,Antigua_and_Barbuda,AG,ATG,96286,2020-04-08,AG,ATG,Antigua and Barbuda
07/04/2020,7,4,2020,0,0,Antigua_and_Barbuda,AG,ATG,96286,2020-04-07,AG,ATG,Antigua and Barbuda
06/04/2020,6,4,2020,0,0,Antigua_and_Barbuda,AG,ATG,96286,2020-04-06,AG,ATG,Antigua and Barbuda
05/04/2020,5,4,2020,0,0,Antigua_and_Barbuda,AG,ATG,96286,2020-04-05,AG,ATG,Antigua and Barbuda
04/04/2020,4,4,2020,6,0,Antigua_and_Barbuda,AG,ATG,96286,2020-04-04,AG,ATG,Antigua and Barbuda
03/04/2020,3,4,2020,2,0,Antigua_and_Barbuda,AG,ATG,96286,2020-04-03,AG,ATG,Antigua and Barbuda
02/04/2020,2,4,2020,0,0,Antigua_and_Barbuda,AG,ATG,96286,2020-04-02,AG,ATG,Antigua and Barbuda
01/04/2020,1,4,2020,0,0,Antigua_and_Barbuda,AG,ATG,96286,2020-04-01,AG,ATG,Antigua and Barbuda
31/03/2020,31,3,2020,0,0,Antigua_and_Barbuda,AG,ATG,96286,2020-03-31,AG,ATG,Antigua and Barbuda
30/03/2020,30,3,2020,0,0,Antigua_and_Barbuda,AG,ATG,96286,2020-03-30,AG,ATG,Antigua and Barbuda
29/03/2020,29,3,2020,0,0,Antigua_and_Barbuda,AG,ATG,96286,2020-03-29,AG,ATG,Antigua and Barbuda
28/03/2020,28,3,2020,0,0,Antigua_and_Barbuda,AG,ATG,96286,2020-03-28,AG,ATG,Antigua and Barbuda
27/03/2020,27,3,2020,4,0,Antigua_and_Barbuda,AG,ATG,96286,2020-03-27,AG,ATG,Antigua and Barbuda
26/03/2020,26,3,2020,0,0,Antigua_and_Barbuda,AG,ATG,96286,2020-03-26,AG,ATG,Antigua and Barbuda
25/03/2020,25,3,2020,2,0,Antigua_and_Barbuda,AG,ATG,96286,2020-03-25,AG,ATG,Antigua and Barbuda
24/03/2020,24,3,2020,0,0,Antigua_and_Barbuda,AG,ATG,96286,2020-03-24,AG,ATG,Antigua and Barbuda
23/03/2020,23,3,2020,0,0,Antigua_and_Barbuda,AG,ATG,96286,2020-03-23,AG,ATG,Antigua and Barbuda
22/03/2020,22,3,2020,0,0,Antigua_and_Barbuda,AG,ATG,96286,2020-03-22,AG,ATG,Antigua and Barbuda
21/03/2020,21,3,2020,0,0,Antigua_and_Barbuda,AG,ATG,96286,2020-03-21,AG,ATG,Antigua and Barbuda
15/03/2020,15,3,2020,1,0,Antigua_and_Barbuda,AG,ATG,96286,2020-03-15,AG,ATG,Antigua and Barbuda
13/04/2020,13,4,2020,71,6,Argentina,AR,ARG,44494502,2020-04-13,AR,ARG,Argentina
12/04/2020,12,4,2020,162,7,Argentina,AR,ARG,44494502,2020-04-12,AR,ARG,Argentina
11/04/2020,11,4,2020,81,3,Argentina,AR,ARG,44494502,2020-04-11,AR,ARG,Argentina
10/04/2020,10,4,2020,99,14,Argentina,AR,ARG,44494502,2020-04-10,AR,ARG,Argentina
09/04/2020,9,4,2020,80,5,Argentina,AR,ARG,44494502,2020-04-09,AR,ARG,Argentina
08/04/2020,8,4,2020,87,7,Argentina,AR,ARG,44494502,2020-04-08,AR,ARG,Argentina
07/04/2020,7,4,2020,74,7,Argentina,AR,ARG,44494502,2020-04-07,AR,ARG,Argentina
06/04/2020,6,4,2020,103,3,Argentina,AR,ARG,44494502,2020-04-06,AR,ARG,Argentina
05/04/2020,5,4,2020,186,6,Argentina,AR,ARG,44494502,2020-04-05,AR,ARG,Argentina
04/04/2020,4,4,2020,132,3,Argentina,AR,ARG,44494502,2020-04-04,AR,ARG,Argentina
03/04/2020,3,4,2020,0,3,Argentina,AR,ARG,44494502,2020-04-03,AR,ARG,Argentina
02/04/2020,2,4,2020,167,7,Argentina,AR,ARG,44494502,2020-04-02,AR,ARG,Argentina
01/04/2020,1,4,2020,0,0,Argentina,AR,ARG,44494502,2020-04-01,AR,ARG,Argentina
31/03/2020,31,3,2020,146,4,Argentina,AR,ARG,44494502,2020-03-31,AR,ARG,Argentina
30/03/2020,30,3,2020,75,1,Argentina,AR,ARG,44494502,2020-03-30,AR,ARG,Argentina
29/03/2020,29,3,2020,55,2,Argentina,AR,ARG,44494502,2020-03-29,AR,ARG,Argentina
28/03/2020,28,3,2020,101,5,Argentina,AR,ARG,44494502,2020-03-28,AR,ARG,Argentina
27/03/2020,27,3,2020,87,4,Argentina,AR,ARG,44494502,2020-03-27,AR,ARG,Argentina
26/03/2020,26,3,2020,115,2,Argentina,AR,ARG,44494502,2020-03-26,AR,ARG,Argentina
25/03/2020,25,3,2020,86,2,Argentina,AR,ARG,44494502,2020-03-25,AR,ARG,Argentina
24/03/2020,24,3,2020,35,0,Argentina,AR,ARG,44494502,2020-03-24,AR,ARG,Argentina
23/03/2020,23,3,2020,41,0,Argentina,AR,ARG,44494502,2020-03-23,AR,ARG,Argentina
22/03/2020,22,3,2020,67,1,Argentina,AR,ARG,44494502,2020-03-22,AR,ARG,Argentina
21/03/2020,21,3,2020,30,0,Argentina,AR,ARG,44494502,2020-03-21,AR,ARG,Argentina
20/03/2020,20,3,2020,31,1,Argentina,AR,ARG,44494502,2020-03-20,AR,ARG,Argentina
19/03/2020,19,3,2020,18,0,Argentina,AR,ARG,44494502,2020-03-19,AR,ARG,Argentina
18/03/2020,18,3,2020,14,0,Argentina,AR,ARG,44494502,2020-03-18,AR,ARG,Argentina
17/03/2020,17,3,2020,9,0,Argentina,AR,ARG,44494502,2020-03-17,AR,ARG,Argentina
16/03/2020,16,3,2020,11,0,Argentina,AR,ARG,44494502,2020-03-16,AR,ARG,Argentina
15/03/2020,15,3,2020,11,0,Argentina,AR,ARG,44494502,2020-03-15,AR,ARG,Argentina
14/03/2020,14,3,2020,3,1,Argentina,AR,ARG,44494502,2020-03-14,AR,ARG,Argentina
13/03/2020,13,3,2020,12,0,Argentina,AR,ARG,44494502,2020-03-13,AR,ARG,Argentina
11/03/2020,11,3,2020,7,0,Argentina,AR,ARG,44494502,2020-03-11,AR,ARG,Argentina
09/03/2020,9,3,2020,3,0,Argentina,AR,ARG,44494502,2020-03-09,AR,ARG,Argentina
08/03/2020,8,3,2020,1,1,Argentina,AR,ARG,44494502,2020-03-08,AR,ARG,Argentina
07/03/2020,7,3,2020,6,0,Argentina,AR,ARG,44494502,2020-03-07,AR,ARG,Argentina
06/03/2020,6,3,2020,1,0,Argentina,AR,ARG,44494502,2020-03-06,AR,ARG,Argentina
04/03/2020,4,3,2020,1,0,Argentina,AR,ARG,44494502,2020-03-04,AR,ARG,Argentina
13/04/2020,13,4,2020,46,0,Armenia,AM,ARM,2951776,2020-04-13,AM,ARM,Armenia
12/04/2020,12,4,2020,30,2,Armenia,AM,ARM,2951776,2020-04-12,AM,ARM,Armenia
11/04/2020,11,4,2020,16,1,Armenia,AM,ARM,2951776,2020-04-11,AM,ARM,Armenia
10/04/2020,10,4,2020,40,1,Armenia,AM,ARM,2951776,2020-04-10,AM,ARM,Armenia
09/04/2020,9,4,2020,28,1,Armenia,AM,ARM,2951776,2020-04-09,AM,ARM,Armenia
08/04/2020,8,4,2020,20,0,Armenia,AM,ARM,2951776,2020-04-08,AM,ARM,Armenia
07/04/2020,7,4,2020,11,1,Armenia,AM,ARM,2951776,2020-04-07,AM,ARM,Armenia
06/04/2020,6,4,2020,52,0,Armenia,AM,ARM,2951776,2020-04-06,AM,ARM,Armenia
05/04/2020,5,4,2020,34,0,Armenia,AM,ARM,2951776,2020-04-05,AM,ARM,Armenia
04/04/2020,4,4,2020,73,3,Armenia,AM,ARM,2951776,2020-04-04,AM,ARM,Armenia
03/04/2020,3,4,2020,92,1,Armenia,AM,ARM,2951776,2020-04-03,AM,ARM,Armenia
02/04/2020,2,4,2020,39,0,Armenia,AM,ARM,2951776,2020-04-02,AM,ARM,Armenia
01/04/2020,1,4,2020,50,0,Armenia,AM,ARM,2951776,2020-04-01,AM,ARM,Armenia
31/03/2020,31,3,2020,58,0,Armenia,AM,ARM,2951776,2020-03-31,AM,ARM,Armenia
30/03/2020,30,3,2020,0,0,Armenia,AM,ARM,2951776,2020-03-30,AM,ARM,Armenia
29/03/2020,29,3,2020,52,2,Armenia,AM,ARM,2951776,2020-03-29,AM,ARM,Armenia
28/03/2020,28,3,2020,43,0,Armenia,AM,ARM,2951776,2020-03-28,AM,ARM,Armenia
27/03/2020,27,3,2020,39,1,Armenia,AM,ARM,2951776,2020-03-27,AM,ARM,Armenia
26/03/2020,26,3,2020,25,0,Armenia,AM,ARM,2951776,2020-03-26,AM,ARM,Armenia
25/03/2020,25,3,2020,71,0,Armenia,AM,ARM,2951776,2020-03-25,AM,ARM,Armenia
24/03/2020,24,3,2020,4,0,Armenia,AM,ARM,2951776,2020-03-24,AM,ARM,Armenia
23/03/2020,23,3,2020,30,0,Armenia,AM,ARM,2951776,2020-03-23,AM,ARM,Armenia
22/03/2020,22,3,2020,24,0,Armenia,AM,ARM,2951776,2020-03-22,AM,ARM,Armenia
21/03/2020,21,3,2020,14,0,Armenia,AM,ARM,2951776,2020-03-21,AM,ARM,Armenia
20/03/2020,20,3,2020,7,0,Armenia,AM,ARM,2951776,2020-03-20,AM,ARM,Armenia
19/03/2020,19,3,2020,37,0,Armenia,AM,ARM,2951776,2020-03-19,AM,ARM,Armenia
18/03/2020,18,3,2020,26,0,Armenia,AM,ARM,2951776,2020-03-18,AM,ARM,Armenia
17/03/2020,17,3,2020,22,0,Armenia,AM,ARM,2951776,2020-03-17,AM,ARM,Armenia
16/03/2020,16,3,2020,10,0,Armenia,AM,ARM,2951776,2020-03-16,AM,ARM,Armenia
15/03/2020,15,3,2020,7,0,Armenia,AM,ARM,2951776,2020-03-15,AM,ARM,Armenia
14/03/2020,14,3,2020,7,0,Armenia,AM,ARM,2951776,2020-03-14,AM,ARM,Armenia
13/03/2020,13,3,2020,2,0,Armenia,AM,ARM,2951776,2020-03-13,AM,ARM,Armenia
12/03/2020,12,3,2020,3,0,Armenia,AM,ARM,2951776,2020-03-12,AM,ARM,Armenia
02/03/2020,2,3,2020,0,0,Armenia,AM,ARM,2951776,2020-03-02,AM,ARM,Armenia
01/03/2020,1,3,2020,1,0,Armenia,AM,ARM,2951776,2020-03-01,AM,ARM,Armenia
29/02/2020,29,2,2020,0,0,Armenia,AM,ARM,2951776,2020-02-29,AM,ARM,Armenia
28/02/2020,28,2,2020,0,0,Armenia,AM,ARM,2951776,2020-02-28,AM,ARM,Armenia
27/02/2020,27,2,2020,0,0,Armenia,AM,ARM,2951776,2020-02-27,AM,ARM,Armenia
26/02/2020,26,2,2020,0,0,Armenia,AM,ARM,2951776,2020-02-26,AM,ARM,Armenia
25/02/2020,25,2,2020,0,0,Armenia,AM,ARM,2951776,2020-02-25,AM,ARM,Armenia
24/02/2020,24,2,2020,0,0,Armenia,AM,ARM,2951776,2020-02-24,AM,ARM,Armenia
23/02/2020,23,2,2020,0,0,Armenia,AM,ARM,2951776,2020-02-23,AM,ARM,Armenia
22/02/2020,22,2,2020,0,0,Armenia,AM,ARM,2951776,2020-02-22,AM,ARM,Armenia
21/02/2020,21,2,2020,0,0,Armenia,AM,ARM,2951776,2020-02-21,AM,ARM,Armenia
20/02/2020,20,2,2020,0,0,Armenia,AM,ARM,2951776,2020-02-20,AM,ARM,Armenia
19/02/2020,19,2,2020,0,0,Armenia,AM,ARM,2951776,2020-02-19,AM,ARM,Armenia
18/02/2020,18,2,2020,0,0,Armenia,AM,ARM,2951776,2020-02-18,AM,ARM,Armenia
17/02/2020,17,2,2020,0,0,Armenia,AM,ARM,2951776,2020-02-17,AM,ARM,Armenia
16/02/2020,16,2,2020,0,0,Armenia,AM,ARM,2951776,2020-02-16,AM,ARM,Armenia
15/02/2020,15,2,2020,0,0,Armenia,AM,ARM,2951776,2020-02-15,AM,ARM,Armenia
14/02/2020,14,2,2020,0,0,Armenia,AM,ARM,2951776,2020-02-14,AM,ARM,Armenia
13/02/2020,13,2,2020,0,0,Armenia,AM,ARM,2951776,2020-02-13,AM,ARM,Armenia
12/02/2020,12,2,2020,0,0,Armenia,AM,ARM,2951776,2020-02-12,AM,ARM,Armenia
11/02/2020,11,2,2020,0,0,Armenia,AM,ARM,2951776,2020-02-11,AM,ARM,Armenia
10/02/2020,10,2,2020,0,0,Armenia,AM,ARM,2951776,2020-02-10,AM,ARM,Armenia
09/02/2020,9,2,2020,0,0,Armenia,AM,ARM,2951776,2020-02-09,AM,ARM,Armenia
08/02/2020,8,2,2020,0,0,Armenia,AM,ARM,2951776,2020-02-08,AM,ARM,Armenia
07/02/2020,7,2,2020,0,0,Armenia,AM,ARM,2951776,2020-02-07,AM,ARM,Armenia
06/02/2020,6,2,2020,0,0,Armenia,AM,ARM,2951776,2020-02-06,AM,ARM,Armenia
05/02/2020,5,2,2020,0,0,Armenia,AM,ARM,2951776,2020-02-05,AM,ARM,Armenia
04/02/2020,4,2,2020,0,0,Armenia,AM,ARM,2951776,2020-02-04,AM,ARM,Armenia
03/02/2020,3,2,2020,0,0,Armenia,AM,ARM,2951776,2020-02-03,AM,ARM,Armenia
02/02/2020,2,2,2020,0,0,Armenia,AM,ARM,2951776,2020-02-02,AM,ARM,Armenia
01/02/2020,1,2,2020,0,0,Armenia,AM,ARM,2951776,2020-02-01,AM,ARM,Armenia
31/01/2020,31,1,2020,0,0,Armenia,AM,ARM,2951776,2020-01-31,AM,ARM,Armenia
30/01/2020,30,1,2020,0,0,Armenia,AM,ARM,2951776,2020-01-30,AM,ARM,Armenia
29/01/2020,29,1,2020,0,0,Armenia,AM,ARM,2951776,2020-01-29,AM,ARM,Armenia
28/01/2020,28,1,2020,0,0,Armenia,AM,ARM,2951776,2020-01-28,AM,ARM,Armenia
27/01/2020,27,1,2020,0,0,Armenia,AM,ARM,2951776,2020-01-27,AM,ARM,Armenia
26/01/2020,26,1,2020,0,0,Armenia,AM,ARM,2951776,2020-01-26,AM,ARM,Armenia
25/01/2020,25,1,2020,0,0,Armenia,AM,ARM,2951776,2020-01-25,AM,ARM,Armenia
24/01/2020,24,1,2020,0,0,Armenia,AM,ARM,2951776,2020-01-24,AM,ARM,Armenia
23/01/2020,23,1,2020,0,0,Armenia,AM,ARM,2951776,2020-01-23,AM,ARM,Armenia
22/01/2020,22,1,2020,0,0,Armenia,AM,ARM,2951776,2020-01-22,AM,ARM,Armenia
21/01/2020,21,1,2020,0,0,Armenia,AM,ARM,2951776,2020-01-21,AM,ARM,Armenia
20/01/2020,20,1,2020,0,0,Armenia,AM,ARM,2951776,2020-01-20,AM,ARM,Armenia
19/01/2020,19,1,2020,0,0,Armenia,AM,ARM,2951776,2020-01-19,AM,ARM,Armenia
18/01/2020,18,1,2020,0,0,Armenia,AM,ARM,2951776,2020-01-18,AM,ARM,Armenia
17/01/2020,17,1,2020,0,0,Armenia,AM,ARM,2951776,2020-01-17,AM,ARM,Armenia
16/01/2020,16,1,2020,0,0,Armenia,AM,ARM,2951776,2020-01-16,AM,ARM,Armenia
15/01/2020,15,1,2020,0,0,Armenia,AM,ARM,2951776,2020-01-15,AM,ARM,Armenia
14/01/2020,14,1,2020,0,0,Armenia,AM,ARM,2951776,2020-01-14,AM,ARM,Armenia
13/01/2020,13,1,2020,0,0,Armenia,AM,ARM,2951776,2020-01-13,AM,ARM,Armenia
12/01/2020,12,1,2020,0,0,Armenia,AM,ARM,2951776,2020-01-12,AM,ARM,Armenia
11/01/2020,11,1,2020,0,0,Armenia,AM,ARM,2951776,2020-01-11,AM,ARM,Armenia
10/01/2020,10,1,2020,0,0,Armenia,AM,ARM,2951776,2020-01-10,AM,ARM,Armenia
09/01/2020,9,1,2020,0,0,Armenia,AM,ARM,2951776,2020-01-09,AM,ARM,Armenia
08/01/2020,8,1,2020,0,0,Armenia,AM,ARM,2951776,2020-01-08,AM,ARM,Armenia
07/01/2020,7,1,2020,0,0,Armenia,AM,ARM,2951776,2020-01-07,AM,ARM,Armenia
06/01/2020,6,1,2020,0,0,Armenia,AM,ARM,2951776,2020-01-06,AM,ARM,Armenia
05/01/2020,5,1,2020,0,0,Armenia,AM,ARM,2951776,2020-01-05,AM,ARM,Armenia
04/01/2020,4,1,2020,0,0,Armenia,AM,ARM,2951776,2020-01-04,AM,ARM,Armenia
03/01/2020,3,1,2020,0,0,Armenia,AM,ARM,2951776,2020-01-03,AM,ARM,Armenia
02/01/2020,2,1,2020,0,0,Armenia,AM,ARM,2951776,2020-01-02,AM,ARM,Armenia
01/01/2020,1,1,2020,0,0,Armenia,AM,ARM,2951776,2020-01-01,AM,ARM,Armenia
31/12/2019,31,12,2019,0,0,Armenia,AM,ARM,2951776,2019-12-31,AM,ARM,Armenia
13/04/2020,13,4,2020,0,0,Aruba,AW,ABW,105845,2020-04-13,AW,ABW,Aruba
12/04/2020,12,4,2020,6,0,Aruba,AW,ABW,105845,2020-04-12,AW,ABW,Aruba
11/04/2020,11,4,2020,4,0,Aruba,AW,ABW,105845,2020-04-11,AW,ABW,Aruba
10/04/2020,10,4,2020,5,0,Aruba,AW,ABW,105845,2020-04-10,AW,ABW,Aruba
09/04/2020,9,4,2020,3,0,Aruba,AW,ABW,105845,2020-04-09,AW,ABW,Aruba
08/04/2020,8,4,2020,3,0,Aruba,AW,ABW,105845,2020-04-08,AW,ABW,Aruba
07/04/2020,7,4,2020,7,0,Aruba,AW,ABW,105845,2020-04-07,AW,ABW,Aruba
06/04/2020,6,4,2020,0,0,Aruba,AW,ABW,105845,2020-04-06,AW,ABW,Aruba
05/04/2020,5,4,2020,2,0,Aruba,AW,ABW,105845,2020-04-05,AW,ABW,Aruba
04/04/2020,4,4,2020,2,0,Aruba,AW,ABW,105845,2020-04-04,AW,ABW,Aruba
03/04/2020,3,4,2020,5,0,Aruba,AW,ABW,105845,2020-04-03,AW,ABW,Aruba
02/04/2020,2,4,2020,0,0,Aruba,AW,ABW,105845,2020-04-02,AW,ABW,Aruba
01/04/2020,1,4,2020,5,0,Aruba,AW,ABW,105845,2020-04-01,AW,ABW,Aruba
30/03/2020,30,3,2020,22,0,Aruba,AW,ABW,105845,2020-03-30,AW,ABW,Aruba
29/03/2020,29,3,2020,0,0,Aruba,AW,ABW,105845,2020-03-29,AW,ABW,Aruba
28/03/2020,28,3,2020,0,0,Aruba,AW,ABW,105845,2020-03-28,AW,ABW,Aruba
27/03/2020,27,3,2020,9,0,Aruba,AW,ABW,105845,2020-03-27,AW,ABW,Aruba
26/03/2020,26,3,2020,2,0,Aruba,AW,ABW,105845,2020-03-26,AW,ABW,Aruba
25/03/2020,25,3,2020,5,0,Aruba,AW,ABW,105845,2020-03-25,AW,ABW,Aruba
24/03/2020,24,3,2020,8,0,Aruba,AW,ABW,105845,2020-03-24,AW,ABW,Aruba
20/03/2020,20,3,2020,2,0,Aruba,AW,ABW,105845,2020-03-20,AW,ABW,Aruba
13/03/2020,13,3,2020,2,0,Aruba,AW,ABW,105845,2020-03-13,AW,ABW,Aruba
13/04/2020,13,4,2020,33,4,Australia,AU,AUS,24992369,2020-04-13,AU,AUS,Australia
12/04/2020,12,4,2020,51,3,Australia,AU,AUS,24992369,2020-04-12,AU,AUS,Australia
11/04/2020,11,4,2020,86,2,Australia,AU,AUS,24992369,2020-04-11,AU,AUS,Australia
10/04/2020,10,4,2020,100,2,Australia,AU,AUS,24992369,2020-04-10,AU,AUS,Australia
09/04/2020,9,4,2020,96,5,Australia,AU,AUS,24992369,2020-04-09,AU,AUS,Australia
08/04/2020,8,4,2020,112,3,Australia,AU,AUS,24992369,2020-04-08,AU,AUS,Australia
07/04/2020,7,4,2020,100,6,Australia,AU,AUS,24992369,2020-04-07,AU,AUS,Australia
06/04/2020,6,4,2020,57,2,Australia,AU,AUS,24992369,2020-04-06,AU,AUS,Australia
05/04/2020,5,4,2020,139,4,Australia,AU,AUS,24992369,2020-04-05,AU,AUS,Australia
04/04/2020,4,4,2020,324,7,Australia,AU,AUS,24992369,2020-04-04,AU,AUS,Australia
03/04/2020,3,4,2020,248,2,Australia,AU,AUS,24992369,2020-04-03,AU,AUS,Australia
02/04/2020,2,4,2020,269,1,Australia,AU,AUS,24992369,2020-04-02,AU,AUS,Australia
01/04/2020,1,4,2020,150,1,Australia,AU,AUS,24992369,2020-04-01,AU,AUS,Australia
31/03/2020,31,3,2020,464,3,Australia,AU,AUS,24992369,2020-03-31,AU,AUS,Australia
30/03/2020,30,3,2020,284,2,Australia,AU,AUS,24992369,2020-03-30,AU,AUS,Australia
29/03/2020,29,3,2020,431,1,Australia,AU,AUS,24992369,2020-03-29,AU,AUS,Australia
28/03/2020,28,3,2020,212,0,Australia,AU,AUS,24992369,2020-03-28,AU,AUS,Australia
27/03/2020,27,3,2020,367,2,Australia,AU,AUS,24992369,2020-03-27,AU,AUS,Australia
26/03/2020,26,3,2020,376,3,Australia,AU,AUS,24992369,2020-03-26,AU,AUS,Australia
25/03/2020,25,3,2020,600,1,Australia,AU,AUS,24992369,2020-03-25,AU,AUS,Australia
24/03/2020,24,3,2020,114,0,Australia,AU,AUS,24992369,2020-03-24,AU,AUS,Australia
23/03/2020,23,3,2020,611,0,Australia,AU,AUS,24992369,2020-03-23,AU,AUS,Australia
22/03/2020,22,3,2020,224,0,Australia,AU,AUS,24992369,2020-03-22,AU,AUS,Australia
21/03/2020,21,3,2020,165,1,Australia,AU,AUS,24992369,2020-03-21,AU,AUS,Australia
20/03/2020,20,3,2020,144,0,Australia,AU,AUS,24992369,2020-03-20,AU,AUS,Australia
19/03/2020,19,3,2020,111,1,Australia,AU,AUS,24992369,2020-03-19,AU,AUS,Australia
18/03/2020,18,3,2020,79,0,Australia,AU,AUS,24992369,2020-03-18,AU,AUS,Australia
17/03/2020,17,3,2020,77,0,Australia,AU,AUS,24992369,2020-03-17,AU,AUS,Australia
16/03/2020,16,3,2020,49,2,Australia,AU,AUS,24992369,2020-03-16,AU,AUS,Australia
15/03/2020,15,3,2020,52,0,Australia,AU,AUS,24992369,2020-03-15,AU,AUS,Australia
14/03/2020,14,3,2020,41,0,Australia,AU,AUS,24992369,2020-03-14,AU,AUS,Australia
13/03/2020,13,3,2020,30,0,Australia,AU,AUS,24992369,2020-03-13,AU,AUS,Australia
12/03/2020,12,3,2020,14,0,Australia,AU,AUS,24992369,2020-03-12,AU,AUS,Australia
11/03/2020,11,3,2020,12,0,Australia,AU,AUS,24992369,2020-03-11,AU,AUS,Australia
10/03/2020,10,3,2020,20,0,Australia,AU,AUS,24992369,2020-03-10,AU,AUS,Australia
09/03/2020,9,3,2020,6,0,Australia,AU,AUS,24992369,2020-03-09,AU,AUS,Australia
08/03/2020,8,3,2020,11,1,Australia,AU,AUS,24992369,2020-03-08,AU,AUS,Australia
07/03/2020,7,3,2020,4,0,Australia,AU,AUS,24992369,2020-03-07,AU,AUS,Australia
06/03/2020,6,3,2020,7,0,Australia,AU,AUS,24992369,2020-03-06,AU,AUS,Australia
05/03/2020,5,3,2020,11,1,Australia,AU,AUS,24992369,2020-03-05,AU,AUS,Australia
04/03/2020,4,3,2020,8,0,Australia,AU,AUS,24992369,2020-03-04,AU,AUS,Australia
03/03/2020,3,3,2020,4,0,Australia,AU,AUS,24992369,2020-03-03,AU,AUS,Australia
02/03/2020,2,3,2020,3,0,Australia,AU,AUS,24992369,2020-03-02,AU,AUS,Australia
01/03/2020,1,3,2020,1,1,Australia,AU,AUS,24992369,2020-03-01,AU,AUS,Australia
29/02/2020,29,2,2020,2,0,Australia,AU,AUS,24992369,2020-02-29,AU,AUS,Australia
28/02/2020,28,2,2020,0,0,Australia,AU,AUS,24992369,2020-02-28,AU,AUS,Australia
27/02/2020,27,2,2020,1,0,Australia,AU,AUS,24992369,2020-02-27,AU,AUS,Australia
26/02/2020,26,2,2020,0,0,Australia,AU,AUS,24992369,2020-02-26,AU,AUS,Australia
25/02/2020,25,2,2020,0,0,Australia,AU,AUS,24992369,2020-02-25,AU,AUS,Australia
24/02/2020,24,2,2020,0,0,Australia,AU,AUS,24992369,2020-02-24,AU,AUS,Australia
23/02/2020,23,2,2020,1,0,Australia,AU,AUS,24992369,2020-02-23,AU,AUS,Australia
22/02/2020,22,2,2020,4,0,Australia,AU,AUS,24992369,2020-02-22,AU,AUS,Australia
21/02/2020,21,2,2020,2,0,Australia,AU,AUS,24992369,2020-02-21,AU,AUS,Australia
20/02/2020,20,2,2020,0,0,Australia,AU,AUS,24992369,2020-02-20,AU,AUS,Australia
19/02/2020,19,2,2020,0,0,Australia,AU,AUS,24992369,2020-02-19,AU,AUS,Australia
18/02/2020,18,2,2020,0,0,Australia,AU,AUS,24992369,2020-02-18,AU,AUS,Australia
17/02/2020,17,2,2020,0,0,Australia,AU,AUS,24992369,2020-02-17,AU,AUS,Australia
16/02/2020,16,2,2020,0,0,Australia,AU,AUS,24992369,2020-02-16,AU,AUS,Australia
15/02/2020,15,2,2020,0,0,Australia,AU,AUS,24992369,2020-02-15,AU,AUS,Australia
14/02/2020,14,2,2020,1,0,Australia,AU,AUS,24992369,2020-02-14,AU,AUS,Australia
13/02/2020,13,2,2020,0,0,Australia,AU,AUS,24992369,2020-02-13,AU,AUS,Australia
12/02/2020,12,2,2020,0,0,Australia,AU,AUS,24992369,2020-02-12,AU,AUS,Australia
11/02/2020,11,2,2020,0,0,Australia,AU,AUS,24992369,2020-02-11,AU,AUS,Australia
10/02/2020,10,2,2020,0,0,Australia,AU,AUS,24992369,2020-02-10,AU,AUS,Australia
09/02/2020,9,2,2020,0,0,Australia,AU,AUS,24992369,2020-02-09,AU,AUS,Australia
08/02/2020,8,2,2020,0,0,Australia,AU,AUS,24992369,2020-02-08,AU,AUS,Australia
07/02/2020,7,2,2020,1,0,Australia,AU,AUS,24992369,2020-02-07,AU,AUS,Australia
06/02/2020,6,2,2020,1,0,Australia,AU,AUS,24992369,2020-02-06,AU,AUS,Australia
05/02/2020,5,2,2020,1,0,Australia,AU,AUS,24992369,2020-02-05,AU,AUS,Australia
04/02/2020,4,2,2020,0,0,Australia,AU,AUS,24992369,2020-02-04,AU,AUS,Australia
03/02/2020,3,2,2020,0,0,Australia,AU,AUS,24992369,2020-02-03,AU,AUS,Australia
02/02/2020,2,2,2020,2,0,Australia,AU,AUS,24992369,2020-02-02,AU,AUS,Australia
01/02/2020,1,2,2020,2,0,Australia,AU,AUS,24992369,2020-02-01,AU,AUS,Australia
31/01/2020,31,1,2020,1,0,Australia,AU,AUS,24992369,2020-01-31,AU,AUS,Australia
30/01/2020,30,1,2020,2,0,Australia,AU,AUS,24992369,2020-01-30,AU,AUS,Australia
29/01/2020,29,1,2020,0,0,Australia,AU,AUS,24992369,2020-01-29,AU,AUS,Australia
28/01/2020,28,1,2020,0,0,Australia,AU,AUS,24992369,2020-01-28,AU,AUS,Australia
27/01/2020,27,1,2020,0,0,Australia,AU,AUS,24992369,2020-01-27,AU,AUS,Australia
26/01/2020,26,1,2020,3,0,Australia,AU,AUS,24992369,2020-01-26,AU,AUS,Australia
25/01/2020,25,1,2020,1,0,Australia,AU,AUS,24992369,2020-01-25,AU,AUS,Australia
24/01/2020,24,1,2020,0,0,Australia,AU,AUS,24992369,2020-01-24,AU,AUS,Australia
23/01/2020,23,1,2020,0,0,Australia,AU,AUS,24992369,2020-01-23,AU,AUS,Australia
22/01/2020,22,1,2020,0,0,Australia,AU,AUS,24992369,2020-01-22,AU,AUS,Australia
21/01/2020,21,1,2020,0,0,Australia,AU,AUS,24992369,2020-01-21,AU,AUS,Australia
20/01/2020,20,1,2020,0,0,Australia,AU,AUS,24992369,2020-01-20,AU,AUS,Australia
19/01/2020,19,1,2020,0,0,Australia,AU,AUS,24992369,2020-01-19,AU,AUS,Australia
18/01/2020,18,1,2020,0,0,Australia,AU,AUS,24992369,2020-01-18,AU,AUS,Australia
17/01/2020,17,1,2020,0,0,Australia,AU,AUS,24992369,2020-01-17,AU,AUS,Australia
16/01/2020,16,1,2020,0,0,Australia,AU,AUS,24992369,2020-01-16,AU,AUS,Australia
15/01/2020,15,1,2020,0,0,Australia,AU,AUS,24992369,2020-01-15,AU,AUS,Australia
14/01/2020,14,1,2020,0,0,Australia,AU,AUS,24992369,2020-01-14,AU,AUS,Australia
13/01/2020,13,1,2020,0,0,Australia,AU,AUS,24992369,2020-01-13,AU,AUS,Australia
12/01/2020,12,1,2020,0,0,Australia,AU,AUS,24992369,2020-01-12,AU,AUS,Australia
11/01/2020,11,1,2020,0,0,Australia,AU,AUS,24992369,2020-01-11,AU,AUS,Australia
10/01/2020,10,1,2020,0,0,Australia,AU,AUS,24992369,2020-01-10,AU,AUS,Australia
09/01/2020,9,1,2020,0,0,Australia,AU,AUS,24992369,2020-01-09,AU,AUS,Australia
08/01/2020,8,1,2020,0,0,Australia,AU,AUS,24992369,2020-01-08,AU,AUS,Australia
07/01/2020,7,1,2020,0,0,Australia,AU,AUS,24992369,2020-01-07,AU,AUS,Australia
06/01/2020,6,1,2020,0,0,Australia,AU,AUS,24992369,2020-01-06,AU,AUS,Australia
05/01/2020,5,1,2020,0,0,Australia,AU,AUS,24992369,2020-01-05,AU,AUS,Australia
04/01/2020,4,1,2020,0,0,Australia,AU,AUS,24992369,2020-01-04,AU,AUS,Australia
03/01/2020,3,1,2020,0,0,Australia,AU,AUS,24992369,2020-01-03,AU,AUS,Australia
02/01/2020,2,1,2020,0,0,Australia,AU,AUS,24992369,2020-01-02,AU,AUS,Australia
01/01/2020,1,1,2020,0,0,Australia,AU,AUS,24992369,2020-01-01,AU,AUS,Australia
31/12/2019,31,12,2019,0,0,Australia,AU,AUS,24992369,2019-12-31,AU,AUS,Australia
13/04/2020,13,4,2020,130,13,Austria,AT,AUT,8847037,2020-04-13,AT,AUT,Austria
12/04/2020,12,4,2020,247,18,Austria,AT,AUT,8847037,2020-04-12,AT,AUT,Austria
11/04/2020,11,4,2020,312,24,Austria,AT,AUT,8847037,2020-04-11,AT,AUT,Austria
10/04/2020,10,4,2020,279,22,Austria,AT,AUT,8847037,2020-04-10,AT,AUT,Austria
09/04/2020,9,4,2020,329,30,Austria,AT,AUT,8847037,2020-04-09,AT,AUT,Austria
08/04/2020,8,4,2020,343,23,Austria,AT,AUT,8847037,2020-04-08,AT,AUT,Austria
07/04/2020,7,4,2020,314,16,Austria,AT,AUT,8847037,2020-04-07,AT,AUT,Austria
06/04/2020,6,4,2020,217,18,Austria,AT,AUT,8847037,2020-04-06,AT,AUT,Austria
05/04/2020,5,4,2020,241,18,Austria,AT,AUT,8847037,2020-04-05,AT,AUT,Austria
04/04/2020,4,4,2020,396,10,Austria,AT,AUT,8847037,2020-04-04,AT,AUT,Austria
03/04/2020,3,4,2020,418,12,Austria,AT,AUT,8847037,2020-04-03,AT,AUT,Austria
02/04/2020,2,4,2020,529,18,Austria,AT,AUT,8847037,2020-04-02,AT,AUT,Austria
01/04/2020,1,4,2020,564,20,Austria,AT,AUT,8847037,2020-04-01,AT,AUT,Austria
31/03/2020,31,3,2020,805,22,Austria,AT,AUT,8847037,2020-03-31,AT,AUT,Austria
30/03/2020,30,3,2020,522,18,Austria,AT,AUT,8847037,2020-03-30,AT,AUT,Austria
29/03/2020,29,3,2020,594,0,Austria,AT,AUT,8847037,2020-03-29,AT,AUT,Austria
28/03/2020,28,3,2020,668,16,Austria,AT,AUT,8847037,2020-03-28,AT,AUT,Austria
27/03/2020,27,3,2020,1141,18,Austria,AT,AUT,8847037,2020-03-27,AT,AUT,Austria
26/03/2020,26,3,2020,606,4,Austria,AT,AUT,8847037,2020-03-26,AT,AUT,Austria
25/03/2020,25,3,2020,796,5,Austria,AT,AUT,8847037,2020-03-25,AT,AUT,Austria
24/03/2020,24,3,2020,855,9,Austria,AT,AUT,8847037,2020-03-24,AT,AUT,Austria
23/03/2020,23,3,2020,607,8,Austria,AT,AUT,8847037,2020-03-23,AT,AUT,Austria
22/03/2020,22,3,2020,375,2,Austria,AT,AUT,8847037,2020-03-22,AT,AUT,Austria
21/03/2020,21,3,2020,453,0,Austria,AT,AUT,8847037,2020-03-21,AT,AUT,Austria
20/03/2020,20,3,2020,550,2,Austria,AT,AUT,8847037,2020-03-20,AT,AUT,Austria
19/03/2020,19,3,2020,314,1,Austria,AT,AUT,8847037,2020-03-19,AT,AUT,Austria
18/03/2020,18,3,2020,316,0,Austria,AT,AUT,8847037,2020-03-18,AT,AUT,Austria
17/03/2020,17,3,2020,156,2,Austria,AT,AUT,8847037,2020-03-17,AT,AUT,Austria
16/03/2020,16,3,2020,205,0,Austria,AT,AUT,8847037,2020-03-16,AT,AUT,Austria
15/03/2020,15,3,2020,151,0,Austria,AT,AUT,8847037,2020-03-15,AT,AUT,Austria
14/03/2020,14,3,2020,143,0,Austria,AT,AUT,8847037,2020-03-14,AT,AUT,Austria
13/03/2020,13,3,2020,115,1,Austria,AT,AUT,8847037,2020-03-13,AT,AUT,Austria
12/03/2020,12,3,2020,64,0,Austria,AT,AUT,8847037,2020-03-12,AT,AUT,Austria
11/03/2020,11,3,2020,51,0,Austria,AT,AUT,8847037,2020-03-11,AT,AUT,Austria
10/03/2020,10,3,2020,29,0,Austria,AT,AUT,8847037,2020-03-10,AT,AUT,Austria
09/03/2020,9,3,2020,3,0,Austria,AT,AUT,8847037,2020-03-09,AT,AUT,Austria
08/03/2020,8,3,2020,25,0,Austria,AT,AUT,8847037,2020-03-08,AT,AUT,Austria
07/03/2020,7,3,2020,33,0,Austria,AT,AUT,8847037,2020-03-07,AT,AUT,Austria
06/03/2020,6,3,2020,12,0,Austria,AT,AUT,8847037,2020-03-06,AT,AUT,Austria
05/03/2020,5,3,2020,5,0,Austria,AT,AUT,8847037,2020-03-05,AT,AUT,Austria
04/03/2020,4,3,2020,6,0,Austria,AT,AUT,8847037,2020-03-04,AT,AUT,Austria
03/03/2020,3,3,2020,4,0,Austria,AT,AUT,8847037,2020-03-03,AT,AUT,Austria
02/03/2020,2,3,2020,4,0,Austria,AT,AUT,8847037,2020-03-02,AT,AUT,Austria
01/03/2020,1,3,2020,3,0,Austria,AT,AUT,8847037,2020-03-01,AT,AUT,Austria
29/02/2020,29,2,2020,2,0,Austria,AT,AUT,8847037,2020-02-29,AT,AUT,Austria
28/02/2020,28,2,2020,3,0,Austria,AT,AUT,8847037,2020-02-28,AT,AUT,Austria
27/02/2020,27,2,2020,0,0,Austria,AT,AUT,8847037,2020-02-27,AT,AUT,Austria
26/02/2020,26,2,2020,2,0,Austria,AT,AUT,8847037,2020-02-26,AT,AUT,Austria
25/02/2020,25,2,2020,0,0,Austria,AT,AUT,8847037,2020-02-25,AT,AUT,Austria
24/02/2020,24,2,2020,0,0,Austria,AT,AUT,8847037,2020-02-24,AT,AUT,Austria
23/02/2020,23,2,2020,0,0,Austria,AT,AUT,8847037,2020-02-23,AT,AUT,Austria
22/02/2020,22,2,2020,0,0,Austria,AT,AUT,8847037,2020-02-22,AT,AUT,Austria
21/02/2020,21,2,2020,0,0,Austria,AT,AUT,8847037,2020-02-21,AT,AUT,Austria
20/02/2020,20,2,2020,0,0,Austria,AT,AUT,8847037,2020-02-20,AT,AUT,Austria
19/02/2020,19,2,2020,0,0,Austria,AT,AUT,8847037,2020-02-19,AT,AUT,Austria
18/02/2020,18,2,2020,0,0,Austria,AT,AUT,8847037,2020-02-18,AT,AUT,Austria
17/02/2020,17,2,2020,0,0,Austria,AT,AUT,8847037,2020-02-17,AT,AUT,Austria
16/02/2020,16,2,2020,0,0,Austria,AT,AUT,8847037,2020-02-16,AT,AUT,Austria
15/02/2020,15,2,2020,0,0,Austria,AT,AUT,8847037,2020-02-15,AT,AUT,Austria
14/02/2020,14,2,2020,0,0,Austria,AT,AUT,8847037,2020-02-14,AT,AUT,Austria
13/02/2020,13,2,2020,0,0,Austria,AT,AUT,8847037,2020-02-13,AT,AUT,Austria
12/02/2020,12,2,2020,0,0,Austria,AT,AUT,8847037,2020-02-12,AT,AUT,Austria
11/02/2020,11,2,2020,0,0,Austria,AT,AUT,8847037,2020-02-11,AT,AUT,Austria
10/02/2020,10,2,2020,0,0,Austria,AT,AUT,8847037,2020-02-10,AT,AUT,Austria
09/02/2020,9,2,2020,0,0,Austria,AT,AUT,8847037,2020-02-09,AT,AUT,Austria
08/02/2020,8,2,2020,0,0,Austria,AT,AUT,8847037,2020-02-08,AT,AUT,Austria
07/02/2020,7,2,2020,0,0,Austria,AT,AUT,8847037,2020-02-07,AT,AUT,Austria
06/02/2020,6,2,2020,0,0,Austria,AT,AUT,8847037,2020-02-06,AT,AUT,Austria
05/02/2020,5,2,2020,0,0,Austria,AT,AUT,8847037,2020-02-05,AT,AUT,Austria
04/02/2020,4,2,2020,0,0,Austria,AT,AUT,8847037,2020-02-04,AT,AUT,Austria
03/02/2020,3,2,2020,0,0,Austria,AT,AUT,8847037,2020-02-03,AT,AUT,Austria
02/02/2020,2,2,2020,0,0,Austria,AT,AUT,8847037,2020-02-02,AT,AUT,Austria
01/02/2020,1,2,2020,0,0,Austria,AT,AUT,8847037,2020-02-01,AT,AUT,Austria
31/01/2020,31,1,2020,0,0,Austria,AT,AUT,8847037,2020-01-31,AT,AUT,Austria
30/01/2020,30,1,2020,0,0,Austria,AT,AUT,8847037,2020-01-30,AT,AUT,Austria
29/01/2020,29,1,2020,0,0,Austria,AT,AUT,8847037,2020-01-29,AT,AUT,Austria
28/01/2020,28,1,2020,0,0,Austria,AT,AUT,8847037,2020-01-28,AT,AUT,Austria
27/01/2020,27,1,2020,0,0,Austria,AT,AUT,8847037,2020-01-27,AT,AUT,Austria
26/01/2020,26,1,2020,0,0,Austria,AT,AUT,8847037,2020-01-26,AT,AUT,Austria
25/01/2020,25,1,2020,0,0,Austria,AT,AUT,8847037,2020-01-25,AT,AUT,Austria
24/01/2020,24,1,2020,0,0,Austria,AT,AUT,8847037,2020-01-24,AT,AUT,Austria
23/01/2020,23,1,2020,0,0,Austria,AT,AUT,8847037,2020-01-23,AT,AUT,Austria
22/01/2020,22,1,2020,0,0,Austria,AT,AUT,8847037,2020-01-22,AT,AUT,Austria
21/01/2020,21,1,2020,0,0,Austria,AT,AUT,8847037,2020-01-21,AT,AUT,Austria
20/01/2020,20,1,2020,0,0,Austria,AT,AUT,8847037,2020-01-20,AT,AUT,Austria
19/01/2020,19,1,2020,0,0,Austria,AT,AUT,8847037,2020-01-19,AT,AUT,Austria
18/01/2020,18,1,2020,0,0,Austria,AT,AUT,8847037,2020-01-18,AT,AUT,Austria
17/01/2020,17,1,2020,0,0,Austria,AT,AUT,8847037,2020-01-17,AT,AUT,Austria
16/01/2020,16,1,2020,0,0,Austria,AT,AUT,8847037,2020-01-16,AT,AUT,Austria
15/01/2020,15,1,2020,0,0,Austria,AT,AUT,8847037,2020-01-15,AT,AUT,Austria
14/01/2020,14,1,2020,0,0,Austria,AT,AUT,8847037,2020-01-14,AT,AUT,Austria
13/01/2020,13,1,2020,0,0,Austria,AT,AUT,8847037,2020-01-13,AT,AUT,Austria
12/01/2020,12,1,2020,0,0,Austria,AT,AUT,8847037,2020-01-12,AT,AUT,Austria
11/01/2020,11,1,2020,0,0,Austria,AT,AUT,8847037,2020-01-11,AT,AUT,Austria
10/01/2020,10,1,2020,0,0,Austria,AT,AUT,8847037,2020-01-10,AT,AUT,Austria
09/01/2020,9,1,2020,0,0,Austria,AT,AUT,8847037,2020-01-09,AT,AUT,Austria
08/01/2020,8,1,2020,0,0,Austria,AT,AUT,8847037,2020-01-08,AT,AUT,Austria
07/01/2020,7,1,2020,0,0,Austria,AT,AUT,8847037,2020-01-07,AT,AUT,Austria
06/01/2020,6,1,2020,0,0,Austria,AT,AUT,8847037,2020-01-06,AT,AUT,Austria
05/01/2020,5,1,2020,0,0,Austria,AT,AUT,8847037,2020-01-05,AT,AUT,Austria
04/01/2020,4,1,2020,0,0,Austria,AT,AUT,8847037,2020-01-04,AT,AUT,Austria
03/01/2020,3,1,2020,0,0,Austria,AT,AUT,8847037,2020-01-03,AT,AUT,Austria
02/01/2020,2,1,2020,0,0,Austria,AT,AUT,8847037,2020-01-02,AT,AUT,Austria
01/01/2020,1,1,2020,0,0,Austria,AT,AUT,8847037,2020-01-01,AT,AUT,Austria
31/12/2019,31,12,2019,0,0,Austria,AT,AUT,8847037,2019-12-31,AT,AUT,Austria
13/04/2020,13,4,2020,40,0,Azerbaijan,AZ,AZE,9942334,2020-04-13,AZ,AZE,Azerbaijan
12/04/2020,12,4,2020,67,1,Azerbaijan,AZ,AZE,9942334,2020-04-12,AZ,AZE,Azerbaijan
11/04/2020,11,4,2020,65,1,Azerbaijan,AZ,AZE,9942334,2020-04-11,AZ,AZE,Azerbaijan
10/04/2020,10,4,2020,104,1,Azerbaijan,AZ,AZE,9942334,2020-04-10,AZ,AZE,Azerbaijan
09/04/2020,9,4,2020,105,0,Azerbaijan,AZ,AZE,9942334,2020-04-09,AZ,AZE,Azerbaijan
08/04/2020,8,4,2020,76,1,Azerbaijan,AZ,AZE,9942334,2020-04-08,AZ,AZE,Azerbaijan
07/04/2020,7,4,2020,57,0,Azerbaijan,AZ,AZE,9942334,2020-04-07,AZ,AZE,Azerbaijan
06/04/2020,6,4,2020,63,2,Azerbaijan,AZ,AZE,9942334,2020-04-06,AZ,AZE,Azerbaijan
05/04/2020,5,4,2020,78,0,Azerbaijan,AZ,AZE,9942334,2020-04-05,AZ,AZE,Azerbaijan
04/04/2020,4,4,2020,43,0,Azerbaijan,AZ,AZE,9942334,2020-04-04,AZ,AZE,Azerbaijan
03/04/2020,3,4,2020,41,0,Azerbaijan,AZ,AZE,9942334,2020-04-03,AZ,AZE,Azerbaijan
02/04/2020,2,4,2020,61,0,Azerbaijan,AZ,AZE,9942334,2020-04-02,AZ,AZE,Azerbaijan
01/04/2020,1,4,2020,25,1,Azerbaijan,AZ,AZE,9942334,2020-04-01,AZ,AZE,Azerbaijan
31/03/2020,31,3,2020,64,0,Azerbaijan,AZ,AZE,9942334,2020-03-31,AZ,AZE,Azerbaijan
30/03/2020,30,3,2020,27,0,Azerbaijan,AZ,AZE,9942334,2020-03-30,AZ,AZE,Azerbaijan
29/03/2020,29,3,2020,17,1,Azerbaijan,AZ,AZE,9942334,2020-03-29,AZ,AZE,Azerbaijan
28/03/2020,28,3,2020,43,0,Azerbaijan,AZ,AZE,9942334,2020-03-28,AZ,AZE,Azerbaijan
27/03/2020,27,3,2020,29,1,Azerbaijan,AZ,AZE,9942334,2020-03-27,AZ,AZE,Azerbaijan
26/03/2020,26,3,2020,6,1,Azerbaijan,AZ,AZE,9942334,2020-03-26,AZ,AZE,Azerbaijan
25/03/2020,25,3,2020,15,0,Azerbaijan,AZ,AZE,9942334,2020-03-25,AZ,AZE,Azerbaijan
24/03/2020,24,3,2020,7,0,Azerbaijan,AZ,AZE,9942334,2020-03-24,AZ,AZE,Azerbaijan
23/03/2020,23,3,2020,12,0,Azerbaijan,AZ,AZE,9942334,2020-03-23,AZ,AZE,Azerbaijan
22/03/2020,22,3,2020,9,0,Azerbaijan,AZ,AZE,9942334,2020-03-22,AZ,AZE,Azerbaijan
21/03/2020,21,3,2020,0,1,Azerbaijan,AZ,AZE,9942334,2020-03-21,AZ,AZE,Azerbaijan
20/03/2020,20,3,2020,10,0,Azerbaijan,AZ,AZE,9942334,2020-03-20,AZ,AZE,Azerbaijan
19/03/2020,19,3,2020,6,0,Azerbaijan,AZ,AZE,9942334,2020-03-19,AZ,AZE,Azerbaijan
18/03/2020,18,3,2020,9,0,Azerbaijan,AZ,AZE,9942334,2020-03-18,AZ,AZE,Azerbaijan
17/03/2020,17,3,2020,0,0,Azerbaijan,AZ,AZE,9942334,2020-03-17,AZ,AZE,Azerbaijan
16/03/2020,16,3,2020,0,0,Azerbaijan,AZ,AZE,9942334,2020-03-16,AZ,AZE,Azerbaijan
15/03/2020,15,3,2020,6,0,Azerbaijan,AZ,AZE,9942334,2020-03-15,AZ,AZE,Azerbaijan
13/03/2020,13,3,2020,0,0,Azerbaijan,AZ,AZE,9942334,2020-03-13,AZ,AZE,Azerbaijan
12/03/2020,12,3,2020,2,0,Azerbaijan,AZ,AZE,9942334,2020-03-12,AZ,AZE,Azerbaijan
11/03/2020,11,3,2020,2,0,Azerbaijan,AZ,AZE,9942334,2020-03-11,AZ,AZE,Azerbaijan
07/03/2020,7,3,2020,3,0,Azerbaijan,AZ,AZE,9942334,2020-03-07,AZ,AZE,Azerbaijan
06/03/2020,6,3,2020,3,0,Azerbaijan,AZ,AZE,9942334,2020-03-06,AZ,AZE,Azerbaijan
02/03/2020,2,3,2020,2,0,Azerbaijan,AZ,AZE,9942334,2020-03-02,AZ,AZE,Azerbaijan
01/03/2020,1,3,2020,0,0,Azerbaijan,AZ,AZE,9942334,2020-03-01,AZ,AZE,Azerbaijan
29/02/2020,29,2,2020,1,0,Azerbaijan,AZ,AZE,9942334,2020-02-29,AZ,AZE,Azerbaijan
28/02/2020,28,2,2020,0,0,Azerbaijan,AZ,AZE,9942334,2020-02-28,AZ,AZE,Azerbaijan
27/02/2020,27,2,2020,0,0,Azerbaijan,AZ,AZE,9942334,2020-02-27,AZ,AZE,Azerbaijan
26/02/2020,26,2,2020,0,0,Azerbaijan,AZ,AZE,9942334,2020-02-26,AZ,AZE,Azerbaijan
25/02/2020,25,2,2020,0,0,Azerbaijan,AZ,AZE,9942334,2020-02-25,AZ,AZE,Azerbaijan
24/02/2020,24,2,2020,0,0,Azerbaijan,AZ,AZE,9942334,2020-02-24,AZ,AZE,Azerbaijan
23/02/2020,23,2,2020,0,0,Azerbaijan,AZ,AZE,9942334,2020-02-23,AZ,AZE,Azerbaijan
22/02/2020,22,2,2020,0,0,Azerbaijan,AZ,AZE,9942334,2020-02-22,AZ,AZE,Azerbaijan
21/02/2020,21,2,2020,0,0,Azerbaijan,AZ,AZE,9942334,2020-02-21,AZ,AZE,Azerbaijan
20/02/2020,20,2,2020,0,0,Azerbaijan,AZ,AZE,9942334,2020-02-20,AZ,AZE,Azerbaijan
19/02/2020,19,2,2020,0,0,Azerbaijan,AZ,AZE,9942334,2020-02-19,AZ,AZE,Azerbaijan
18/02/2020,18,2,2020,0,0,Azerbaijan,AZ,AZE,9942334,2020-02-18,AZ,AZE,Azerbaijan
17/02/2020,17,2,2020,0,0,Azerbaijan,AZ,AZE,9942334,2020-02-17,AZ,AZE,Azerbaijan
16/02/2020,16,2,2020,0,0,Azerbaijan,AZ,AZE,9942334,2020-02-16,AZ,AZE,Azerbaijan
15/02/2020,15,2,2020,0,0,Azerbaijan,AZ,AZE,9942334,2020-02-15,AZ,AZE,Azerbaijan
14/02/2020,14,2,2020,0,0,Azerbaijan,AZ,AZE,9942334,2020-02-14,AZ,AZE,Azerbaijan
13/02/2020,13,2,2020,0,0,Azerbaijan,AZ,AZE,9942334,2020-02-13,AZ,AZE,Azerbaijan
12/02/2020,12,2,2020,0,0,Azerbaijan,AZ,AZE,9942334,2020-02-12,AZ,AZE,Azerbaijan
11/02/2020,11,2,2020,0,0,Azerbaijan,AZ,AZE,9942334,2020-02-11,AZ,AZE,Azerbaijan
10/02/2020,10,2,2020,0,0,Azerbaijan,AZ,AZE,9942334,2020-02-10,AZ,AZE,Azerbaijan
09/02/2020,9,2,2020,0,0,Azerbaijan,AZ,AZE,9942334,2020-02-09,AZ,AZE,Azerbaijan
08/02/2020,8,2,2020,0,0,Azerbaijan,AZ,AZE,9942334,2020-02-08,AZ,AZE,Azerbaijan
07/02/2020,7,2,2020,0,0,Azerbaijan,AZ,AZE,9942334,2020-02-07,AZ,AZE,Azerbaijan
06/02/2020,6,2,2020,0,0,Azerbaijan,AZ,AZE,9942334,2020-02-06,AZ,AZE,Azerbaijan
05/02/2020,5,2,2020,0,0,Azerbaijan,AZ,AZE,9942334,2020-02-05,AZ,AZE,Azerbaijan
04/02/2020,4,2,2020,0,0,Azerbaijan,AZ,AZE,9942334,2020-02-04,AZ,AZE,Azerbaijan
03/02/2020,3,2,2020,0,0,Azerbaijan,AZ,AZE,9942334,2020-02-03,AZ,AZE,Azerbaijan
02/02/2020,2,2,2020,0,0,Azerbaijan,AZ,AZE,9942334,2020-02-02,AZ,AZE,Azerbaijan
01/02/2020,1,2,2020,0,0,Azerbaijan,AZ,AZE,9942334,2020-02-01,AZ,AZE,Azerbaijan
31/01/2020,31,1,2020,0,0,Azerbaijan,AZ,AZE,9942334,2020-01-31,AZ,AZE,Azerbaijan
30/01/2020,30,1,2020,0,0,Azerbaijan,AZ,AZE,9942334,2020-01-30,AZ,AZE,Azerbaijan
29/01/2020,29,1,2020,0,0,Azerbaijan,AZ,AZE,9942334,2020-01-29,AZ,AZE,Azerbaijan
28/01/2020,28,1,2020,0,0,Azerbaijan,AZ,AZE,9942334,2020-01-28,AZ,AZE,Azerbaijan
27/01/2020,27,1,2020,0,0,Azerbaijan,AZ,AZE,9942334,2020-01-27,AZ,AZE,Azerbaijan
26/01/2020,26,1,2020,0,0,Azerbaijan,AZ,AZE,9942334,2020-01-26,AZ,AZE,Azerbaijan
25/01/2020,25,1,2020,0,0,Azerbaijan,AZ,AZE,9942334,2020-01-25,AZ,AZE,Azerbaijan
24/01/2020,24,1,2020,0,0,Azerbaijan,AZ,AZE,9942334,2020-01-24,AZ,AZE,Azerbaijan
23/01/2020,23,1,2020,0,0,Azerbaijan,AZ,AZE,9942334,2020-01-23,AZ,AZE,Azerbaijan
22/01/2020,22,1,2020,0,0,Azerbaijan,AZ,AZE,9942334,2020-01-22,AZ,AZE,Azerbaijan
21/01/2020,21,1,2020,0,0,Azerbaijan,AZ,AZE,9942334,2020-01-21,AZ,AZE,Azerbaijan
20/01/2020,20,1,2020,0,0,Azerbaijan,AZ,AZE,9942334,2020-01-20,AZ,AZE,Azerbaijan
19/01/2020,19,1,2020,0,0,Azerbaijan,AZ,AZE,9942334,2020-01-19,AZ,AZE,Azerbaijan
18/01/2020,18,1,2020,0,0,Azerbaijan,AZ,AZE,9942334,2020-01-18,AZ,AZE,Azerbaijan
17/01/2020,17,1,2020,0,0,Azerbaijan,AZ,AZE,9942334,2020-01-17,AZ,AZE,Azerbaijan
16/01/2020,16,1,2020,0,0,Azerbaijan,AZ,AZE,9942334,2020-01-16,AZ,AZE,Azerbaijan
15/01/2020,15,1,2020,0,0,Azerbaijan,AZ,AZE,9942334,2020-01-15,AZ,AZE,Azerbaijan
14/01/2020,14,1,2020,0,0,Azerbaijan,AZ,AZE,9942334,2020-01-14,AZ,AZE,Azerbaijan
13/01/2020,13,1,2020,0,0,Azerbaijan,AZ,AZE,9942334,2020-01-13,AZ,AZE,Azerbaijan
12/01/2020,12,1,2020,0,0,Azerbaijan,AZ,AZE,9942334,2020-01-12,AZ,AZE,Azerbaijan
11/01/2020,11,1,2020,0,0,Azerbaijan,AZ,AZE,9942334,2020-01-11,AZ,AZE,Azerbaijan
10/01/2020,10,1,2020,0,0,Azerbaijan,AZ,AZE,9942334,2020-01-10,AZ,AZE,Azerbaijan
09/01/2020,9,1,2020,0,0,Azerbaijan,AZ,AZE,9942334,2020-01-09,AZ,AZE,Azerbaijan
08/01/2020,8,1,2020,0,0,Azerbaijan,AZ,AZE,9942334,2020-01-08,AZ,AZE,Azerbaijan
07/01/2020,7,1,2020,0,0,Azerbaijan,AZ,AZE,9942334,2020-01-07,AZ,AZE,Azerbaijan
06/01/2020,6,1,2020,0,0,Azerbaijan,AZ,AZE,9942334,2020-01-06,AZ,AZE,Azerbaijan
05/01/2020,5,1,2020,0,0,Azerbaijan,AZ,AZE,9942334,2020-01-05,AZ,AZE,Azerbaijan
04/01/2020,4,1,2020,0,0,Azerbaijan,AZ,AZE,9942334,2020-01-04,AZ,AZE,Azerbaijan
03/01/2020,3,1,2020,0,0,Azerbaijan,AZ,AZE,9942334,2020-01-03,AZ,AZE,Azerbaijan
02/01/2020,2,1,2020,0,0,Azerbaijan,AZ,AZE,9942334,2020-01-02,AZ,AZE,Azerbaijan
01/01/2020,1,1,2020,0,0,Azerbaijan,AZ,AZE,9942334,2020-01-01,AZ,AZE,Azerbaijan
31/12/2019,31,12,2019,0,0,Azerbaijan,AZ,AZE,9942334,2019-12-31,AZ,AZE,Azerbaijan
13/04/2020,13,4,2020,1,0,Bahamas,BS,BHS,385640,2020-04-13,BS,BHS,Bahamas
12/04/2020,12,4,2020,4,0,Bahamas,BS,BHS,385640,2020-04-12,BS,BHS,Bahamas
11/04/2020,11,4,2020,1,0,Bahamas,BS,BHS,385640,2020-04-11,BS,BHS,Bahamas
10/04/2020,10,4,2020,1,1,Bahamas,BS,BHS,385640,2020-04-10,BS,BHS,Bahamas
09/04/2020,9,4,2020,4,1,Bahamas,BS,BHS,385640,2020-04-09,BS,BHS,Bahamas
08/04/2020,8,4,2020,3,1,Bahamas,BS,BHS,385640,2020-04-08,BS,BHS,Bahamas
07/04/2020,7,4,2020,4,0,Bahamas,BS,BHS,385640,2020-04-07,BS,BHS,Bahamas
06/04/2020,6,4,2020,1,1,Bahamas,BS,BHS,385640,2020-04-06,BS,BHS,Bahamas
05/04/2020,5,4,2020,4,1,Bahamas,BS,BHS,385640,2020-04-05,BS,BHS,Bahamas
04/04/2020,4,4,2020,0,2,Bahamas,BS,BHS,385640,2020-04-04,BS,BHS,Bahamas
03/04/2020,3,4,2020,3,0,Bahamas,BS,BHS,385640,2020-04-03,BS,BHS,Bahamas
02/04/2020,2,4,2020,6,1,Bahamas,BS,BHS,385640,2020-04-02,BS,BHS,Bahamas
01/04/2020,1,4,2020,1,0,Bahamas,BS,BHS,385640,2020-04-01,BS,BHS,Bahamas
31/03/2020,31,3,2020,0,0,Bahamas,BS,BHS,385640,2020-03-31,BS,BHS,Bahamas
30/03/2020,30,3,2020,3,0,Bahamas,BS,BHS,385640,2020-03-30,BS,BHS,Bahamas
29/03/2020,29,3,2020,2,0,Bahamas,BS,BHS,385640,2020-03-29,BS,BHS,Bahamas
28/03/2020,28,3,2020,0,0,Bahamas,BS,BHS,385640,2020-03-28,BS,BHS,Bahamas
27/03/2020,27,3,2020,4,0,Bahamas,BS,BHS,385640,2020-03-27,BS,BHS,Bahamas
26/03/2020,26,3,2020,1,0,Bahamas,BS,BHS,385640,2020-03-26,BS,BHS,Bahamas
25/03/2020,25,3,2020,0,0,Bahamas,BS,BHS,385640,2020-03-25,BS,BHS,Bahamas
24/03/2020,24,3,2020,0,0,Bahamas,BS,BHS,385640,2020-03-24,BS,BHS,Bahamas
23/03/2020,23,3,2020,0,0,Bahamas,BS,BHS,385640,2020-03-23,BS,BHS,Bahamas
22/03/2020,22,3,2020,0,0,Bahamas,BS,BHS,385640,2020-03-22,BS,BHS,Bahamas
21/03/2020,21,3,2020,1,0,Bahamas,BS,BHS,385640,2020-03-21,BS,BHS,Bahamas
20/03/2020,20,3,2020,2,0,Bahamas,BS,BHS,385640,2020-03-20,BS,BHS,Bahamas
17/03/2020,17,3,2020,0,0,Bahamas,BS,BHS,385640,2020-03-17,BS,BHS,Bahamas
16/03/2020,16,3,2020,1,0,Bahamas,BS,BHS,385640,2020-03-16,BS,BHS,Bahamas
13/04/2020,13,4,2020,96,0,Bahrain,BH,BHR,1569439,2020-04-13,BH,BHR,Bahrain
12/04/2020,12,4,2020,42,0,Bahrain,BH,BHR,1569439,2020-04-12,BH,BHR,Bahrain
11/04/2020,11,4,2020,111,1,Bahrain,BH,BHR,1569439,2020-04-11,BH,BHR,Bahrain
10/04/2020,10,4,2020,64,0,Bahrain,BH,BHR,1569439,2020-04-10,BH,BHR,Bahrain
09/04/2020,9,4,2020,12,0,Bahrain,BH,BHR,1569439,2020-04-09,BH,BHR,Bahrain
08/04/2020,8,4,2020,55,1,Bahrain,BH,BHR,1569439,2020-04-08,BH,BHR,Bahrain
07/04/2020,7,4,2020,56,0,Bahrain,BH,BHR,1569439,2020-04-07,BH,BHR,Bahrain
06/04/2020,6,4,2020,12,0,Bahrain,BH,BHR,1569439,2020-04-06,BH,BHR,Bahrain
05/04/2020,5,4,2020,45,0,Bahrain,BH,BHR,1569439,2020-04-05,BH,BHR,Bahrain
04/04/2020,4,4,2020,0,0,Bahrain,BH,BHR,1569439,2020-04-04,BH,BHR,Bahrain
03/04/2020,3,4,2020,74,0,Bahrain,BH,BHR,1569439,2020-04-03,BH,BHR,Bahrain
02/04/2020,2,4,2020,2,0,Bahrain,BH,BHR,1569439,2020-04-02,BH,BHR,Bahrain
01/04/2020,1,4,2020,52,0,Bahrain,BH,BHR,1569439,2020-04-01,BH,BHR,Bahrain
31/03/2020,31,3,2020,15,0,Bahrain,BH,BHR,1569439,2020-03-31,BH,BHR,Bahrain
30/03/2020,30,3,2020,27,0,Bahrain,BH,BHR,1569439,2020-03-30,BH,BHR,Bahrain
29/03/2020,29,3,2020,7,0,Bahrain,BH,BHR,1569439,2020-03-29,BH,BHR,Bahrain
28/03/2020,28,3,2020,8,0,Bahrain,BH,BHR,1569439,2020-03-28,BH,BHR,Bahrain
27/03/2020,27,3,2020,39,1,Bahrain,BH,BHR,1569439,2020-03-27,BH,BHR,Bahrain
26/03/2020,26,3,2020,29,0,Bahrain,BH,BHR,1569439,2020-03-26,BH,BHR,Bahrain
25/03/2020,25,3,2020,51,1,Bahrain,BH,BHR,1569439,2020-03-25,BH,BHR,Bahrain
24/03/2020,24,3,2020,5,0,Bahrain,BH,BHR,1569439,2020-03-24,BH,BHR,Bahrain
23/03/2020,23,3,2020,28,1,Bahrain,BH,BHR,1569439,2020-03-23,BH,BHR,Bahrain
22/03/2020,22,3,2020,21,0,Bahrain,BH,BHR,1569439,2020-03-22,BH,BHR,Bahrain
21/03/2020,21,3,2020,16,0,Bahrain,BH,BHR,1569439,2020-03-21,BH,BHR,Bahrain
20/03/2020,20,3,2020,13,0,Bahrain,BH,BHR,1569439,2020-03-20,BH,BHR,Bahrain
19/03/2020,19,3,2020,19,0,Bahrain,BH,BHR,1569439,2020-03-19,BH,BHR,Bahrain
18/03/2020,18,3,2020,16,0,Bahrain,BH,BHR,1569439,2020-03-18,BH,BHR,Bahrain
17/03/2020,17,3,2020,7,1,Bahrain,BH,BHR,1569439,2020-03-17,BH,BHR,Bahrain
16/03/2020,16,3,2020,3,0,Bahrain,BH,BHR,1569439,2020-03-16,BH,BHR,Bahrain
15/03/2020,15,3,2020,1,0,Bahrain,BH,BHR,1569439,2020-03-15,BH,BHR,Bahrain
14/03/2020,14,3,2020,48,0,Bahrain,BH,BHR,1569439,2020-03-14,BH,BHR,Bahrain
13/03/2020,13,3,2020,0,0,Bahrain,BH,BHR,1569439,2020-03-13,BH,BHR,Bahrain
12/03/2020,12,3,2020,52,0,Bahrain,BH,BHR,1569439,2020-03-12,BH,BHR,Bahrain
11/03/2020,11,3,2020,1,0,Bahrain,BH,BHR,1569439,2020-03-11,BH,BHR,Bahrain
10/03/2020,10,3,2020,30,0,Bahrain,BH,BHR,1569439,2020-03-10,BH,BHR,Bahrain
09/03/2020,9,3,2020,16,0,Bahrain,BH,BHR,1569439,2020-03-09,BH,BHR,Bahrain
08/03/2020,8,3,2020,7,0,Bahrain,BH,BHR,1569439,2020-03-08,BH,BHR,Bahrain
07/03/2020,7,3,2020,4,0,Bahrain,BH,BHR,1569439,2020-03-07,BH,BHR,Bahrain
06/03/2020,6,3,2020,0,0,Bahrain,BH,BHR,1569439,2020-03-06,BH,BHR,Bahrain
05/03/2020,5,3,2020,3,0,Bahrain,BH,BHR,1569439,2020-03-05,BH,BHR,Bahrain
04/03/2020,4,3,2020,2,0,Bahrain,BH,BHR,1569439,2020-03-04,BH,BHR,Bahrain
02/03/2020,2,3,2020,6,0,Bahrain,BH,BHR,1569439,2020-03-02,BH,BHR,Bahrain
01/03/2020,1,3,2020,3,0,Bahrain,BH,BHR,1569439,2020-03-01,BH,BHR,Bahrain
29/02/2020,29,2,2020,5,0,Bahrain,BH,BHR,1569439,2020-02-29,BH,BHR,Bahrain
28/02/2020,28,2,2020,0,0,Bahrain,BH,BHR,1569439,2020-02-28,BH,BHR,Bahrain
27/02/2020,27,2,2020,10,0,Bahrain,BH,BHR,1569439,2020-02-27,BH,BHR,Bahrain
26/02/2020,26,2,2020,21,0,Bahrain,BH,BHR,1569439,2020-02-26,BH,BHR,Bahrain
25/02/2020,25,2,2020,1,0,Bahrain,BH,BHR,1569439,2020-02-25,BH,BHR,Bahrain
24/02/2020,24,2,2020,1,0,Bahrain,BH,BHR,1569439,2020-02-24,BH,BHR,Bahrain
23/02/2020,23,2,2020,0,0,Bahrain,BH,BHR,1569439,2020-02-23,BH,BHR,Bahrain
22/02/2020,22,2,2020,0,0,Bahrain,BH,BHR,1569439,2020-02-22,BH,BHR,Bahrain
21/02/2020,21,2,2020,0,0,Bahrain,BH,BHR,1569439,2020-02-21,BH,BHR,Bahrain
20/02/2020,20,2,2020,0,0,Bahrain,BH,BHR,1569439,2020-02-20,BH,BHR,Bahrain
19/02/2020,19,2,2020,0,0,Bahrain,BH,BHR,1569439,2020-02-19,BH,BHR,Bahrain
18/02/2020,18,2,2020,0,0,Bahrain,BH,BHR,1569439,2020-02-18,BH,BHR,Bahrain
17/02/2020,17,2,2020,0,0,Bahrain,BH,BHR,1569439,2020-02-17,BH,BHR,Bahrain
16/02/2020,16,2,2020,0,0,Bahrain,BH,BHR,1569439,2020-02-16,BH,BHR,Bahrain
15/02/2020,15,2,2020,0,0,Bahrain,BH,BHR,1569439,2020-02-15,BH,BHR,Bahrain
14/02/2020,14,2,2020,0,0,Bahrain,BH,BHR,1569439,2020-02-14,BH,BHR,Bahrain
13/02/2020,13,2,2020,0,0,Bahrain,BH,BHR,1569439,2020-02-13,BH,BHR,Bahrain
12/02/2020,12,2,2020,0,0,Bahrain,BH,BHR,1569439,2020-02-12,BH,BHR,Bahrain
11/02/2020,11,2,2020,0,0,Bahrain,BH,BHR,1569439,2020-02-11,BH,BHR,Bahrain
10/02/2020,10,2,2020,0,0,Bahrain,BH,BHR,1569439,2020-02-10,BH,BHR,Bahrain
09/02/2020,9,2,2020,0,0,Bahrain,BH,BHR,1569439,2020-02-09,BH,BHR,Bahrain
08/02/2020,8,2,2020,0,0,Bahrain,BH,BHR,1569439,2020-02-08,BH,BHR,Bahrain
07/02/2020,7,2,2020,0,0,Bahrain,BH,BHR,1569439,2020-02-07,BH,BHR,Bahrain
06/02/2020,6,2,2020,0,0,Bahrain,BH,BHR,1569439,2020-02-06,BH,BHR,Bahrain
05/02/2020,5,2,2020,0,0,Bahrain,BH,BHR,1569439,2020-02-05,BH,BHR,Bahrain
04/02/2020,4,2,2020,0,0,Bahrain,BH,BHR,1569439,2020-02-04,BH,BHR,Bahrain
03/02/2020,3,2,2020,0,0,Bahrain,BH,BHR,1569439,2020-02-03,BH,BHR,Bahrain
02/02/2020,2,2,2020,0,0,Bahrain,BH,BHR,1569439,2020-02-02,BH,BHR,Bahrain
01/02/2020,1,2,2020,0,0,Bahrain,BH,BHR,1569439,2020-02-01,BH,BHR,Bahrain
31/01/2020,31,1,2020,0,0,Bahrain,BH,BHR,1569439,2020-01-31,BH,BHR,Bahrain
30/01/2020,30,1,2020,0,0,Bahrain,BH,BHR,1569439,2020-01-30,BH,BHR,Bahrain
29/01/2020,29,1,2020,0,0,Bahrain,BH,BHR,1569439,2020-01-29,BH,BHR,Bahrain
28/01/2020,28,1,2020,0,0,Bahrain,BH,BHR,1569439,2020-01-28,BH,BHR,Bahrain
27/01/2020,27,1,2020,0,0,Bahrain,BH,BHR,1569439,2020-01-27,BH,BHR,Bahrain
26/01/2020,26,1,2020,0,0,Bahrain,BH,BHR,1569439,2020-01-26,BH,BHR,Bahrain
25/01/2020,25,1,2020,0,0,Bahrain,BH,BHR,1569439,2020-01-25,BH,BHR,Bahrain
24/01/2020,24,1,2020,0,0,Bahrain,BH,BHR,1569439,2020-01-24,BH,BHR,Bahrain
23/01/2020,23,1,2020,0,0,Bahrain,BH,BHR,1569439,2020-01-23,BH,BHR,Bahrain
22/01/2020,22,1,2020,0,0,Bahrain,BH,BHR,1569439,2020-01-22,BH,BHR,Bahrain
21/01/2020,21,1,2020,0,0,Bahrain,BH,BHR,1569439,2020-01-21,BH,BHR,Bahrain
20/01/2020,20,1,2020,0,0,Bahrain,BH,BHR,1569439,2020-01-20,BH,BHR,Bahrain
19/01/2020,19,1,2020,0,0,Bahrain,BH,BHR,1569439,2020-01-19,BH,BHR,Bahrain
18/01/2020,18,1,2020,0,0,Bahrain,BH,BHR,1569439,2020-01-18,BH,BHR,Bahrain
17/01/2020,17,1,2020,0,0,Bahrain,BH,BHR,1569439,2020-01-17,BH,BHR,Bahrain
16/01/2020,16,1,2020,0,0,Bahrain,BH,BHR,1569439,2020-01-16,BH,BHR,Bahrain
15/01/2020,15,1,2020,0,0,Bahrain,BH,BHR,1569439,2020-01-15,BH,BHR,Bahrain
14/01/2020,14,1,2020,0,0,Bahrain,BH,BHR,1569439,2020-01-14,BH,BHR,Bahrain
13/01/2020,13,1,2020,0,0,Bahrain,BH,BHR,1569439,2020-01-13,BH,BHR,Bahrain
12/01/2020,12,1,2020,0,0,Bahrain,BH,BHR,1569439,2020-01-12,BH,BHR,Bahrain
11/01/2020,11,1,2020,0,0,Bahrain,BH,BHR,1569439,2020-01-11,BH,BHR,Bahrain
10/01/2020,10,1,2020,0,0,Bahrain,BH,BHR,1569439,2020-01-10,BH,BHR,Bahrain
09/01/2020,9,1,2020,0,0,Bahrain,BH,BHR,1569439,2020-01-09,BH,BHR,Bahrain
08/01/2020,8,1,2020,0,0,Bahrain,BH,BHR,1569439,2020-01-08,BH,BHR,Bahrain
07/01/2020,7,1,2020,0,0,Bahrain,BH,BHR,1569439,2020-01-07,BH,BHR,Bahrain
06/01/2020,6,1,2020,0,0,Bahrain,BH,BHR,1569439,2020-01-06,BH,BHR,Bahrain
05/01/2020,5,1,2020,0,0,Bahrain,BH,BHR,1569439,2020-01-05,BH,BHR,Bahrain
04/01/2020,4,1,2020,0,0,Bahrain,BH,BHR,1569439,2020-01-04,BH,BHR,Bahrain
03/01/2020,3,1,2020,0,0,Bahrain,BH,BHR,1569439,2020-01-03,BH,BHR,Bahrain
02/01/2020,2,1,2020,0,0,Bahrain,BH,BHR,1569439,2020-01-02,BH,BHR,Bahrain
01/01/2020,1,1,2020,0,0,Bahrain,BH,BHR,1569439,2020-01-01,BH,BHR,Bahrain
31/12/2019,31,12,2019,0,0,Bahrain,BH,BHR,1569439,2019-12-31,BH,BHR,Bahrain
13/04/2020,13,4,2020,139,4,Bangladesh,BD,BGD,161356039,2020-04-13,BD,BGD,Bangladesh
12/04/2020,12,4,2020,58,3,Bangladesh,BD,BGD,161356039,2020-04-12,BD,BGD,Bangladesh
11/04/2020,11,4,2020,94,6,Bangladesh,BD,BGD,161356039,2020-04-11,BD,BGD,Bangladesh
10/04/2020,10,4,2020,112,1,Bangladesh,BD,BGD,161356039,2020-04-10,BD,BGD,Bangladesh
09/04/2020,9,4,2020,54,3,Bangladesh,BD,BGD,161356039,2020-04-09,BD,BGD,Bangladesh
08/04/2020,8,4,2020,41,5,Bangladesh,BD,BGD,161356039,2020-04-08,BD,BGD,Bangladesh
07/04/2020,7,4,2020,35,3,Bangladesh,BD,BGD,161356039,2020-04-07,BD,BGD,Bangladesh
06/04/2020,6,4,2020,18,1,Bangladesh,BD,BGD,161356039,2020-04-06,BD,BGD,Bangladesh
05/04/2020,5,4,2020,9,2,Bangladesh,BD,BGD,161356039,2020-04-05,BD,BGD,Bangladesh
04/04/2020,4,4,2020,5,0,Bangladesh,BD,BGD,161356039,2020-04-04,BD,BGD,Bangladesh
03/04/2020,3,4,2020,2,0,Bangladesh,BD,BGD,161356039,2020-04-03,BD,BGD,Bangladesh
02/04/2020,2,4,2020,3,1,Bangladesh,BD,BGD,161356039,2020-04-02,BD,BGD,Bangladesh
01/04/2020,1,4,2020,2,0,Bangladesh,BD,BGD,161356039,2020-04-01,BD,BGD,Bangladesh
31/03/2020,31,3,2020,0,0,Bangladesh,BD,BGD,161356039,2020-03-31,BD,BGD,Bangladesh
30/03/2020,30,3,2020,1,0,Bangladesh,BD,BGD,161356039,2020-03-30,BD,BGD,Bangladesh
29/03/2020,29,3,2020,0,0,Bangladesh,BD,BGD,161356039,2020-03-29,BD,BGD,Bangladesh
28/03/2020,28,3,2020,0,0,Bangladesh,BD,BGD,161356039,2020-03-28,BD,BGD,Bangladesh
27/03/2020,27,3,2020,9,0,Bangladesh,BD,BGD,161356039,2020-03-27,BD,BGD,Bangladesh
26/03/2020,26,3,2020,0,1,Bangladesh,BD,BGD,161356039,2020-03-26,BD,BGD,Bangladesh
25/03/2020,25,3,2020,6,1,Bangladesh,BD,BGD,161356039,2020-03-25,BD,BGD,Bangladesh
24/03/2020,24,3,2020,6,0,Bangladesh,BD,BGD,161356039,2020-03-24,BD,BGD,Bangladesh
23/03/2020,23,3,2020,3,1,Bangladesh,BD,BGD,161356039,2020-03-23,BD,BGD,Bangladesh
22/03/2020,22,3,2020,7,2,Bangladesh,BD,BGD,161356039,2020-03-22,BD,BGD,Bangladesh
21/03/2020,21,3,2020,7,0,Bangladesh,BD,BGD,161356039,2020-03-21,BD,BGD,Bangladesh
20/03/2020,20,3,2020,0,0,Bangladesh,BD,BGD,161356039,2020-03-20,BD,BGD,Bangladesh
19/03/2020,19,3,2020,2,0,Bangladesh,BD,BGD,161356039,2020-03-19,BD,BGD,Bangladesh
18/03/2020,18,3,2020,3,0,Bangladesh,BD,BGD,161356039,2020-03-18,BD,BGD,Bangladesh
17/03/2020,17,3,2020,2,0,Bangladesh,BD,BGD,161356039,2020-03-17,BD,BGD,Bangladesh
15/03/2020,15,3,2020,0,0,Bangladesh,BD,BGD,161356039,2020-03-15,BD,BGD,Bangladesh
09/03/2020,9,3,2020,3,0,Bangladesh,BD,BGD,161356039,2020-03-09,BD,BGD,Bangladesh
13/04/2020,13,4,2020,3,0,Barbados,BB,BRB,286641,2020-04-13,BB,BRB,Barbados
12/04/2020,12,4,2020,1,0,Barbados,BB,BRB,286641,2020-04-12,BB,BRB,Barbados
11/04/2020,11,4,2020,1,1,Barbados,BB,BRB,286641,2020-04-11,BB,BRB,Barbados
10/04/2020,10,4,2020,3,0,Barbados,BB,BRB,286641,2020-04-10,BB,BRB,Barbados
09/04/2020,9,4,2020,0,0,Barbados,BB,BRB,286641,2020-04-09,BB,BRB,Barbados
08/04/2020,8,4,2020,3,1,Barbados,BB,BRB,286641,2020-04-08,BB,BRB,Barbados
07/04/2020,7,4,2020,4,1,Barbados,BB,BRB,286641,2020-04-07,BB,BRB,Barbados
06/04/2020,6,4,2020,5,1,Barbados,BB,BRB,286641,2020-04-06,BB,BRB,Barbados
05/04/2020,5,4,2020,6,0,Barbados,BB,BRB,286641,2020-04-05,BB,BRB,Barbados
04/04/2020,4,4,2020,0,0,Barbados,BB,BRB,286641,2020-04-04,BB,BRB,Barbados
03/04/2020,3,4,2020,0,0,Barbados,BB,BRB,286641,2020-04-03,BB,BRB,Barbados
02/04/2020,2,4,2020,11,0,Barbados,BB,BRB,286641,2020-04-02,BB,BRB,Barbados
01/04/2020,1,4,2020,0,0,Barbados,BB,BRB,286641,2020-04-01,BB,BRB,Barbados
31/03/2020,31,3,2020,1,0,Barbados,BB,BRB,286641,2020-03-31,BB,BRB,Barbados
30/03/2020,30,3,2020,7,0,Barbados,BB,BRB,286641,2020-03-30,BB,BRB,Barbados
29/03/2020,29,3,2020,2,0,Barbados,BB,BRB,286641,2020-03-29,BB,BRB,Barbados
28/03/2020,28,3,2020,0,0,Barbados,BB,BRB,286641,2020-03-28,BB,BRB,Barbados
27/03/2020,27,3,2020,6,0,Barbados,BB,BRB,286641,2020-03-27,BB,BRB,Barbados
26/03/2020,26,3,2020,0,0,Barbados,BB,BRB,286641,2020-03-26,BB,BRB,Barbados
25/03/2020,25,3,2020,1,0,Barbados,BB,BRB,286641,2020-03-25,BB,BRB,Barbados
24/03/2020,24,3,2020,0,0,Barbados,BB,BRB,286641,2020-03-24,BB,BRB,Barbados
23/03/2020,23,3,2020,3,0,Barbados,BB,BRB,286641,2020-03-23,BB,BRB,Barbados
22/03/2020,22,3,2020,8,0,Barbados,BB,BRB,286641,2020-03-22,BB,BRB,Barbados
21/03/2020,21,3,2020,4,0,Barbados,BB,BRB,286641,2020-03-21,BB,BRB,Barbados
20/03/2020,20,3,2020,1,0,Barbados,BB,BRB,286641,2020-03-20,BB,BRB,Barbados
19/03/2020,19,3,2020,0,0,Barbados,BB,BRB,286641,2020-03-19,BB,BRB,Barbados
18/03/2020,18,3,2020,1,0,Barbados,BB,BRB,286641,2020-03-18,BB,BRB,Barbados
13/04/2020,13,4,2020,352,3,Belarus,BY,BLR,9485386,2020-04-13,BY,BLR,Belarus
12/04/2020,12,4,2020,245,4,Belarus,BY,BLR,9485386,2020-04-12,BY,BLR,Belarus
11/04/2020,11,4,2020,495,3,Belarus,BY,BLR,9485386,2020-04-11,BY,BLR,Belarus
10/04/2020,10,4,2020,420,3,Belarus,BY,BLR,9485386,2020-04-10,BY,BLR,Belarus
09/04/2020,9,4,2020,205,0,Belarus,BY,BLR,9485386,2020-04-09,BY,BLR,Belarus
08/04/2020,8,4,2020,161,0,Belarus,BY,BLR,9485386,2020-04-08,BY,BLR,Belarus
07/04/2020,7,4,2020,136,5,Belarus,BY,BLR,9485386,2020-04-07,BY,BLR,Belarus
06/04/2020,6,4,2020,170,3,Belarus,BY,BLR,9485386,2020-04-06,BY,BLR,Belarus
05/04/2020,5,4,2020,43,1,Belarus,BY,BLR,9485386,2020-04-05,BY,BLR,Belarus
04/04/2020,4,4,2020,97,0,Belarus,BY,BLR,9485386,2020-04-04,BY,BLR,Belarus
03/04/2020,3,4,2020,102,4,Belarus,BY,BLR,9485386,2020-04-03,BY,BLR,Belarus
02/04/2020,2,4,2020,0,0,Belarus,BY,BLR,9485386,2020-04-02,BY,BLR,Belarus
01/04/2020,1,4,2020,47,0,Belarus,BY,BLR,9485386,2020-04-01,BY,BLR,Belarus
31/03/2020,31,3,2020,11,0,Belarus,BY,BLR,9485386,2020-03-31,BY,BLR,Belarus
30/03/2020,30,3,2020,0,0,Belarus,BY,BLR,9485386,2020-03-30,BY,BLR,Belarus
29/03/2020,29,3,2020,0,0,Belarus,BY,BLR,9485386,2020-03-29,BY,BLR,Belarus
28/03/2020,28,3,2020,8,0,Belarus,BY,BLR,9485386,2020-03-28,BY,BLR,Belarus
27/03/2020,27,3,2020,0,0,Belarus,BY,BLR,9485386,2020-03-27,BY,BLR,Belarus
26/03/2020,26,3,2020,5,0,Belarus,BY,BLR,9485386,2020-03-26,BY,BLR,Belarus
25/03/2020,25,3,2020,0,0,Belarus,BY,BLR,9485386,2020-03-25,BY,BLR,Belarus
24/03/2020,24,3,2020,5,0,Belarus,BY,BLR,9485386,2020-03-24,BY,BLR,Belarus
23/03/2020,23,3,2020,0,0,Belarus,BY,BLR,9485386,2020-03-23,BY,BLR,Belarus
22/03/2020,22,3,2020,19,0,Belarus,BY,BLR,9485386,2020-03-22,BY,BLR,Belarus
21/03/2020,21,3,2020,0,0,Belarus,BY,BLR,9485386,2020-03-21,BY,BLR,Belarus
20/03/2020,20,3,2020,11,0,Belarus,BY,BLR,9485386,2020-03-20,BY,BLR,Belarus
19/03/2020,19,3,2020,10,0,Belarus,BY,BLR,9485386,2020-03-19,BY,BLR,Belarus
18/03/2020,18,3,2020,0,0,Belarus,BY,BLR,9485386,2020-03-18,BY,BLR,Belarus
17/03/2020,17,3,2020,9,0,Belarus,BY,BLR,9485386,2020-03-17,BY,BLR,Belarus
16/03/2020,16,3,2020,6,0,Belarus,BY,BLR,9485386,2020-03-16,BY,BLR,Belarus
13/03/2020,13,3,2020,9,0,Belarus,BY,BLR,9485386,2020-03-13,BY,BLR,Belarus
12/03/2020,12,3,2020,3,0,Belarus,BY,BLR,9485386,2020-03-12,BY,BLR,Belarus
11/03/2020,11,3,2020,3,0,Belarus,BY,BLR,9485386,2020-03-11,BY,BLR,Belarus
05/03/2020,5,3,2020,2,0,Belarus,BY,BLR,9485386,2020-03-05,BY,BLR,Belarus
04/03/2020,4,3,2020,3,0,Belarus,BY,BLR,9485386,2020-03-04,BY,BLR,Belarus
02/03/2020,2,3,2020,0,0,Belarus,BY,BLR,9485386,2020-03-02,BY,BLR,Belarus
01/03/2020,1,3,2020,0,0,Belarus,BY,BLR,9485386,2020-03-01,BY,BLR,Belarus
29/02/2020,29,2,2020,0,0,Belarus,BY,BLR,9485386,2020-02-29,BY,BLR,Belarus
28/02/2020,28,2,2020,1,0,Belarus,BY,BLR,9485386,2020-02-28,BY,BLR,Belarus
27/02/2020,27,2,2020,0,0,Belarus,BY,BLR,9485386,2020-02-27,BY,BLR,Belarus
26/02/2020,26,2,2020,0,0,Belarus,BY,BLR,9485386,2020-02-26,BY,BLR,Belarus
25/02/2020,25,2,2020,0,0,Belarus,BY,BLR,9485386,2020-02-25,BY,BLR,Belarus
24/02/2020,24,2,2020,0,0,Belarus,BY,BLR,9485386,2020-02-24,BY,BLR,Belarus
23/02/2020,23,2,2020,0,0,Belarus,BY,BLR,9485386,2020-02-23,BY,BLR,Belarus
22/02/2020,22,2,2020,0,0,Belarus,BY,BLR,9485386,2020-02-22,BY,BLR,Belarus
21/02/2020,21,2,2020,0,0,Belarus,BY,BLR,9485386,2020-02-21,BY,BLR,Belarus
20/02/2020,20,2,2020,0,0,Belarus,BY,BLR,9485386,2020-02-20,BY,BLR,Belarus
19/02/2020,19,2,2020,0,0,Belarus,BY,BLR,9485386,2020-02-19,BY,BLR,Belarus
18/02/2020,18,2,2020,0,0,Belarus,BY,BLR,9485386,2020-02-18,BY,BLR,Belarus
17/02/2020,17,2,2020,0,0,Belarus,BY,BLR,9485386,2020-02-17,BY,BLR,Belarus
16/02/2020,16,2,2020,0,0,Belarus,BY,BLR,9485386,2020-02-16,BY,BLR,Belarus
15/02/2020,15,2,2020,0,0,Belarus,BY,BLR,9485386,2020-02-15,BY,BLR,Belarus
14/02/2020,14,2,2020,0,0,Belarus,BY,BLR,9485386,2020-02-14,BY,BLR,Belarus
13/02/2020,13,2,2020,0,0,Belarus,BY,BLR,9485386,2020-02-13,BY,BLR,Belarus
12/02/2020,12,2,2020,0,0,Belarus,BY,BLR,9485386,2020-02-12,BY,BLR,Belarus
11/02/2020,11,2,2020,0,0,Belarus,BY,BLR,9485386,2020-02-11,BY,BLR,Belarus
10/02/2020,10,2,2020,0,0,Belarus,BY,BLR,9485386,2020-02-10,BY,BLR,Belarus
09/02/2020,9,2,2020,0,0,Belarus,BY,BLR,9485386,2020-02-09,BY,BLR,Belarus
08/02/2020,8,2,2020,0,0,Belarus,BY,BLR,9485386,2020-02-08,BY,BLR,Belarus
07/02/2020,7,2,2020,0,0,Belarus,BY,BLR,9485386,2020-02-07,BY,BLR,Belarus
06/02/2020,6,2,2020,0,0,Belarus,BY,BLR,9485386,2020-02-06,BY,BLR,Belarus
05/02/2020,5,2,2020,0,0,Belarus,BY,BLR,9485386,2020-02-05,BY,BLR,Belarus
04/02/2020,4,2,2020,0,0,Belarus,BY,BLR,9485386,2020-02-04,BY,BLR,Belarus
03/02/2020,3,2,2020,0,0,Belarus,BY,BLR,9485386,2020-02-03,BY,BLR,Belarus
02/02/2020,2,2,2020,0,0,Belarus,BY,BLR,9485386,2020-02-02,BY,BLR,Belarus
01/02/2020,1,2,2020,0,0,Belarus,BY,BLR,9485386,2020-02-01,BY,BLR,Belarus
31/01/2020,31,1,2020,0,0,Belarus,BY,BLR,9485386,2020-01-31,BY,BLR,Belarus
30/01/2020,30,1,2020,0,0,Belarus,BY,BLR,9485386,2020-01-30,BY,BLR,Belarus
29/01/2020,29,1,2020,0,0,Belarus,BY,BLR,9485386,2020-01-29,BY,BLR,Belarus
28/01/2020,28,1,2020,0,0,Belarus,BY,BLR,9485386,2020-01-28,BY,BLR,Belarus
27/01/2020,27,1,2020,0,0,Belarus,BY,BLR,9485386,2020-01-27,BY,BLR,Belarus
26/01/2020,26,1,2020,0,0,Belarus,BY,BLR,9485386,2020-01-26,BY,BLR,Belarus
25/01/2020,25,1,2020,0,0,Belarus,BY,BLR,9485386,2020-01-25,BY,BLR,Belarus
24/01/2020,24,1,2020,0,0,Belarus,BY,BLR,9485386,2020-01-24,BY,BLR,Belarus
23/01/2020,23,1,2020,0,0,Belarus,BY,BLR,9485386,2020-01-23,BY,BLR,Belarus
22/01/2020,22,1,2020,0,0,Belarus,BY,BLR,9485386,2020-01-22,BY,BLR,Belarus
21/01/2020,21,1,2020,0,0,Belarus,BY,BLR,9485386,2020-01-21,BY,BLR,Belarus
20/01/2020,20,1,2020,0,0,Belarus,BY,BLR,9485386,2020-01-20,BY,BLR,Belarus
19/01/2020,19,1,2020,0,0,Belarus,BY,BLR,9485386,2020-01-19,BY,BLR,Belarus
18/01/2020,18,1,2020,0,0,Belarus,BY,BLR,9485386,2020-01-18,BY,BLR,Belarus
17/01/2020,17,1,2020,0,0,Belarus,BY,BLR,9485386,2020-01-17,BY,BLR,Belarus
16/01/2020,16,1,2020,0,0,Belarus,BY,BLR,9485386,2020-01-16,BY,BLR,Belarus
15/01/2020,15,1,2020,0,0,Belarus,BY,BLR,9485386,2020-01-15,BY,BLR,Belarus
14/01/2020,14,1,2020,0,0,Belarus,BY,BLR,9485386,2020-01-14,BY,BLR,Belarus
13/01/2020,13,1,2020,0,0,Belarus,BY,BLR,9485386,2020-01-13,BY,BLR,Belarus
12/01/2020,12,1,2020,0,0,Belarus,BY,BLR,9485386,2020-01-12,BY,BLR,Belarus
11/01/2020,11,1,2020,0,0,Belarus,BY,BLR,9485386,2020-01-11,BY,BLR,Belarus
10/01/2020,10,1,2020,0,0,Belarus,BY,BLR,9485386,2020-01-10,BY,BLR,Belarus
09/01/2020,9,1,2020,0,0,Belarus,BY,BLR,9485386,2020-01-09,BY,BLR,Belarus
08/01/2020,8,1,2020,0,0,Belarus,BY,BLR,9485386,2020-01-08,BY,BLR,Belarus
07/01/2020,7,1,2020,0,0,Belarus,BY,BLR,9485386,2020-01-07,BY,BLR,Belarus
06/01/2020,6,1,2020,0,0,Belarus,BY,BLR,9485386,2020-01-06,BY,BLR,Belarus
05/01/2020,5,1,2020,0,0,Belarus,BY,BLR,9485386,2020-01-05,BY,BLR,Belarus
04/01/2020,4,1,2020,0,0,Belarus,BY,BLR,9485386,2020-01-04,BY,BLR,Belarus
03/01/2020,3,1,2020,0,0,Belarus,BY,BLR,9485386,2020-01-03,BY,BLR,Belarus
02/01/2020,2,1,2020,0,0,Belarus,BY,BLR,9485386,2020-01-02,BY,BLR,Belarus
01/01/2020,1,1,2020,0,0,Belarus,BY,BLR,9485386,2020-01-01,BY,BLR,Belarus
31/12/2019,31,12,2019,0,0,Belarus,BY,BLR,9485386,2019-12-31,BY,BLR,Belarus
13/04/2020,13,4,2020,1629,254,Belgium,BE,BEL,11422068,2020-04-13,BE,BEL,Belgium
12/04/2020,12,4,2020,1351,327,Belgium,BE,BEL,11422068,2020-04-12,BE,BEL,Belgium
11/04/2020,11,4,2020,1684,496,Belgium,BE,BEL,11422068,2020-04-11,BE,BEL,Belgium
10/04/2020,10,4,2020,1580,283,Belgium,BE,BEL,11422068,2020-04-10,BE,BEL,Belgium
09/04/2020,9,4,2020,1209,205,Belgium,BE,BEL,11422068,2020-04-09,BE,BEL,Belgium
08/04/2020,8,4,2020,1380,403,Belgium,BE,BEL,11422068,2020-04-08,BE,BEL,Belgium
07/04/2020,7,4,2020,1123,185,Belgium,BE,BEL,11422068,2020-04-07,BE,BEL,Belgium
06/04/2020,6,4,2020,1260,164,Belgium,BE,BEL,11422068,2020-04-06,BE,BEL,Belgium
05/04/2020,5,4,2020,1661,140,Belgium,BE,BEL,11422068,2020-04-05,BE,BEL,Belgium
04/04/2020,4,4,2020,1422,132,Belgium,BE,BEL,11422068,2020-04-04,BE,BEL,Belgium
03/04/2020,3,4,2020,1384,183,Belgium,BE,BEL,11422068,2020-04-03,BE,BEL,Belgium
02/04/2020,2,4,2020,1189,123,Belgium,BE,BEL,11422068,2020-04-02,BE,BEL,Belgium
01/04/2020,1,4,2020,876,192,Belgium,BE,BEL,11422068,2020-04-01,BE,BEL,Belgium
31/03/2020,31,3,2020,1063,82,Belgium,BE,BEL,11422068,2020-03-31,BE,BEL,Belgium
30/03/2020,30,3,2020,1702,78,Belgium,BE,BEL,11422068,2020-03-30,BE,BEL,Belgium
29/03/2020,29,3,2020,1850,64,Belgium,BE,BEL,11422068,2020-03-29,BE,BEL,Belgium
28/03/2020,28,3,2020,1049,69,Belgium,BE,BEL,11422068,2020-03-28,BE,BEL,Belgium
27/03/2020,27,3,2020,1298,42,Belgium,BE,BEL,11422068,2020-03-27,BE,BEL,Belgium
26/03/2020,26,3,2020,668,56,Belgium,BE,BEL,11422068,2020-03-26,BE,BEL,Belgium
25/03/2020,25,3,2020,526,34,Belgium,BE,BEL,11422068,2020-03-25,BE,BEL,Belgium
24/03/2020,24,3,2020,342,13,Belgium,BE,BEL,11422068,2020-03-24,BE,BEL,Belgium
23/03/2020,23,3,2020,586,8,Belgium,BE,BEL,11422068,2020-03-23,BE,BEL,Belgium
22/03/2020,22,3,2020,558,30,Belgium,BE,BEL,11422068,2020-03-22,BE,BEL,Belgium
21/03/2020,21,3,2020,462,16,Belgium,BE,BEL,11422068,2020-03-21,BE,BEL,Belgium
20/03/2020,20,3,2020,309,7,Belgium,BE,BEL,11422068,2020-03-20,BE,BEL,Belgium
19/03/2020,19,3,2020,243,9,Belgium,BE,BEL,11422068,2020-03-19,BE,BEL,Belgium
18/03/2020,18,3,2020,158,0,Belgium,BE,BEL,11422068,2020-03-18,BE,BEL,Belgium
17/03/2020,17,3,2020,199,1,Belgium,BE,BEL,11422068,2020-03-17,BE,BEL,Belgium
16/03/2020,16,3,2020,197,0,Belgium,BE,BEL,11422068,2020-03-16,BE,BEL,Belgium
15/03/2020,15,3,2020,130,1,Belgium,BE,BEL,11422068,2020-03-15,BE,BEL,Belgium
14/03/2020,14,3,2020,160,0,Belgium,BE,BEL,11422068,2020-03-14,BE,BEL,Belgium
13/03/2020,13,3,2020,85,0,Belgium,BE,BEL,11422068,2020-03-13,BE,BEL,Belgium
12/03/2020,12,3,2020,47,3,Belgium,BE,BEL,11422068,2020-03-12,BE,BEL,Belgium
11/03/2020,11,3,2020,28,0,Belgium,BE,BEL,11422068,2020-03-11,BE,BEL,Belgium
10/03/2020,10,3,2020,39,0,Belgium,BE,BEL,11422068,2020-03-10,BE,BEL,Belgium
09/03/2020,9,3,2020,31,0,Belgium,BE,BEL,11422068,2020-03-09,BE,BEL,Belgium
08/03/2020,8,3,2020,60,0,Belgium,BE,BEL,11422068,2020-03-08,BE,BEL,Belgium
07/03/2020,7,3,2020,59,0,Belgium,BE,BEL,11422068,2020-03-07,BE,BEL,Belgium
06/03/2020,6,3,2020,27,0,Belgium,BE,BEL,11422068,2020-03-06,BE,BEL,Belgium
05/03/2020,5,3,2020,10,0,Belgium,BE,BEL,11422068,2020-03-05,BE,BEL,Belgium
04/03/2020,4,3,2020,5,0,Belgium,BE,BEL,11422068,2020-03-04,BE,BEL,Belgium
03/03/2020,3,3,2020,6,0,Belgium,BE,BEL,11422068,2020-03-03,BE,BEL,Belgium
02/03/2020,2,3,2020,1,0,Belgium,BE,BEL,11422068,2020-03-02,BE,BEL,Belgium
01/03/2020,1,3,2020,0,0,Belgium,BE,BEL,11422068,2020-03-01,BE,BEL,Belgium
29/02/2020,29,2,2020,0,0,Belgium,BE,BEL,11422068,2020-02-29,BE,BEL,Belgium
28/02/2020,28,2,2020,0,0,Belgium,BE,BEL,11422068,2020-02-28,BE,BEL,Belgium
27/02/2020,27,2,2020,0,0,Belgium,BE,BEL,11422068,2020-02-27,BE,BEL,Belgium
26/02/2020,26,2,2020,0,0,Belgium,BE,BEL,11422068,2020-02-26,BE,BEL,Belgium
25/02/2020,25,2,2020,0,0,Belgium,BE,BEL,11422068,2020-02-25,BE,BEL,Belgium
24/02/2020,24,2,2020,0,0,Belgium,BE,BEL,11422068,2020-02-24,BE,BEL,Belgium
23/02/2020,23,2,2020,0,0,Belgium,BE,BEL,11422068,2020-02-23,BE,BEL,Belgium
22/02/2020,22,2,2020,0,0,Belgium,BE,BEL,11422068,2020-02-22,BE,BEL,Belgium
21/02/2020,21,2,2020,0,0,Belgium,BE,BEL,11422068,2020-02-21,BE,BEL,Belgium
20/02/2020,20,2,2020,0,0,Belgium,BE,BEL,11422068,2020-02-20,BE,BEL,Belgium
19/02/2020,19,2,2020,0,0,Belgium,BE,BEL,11422068,2020-02-19,BE,BEL,Belgium
18/02/2020,18,2,2020,0,0,Belgium,BE,BEL,11422068,2020-02-18,BE,BEL,Belgium
17/02/2020,17,2,2020,0,0,Belgium,BE,BEL,11422068,2020-02-17,BE,BEL,Belgium
16/02/2020,16,2,2020,0,0,Belgium,BE,BEL,11422068,2020-02-16,BE,BEL,Belgium
15/02/2020,15,2,2020,0,0,Belgium,BE,BEL,11422068,2020-02-15,BE,BEL,Belgium
14/02/2020,14,2,2020,0,0,Belgium,BE,BEL,11422068,2020-02-14,BE,BEL,Belgium
13/02/2020,13,2,2020,0,0,Belgium,BE,BEL,11422068,2020-02-13,BE,BEL,Belgium
12/02/2020,12,2,2020,0,0,Belgium,BE,BEL,11422068,2020-02-12,BE,BEL,Belgium
11/02/2020,11,2,2020,0,0,Belgium,BE,BEL,11422068,2020-02-11,BE,BEL,Belgium
10/02/2020,10,2,2020,0,0,Belgium,BE,BEL,11422068,2020-02-10,BE,BEL,Belgium
09/02/2020,9,2,2020,0,0,Belgium,BE,BEL,11422068,2020-02-09,BE,BEL,Belgium
08/02/2020,8,2,2020,0,0,Belgium,BE,BEL,11422068,2020-02-08,BE,BEL,Belgium
07/02/2020,7,2,2020,0,0,Belgium,BE,BEL,11422068,2020-02-07,BE,BEL,Belgium
06/02/2020,6,2,2020,0,0,Belgium,BE,BEL,11422068,2020-02-06,BE,BEL,Belgium
05/02/2020,5,2,2020,0,0,Belgium,BE,BEL,11422068,2020-02-05,BE,BEL,Belgium
04/02/2020,4,2,2020,1,0,Belgium,BE,BEL,11422068,2020-02-04,BE,BEL,Belgium
03/02/2020,3,2,2020,0,0,Belgium,BE,BEL,11422068,2020-02-03,BE,BEL,Belgium
02/02/2020,2,2,2020,0,0,Belgium,BE,BEL,11422068,2020-02-02,BE,BEL,Belgium
01/02/2020,1,2,2020,0,0,Belgium,BE,BEL,11422068,2020-02-01,BE,BEL,Belgium
31/01/2020,31,1,2020,0,0,Belgium,BE,BEL,11422068,2020-01-31,BE,BEL,Belgium
30/01/2020,30,1,2020,0,0,Belgium,BE,BEL,11422068,2020-01-30,BE,BEL,Belgium
29/01/2020,29,1,2020,0,0,Belgium,BE,BEL,11422068,2020-01-29,BE,BEL,Belgium
28/01/2020,28,1,2020,0,0,Belgium,BE,BEL,11422068,2020-01-28,BE,BEL,Belgium
27/01/2020,27,1,2020,0,0,Belgium,BE,BEL,11422068,2020-01-27,BE,BEL,Belgium
26/01/2020,26,1,2020,0,0,Belgium,BE,BEL,11422068,2020-01-26,BE,BEL,Belgium
25/01/2020,25,1,2020,0,0,Belgium,BE,BEL,11422068,2020-01-25,BE,BEL,Belgium
24/01/2020,24,1,2020,0,0,Belgium,BE,BEL,11422068,2020-01-24,BE,BEL,Belgium
23/01/2020,23,1,2020,0,0,Belgium,BE,BEL,11422068,2020-01-23,BE,BEL,Belgium
22/01/2020,22,1,2020,0,0,Belgium,BE,BEL,11422068,2020-01-22,BE,BEL,Belgium
21/01/2020,21,1,2020,0,0,Belgium,BE,BEL,11422068,2020-01-21,BE,BEL,Belgium
20/01/2020,20,1,2020,0,0,Belgium,BE,BEL,11422068,2020-01-20,BE,BEL,Belgium
19/01/2020,19,1,2020,0,0,Belgium,BE,BEL,11422068,2020-01-19,BE,BEL,Belgium
18/01/2020,18,1,2020,0,0,Belgium,BE,BEL,11422068,2020-01-18,BE,BEL,Belgium
17/01/2020,17,1,2020,0,0,Belgium,BE,BEL,11422068,2020-01-17,BE,BEL,Belgium
16/01/2020,16,1,2020,0,0,Belgium,BE,BEL,11422068,2020-01-16,BE,BEL,Belgium
15/01/2020,15,1,2020,0,0,Belgium,BE,BEL,11422068,2020-01-15,BE,BEL,Belgium
14/01/2020,14,1,2020,0,0,Belgium,BE,BEL,11422068,2020-01-14,BE,BEL,Belgium
13/01/2020,13,1,2020,0,0,Belgium,BE,BEL,11422068,2020-01-13,BE,BEL,Belgium
12/01/2020,12,1,2020,0,0,Belgium,BE,BEL,11422068,2020-01-12,BE,BEL,Belgium
11/01/2020,11,1,2020,0,0,Belgium,BE,BEL,11422068,2020-01-11,BE,BEL,Belgium
10/01/2020,10,1,2020,0,0,Belgium,BE,BEL,11422068,2020-01-10,BE,BEL,Belgium
09/01/2020,9,1,2020,0,0,Belgium,BE,BEL,11422068,2020-01-09,BE,BEL,Belgium
08/01/2020,8,1,2020,0,0,Belgium,BE,BEL,11422068,2020-01-08,BE,BEL,Belgium
07/01/2020,7,1,2020,0,0,Belgium,BE,BEL,11422068,2020-01-07,BE,BEL,Belgium
06/01/2020,6,1,2020,0,0,Belgium,BE,BEL,11422068,2020-01-06,BE,BEL,Belgium
05/01/2020,5,1,2020,0,0,Belgium,BE,BEL,11422068,2020-01-05,BE,BEL,Belgium
04/01/2020,4,1,2020,0,0,Belgium,BE,BEL,11422068,2020-01-04,BE,BEL,Belgium
03/01/2020,3,1,2020,0,0,Belgium,BE,BEL,11422068,2020-01-03,BE,BEL,Belgium
02/01/2020,2,1,2020,0,0,Belgium,BE,BEL,11422068,2020-01-02,BE,BEL,Belgium
01/01/2020,1,1,2020,0,0,Belgium,BE,BEL,11422068,2020-01-01,BE,BEL,Belgium
31/12/2019,31,12,2019,0,0,Belgium,BE,BEL,11422068,2019-12-31,BE,BEL,Belgium
13/04/2020,13,4,2020,1,0,Belize,BZ,BLZ,383071,2020-04-13,BZ,BLZ,Belize
12/04/2020,12,4,2020,3,0,Belize,BZ,BLZ,383071,2020-04-12,BZ,BLZ,Belize
11/04/2020,11,4,2020,1,1,Belize,BZ,BLZ,383071,2020-04-11,BZ,BLZ,Belize
10/04/2020,10,4,2020,1,0,Belize,BZ,BLZ,383071,2020-04-10,BZ,BLZ,Belize
09/04/2020,9,4,2020,1,0,Belize,BZ,BLZ,383071,2020-04-09,BZ,BLZ,Belize
08/04/2020,8,4,2020,0,0,Belize,BZ,BLZ,383071,2020-04-08,BZ,BLZ,Belize
07/04/2020,7,4,2020,2,0,Belize,BZ,BLZ,383071,2020-04-07,BZ,BLZ,Belize
06/04/2020,6,4,2020,1,1,Belize,BZ,BLZ,383071,2020-04-06,BZ,BLZ,Belize
05/04/2020,5,4,2020,0,0,Belize,BZ,BLZ,383071,2020-04-05,BZ,BLZ,Belize
04/04/2020,4,4,2020,1,0,Belize,BZ,BLZ,383071,2020-04-04,BZ,BLZ,Belize
03/04/2020,3,4,2020,0,0,Belize,BZ,BLZ,383071,2020-04-03,BZ,BLZ,Belize
02/04/2020,2,4,2020,0,0,Belize,BZ,BLZ,383071,2020-04-02,BZ,BLZ,Belize
01/04/2020,1,4,2020,0,0,Belize,BZ,BLZ,383071,2020-04-01,BZ,BLZ,Belize
31/03/2020,31,3,2020,1,0,Belize,BZ,BLZ,383071,2020-03-31,BZ,BLZ,Belize
30/03/2020,30,3,2020,0,0,Belize,BZ,BLZ,383071,2020-03-30,BZ,BLZ,Belize
29/03/2020,29,3,2020,0,0,Belize,BZ,BLZ,383071,2020-03-29,BZ,BLZ,Belize
28/03/2020,28,3,2020,0,0,Belize,BZ,BLZ,383071,2020-03-28,BZ,BLZ,Belize
27/03/2020,27,3,2020,0,0,Belize,BZ,BLZ,383071,2020-03-27,BZ,BLZ,Belize
26/03/2020,26,3,2020,1,0,Belize,BZ,BLZ,383071,2020-03-26,BZ,BLZ,Belize
25/03/2020,25,3,2020,0,0,Belize,BZ,BLZ,383071,2020-03-25,BZ,BLZ,Belize
24/03/2020,24,3,2020,1,0,Belize,BZ,BLZ,383071,2020-03-24,BZ,BLZ,Belize
13/04/2020,13,4,2020,0,0,Benin,BJ,BEN,11485048,2020-04-13,BJ,BEN,Benin
12/04/2020,12,4,2020,0,0,Benin,BJ,BEN,11485048,2020-04-12,BJ,BEN,Benin
11/04/2020,11,4,2020,5,0,Benin,BJ,BEN,11485048,2020-04-11,BJ,BEN,Benin
10/04/2020,10,4,2020,4,0,Benin,BJ,BEN,11485048,2020-04-10,BJ,BEN,Benin
09/04/2020,9,4,2020,0,0,Benin,BJ,BEN,11485048,2020-04-09,BJ,BEN,Benin
08/04/2020,8,4,2020,0,0,Benin,BJ,BEN,11485048,2020-04-08,BJ,BEN,Benin
07/04/2020,7,4,2020,4,1,Benin,BJ,BEN,11485048,2020-04-07,BJ,BEN,Benin
06/04/2020,6,4,2020,6,0,Benin,BJ,BEN,11485048,2020-04-06,BJ,BEN,Benin
05/04/2020,5,4,2020,0,0,Benin,BJ,BEN,11485048,2020-04-05,BJ,BEN,Benin
04/04/2020,4,4,2020,3,0,Benin,BJ,BEN,11485048,2020-04-04,BJ,BEN,Benin
03/04/2020,3,4,2020,0,0,Benin,BJ,BEN,11485048,2020-04-03,BJ,BEN,Benin
02/04/2020,2,4,2020,5,0,Benin,BJ,BEN,11485048,2020-04-02,BJ,BEN,Benin
01/04/2020,1,4,2020,2,0,Benin,BJ,BEN,11485048,2020-04-01,BJ,BEN,Benin
31/03/2020,31,3,2020,0,0,Benin,BJ,BEN,11485048,2020-03-31,BJ,BEN,Benin
30/03/2020,30,3,2020,0,0,Benin,BJ,BEN,11485048,2020-03-30,BJ,BEN,Benin
29/03/2020,29,3,2020,0,0,Benin,BJ,BEN,11485048,2020-03-29,BJ,BEN,Benin
28/03/2020,28,3,2020,0,0,Benin,BJ,BEN,11485048,2020-03-28,BJ,BEN,Benin
27/03/2020,27,3,2020,1,0,Benin,BJ,BEN,11485048,2020-03-27,BJ,BEN,Benin
26/03/2020,26,3,2020,0,0,Benin,BJ,BEN,11485048,2020-03-26,BJ,BEN,Benin
25/03/2020,25,3,2020,0,0,Benin,BJ,BEN,11485048,2020-03-25,BJ,BEN,Benin
24/03/2020,24,3,2020,3,0,Benin,BJ,BEN,11485048,2020-03-24,BJ,BEN,Benin
23/03/2020,23,3,2020,0,0,Benin,BJ,BEN,11485048,2020-03-23,BJ,BEN,Benin
22/03/2020,22,3,2020,0,0,Benin,BJ,BEN,11485048,2020-03-22,BJ,BEN,Benin
21/03/2020,21,3,2020,0,0,Benin,BJ,BEN,11485048,2020-03-21,BJ,BEN,Benin
20/03/2020,20,3,2020,1,0,Benin,BJ,BEN,11485048,2020-03-20,BJ,BEN,Benin
19/03/2020,19,3,2020,0,0,Benin,BJ,BEN,11485048,2020-03-19,BJ,BEN,Benin
18/03/2020,18,3,2020,0,0,Benin,BJ,BEN,11485048,2020-03-18,BJ,BEN,Benin
17/03/2020,17,3,2020,1,0,Benin,BJ,BEN,11485048,2020-03-17,BJ,BEN,Benin
13/04/2020,13,4,2020,7,0,Bermuda,BM,BMU,63968,2020-04-13,BM,BMU,Bermuda
12/04/2020,12,4,2020,2,0,Bermuda,BM,BMU,63968,2020-04-12,BM,BMU,Bermuda
11/04/2020,11,4,2020,0,0,Bermuda,BM,BMU,63968,2020-04-11,BM,BMU,Bermuda
10/04/2020,10,4,2020,9,1,Bermuda,BM,BMU,63968,2020-04-10,BM,BMU,Bermuda
09/04/2020,9,4,2020,0,1,Bermuda,BM,BMU,63968,2020-04-09,BM,BMU,Bermuda
08/04/2020,8,4,2020,0,0,Bermuda,BM,BMU,63968,2020-04-08,BM,BMU,Bermuda
07/04/2020,7,4,2020,2,2,Bermuda,BM,BMU,63968,2020-04-07,BM,BMU,Bermuda
06/04/2020,6,4,2020,0,0,Bermuda,BM,BMU,63968,2020-04-06,BM,BMU,Bermuda
05/04/2020,5,4,2020,2,0,Bermuda,BM,BMU,63968,2020-04-05,BM,BMU,Bermuda
04/04/2020,4,4,2020,0,0,Bermuda,BM,BMU,63968,2020-04-04,BM,BMU,Bermuda
03/04/2020,3,4,2020,3,0,Bermuda,BM,BMU,63968,2020-04-03,BM,BMU,Bermuda
02/04/2020,2,4,2020,0,0,Bermuda,BM,BMU,63968,2020-04-02,BM,BMU,Bermuda
01/04/2020,1,4,2020,5,0,Bermuda,BM,BMU,63968,2020-04-01,BM,BMU,Bermuda
31/03/2020,31,3,2020,5,0,Bermuda,BM,BMU,63968,2020-03-31,BM,BMU,Bermuda
30/03/2020,30,3,2020,0,0,Bermuda,BM,BMU,63968,2020-03-30,BM,BMU,Bermuda
29/03/2020,29,3,2020,5,0,Bermuda,BM,BMU,63968,2020-03-29,BM,BMU,Bermuda
28/03/2020,28,3,2020,2,0,Bermuda,BM,BMU,63968,2020-03-28,BM,BMU,Bermuda
27/03/2020,27,3,2020,9,0,Bermuda,BM,BMU,63968,2020-03-27,BM,BMU,Bermuda
26/03/2020,26,3,2020,0,0,Bermuda,BM,BMU,63968,2020-03-26,BM,BMU,Bermuda
25/03/2020,25,3,2020,0,0,Bermuda,BM,BMU,63968,2020-03-25,BM,BMU,Bermuda
24/03/2020,24,3,2020,0,0,Bermuda,BM,BMU,63968,2020-03-24,BM,BMU,Bermuda
23/03/2020,23,3,2020,4,0,Bermuda,BM,BMU,63968,2020-03-23,BM,BMU,Bermuda
22/03/2020,22,3,2020,0,0,Bermuda,BM,BMU,63968,2020-03-22,BM,BMU,Bermuda
21/03/2020,21,3,2020,0,0,Bermuda,BM,BMU,63968,2020-03-21,BM,BMU,Bermuda
20/03/2020,20,3,2020,2,0,Bermuda,BM,BMU,63968,2020-03-20,BM,BMU,Bermuda
13/04/2020,13,4,2020,0,0,Bhutan,BT,BTN,754394,2020-04-13,BT,BTN,Bhutan
12/04/2020,12,4,2020,0,0,Bhutan,BT,BTN,754394,2020-04-12,BT,BTN,Bhutan
11/04/2020,11,4,2020,0,0,Bhutan,BT,BTN,754394,2020-04-11,BT,BTN,Bhutan
10/04/2020,10,4,2020,0,0,Bhutan,BT,BTN,754394,2020-04-10,BT,BTN,Bhutan
09/04/2020,9,4,2020,0,0,Bhutan,BT,BTN,754394,2020-04-09,BT,BTN,Bhutan
08/04/2020,8,4,2020,0,0,Bhutan,BT,BTN,754394,2020-04-08,BT,BTN,Bhutan
07/04/2020,7,4,2020,0,0,Bhutan,BT,BTN,754394,2020-04-07,BT,BTN,Bhutan
06/04/2020,6,4,2020,0,0,Bhutan,BT,BTN,754394,2020-04-06,BT,BTN,Bhutan
05/04/2020,5,4,2020,0,0,Bhutan,BT,BTN,754394,2020-04-05,BT,BTN,Bhutan
04/04/2020,4,4,2020,0,0,Bhutan,BT,BTN,754394,2020-04-04,BT,BTN,Bhutan
03/04/2020,3,4,2020,0,0,Bhutan,BT,BTN,754394,2020-04-03,BT,BTN,Bhutan
02/04/2020,2,4,2020,1,0,Bhutan,BT,BTN,754394,2020-04-02,BT,BTN,Bhutan
01/04/2020,1,4,2020,0,0,Bhutan,BT,BTN,754394,2020-04-01,BT,BTN,Bhutan
31/03/2020,31,3,2020,0,0,Bhutan,BT,BTN,754394,2020-03-31,BT,BTN,Bhutan
30/03/2020,30,3,2020,0,0,Bhutan,BT,BTN,754394,2020-03-30,BT,BTN,Bhutan
29/03/2020,29,3,2020,1,0,Bhutan,BT,BTN,754394,2020-03-29,BT,BTN,Bhutan
28/03/2020,28,3,2020,0,0,Bhutan,BT,BTN,754394,2020-03-28,BT,BTN,Bhutan
27/03/2020,27,3,2020,0,0,Bhutan,BT,BTN,754394,2020-03-27,BT,BTN,Bhutan
26/03/2020,26,3,2020,1,0,Bhutan,BT,BTN,754394,2020-03-26,BT,BTN,Bhutan
25/03/2020,25,3,2020,0,0,Bhutan,BT,BTN,754394,2020-03-25,BT,BTN,Bhutan
24/03/2020,24,3,2020,0,0,Bhutan,BT,BTN,754394,2020-03-24,BT,BTN,Bhutan
23/03/2020,23,3,2020,0,0,Bhutan,BT,BTN,754394,2020-03-23,BT,BTN,Bhutan
22/03/2020,22,3,2020,0,0,Bhutan,BT,BTN,754394,2020-03-22,BT,BTN,Bhutan
21/03/2020,21,3,2020,1,0,Bhutan,BT,BTN,754394,2020-03-21,BT,BTN,Bhutan
20/03/2020,20,3,2020,0,0,Bhutan,BT,BTN,754394,2020-03-20,BT,BTN,Bhutan
19/03/2020,19,3,2020,0,0,Bhutan,BT,BTN,754394,2020-03-19,BT,BTN,Bhutan
18/03/2020,18,3,2020,0,0,Bhutan,BT,BTN,754394,2020-03-18,BT,BTN,Bhutan
17/03/2020,17,3,2020,0,0,Bhutan,BT,BTN,754394,2020-03-17,BT,BTN,Bhutan
15/03/2020,15,3,2020,0,0,Bhutan,BT,BTN,754394,2020-03-15,BT,BTN,Bhutan
13/03/2020,13,3,2020,0,0,Bhutan,BT,BTN,754394,2020-03-13,BT,BTN,Bhutan
06/03/2020,6,3,2020,1,0,Bhutan,BT,BTN,754394,2020-03-06,BT,BTN,Bhutan
13/04/2020,13,4,2020,30,3,Bolivia,BO,BOL,11353142,2020-04-13,BO,BOL,"Bolivia, Plurinational State of"
12/04/2020,12,4,2020,24,4,Bolivia,BO,BOL,11353142,2020-04-12,BO,BOL,"Bolivia, Plurinational State of"
11/04/2020,11,4,2020,8,1,Bolivia,BO,BOL,11353142,2020-04-11,BO,BOL,"Bolivia, Plurinational State of"
10/04/2020,10,4,2020,4,1,Bolivia,BO,BOL,11353142,2020-04-10,BO,BOL,"Bolivia, Plurinational State of"
09/04/2020,9,4,2020,54,3,Bolivia,BO,BOL,11353142,2020-04-09,BO,BOL,"Bolivia, Plurinational State of"
08/04/2020,8,4,2020,16,1,Bolivia,BO,BOL,11353142,2020-04-08,BO,BOL,"Bolivia, Plurinational State of"
07/04/2020,7,4,2020,11,3,Bolivia,BO,BOL,11353142,2020-04-07,BO,BOL,"Bolivia, Plurinational State of"
06/04/2020,6,4,2020,26,1,Bolivia,BO,BOL,11353142,2020-04-06,BO,BOL,"Bolivia, Plurinational State of"
05/04/2020,5,4,2020,18,0,Bolivia,BO,BOL,11353142,2020-04-05,BO,BOL,"Bolivia, Plurinational State of"
04/04/2020,4,4,2020,7,1,Bolivia,BO,BOL,11353142,2020-04-04,BO,BOL,"Bolivia, Plurinational State of"
03/04/2020,3,4,2020,9,1,Bolivia,BO,BOL,11353142,2020-04-03,BO,BOL,"Bolivia, Plurinational State of"
02/04/2020,2,4,2020,8,1,Bolivia,BO,BOL,11353142,2020-04-02,BO,BOL,"Bolivia, Plurinational State of"
01/04/2020,1,4,2020,8,1,Bolivia,BO,BOL,11353142,2020-04-01,BO,BOL,"Bolivia, Plurinational State of"
31/03/2020,31,3,2020,11,3,Bolivia,BO,BOL,11353142,2020-03-31,BO,BOL,"Bolivia, Plurinational State of"
30/03/2020,30,3,2020,15,3,Bolivia,BO,BOL,11353142,2020-03-30,BO,BOL,"Bolivia, Plurinational State of"
29/03/2020,29,3,2020,7,0,Bolivia,BO,BOL,11353142,2020-03-29,BO,BOL,"Bolivia, Plurinational State of"
28/03/2020,28,3,2020,13,0,Bolivia,BO,BOL,11353142,2020-03-28,BO,BOL,"Bolivia, Plurinational State of"
27/03/2020,27,3,2020,22,0,Bolivia,BO,BOL,11353142,2020-03-27,BO,BOL,"Bolivia, Plurinational State of"
