records.dateRep,records.day,records.month,records.year,records.cases,records.deaths,records.countriesAndTerritories,records.geoId,records.countryterritoryCode,records.popData2018,date,iso2
13/04/2020,13,4,2020,52,0,Afghanistan,AF,AFG,37172386,2020-04-13,AF
12/04/2020,12,4,2020,34,3,Afghanistan,AF,AFG,37172386,2020-04-12,AF
11/04/2020,11,4,2020,37,0,Afghanistan,AF,AFG,37172386,2020-04-11,AF
10/04/2020,10,4,2020,61,1,Afghanistan,AF,AFG,37172386,2020-04-10,AF
09/04/2020,9,4,2020,56,3,Afghanistan,AF,AFG,37172386,2020-04-09,AF
08/04/2020,8,4,2020,30,4,Afghanistan,AF,AFG,37172386,2020-04-08,AF
07/04/2020,7,4,2020,38,0,Afghanistan,AF,AFG,37172386,2020-04-07,AF
06/04/2020,6,4,2020,29,2,Afghanistan,AF,AFG,37172386,2020-04-06,AF
05/04/2020,5,4,2020,35,1,Afghanistan,AF,AFG,37172386,2020-04-05,AF
04/04/2020,4,4,2020,0,0,Afghanistan,AF,AFG,37172386,2020-04-04,AF
03/04/2020,3,4,2020,43,0,Afghanistan,AF,AFG,37172386,2020-04-03,AF
02/04/2020,2,4,2020,26,0,Afghanistan,AF,AFG,37172386,2020-04-02,AF
01/04/2020,1,4,2020,25,0,Afghanistan,AF,AFG,37172386,2020-04-01,AF
31/03/2020,31,3,2020,27,0,Afghanistan,AF,AFG,37172386,2020-03-31,AF
30/03/2020,30,3,2020,8,1,Afghanistan,AF,AFG,37172386,2020-03-30,AF
29/03/2020,29,3,2020,15,1,Afghanistan,AF,AFG,37172386,2020-03-29,AF
28/03/2020,28,3,2020,16,1,Afghanistan,AF,AFG,37172386,2020-03-28,AF
27/03/2020,27,3,2020,0,0,Afghanistan,AF,AFG,37172386,2020-03-27,AF
26/03/2020,26,3,2020,33,0,Afghanistan,AF,AFG,37172386,2020-03-26,AF
25/03/2020,25,3,2020,2,0,Afghanistan,AF,AFG,37172386,2020-03-25,AF
24/03/2020,24,3,2020,6,1,Afghanistan,AF,AFG,37172386,2020-03-24,AF
23/03/2020,23,3,2020,10,0,Afghanistan,AF,AFG,37172386,2020-03-23,AF
22/03/2020,22,3,2020,0,0,Afghanistan,AF,AFG,37172386,2020-03-22,AF
21/03/2020,21,3,2020,2,0,Afghanistan,AF,AFG,37172386,2020-03-21,AF
20/03/2020,20,3,2020,0,0,Afghanistan,AF,AFG,37172386,2020-03-20,AF
19/03/2020,19,3,2020,0,0,Afghanistan,AF,AFG,37172386,2020-03-19,AF
18/03/2020,18,3,2020,1,0,Afghanistan,AF,AFG,37172386,2020-03-18,AF
17/03/2020,17,3,2020,5,0,Afghanistan,AF,AFG,37172386,2020-03-17,AF
16/03/2020,16,3,2020,6,0,Afghanistan,AF,AFG,37172386,2020-03-16,AF
15/03/2020,15,3,2020,3,0,Afghanistan,AF,AFG,37172386,2020-03-15,AF
11/03/2020,11,3,2020,3,0,Afghanistan,AF,AFG,37172386,2020-03-11,AF
08/03/2020,8,3,2020,3,0,Afghanistan,AF,AFG,37172386,2020-03-08,AF
02/03/2020,2,3,2020,0,0,Afghanistan,AF,AFG,37172386,2020-03-02,AF
01/03/2020,1,3,2020,0,0,Afghanistan,AF,AFG,37172386,2020-03-01,AF
29/02/2020,29,2,2020,0,0,Afghanistan,AF,AFG,37172386,2020-02-29,AF
28/02/2020,28,2,2020,0,0,Afghanistan,AF,AFG,37172386,2020-02-28,AF
27/02/2020,27,2,2020,0,0,Afghanistan,AF,AFG,37172386,2020-02-27,AF
26/02/2020,26,2,2020,0,0,Afghanistan,AF,AFG,37172386,2020-02-26,AF
25/02/2020,25,2,2020,1,0,Afghanistan,AF,AFG,37172386,2020-02-25,AF
24/02/2020,24,2,2020,0,0,Afghanistan,AF,AFG,37172386,2020-02-24,AF
23/02/2020,23,2,2020,0,0,Afghanistan,AF,AFG,37172386,2020-02-23,AF
22/02/2020,22,2,2020,0,0,Afghanistan,AF,AFG,37172386,2020-02-22,AF
21/02/2020,21,2,2020,0,0,Afghanistan,AF,AFG,37172386,2020-02-21,AF
20/02/2020,20,2,2020,0,0,Afghanistan,AF,AFG,37172386,2020-02-20,AF
19/02/2020,19,2,2020,0,0,Afghanistan,AF,AFG,37172386,2020-02-19,AF
18/02/2020,18,2,2020,0,0,Afghanistan,AF,AFG,37172386,2020-02-18,AF
17/02/2020,17,2,2020,0,0,Afghanistan,AF,AFG,37172386,2020-02-17,AF
16/02/2020,16,2,2020,0,0,Afghanistan,AF,AFG,37172386,2020-02-16,AF
15/02/2020,15,2,2020,0,0,Afghanistan,AF,AFG,37172386,2020-02-15,AF
14/02/2020,14,2,2020,0,0,Afghanistan,AF,AFG,37172386,2020-02-14,AF
13/02/2020,13,2,2020,0,0,Afghanistan,AF,AFG,37172386,2020-02-13,AF
12/02/2020,12,2,2020,0,0,Afghanistan,AF,AFG,37172386,2020-02-12,AF
11/02/2020,11,2,2020,0,0,Afghanistan,AF,AFG,37172386,2020-02-11,AF
10/02/2020,10,2,2020,0,0,Afghanistan,AF,AFG,37172386,2020-02-10,AF
09/02/2020,9,2,2020,0,0,Afghanistan,AF,AFG,37172386,2020-02-09,AF
08/02/2020,8,2,2020,0,0,Afghanistan,AF,AFG,37172386,2020-02-08,AF
07/02/2020,7,2,2020,0,0,Afghanistan,AF,AFG,37172386,2020-02-07,AF
06/02/2020,6,2,2020,0,0,Afghanistan,AF,AFG,37172386,2020-02-06,AF
05/02/2020,5,2,2020,0,0,Afghanistan,AF,AFG,37172386,2020-02-05,AF
04/02/2020,4,2,2020,0,0,Afghanistan,AF,AFG,37172386,2020-02-04,AF
03/02/2020,3,2,2020,0,0,Afghanistan,AF,AFG,37172386,2020-02-03,AF
02/02/2020,2,2,2020,0,0,Afghanistan,AF,AFG,37172386,2020-02-02,AF
01/02/2020,1,2,2020,0,0,Afghanistan,AF,AFG,37172386,2020-02-01,AF
31/01/2020,31,1,2020,0,0,Afghanistan,AF,AFG,37172386,2020-01-31,AF
30/01/2020,30,1,2020,0,0,Afghanistan,AF,AFG,37172386,2020-01-30,AF
29/01/2020,29,1,2020,0,0,Afghanistan,AF,AFG,37172386,2020-01-29,AF
28/01/2020,28,1,2020,0,0,Afghanistan,AF,AFG,37172386,2020-01-28,AF
27/01/2020,27,1,2020,0,0,Afghanistan,AF,AFG,37172386,2020-01-27,AF
26/01/2020,26,1,2020,0,0,Afghanistan,AF,AFG,37172386,2020-01-26,AF
25/01/2020,25,1,2020,0,0,Afghanistan,AF,AFG,37172386,2020-01-25,AF
24/01/2020,24,1,2020,0,0,Afghanistan,AF,AFG,37172386,2020-01-24,AF
23/01/2020,23,1,2020,0,0,Afghanistan,AF,AFG,37172386,2020-01-23,AF
22/01/2020,22,1,2020,0,0,Afghanistan,AF,AFG,37172386,2020-01-22,AF
21/01/2020,21,1,2020,0,0,Afghanistan,AF,AFG,37172386,2020-01-21,AF
20/01/2020,20,1,2020,0,0,Afghanistan,AF,AFG,37172386,2020-01-20,AF
19/01/2020,19,1,2020,0,0,Afghanistan,AF,AFG,37172386,2020-01-19,AF
18/01/2020,18,1,2020,0,0,Afghanistan,AF,AFG,37172386,2020-01-18,AF
17/01/2020,17,1,2020,0,0,Afghanistan,AF,AFG,37172386,2020-01-17,AF
16/01/2020,16,1,2020,0,0,Afghanistan,AF,AFG,37172386,2020-01-16,AF
15/01/2020,15,1,2020,0,0,Afghanistan,AF,AFG,37172386,2020-01-15,AF
14/01/2020,14,1,2020,0,0,Afghanistan,AF,AFG,37172386,2020-01-14,AF
13/01/2020,13,1,2020,0,0,Afghanistan,AF,AFG,37172386,2020-01-13,AF
12/01/2020,12,1,2020,0,0,Afghanistan,AF,AFG,37172386,2020-01-12,AF
11/01/2020,11,1,2020,0,0,Afghanistan,AF,AFG,37172386,2020-01-11,AF
10/01/2020,10,1,2020,0,0,Afghanistan,AF,AFG,37172386,2020-01-10,AF
09/01/2020,9,1,2020,0,0,Afghanistan,AF,AFG,37172386,2020-01-09,AF
08/01/2020,8,1,2020,0,0,Afghanistan,AF,AFG,37172386,2020-01-08,AF
07/01/2020,7,1,2020,0,0,Afghanistan,AF,AFG,37172386,2020-01-07,AF
06/01/2020,6,1,2020,0,0,Afghanistan,AF,AFG,37172386,2020-01-06,AF
05/01/2020,5,1,2020,0,0,Afghanistan,AF,AFG,37172386,2020-01-05,AF
04/01/2020,4,1,2020,0,0,Afghanistan,AF,AFG,37172386,2020-01-04,AF
03/01/2020,3,1,2020,0,0,Afghanistan,AF,AFG,37172386,2020-01-03,AF
02/01/2020,2,1,2020,0,0,Afghanistan,AF,AFG,37172386,2020-01-02,AF
01/01/2020,1,1,2020,0,0,Afghanistan,AF,AFG,37172386,2020-01-01,AF
31/12/2019,31,12,2019,0,0,Afghanistan,AF,AFG,37172386,2019-12-31,AF
13/04/2020,13,4,2020,13,0,Albania,AL,ALB,2866376,2020-04-13,AL
12/04/2020,12,4,2020,17,0,Albania,AL,ALB,2866376,2020-04-12,AL
11/04/2020,11,4,2020,7,0,Albania,AL,ALB,2866376,2020-04-11,AL
10/04/2020,10,4,2020,9,1,Albania,AL,ALB,2866376,2020-04-10,AL
09/04/2020,9,4,2020,17,0,Albania,AL,ALB,2866376,2020-04-09,AL
08/04/2020,8,4,2020,6,0,Albania,AL,ALB,2866376,2020-04-08,AL
07/04/2020,7,4,2020,16,1,Albania,AL,ALB,2866376,2020-04-07,AL
06/04/2020,6,4,2020,28,2,Albania,AL,ALB,2866376,2020-04-06,AL
05/04/2020,5,4,2020,29,2,Albania,AL,ALB,2866376,2020-04-05,AL
04/04/2020,4,4,2020,27,1,Albania,AL,ALB,2866376,2020-04-04,AL
03/04/2020,3,4,2020,18,1,Albania,AL,ALB,2866376,2020-04-03,AL
02/04/2020,2,4,2020,16,0,Albania,AL,ALB,2866376,2020-04-02,AL
01/04/2020,1,4,2020,20,3,Albania,AL,ALB,2866376,2020-04-01,AL
31/03/2020,31,3,2020,11,2,Albania,AL,ALB,2866376,2020-03-31,AL
30/03/2020,30,3,2020,15,0,Albania,AL,ALB,2866376,2020-03-30,AL
29/03/2020,29,3,2020,11,1,Albania,AL,ALB,2866376,2020-03-29,AL
28/03/2020,28,3,2020,12,3,Albania,AL,ALB,2866376,2020-03-28,AL
27/03/2020,27,3,2020,28,1,Albania,AL,ALB,2866376,2020-03-27,AL
26/03/2020,26,3,2020,23,0,Albania,AL,ALB,2866376,2020-03-26,AL
25/03/2020,25,3,2020,23,1,Albania,AL,ALB,2866376,2020-03-25,AL
24/03/2020,24,3,2020,11,2,Albania,AL,ALB,2866376,2020-03-24,AL
23/03/2020,23,3,2020,13,0,Albania,AL,ALB,2866376,2020-03-23,AL
22/03/2020,22,3,2020,6,0,Albania,AL,ALB,2866376,2020-03-22,AL
21/03/2020,21,3,2020,0,0,Albania,AL,ALB,2866376,2020-03-21,AL
20/03/2020,20,3,2020,11,0,Albania,AL,ALB,2866376,2020-03-20,AL
19/03/2020,19,3,2020,4,1,Albania,AL,ALB,2866376,2020-03-19,AL
18/03/2020,18,3,2020,4,0,Albania,AL,ALB,2866376,2020-03-18,AL
17/03/2020,17,3,2020,9,0,Albania,AL,ALB,2866376,2020-03-17,AL
16/03/2020,16,3,2020,4,0,Albania,AL,ALB,2866376,2020-03-16,AL
15/03/2020,15,3,2020,5,0,Albania,AL,ALB,2866376,2020-03-15,AL
14/03/2020,14,3,2020,10,0,Albania,AL,ALB,2866376,2020-03-14,AL
13/03/2020,13,3,2020,12,0,Albania,AL,ALB,2866376,2020-03-13,AL
12/03/2020,12,3,2020,1,1,Albania,AL,ALB,2866376,2020-03-12,AL
11/03/2020,11,3,2020,4,0,Albania,AL,ALB,2866376,2020-03-11,AL
10/03/2020,10,3,2020,4,0,Albania,AL,ALB,2866376,2020-03-10,AL
09/03/2020,9,3,2020,2,0,Albania,AL,ALB,2866376,2020-03-09,AL
13/04/2020,13,4,2020,89,18,Algeria,DZ,DZA,42228429,2020-04-13,DZ
12/04/2020,12,4,2020,64,19,Algeria,DZ,DZA,42228429,2020-04-12,DZ
11/04/2020,11,4,2020,95,21,Algeria,DZ,DZA,42228429,2020-04-11,DZ
10/04/2020,10,4,2020,94,30,Algeria,DZ,DZA,42228429,2020-04-10,DZ
09/04/2020,9,4,2020,104,11,Algeria,DZ,DZA,42228429,2020-04-09,DZ
08/04/2020,8,4,2020,45,21,Algeria,DZ,DZA,42228429,2020-04-08,DZ
07/04/2020,7,4,2020,103,21,Algeria,DZ,DZA,42228429,2020-04-07,DZ
06/04/2020,6,4,2020,20,22,Algeria,DZ,DZA,42228429,2020-04-06,DZ
05/04/2020,5,4,2020,314,47,Algeria,DZ,DZA,42228429,2020-04-05,DZ
04/04/2020,4,4,2020,139,25,Algeria,DZ,DZA,42228429,2020-04-04,DZ
03/04/2020,3,4,2020,0,0,Algeria,DZ,DZA,42228429,2020-04-03,DZ
02/04/2020,2,4,2020,263,23,Algeria,DZ,DZA,42228429,2020-04-02,DZ
01/04/2020,1,4,2020,73,4,Algeria,DZ,DZA,42228429,2020-04-01,DZ
31/03/2020,31,3,2020,57,2,Algeria,DZ,DZA,42228429,2020-03-31,DZ
30/03/2020,30,3,2020,45,3,Algeria,DZ,DZA,42228429,2020-03-30,DZ
29/03/2020,29,3,2020,104,5,Algeria,DZ,DZA,42228429,2020-03-29,DZ
28/03/2020,28,3,2020,0,0,Algeria,DZ,DZA,42228429,2020-03-28,DZ
27/03/2020,27,3,2020,41,4,Algeria,DZ,DZA,42228429,2020-03-27,DZ
26/03/2020,26,3,2020,33,0,Algeria,DZ,DZA,42228429,2020-03-26,DZ
25/03/2020,25,3,2020,42,0,Algeria,DZ,DZA,42228429,2020-03-25,DZ
24/03/2020,24,3,2020,87,2,Algeria,DZ,DZA,42228429,2020-03-24,DZ
23/03/2020,23,3,2020,8,5,Algeria,DZ,DZA,42228429,2020-03-23,DZ
22/03/2020,22,3,2020,0,0,Algeria,DZ,DZA,42228429,2020-03-22,DZ
21/03/2020,21,3,2020,12,3,Algeria,DZ,DZA,42228429,2020-03-21,DZ
20/03/2020,20,3,2020,9,1,Algeria,DZ,DZA,42228429,2020-03-20,DZ
19/03/2020,19,3,2020,13,1,Algeria,DZ,DZA,42228429,2020-03-19,DZ
18/03/2020,18,3,2020,0,1,Algeria,DZ,DZA,42228429,2020-03-18,DZ
17/03/2020,17,3,2020,12,0,Algeria,DZ,DZA,42228429,2020-03-17,DZ
16/03/2020,16,3,2020,11,2,Algeria,DZ,DZA,42228429,2020-03-16,DZ
15/03/2020,15,3,2020,11,0,Algeria,DZ,DZA,42228429,2020-03-15,DZ
14/03/2020,14,3,2020,2,1,Algeria,DZ,DZA,42228429,2020-03-14,DZ
13/03/2020,13,3,2020,4,1,Algeria,DZ,DZA,42228429,2020-03-13,DZ
12/03/2020,12,3,2020,0,0,Algeria,DZ,DZA,42228429,2020-03-12,DZ
09/03/2020,9,3,2020,3,0,Algeria,DZ,DZA,42228429,2020-03-09,DZ
06/03/2020,6,3,2020,5,0,Algeria,DZ,DZA,42228429,2020-03-06,DZ
05/03/2020,5,3,2020,7,0,Algeria,DZ,DZA,42228429,2020-03-05,DZ
04/03/2020,4,3,2020,2,0,Algeria,DZ,DZA,42228429,2020-03-04,DZ
02/03/2020,2,3,2020,2,0,Algeria,DZ,DZA,42228429,2020-03-02,DZ
01/03/2020,1,3,2020,0,0,Algeria,DZ,DZA,42228429,2020-03-01,DZ
29/02/2020,29,2,2020,0,0,Algeria,DZ,DZA,42228429,2020-02-29,DZ
28/02/2020,28,2,2020,0,0,Algeria,DZ,DZA,42228429,2020-02-28,DZ
27/02/2020,27,2,2020,0,0,Algeria,DZ,DZA,42228429,2020-02-27,DZ
26/02/2020,26,2,2020,1,0,Algeria,DZ,DZA,42228429,2020-02-26,DZ
25/02/2020,25,2,2020,0,0,Algeria,DZ,DZA,42228429,2020-02-25,DZ
24/02/2020,24,2,2020,0,0,Algeria,DZ,DZA,42228429,2020-02-24,DZ
23/02/2020,23,2,2020,0,0,Algeria,DZ,DZA,42228429,2020-02-23,DZ
22/02/2020,22,2,2020,0,0,Algeria,DZ,DZA,42228429,2020-02-22,DZ
21/02/2020,21,2,2020,0,0,Algeria,DZ,DZA,42228429,2020-02-21,DZ
20/02/2020,20,2,2020,0,0,Algeria,DZ,DZA,42228429,2020-02-20,DZ
19/02/2020,19,2,2020,0,0,Algeria,DZ,DZA,42228429,2020-02-19,DZ
18/02/2020,18,2,2020,0,0,Algeria,DZ,DZA,42228429,2020-02-18,DZ
17/02/2020,17,2,2020,0,0,Algeria,DZ,DZA,42228429,2020-02-17,DZ
16/02/2020,16,2,2020,0,0,Algeria,DZ,DZA,42228429,2020-02-16,DZ
15/02/2020,15,2,2020,0,0,Algeria,DZ,DZA,42228429,2020-02-15,DZ
14/02/2020,14,2,2020,0,0,Algeria,DZ,DZA,42228429,2020-02-14,DZ
13/02/2020,13,2,2020,0,0,Algeria,DZ,DZA,42228429,2020-02-13,DZ
12/02/2020,12,2,2020,0,0,Algeria,DZ,DZA,42228429,2020-02-12,DZ
11/02/2020,11,2,2020,0,0,Algeria,DZ,DZA,42228429,2020-02-11,DZ
10/02/2020,10,2,2020,0,0,Algeria,DZ,DZA,42228429,2020-02-10,DZ
09/02/2020,9,2,2020,0,0,Algeria,DZ,DZA,42228429,2020-02-09,DZ
08/02/2020,8,2,2020,0,0,Algeria,DZ,DZA,42228429,2020-02-08,DZ
07/02/2020,7,2,2020,0,0,Algeria,DZ,DZA,42228429,2020-02-07,DZ
06/02/2020,6,2,2020,0,0,Algeria,DZ,DZA,42228429,2020-02-06,DZ
05/02/2020,5,2,2020,0,0,Algeria,DZ,DZA,42228429,2020-02-05,DZ
04/02/2020,4,2,2020,0,0,Algeria,DZ,DZA,42228429,2020-02-04,DZ
03/02/2020,3,2,2020,0,0,Algeria,DZ,DZA,42228429,2020-02-03,DZ
02/02/2020,2,2,2020,0,0,Algeria,DZ,DZA,42228429,2020-02-02,DZ
01/02/2020,1,2,2020,0,0,Algeria,DZ,DZA,42228429,2020-02-01,DZ
31/01/2020,31,1,2020,0,0,Algeria,DZ,DZA,42228429,2020-01-31,DZ
30/01/2020,30,1,2020,0,0,Algeria,DZ,DZA,42228429,2020-01-30,DZ
29/01/2020,29,1,2020,0,0,Algeria,DZ,DZA,42228429,2020-01-29,DZ
28/01/2020,28,1,2020,0,0,Algeria,DZ,DZA,42228429,2020-01-28,DZ
27/01/2020,27,1,2020,0,0,Algeria,DZ,DZA,42228429,2020-01-27,DZ
26/01/2020,26,1,2020,0,0,Algeria,DZ,DZA,42228429,2020-01-26,DZ
25/01/2020,25,1,2020,0,0,Algeria,DZ,DZA,42228429,2020-01-25,DZ
24/01/2020,24,1,2020,0,0,Algeria,DZ,DZA,42228429,2020-01-24,DZ
23/01/2020,23,1,2020,0,0,Algeria,DZ,DZA,42228429,2020-01-23,DZ
22/01/2020,22,1,2020,0,0,Algeria,DZ,DZA,42228429,2020-01-22,DZ
21/01/2020,21,1,2020,0,0,Algeria,DZ,DZA,42228429,2020-01-21,DZ
20/01/2020,20,1,2020,0,0,Algeria,DZ,DZA,42228429,2020-01-20,DZ
19/01/2020,19,1,2020,0,0,Algeria,DZ,DZA,42228429,2020-01-19,DZ
18/01/2020,18,1,2020,0,0,Algeria,DZ,DZA,42228429,2020-01-18,DZ
17/01/2020,17,1,2020,0,0,Algeria,DZ,DZA,42228429,2020-01-17,DZ
16/01/2020,16,1,2020,0,0,Algeria,DZ,DZA,42228429,2020-01-16,DZ
15/01/2020,15,1,2020,0,0,Algeria,DZ,DZA,42228429,2020-01-15,DZ
14/01/2020,14,1,2020,0,0,Algeria,DZ,DZA,42228429,2020-01-14,DZ
13/01/2020,13,1,2020,0,0,Algeria,DZ,DZA,42228429,2020-01-13,DZ
12/01/2020,12,1,2020,0,0,Algeria,DZ,DZA,42228429,2020-01-12,DZ
11/01/2020,11,1,2020,0,0,Algeria,DZ,DZA,42228429,2020-01-11,DZ
10/01/2020,10,1,2020,0,0,Algeria,DZ,DZA,42228429,2020-01-10,DZ
09/01/2020,9,1,2020,0,0,Algeria,DZ,DZA,42228429,2020-01-09,DZ
08/01/2020,8,1,2020,0,0,Algeria,DZ,DZA,42228429,2020-01-08,DZ
07/01/2020,7,1,2020,0,0,Algeria,DZ,DZA,42228429,2020-01-07,DZ
06/01/2020,6,1,2020,0,0,Algeria,DZ,DZA,42228429,2020-01-06,DZ
05/01/2020,5,1,2020,0,0,Algeria,DZ,DZA,42228429,2020-01-05,DZ
04/01/2020,4,1,2020,0,0,Algeria,DZ,DZA,42228429,2020-01-04,DZ
03/01/2020,3,1,2020,0,0,Algeria,DZ,DZA,42228429,2020-01-03,DZ
02/01/2020,2,1,2020,0,0,Algeria,DZ,DZA,42228429,2020-01-02,DZ
01/01/2020,1,1,2020,0,0,Algeria,DZ,DZA,42228429,2020-01-01,DZ
31/12/2019,31,12,2019,0,0,Algeria,DZ,DZA,42228429,2019-12-31,DZ
13/04/2020,13,4,2020,16,1,Andorra,AD,AND,77006,2020-04-13,AD
12/04/2020,12,4,2020,21,2,Andorra,AD,AND,77006,2020-04-12,AD
11/04/2020,11,4,2020,18,1,Andorra,AD,AND,77006,2020-04-11,AD
10/04/2020,10,4,2020,19,2,Andorra,AD,AND,77006,2020-04-10,AD
09/04/2020,9,4,2020,19,1,Andorra,AD,AND,77006,2020-04-09,AD
08/04/2020,8,4,2020,19,1,Andorra,AD,AND,77006,2020-04-08,AD
07/04/2020,7,4,2020,25,3,Andorra,AD,AND,77006,2020-04-07,AD
06/04/2020,6,4,2020,35,1,Andorra,AD,AND,77006,2020-04-06,AD
05/04/2020,5,4,2020,27,1,Andorra,AD,AND,77006,2020-04-05,AD
04/04/2020,4,4,2020,11,1,Andorra,AD,AND,77006,2020-04-04,AD
03/04/2020,3,4,2020,38,1,Andorra,AD,AND,77006,2020-04-03,AD
02/04/2020,2,4,2020,14,2,Andorra,AD,AND,77006,2020-04-02,AD
01/04/2020,1,4,2020,6,4,Andorra,AD,AND,77006,2020-04-01,AD
31/03/2020,31,3,2020,36,2,Andorra,AD,AND,77006,2020-03-31,AD
30/03/2020,30,3,2020,26,2,Andorra,AD,AND,77006,2020-03-30,AD
29/03/2020,29,3,2020,41,1,Andorra,AD,AND,77006,2020-03-29,AD
28/03/2020,28,3,2020,43,0,Andorra,AD,AND,77006,2020-03-28,AD
27/03/2020,27,3,2020,36,3,Andorra,AD,AND,77006,2020-03-27,AD
26/03/2020,26,3,2020,24,0,Andorra,AD,AND,77006,2020-03-26,AD
25/03/2020,25,3,2020,31,0,Andorra,AD,AND,77006,2020-03-25,AD
24/03/2020,24,3,2020,20,0,Andorra,AD,AND,77006,2020-03-24,AD
23/03/2020,23,3,2020,25,0,Andorra,AD,AND,77006,2020-03-23,AD
22/03/2020,22,3,2020,13,0,Andorra,AD,AND,77006,2020-03-22,AD
21/03/2020,21,3,2020,0,0,Andorra,AD,AND,77006,2020-03-21,AD
20/03/2020,20,3,2020,22,0,Andorra,AD,AND,77006,2020-03-20,AD
19/03/2020,19,3,2020,39,0,Andorra,AD,AND,77006,2020-03-19,AD
18/03/2020,18,3,2020,0,0,Andorra,AD,AND,77006,2020-03-18,AD
17/03/2020,17,3,2020,9,0,Andorra,AD,AND,77006,2020-03-17,AD
16/03/2020,16,3,2020,3,0,Andorra,AD,AND,77006,2020-03-16,AD
14/03/2020,14,3,2020,1,0,Andorra,AD,AND,77006,2020-03-14,AD
03/03/2020,3,3,2020,1,0,Andorra,AD,AND,77006,2020-03-03,AD
13/04/2020,13,4,2020,0,0,Angola,AO,AGO,30809762,2020-04-13,AO
12/04/2020,12,4,2020,0,0,Angola,AO,AGO,30809762,2020-04-12,AO
11/04/2020,11,4,2020,0,0,Angola,AO,AGO,30809762,2020-04-11,AO
10/04/2020,10,4,2020,0,0,Angola,AO,AGO,30809762,2020-04-10,AO
09/04/2020,9,4,2020,2,0,Angola,AO,AGO,30809762,2020-04-09,AO
08/04/2020,8,4,2020,1,0,Angola,AO,AGO,30809762,2020-04-08,AO
07/04/2020,7,4,2020,2,0,Angola,AO,AGO,30809762,2020-04-07,AO
06/04/2020,6,4,2020,4,0,Angola,AO,AGO,30809762,2020-04-06,AO
05/04/2020,5,4,2020,2,0,Angola,AO,AGO,30809762,2020-04-05,AO
04/04/2020,4,4,2020,0,0,Angola,AO,AGO,30809762,2020-04-04,AO
03/04/2020,3,4,2020,0,0,Angola,AO,AGO,30809762,2020-04-03,AO
02/04/2020,2,4,2020,1,0,Angola,AO,AGO,30809762,2020-04-02,AO
01/04/2020,1,4,2020,0,0,Angola,AO,AGO,30809762,2020-04-01,AO
31/03/2020,31,3,2020,0,0,Angola,AO,AGO,30809762,2020-03-31,AO
30/03/2020,30,3,2020,3,2,Angola,AO,AGO,30809762,2020-03-30,AO
29/03/2020,29,3,2020,0,0,Angola,AO,AGO,30809762,2020-03-29,AO
28/03/2020,28,3,2020,1,0,Angola,AO,AGO,30809762,2020-03-28,AO
27/03/2020,27,3,2020,1,0,Angola,AO,AGO,30809762,2020-03-27,AO
26/03/2020,26,3,2020,0,0,Angola,AO,AGO,30809762,2020-03-26,AO
25/03/2020,25,3,2020,0,0,Angola,AO,AGO,30809762,2020-03-25,AO
24/03/2020,24,3,2020,0,0,Angola,AO,AGO,30809762,2020-03-24,AO
23/03/2020,23,3,2020,0,0,Angola,AO,AGO,30809762,2020-03-23,AO
22/03/2020,22,3,2020,2,0,Angola,AO,AGO,30809762,2020-03-22,AO
13/04/2020,13,4,2020,0,0,Anguilla,AI,,NA,2020-04-13,AI
12/04/2020,12,4,2020,0,0,Anguilla,AI,,NA,2020-04-12,AI
11/04/2020,11,4,2020,0,0,Anguilla,AI,,NA,2020-04-11,AI
10/04/2020,10,4,2020,0,0,Anguilla,AI,,NA,2020-04-10,AI
09/04/2020,9,4,2020,0,0,Anguilla,AI,,NA,2020-04-09,AI
08/04/2020,8,4,2020,0,0,Anguilla,AI,,NA,2020-04-08,AI
07/04/2020,7,4,2020,0,0,Anguilla,AI,,NA,2020-04-07,AI
06/04/2020,6,4,2020,0,0,Anguilla,AI,,NA,2020-04-06,AI
05/04/2020,5,4,2020,0,0,Anguilla,AI,,NA,2020-04-05,AI
04/04/2020,4,4,2020,0,0,Anguilla,AI,,NA,2020-04-04,AI
03/04/2020,3,4,2020,1,0,Anguilla,AI,,NA,2020-04-03,AI
02/04/2020,2,4,2020,0,0,Anguilla,AI,,NA,2020-04-02,AI
01/04/2020,1,4,2020,0,0,Anguilla,AI,,NA,2020-04-01,AI
31/03/2020,31,3,2020,0,0,Anguilla,AI,,NA,2020-03-31,AI
30/03/2020,30,3,2020,0,0,Anguilla,AI,,NA,2020-03-30,AI
29/03/2020,29,3,2020,0,0,Anguilla,AI,,NA,2020-03-29,AI
28/03/2020,28,3,2020,0,0,Anguilla,AI,,NA,2020-03-28,AI
27/03/2020,27,3,2020,2,0,Anguilla,AI,,NA,2020-03-27,AI
13/04/2020,13,4,2020,0,0,Antigua_and_Barbuda,AG,ATG,96286,2020-04-13,AG
12/04/2020,12,4,2020,0,0,Antigua_and_Barbuda,AG,ATG,96286,2020-04-12,AG
11/04/2020,11,4,2020,2,0,Antigua_and_Barbuda,AG,ATG,96286,2020-04-11,AG
10/04/2020,10,4,2020,4,2,Antigua_and_Barbuda,AG,ATG,96286,2020-04-10,AG
09/04/2020,9,4,2020,0,0,Antigua_and_Barbuda,AG,ATG,96286,2020-04-09,AG
08/04/2020,8,4,2020,0,0,Antigua_and_Barbuda,AG,ATG,96286,2020-04-08,AG
07/04/2020,7,4,2020,0,0,Antigua_and_Barbuda,AG,ATG,96286,2020-04-07,AG
06/04/2020,6,4,2020,0,0,Antigua_and_Barbuda,AG,ATG,96286,2020-04-06,AG
05/04/2020,5,4,2020,0,0,Antigua_and_Barbuda,AG,ATG,96286,2020-04-05,AG
04/04/2020,4,4,2020,6,0,Antigua_and_Barbuda,AG,ATG,96286,2020-04-04,AG
03/04/2020,3,4,2020,2,0,Antigua_and_Barbuda,AG,ATG,96286,2020-04-03,AG
02/04/2020,2,4,2020,0,0,Antigua_and_Barbuda,AG,ATG,96286,2020-04-02,AG
01/04/2020,1,4,2020,0,0,Antigua_and_Barbuda,AG,ATG,96286,2020-04-01,AG
31/03/2020,31,3,2020,0,0,Antigua_and_Barbuda,AG,ATG,96286,2020-03-31,AG
30/03/2020,30,3,2020,0,0,Antigua_and_Barbuda,AG,ATG,96286,2020-03-30,AG
29/03/2020,29,3,2020,0,0,Antigua_and_Barbuda,AG,ATG,96286,2020-03-29,AG
28/03/2020,28,3,2020,0,0,Antigua_and_Barbuda,AG,ATG,96286,2020-03-28,AG
27/03/2020,27,3,2020,4,0,Antigua_and_Barbuda,AG,ATG,96286,2020-03-27,AG
26/03/2020,26,3,2020,0,0,Antigua_and_Barbuda,AG,ATG,96286,2020-03-26,AG
25/03/2020,25,3,2020,2,0,Antigua_and_Barbuda,AG,ATG,96286,2020-03-25,AG
24/03/2020,24,3,2020,0,0,Antigua_and_Barbuda,AG,ATG,96286,2020-03-24,AG
23/03/2020,23,3,2020,0,0,Antigua_and_Barbuda,AG,ATG,96286,2020-03-23,AG
22/03/2020,22,3,2020,0,0,Antigua_and_Barbuda,AG,ATG,96286,2020-03-22,AG
21/03/2020,21,3,2020,0,0,Antigua_and_Barbuda,AG,ATG,96286,2020-03-21,AG
15/03/2020,15,3,2020,1,0,Antigua_and_Barbuda,AG,ATG,96286,2020-03-15,AG
13/04/2020,13,4,2020,71,6,Argentina,AR,ARG,44494502,2020-04-13,AR
12/04/2020,12,4,2020,162,7,Argentina,AR,ARG,44494502,2020-04-12,AR
11/04/2020,11,4,2020,81,3,Argentina,AR,ARG,44494502,2020-04-11,AR
10/04/2020,10,4,2020,99,14,Argentina,AR,ARG,44494502,2020-04-10,AR
09/04/2020,9,4,2020,80,5,Argentina,AR,ARG,44494502,2020-04-09,AR
08/04/2020,8,4,2020,87,7,Argentina,AR,ARG,44494502,2020-04-08,AR
07/04/2020,7,4,2020,74,7,Argentina,AR,ARG,44494502,2020-04-07,AR
06/04/2020,6,4,2020,103,3,Argentina,AR,ARG,44494502,2020-04-06,AR
05/04/2020,5,4,2020,186,6,Argentina,AR,ARG,44494502,2020-04-05,AR
04/04/2020,4,4,2020,132,3,Argentina,AR,ARG,44494502,2020-04-04,AR
03/04/2020,3,4,2020,0,3,Argentina,AR,ARG,44494502,2020-04-03,AR
02/04/2020,2,4,2020,167,7,Argentina,AR,ARG,44494502,2020-04-02,AR
01/04/2020,1,4,2020,0,0,Argentina,AR,ARG,44494502,2020-04-01,AR
31/03/2020,31,3,2020,146,4,Argentina,AR,ARG,44494502,2020-03-31,AR
30/03/2020,30,3,2020,75,1,Argentina,AR,ARG,44494502,2020-03-30,AR
29/03/2020,29,3,2020,55,2,Argentina,AR,ARG,44494502,2020-03-29,AR
28/03/2020,28,3,2020,101,5,Argentina,AR,ARG,44494502,2020-03-28,AR
27/03/2020,27,3,2020,87,4,Argentina,AR,ARG,44494502,2020-03-27,AR
26/03/2020,26,3,2020,115,2,Argentina,AR,ARG,44494502,2020-03-26,AR
25/03/2020,25,3,2020,86,2,Argentina,AR,ARG,44494502,2020-03-25,AR
24/03/2020,24,3,2020,35,0,Argentina,AR,ARG,44494502,2020-03-24,AR
23/03/2020,23,3,2020,41,0,Argentina,AR,ARG,44494502,2020-03-23,AR
22/03/2020,22,3,2020,67,1,Argentina,AR,ARG,44494502,2020-03-22,AR
21/03/2020,21,3,2020,30,0,Argentina,AR,ARG,44494502,2020-03-21,AR
20/03/2020,20,3,2020,31,1,Argentina,AR,ARG,44494502,2020-03-20,AR
19/03/2020,19,3,2020,18,0,Argentina,AR,ARG,44494502,2020-03-19,AR
18/03/2020,18,3,2020,14,0,Argentina,AR,ARG,44494502,2020-03-18,AR
17/03/2020,17,3,2020,9,0,Argentina,AR,ARG,44494502,2020-03-17,AR
16/03/2020,16,3,2020,11,0,Argentina,AR,ARG,44494502,2020-03-16,AR
15/03/2020,15,3,2020,11,0,Argentina,AR,ARG,44494502,2020-03-15,AR
14/03/2020,14,3,2020,3,1,Argentina,AR,ARG,44494502,2020-03-14,AR
13/03/2020,13,3,2020,12,0,Argentina,AR,ARG,44494502,2020-03-13,AR
11/03/2020,11,3,2020,7,0,Argentina,AR,ARG,44494502,2020-03-11,AR
09/03/2020,9,3,2020,3,0,Argentina,AR,ARG,44494502,2020-03-09,AR
08/03/2020,8,3,2020,1,1,Argentina,AR,ARG,44494502,2020-03-08,AR
07/03/2020,7,3,2020,6,0,Argentina,AR,ARG,44494502,2020-03-07,AR
06/03/2020,6,3,2020,1,0,Argentina,AR,ARG,44494502,2020-03-06,AR
04/03/2020,4,3,2020,1,0,Argentina,AR,ARG,44494502,2020-03-04,AR
13/04/2020,13,4,2020,46,0,Armenia,AM,ARM,2951776,2020-04-13,AM
12/04/2020,12,4,2020,30,2,Armenia,AM,ARM,2951776,2020-04-12,AM
11/04/2020,11,4,2020,16,1,Armenia,AM,ARM,2951776,2020-04-11,AM
10/04/2020,10,4,2020,40,1,Armenia,AM,ARM,2951776,2020-04-10,AM
09/04/2020,9,4,2020,28,1,Armenia,AM,ARM,2951776,2020-04-09,AM
08/04/2020,8,4,2020,20,0,Armenia,AM,ARM,2951776,2020-04-08,AM
07/04/2020,7,4,2020,11,1,Armenia,AM,ARM,2951776,2020-04-07,AM
06/04/2020,6,4,2020,52,0,Armenia,AM,ARM,2951776,2020-04-06,AM
05/04/2020,5,4,2020,34,0,Armenia,AM,ARM,2951776,2020-04-05,AM
04/04/2020,4,4,2020,73,3,Armenia,AM,ARM,2951776,2020-04-04,AM
03/04/2020,3,4,2020,92,1,Armenia,AM,ARM,2951776,2020-04-03,AM
02/04/2020,2,4,2020,39,0,Armenia,AM,ARM,2951776,2020-04-02,AM
01/04/2020,1,4,2020,50,0,Armenia,AM,ARM,2951776,2020-04-01,AM
31/03/2020,31,3,2020,58,0,Armenia,AM,ARM,2951776,2020-03-31,AM
30/03/2020,30,3,2020,0,0,Armenia,AM,ARM,2951776,2020-03-30,AM
29/03/2020,29,3,2020,52,2,Armenia,AM,ARM,2951776,2020-03-29,AM
28/03/2020,28,3,2020,43,0,Armenia,AM,ARM,2951776,2020-03-28,AM
27/03/2020,27,3,2020,39,1,Armenia,AM,ARM,2951776,2020-03-27,AM
26/03/2020,26,3,2020,25,0,Armenia,AM,ARM,2951776,2020-03-26,AM
25/03/2020,25,3,2020,71,0,Armenia,AM,ARM,2951776,2020-03-25,AM
24/03/2020,24,3,2020,4,0,Armenia,AM,ARM,2951776,2020-03-24,AM
23/03/2020,23,3,2020,30,0,Armenia,AM,ARM,2951776,2020-03-23,AM
22/03/2020,22,3,2020,24,0,Armenia,AM,ARM,2951776,2020-03-22,AM
21/03/2020,21,3,2020,14,0,Armenia,AM,ARM,2951776,2020-03-21,AM
20/03/2020,20,3,2020,7,0,Armenia,AM,ARM,2951776,2020-03-20,AM
19/03/2020,19,3,2020,37,0,Armenia,AM,ARM,2951776,2020-03-19,AM
18/03/2020,18,3,2020,26,0,Armenia,AM,ARM,2951776,2020-03-18,AM
17/03/2020,17,3,2020,22,0,Armenia,AM,ARM,2951776,2020-03-17,AM
16/03/2020,16,3,2020,10,0,Armenia,AM,ARM,2951776,2020-03-16,AM
15/03/2020,15,3,2020,7,0,Armenia,AM,ARM,2951776,2020-03-15,AM
14/03/2020,14,3,2020,7,0,Armenia,AM,ARM,2951776,2020-03-14,AM
13/03/2020,13,3,2020,2,0,Armenia,AM,ARM,2951776,2020-03-13,AM
12/03/2020,12,3,2020,3,0,Armenia,AM,ARM,2951776,2020-03-12,AM
02/03/2020,2,3,2020,0,0,Armenia,AM,ARM,2951776,2020-03-02,AM
01/03/2020,1,3,2020,1,0,Armenia,AM,ARM,2951776,2020-03-01,AM
29/02/2020,29,2,2020,0,0,Armenia,AM,ARM,2951776,2020-02-29,AM
28/02/2020,28,2,2020,0,0,Armenia,AM,ARM,2951776,2020-02-28,AM
27/02/2020,27,2,2020,0,0,Armenia,AM,ARM,2951776,2020-02-27,AM
26/02/2020,26,2,2020,0,0,Armenia,AM,ARM,2951776,2020-02-26,AM
25/02/2020,25,2,2020,0,0,Armenia,AM,ARM,2951776,2020-02-25,AM
24/02/2020,24,2,2020,0,0,Armenia,AM,ARM,2951776,2020-02-24,AM
23/02/2020,23,2,2020,0,0,Armenia,AM,ARM,2951776,2020-02-23,AM
22/02/2020,22,2,2020,0,0,Armenia,AM,ARM,2951776,2020-02-22,AM
21/02/2020,21,2,2020,0,0,Armenia,AM,ARM,2951776,2020-02-21,AM
20/02/2020,20,2,2020,0,0,Armenia,AM,ARM,2951776,2020-02-20,AM
19/02/2020,19,2,2020,0,0,Armenia,AM,ARM,2951776,2020-02-19,AM
18/02/2020,18,2,2020,0,0,Armenia,AM,ARM,2951776,2020-02-18,AM
17/02/2020,17,2,2020,0,0,Armenia,AM,ARM,2951776,2020-02-17,AM
16/02/2020,16,2,2020,0,0,Armenia,AM,ARM,2951776,2020-02-16,AM
15/02/2020,15,2,2020,0,0,Armenia,AM,ARM,2951776,2020-02-15,AM
14/02/2020,14,2,2020,0,0,Armenia,AM,ARM,2951776,2020-02-14,AM
13/02/2020,13,2,2020,0,0,Armenia,AM,ARM,2951776,2020-02-13,AM
12/02/2020,12,2,2020,0,0,Armenia,AM,ARM,2951776,2020-02-12,AM
11/02/2020,11,2,2020,0,0,Armenia,AM,ARM,2951776,2020-02-11,AM
10/02/2020,10,2,2020,0,0,Armenia,AM,ARM,2951776,2020-02-10,AM
09/02/2020,9,2,2020,0,0,Armenia,AM,ARM,2951776,2020-02-09,AM
08/02/2020,8,2,2020,0,0,Armenia,AM,ARM,2951776,2020-02-08,AM
07/02/2020,7,2,2020,0,0,Armenia,AM,ARM,2951776,2020-02-07,AM
06/02/2020,6,2,2020,0,0,Armenia,AM,ARM,2951776,2020-02-06,AM
05/02/2020,5,2,2020,0,0,Armenia,AM,ARM,2951776,2020-02-05,AM
04/02/2020,4,2,2020,0,0,Armenia,AM,ARM,2951776,2020-02-04,AM
03/02/2020,3,2,2020,0,0,Armenia,AM,ARM,2951776,2020-02-03,AM
02/02/2020,2,2,2020,0,0,Armenia,AM,ARM,2951776,2020-02-02,AM
01/02/2020,1,2,2020,0,0,Armenia,AM,ARM,2951776,2020-02-01,AM
31/01/2020,31,1,2020,0,0,Armenia,AM,ARM,2951776,2020-01-31,AM
30/01/2020,30,1,2020,0,0,Armenia,AM,ARM,2951776,2020-01-30,AM
29/01/2020,29,1,2020,0,0,Armenia,AM,ARM,2951776,2020-01-29,AM
28/01/2020,28,1,2020,0,0,Armenia,AM,ARM,2951776,2020-01-28,AM
27/01/2020,27,1,2020,0,0,Armenia,AM,ARM,2951776,2020-01-27,AM
26/01/2020,26,1,2020,0,0,Armenia,AM,ARM,2951776,2020-01-26,AM
25/01/2020,25,1,2020,0,0,Armenia,AM,ARM,2951776,2020-01-25,AM
24/01/2020,24,1,2020,0,0,Armenia,AM,ARM,2951776,2020-01-24,AM
23/01/2020,23,1,2020,0,0,Armenia,AM,ARM,2951776,2020-01-23,AM
22/01/2020,22,1,2020,0,0,Armenia,AM,ARM,2951776,2020-01-22,AM
21/01/2020,21,1,2020,0,0,Armenia,AM,ARM,2951776,2020-01-21,AM
20/01/2020,20,1,2020,0,0,Armenia,AM,ARM,2951776,2020-01-20,AM
19/01/2020,19,1,2020,0,0,Armenia,AM,ARM,2951776,2020-01-19,AM
18/01/2020,18,1,2020,0,0,Armenia,AM,ARM,2951776,2020-01-18,AM
17/01/2020,17,1,2020,0,0,Armenia,AM,ARM,2951776,2020-01-17,AM
16/01/2020,16,1,2020,0,0,Armenia,AM,ARM,2951776,2020-01-16,AM
15/01/2020,15,1,2020,0,0,Armenia,AM,ARM,2951776,2020-01-15,AM
14/01/2020,14,1,2020,0,0,Armenia,AM,ARM,2951776,2020-01-14,AM
13/01/2020,13,1,2020,0,0,Armenia,AM,ARM,2951776,2020-01-13,AM
12/01/2020,12,1,2020,0,0,Armenia,AM,ARM,2951776,2020-01-12,AM
11/01/2020,11,1,2020,0,0,Armenia,AM,ARM,2951776,2020-01-11,AM
10/01/2020,10,1,2020,0,0,Armenia,AM,ARM,2951776,2020-01-10,AM
09/01/2020,9,1,2020,0,0,Armenia,AM,ARM,2951776,2020-01-09,AM
08/01/2020,8,1,2020,0,0,Armenia,AM,ARM,2951776,2020-01-08,AM
07/01/2020,7,1,2020,0,0,Armenia,AM,ARM,2951776,2020-01-07,AM
06/01/2020,6,1,2020,0,0,Armenia,AM,ARM,2951776,2020-01-06,AM
05/01/2020,5,1,2020,0,0,Armenia,AM,ARM,2951776,2020-01-05,AM
04/01/2020,4,1,2020,0,0,Armenia,AM,ARM,2951776,2020-01-04,AM
03/01/2020,3,1,2020,0,0,Armenia,AM,ARM,2951776,2020-01-03,AM
02/01/2020,2,1,2020,0,0,Armenia,AM,ARM,2951776,2020-01-02,AM
01/01/2020,1,1,2020,0,0,Armenia,AM,ARM,2951776,2020-01-01,AM
31/12/2019,31,12,2019,0,0,Armenia,AM,ARM,2951776,2019-12-31,AM
13/04/2020,13,4,2020,0,0,Aruba,AW,ABW,105845,2020-04-13,AW
12/04/2020,12,4,2020,6,0,Aruba,AW,ABW,105845,2020-04-12,AW
11/04/2020,11,4,2020,4,0,Aruba,AW,ABW,105845,2020-04-11,AW
10/04/2020,10,4,2020,5,0,Aruba,AW,ABW,105845,2020-04-10,AW
09/04/2020,9,4,2020,3,0,Aruba,AW,ABW,105845,2020-04-09,AW
08/04/2020,8,4,2020,3,0,Aruba,AW,ABW,105845,2020-04-08,AW
07/04/2020,7,4,2020,7,0,Aruba,AW,ABW,105845,2020-04-07,AW
06/04/2020,6,4,2020,0,0,Aruba,AW,ABW,105845,2020-04-06,AW
05/04/2020,5,4,2020,2,0,Aruba,AW,ABW,105845,2020-04-05,AW
04/04/2020,4,4,2020,2,0,Aruba,AW,ABW,105845,2020-04-04,AW
03/04/2020,3,4,2020,5,0,Aruba,AW,ABW,105845,2020-04-03,AW
02/04/2020,2,4,2020,0,0,Aruba,AW,ABW,105845,2020-04-02,AW
01/04/2020,1,4,2020,5,0,Aruba,AW,ABW,105845,2020-04-01,AW
30/03/2020,30,3,2020,22,0,Aruba,AW,ABW,105845,2020-03-30,AW
29/03/2020,29,3,2020,0,0,Aruba,AW,ABW,105845,2020-03-29,AW
28/03/2020,28,3,2020,0,0,Aruba,AW,ABW,105845,2020-03-28,AW
27/03/2020,27,3,2020,9,0,Aruba,AW,ABW,105845,2020-03-27,AW
26/03/2020,26,3,2020,2,0,Aruba,AW,ABW,105845,2020-03-26,AW
25/03/2020,25,3,2020,5,0,Aruba,AW,ABW,105845,2020-03-25,AW
24/03/2020,24,3,2020,8,0,Aruba,AW,ABW,105845,2020-03-24,AW
20/03/2020,20,3,2020,2,0,Aruba,AW,ABW,105845,2020-03-20,AW
13/03/2020,13,3,2020,2,0,Aruba,AW,ABW,105845,2020-03-13,AW
13/04/2020,13,4,2020,33,4,Australia,AU,AUS,24992369,2020-04-13,AU
12/04/2020,12,4,2020,51,3,Australia,AU,AUS,24992369,2020-04-12,AU
11/04/2020,11,4,2020,86,2,Australia,AU,AUS,24992369,2020-04-11,AU
10/04/2020,10,4,2020,100,2,Australia,AU,AUS,24992369,2020-04-10,AU
09/04/2020,9,4,2020,96,5,Australia,AU,AUS,24992369,2020-04-09,AU
08/04/2020,8,4,2020,112,3,Australia,AU,AUS,24992369,2020-04-08,AU
07/04/2020,7,4,2020,100,6,Australia,AU,AUS,24992369,2020-04-07,AU
06/04/2020,6,4,2020,57,2,Australia,AU,AUS,24992369,2020-04-06,AU
05/04/2020,5,4,2020,139,4,Australia,AU,AUS,24992369,2020-04-05,AU
04/04/2020,4,4,2020,324,7,Australia,AU,AUS,24992369,2020-04-04,AU
03/04/2020,3,4,2020,248,2,Australia,AU,AUS,24992369,2020-04-03,AU
02/04/2020,2,4,2020,269,1,Australia,AU,AUS,24992369,2020-04-02,AU
01/04/2020,1,4,2020,150,1,Australia,AU,AUS,24992369,2020-04-01,AU
31/03/2020,31,3,2020,464,3,Australia,AU,AUS,24992369,2020-03-31,AU
30/03/2020,30,3,2020,284,2,Australia,AU,AUS,24992369,2020-03-30,AU
29/03/2020,29,3,2020,431,1,Australia,AU,AUS,24992369,2020-03-29,AU
28/03/2020,28,3,2020,212,0,Australia,AU,AUS,24992369,2020-03-28,AU
27/03/2020,27,3,2020,367,2,Australia,AU,AUS,24992369,2020-03-27,AU
26/03/2020,26,3,2020,376,3,Australia,AU,AUS,24992369,2020-03-26,AU
25/03/2020,25,3,2020,600,1,Australia,AU,AUS,24992369,2020-03-25,AU
24/03/2020,24,3,2020,114,0,Australia,AU,AUS,24992369,2020-03-24,AU
23/03/2020,23,3,2020,611,0,Australia,AU,AUS,24992369,2020-03-23,AU
22/03/2020,22,3,2020,224,0,Australia,AU,AUS,24992369,2020-03-22,AU
21/03/2020,21,3,2020,165,1,Australia,AU,AUS,24992369,2020-03-21,AU
20/03/2020,20,3,2020,144,0,Australia,AU,AUS,24992369,2020-03-20,AU
19/03/2020,19,3,2020,111,1,Australia,AU,AUS,24992369,2020-03-19,AU
18/03/2020,18,3,2020,79,0,Australia,AU,AUS,24992369,2020-03-18,AU
17/03/2020,17,3,2020,77,0,Australia,AU,AUS,24992369,2020-03-17,AU
16/03/2020,16,3,2020,49,2,Australia,AU,AUS,24992369,2020-03-16,AU
15/03/2020,15,3,2020,52,0,Australia,AU,AUS,24992369,2020-03-15,AU
14/03/2020,14,3,2020,41,0,Australia,AU,AUS,24992369,2020-03-14,AU
13/03/2020,13,3,2020,30,0,Australia,AU,AUS,24992369,2020-03-13,AU
12/03/2020,12,3,2020,14,0,Australia,AU,AUS,24992369,2020-03-12,AU
11/03/2020,11,3,2020,12,0,Australia,AU,AUS,24992369,2020-03-11,AU
10/03/2020,10,3,2020,20,0,Australia,AU,AUS,24992369,2020-03-10,AU
09/03/2020,9,3,2020,6,0,Australia,AU,AUS,24992369,2020-03-09,AU
08/03/2020,8,3,2020,11,1,Australia,AU,AUS,24992369,2020-03-08,AU
07/03/2020,7,3,2020,4,0,Australia,AU,AUS,24992369,2020-03-07,AU
06/03/2020,6,3,2020,7,0,Australia,AU,AUS,24992369,2020-03-06,AU
05/03/2020,5,3,2020,11,1,Australia,AU,AUS,24992369,2020-03-05,AU
04/03/2020,4,3,2020,8,0,Australia,AU,AUS,24992369,2020-03-04,AU
03/03/2020,3,3,2020,4,0,Australia,AU,AUS,24992369,2020-03-03,AU
02/03/2020,2,3,2020,3,0,Australia,AU,AUS,24992369,2020-03-02,AU
01/03/2020,1,3,2020,1,1,Australia,AU,AUS,24992369,2020-03-01,AU
29/02/2020,29,2,2020,2,0,Australia,AU,AUS,24992369,2020-02-29,AU
28/02/2020,28,2,2020,0,0,Australia,AU,AUS,24992369,2020-02-28,AU
27/02/2020,27,2,2020,1,0,Australia,AU,AUS,24992369,2020-02-27,AU
26/02/2020,26,2,2020,0,0,Australia,AU,AUS,24992369,2020-02-26,AU
25/02/2020,25,2,2020,0,0,Australia,AU,AUS,24992369,2020-02-25,AU
24/02/2020,24,2,2020,0,0,Australia,AU,AUS,24992369,2020-02-24,AU
23/02/2020,23,2,2020,1,0,Australia,AU,AUS,24992369,2020-02-23,AU
22/02/2020,22,2,2020,4,0,Australia,AU,AUS,24992369,2020-02-22,AU
21/02/2020,21,2,2020,2,0,Australia,AU,AUS,24992369,2020-02-21,AU
20/02/2020,20,2,2020,0,0,Australia,AU,AUS,24992369,2020-02-20,AU
19/02/2020,19,2,2020,0,0,Australia,AU,AUS,24992369,2020-02-19,AU
18/02/2020,18,2,2020,0,0,Australia,AU,AUS,24992369,2020-02-18,AU
17/02/2020,17,2,2020,0,0,Australia,AU,AUS,24992369,2020-02-17,AU
16/02/2020,16,2,2020,0,0,Australia,AU,AUS,24992369,2020-02-16,AU
15/02/2020,15,2,2020,0,0,Australia,AU,AUS,24992369,2020-02-15,AU
14/02/2020,14,2,2020,1,0,Australia,AU,AUS,24992369,2020-02-14,AU
13/02/2020,13,2,2020,0,0,Australia,AU,AUS,24992369,2020-02-13,AU
12/02/2020,12,2,2020,0,0,Australia,AU,AUS,24992369,2020-02-12,AU
11/02/2020,11,2,2020,0,0,Australia,AU,AUS,24992369,2020-02-11,AU
10/02/2020,10,2,2020,0,0,Australia,AU,AUS,24992369,2020-02-10,AU
09/02/2020,9,2,2020,0,0,Australia,AU,AUS,24992369,2020-02-09,AU
08/02/2020,8,2,2020,0,0,Australia,AU,AUS,24992369,2020-02-08,AU
07/02/2020,7,2,2020,1,0,Australia,AU,AUS,24992369,2020-02-07,AU
06/02/2020,6,2,2020,1,0,Australia,AU,AUS,24992369,2020-02-06,AU
05/02/2020,5,2,2020,1,0,Australia,AU,AUS,24992369,2020-02-05,AU
04/02/2020,4,2,2020,0,0,Australia,AU,AUS,24992369,2020-02-04,AU
03/02/2020,3,2,2020,0,0,Australia,AU,AUS,24992369,2020-02-03,AU
02/02/2020,2,2,2020,2,0,Australia,AU,AUS,24992369,2020-02-02,AU
01/02/2020,1,2,2020,2,0,Australia,AU,AUS,24992369,2020-02-01,AU
31/01/2020,31,1,2020,1,0,Australia,AU,AUS,24992369,2020-01-31,AU
30/01/2020,30,1,2020,2,0,Australia,AU,AUS,24992369,2020-01-30,AU
29/01/2020,29,1,2020,0,0,Australia,AU,AUS,24992369,2020-01-29,AU
28/01/2020,28,1,2020,0,0,Australia,AU,AUS,24992369,2020-01-28,AU
27/01/2020,27,1,2020,0,0,Australia,AU,AUS,24992369,2020-01-27,AU
26/01/2020,26,1,2020,3,0,Australia,AU,AUS,24992369,2020-01-26,AU
25/01/2020,25,1,2020,1,0,Australia,AU,AUS,24992369,2020-01-25,AU
24/01/2020,24,1,2020,0,0,Australia,AU,AUS,24992369,2020-01-24,AU
23/01/2020,23,1,2020,0,0,Australia,AU,AUS,24992369,2020-01-23,AU
22/01/2020,22,1,2020,0,0,Australia,AU,AUS,24992369,2020-01-22,AU
21/01/2020,21,1,2020,0,0,Australia,AU,AUS,24992369,2020-01-21,AU
20/01/2020,20,1,2020,0,0,Australia,AU,AUS,24992369,2020-01-20,AU
19/01/2020,19,1,2020,0,0,Australia,AU,AUS,24992369,2020-01-19,AU
18/01/2020,18,1,2020,0,0,Australia,AU,AUS,24992369,2020-01-18,AU
17/01/2020,17,1,2020,0,0,Australia,AU,AUS,24992369,2020-01-17,AU
16/01/2020,16,1,2020,0,0,Australia,AU,AUS,24992369,2020-01-16,AU
15/01/2020,15,1,2020,0,0,Australia,AU,AUS,24992369,2020-01-15,AU
14/01/2020,14,1,2020,0,0,Australia,AU,AUS,24992369,2020-01-14,AU
13/01/2020,13,1,2020,0,0,Australia,AU,AUS,24992369,2020-01-13,AU
12/01/2020,12,1,2020,0,0,Australia,AU,AUS,24992369,2020-01-12,AU
11/01/2020,11,1,2020,0,0,Australia,AU,AUS,24992369,2020-01-11,AU
10/01/2020,10,1,2020,0,0,Australia,AU,AUS,24992369,2020-01-10,AU
09/01/2020,9,1,2020,0,0,Australia,AU,AUS,24992369,2020-01-09,AU
08/01/2020,8,1,2020,0,0,Australia,AU,AUS,24992369,2020-01-08,AU
07/01/2020,7,1,2020,0,0,Australia,AU,AUS,24992369,2020-01-07,AU
06/01/2020,6,1,2020,0,0,Australia,AU,AUS,24992369,2020-01-06,AU
05/01/2020,5,1,2020,0,0,Australia,AU,AUS,24992369,2020-01-05,AU
04/01/2020,4,1,2020,0,0,Australia,AU,AUS,24992369,2020-01-04,AU
03/01/2020,3,1,2020,0,0,Australia,AU,AUS,24992369,2020-01-03,AU
02/01/2020,2,1,2020,0,0,Australia,AU,AUS,24992369,2020-01-02,AU
01/01/2020,1,1,2020,0,0,Australia,AU,AUS,24992369,2020-01-01,AU
31/12/2019,31,12,2019,0,0,Australia,AU,AUS,24992369,2019-12-31,AU
13/04/2020,13,4,2020,130,13,Austria,AT,AUT,8847037,2020-04-13,AT
12/04/2020,12,4,2020,247,18,Austria,AT,AUT,8847037,2020-04-12,AT
11/04/2020,11,4,2020,312,24,Austria,AT,AUT,8847037,2020-04-11,AT
10/04/2020,10,4,2020,279,22,Austria,AT,AUT,8847037,2020-04-10,AT
09/04/2020,9,4,2020,329,30,Austria,AT,AUT,8847037,2020-04-09,AT
08/04/2020,8,4,2020,343,23,Austria,AT,AUT,8847037,2020-04-08,AT
07/04/2020,7,4,2020,314,16,Austria,AT,AUT,8847037,2020-04-07,AT
06/04/2020,6,4,2020,217,18,Austria,AT,AUT,8847037,2020-04-06,AT
05/04/2020,5,4,2020,241,18,Austria,AT,AUT,8847037,2020-04-05,AT
04/04/2020,4,4,2020,396,10,Austria,AT,AUT,8847037,2020-04-04,AT
03/04/2020,3,4,2020,418,12,Austria,AT,AUT,8847037,2020-04-03,AT
02/04/2020,2,4,2020,529,18,Austria,AT,AUT,8847037,2020-04-02,AT
01/04/2020,1,4,2020,564,20,Austria,AT,AUT,8847037,2020-04-01,AT
31/03/2020,31,3,2020,805,22,Austria,AT,AUT,8847037,2020-03-31,AT
30/03/2020,30,3,2020,522,18,Austria,AT,AUT,8847037,2020-03-30,AT
29/03/2020,29,3,2020,594,0,Austria,AT,AUT,8847037,2020-03-29,AT
28/03/2020,28,3,2020,668,16,Austria,AT,AUT,8847037,2020-03-28,AT
27/03/2020,27,3,2020,1141,18,Austria,AT,AUT,8847037,2020-03-27,AT
26/03/2020,26,3,2020,606,4,Austria,AT,AUT,8847037,2020-03-26,AT
25/03/2020,25,3,2020,796,5,Austria,AT,AUT,8847037,2020-03-25,AT
24/03/2020,24,3,2020,855,9,Austria,AT,AUT,8847037,2020-03-24,AT
23/03/2020,23,3,2020,607,8,Austria,AT,AUT,8847037,2020-03-23,AT
22/03/2020,22,3,2020,375,2,Austria,AT,AUT,8847037,2020-03-22,AT
21/03/2020,21,3,2020,453,0,Austria,AT,AUT,8847037,2020-03-21,AT
20/03/2020,20,3,2020,550,2,Austria,AT,AUT,8847037,2020-03-20,AT
19/03/2020,19,3,2020,314,1,Austria,AT,AUT,8847037,2020-03-19,AT
18/03/2020,18,3,2020,316,0,Austria,AT,AUT,8847037,2020-03-18,AT
17/03/2020,17,3,2020,156,2,Austria,AT,AUT,8847037,2020-03-17,AT
16/03/2020,16,3,2020,205,0,Austria,AT,AUT,8847037,2020-03-16,AT
15/03/2020,15,3,2020,151,0,Austria,AT,AUT,8847037,2020-03-15,AT
14/03/2020,14,3,2020,143,0,Austria,AT,AUT,8847037,2020-03-14,AT
13/03/2020,13,3,2020,115,1,Austria,AT,AUT,8847037,2020-03-13,AT
12/03/2020,12,3,2020,64,0,Austria,AT,AUT,8847037,2020-03-12,AT
11/03/2020,11,3,2020,51,0,Austria,AT,AUT,8847037,2020-03-11,AT
10/03/2020,10,3,2020,29,0,Austria,AT,AUT,8847037,2020-03-10,AT
09/03/2020,9,3,2020,3,0,Austria,AT,AUT,8847037,2020-03-09,AT
08/03/2020,8,3,2020,25,0,Austria,AT,AUT,8847037,2020-03-08,AT
07/03/2020,7,3,2020,33,0,Austria,AT,AUT,8847037,2020-03-07,AT
06/03/2020,6,3,2020,12,0,Austria,AT,AUT,8847037,2020-03-06,AT
05/03/2020,5,3,2020,5,0,Austria,AT,AUT,8847037,2020-03-05,AT
04/03/2020,4,3,2020,6,0,Austria,AT,AUT,8847037,2020-03-04,AT
03/03/2020,3,3,2020,4,0,Austria,AT,AUT,8847037,2020-03-03,AT
02/03/2020,2,3,2020,4,0,Austria,AT,AUT,8847037,2020-03-02,AT
01/03/2020,1,3,2020,3,0,Austria,AT,AUT,8847037,2020-03-01,AT
29/02/2020,29,2,2020,2,0,Austria,AT,AUT,8847037,2020-02-29,AT
28/02/2020,28,2,2020,3,0,Austria,AT,AUT,8847037,2020-02-28,AT
27/02/2020,27,2,2020,0,0,Austria,AT,AUT,8847037,2020-02-27,AT
26/02/2020,26,2,2020,2,0,Austria,AT,AUT,8847037,2020-02-26,AT
25/02/2020,25,2,2020,0,0,Austria,AT,AUT,8847037,2020-02-25,AT
24/02/2020,24,2,2020,0,0,Austria,AT,AUT,8847037,2020-02-24,AT
23/02/2020,23,2,2020,0,0,Austria,AT,AUT,8847037,2020-02-23,AT
22/02/2020,22,2,2020,0,0,Austria,AT,AUT,8847037,2020-02-22,AT
21/02/2020,21,2,2020,0,0,Austria,AT,AUT,8847037,2020-02-21,AT
20/02/2020,20,2,2020,0,0,Austria,AT,AUT,8847037,2020-02-20,AT
19/02/2020,19,2,2020,0,0,Austria,AT,AUT,8847037,2020-02-19,AT
18/02/2020,18,2,2020,0,0,Austria,AT,AUT,8847037,2020-02-18,AT
17/02/2020,17,2,2020,0,0,Austria,AT,AUT,8847037,2020-02-17,AT
16/02/2020,16,2,2020,0,0,Austria,AT,AUT,8847037,2020-02-16,AT
15/02/2020,15,2,2020,0,0,Austria,AT,AUT,8847037,2020-02-15,AT
14/02/2020,14,2,2020,0,0,Austria,AT,AUT,8847037,2020-02-14,AT
13/02/2020,13,2,2020,0,0,Austria,AT,AUT,8847037,2020-02-13,AT
12/02/2020,12,2,2020,0,0,Austria,AT,AUT,8847037,2020-02-12,AT
11/02/2020,11,2,2020,0,0,Austria,AT,AUT,8847037,2020-02-11,AT
10/02/2020,10,2,2020,0,0,Austria,AT,AUT,8847037,2020-02-10,AT
09/02/2020,9,2,2020,0,0,Austria,AT,AUT,8847037,2020-02-09,AT
08/02/2020,8,2,2020,0,0,Austria,AT,AUT,8847037,2020-02-08,AT
07/02/2020,7,2,2020,0,0,Austria,AT,AUT,8847037,2020-02-07,AT
06/02/2020,6,2,2020,0,0,Austria,AT,AUT,8847037,2020-02-06,AT
05/02/2020,5,2,2020,0,0,Austria,AT,AUT,8847037,2020-02-05,AT
04/02/2020,4,2,2020,0,0,Austria,AT,AUT,8847037,2020-02-04,AT
03/02/2020,3,2,2020,0,0,Austria,AT,AUT,8847037,2020-02-03,AT
02/02/2020,2,2,2020,0,0,Austria,AT,AUT,8847037,2020-02-02,AT
01/02/2020,1,2,2020,0,0,Austria,AT,AUT,8847037,2020-02-01,AT
31/01/2020,31,1,2020,0,0,Austria,AT,AUT,8847037,2020-01-31,AT
30/01/2020,30,1,2020,0,0,Austria,AT,AUT,8847037,2020-01-30,AT
29/01/2020,29,1,2020,0,0,Austria,AT,AUT,8847037,2020-01-29,AT
28/01/2020,28,1,2020,0,0,Austria,AT,AUT,8847037,2020-01-28,AT
27/01/2020,27,1,2020,0,0,Austria,AT,AUT,8847037,2020-01-27,AT
26/01/2020,26,1,2020,0,0,Austria,AT,AUT,8847037,2020-01-26,AT
25/01/2020,25,1,2020,0,0,Austria,AT,AUT,8847037,2020-01-25,AT
24/01/2020,24,1,2020,0,0,Austria,AT,AUT,8847037,2020-01-24,AT
23/01/2020,23,1,2020,0,0,Austria,AT,AUT,8847037,2020-01-23,AT
22/01/2020,22,1,2020,0,0,Austria,AT,AUT,8847037,2020-01-22,AT
21/01/2020,21,1,2020,0,0,Austria,AT,AUT,8847037,2020-01-21,AT
20/01/2020,20,1,2020,0,0,Austria,AT,AUT,8847037,2020-01-20,AT
19/01/2020,19,1,2020,0,0,Austria,AT,AUT,8847037,2020-01-19,AT
18/01/2020,18,1,2020,0,0,Austria,AT,AUT,8847037,2020-01-18,AT
17/01/2020,17,1,2020,0,0,Austria,AT,AUT,8847037,2020-01-17,AT
16/01/2020,16,1,2020,0,0,Austria,AT,AUT,8847037,2020-01-16,AT
15/01/2020,15,1,2020,0,0,Austria,AT,AUT,8847037,2020-01-15,AT
14/01/2020,14,1,2020,0,0,Austria,AT,AUT,8847037,2020-01-14,AT
13/01/2020,13,1,2020,0,0,Austria,AT,AUT,8847037,2020-01-13,AT
12/01/2020,12,1,2020,0,0,Austria,AT,AUT,8847037,2020-01-12,AT
11/01/2020,11,1,2020,0,0,Austria,AT,AUT,8847037,2020-01-11,AT
10/01/2020,10,1,2020,0,0,Austria,AT,AUT,8847037,2020-01-10,AT
09/01/2020,9,1,2020,0,0,Austria,AT,AUT,8847037,2020-01-09,AT
08/01/2020,8,1,2020,0,0,Austria,AT,AUT,8847037,2020-01-08,AT
07/01/2020,7,1,2020,0,0,Austria,AT,AUT,8847037,2020-01-07,AT
06/01/2020,6,1,2020,0,0,Austria,AT,AUT,8847037,2020-01-06,AT
05/01/2020,5,1,2020,0,0,Austria,AT,AUT,8847037,2020-01-05,AT
04/01/2020,4,1,2020,0,0,Austria,AT,AUT,8847037,2020-01-04,AT
03/01/2020,3,1,2020,0,0,Austria,AT,AUT,8847037,2020-01-03,AT
02/01/2020,2,1,2020,0,0,Austria,AT,AUT,8847037,2020-01-02,AT
01/01/2020,1,1,2020,0,0,Austria,AT,AUT,8847037,2020-01-01,AT
31/12/2019,31,12,2019,0,0,Austria,AT,AUT,8847037,2019-12-31,AT
13/04/2020,13,4,2020,40,0,Azerbaijan,AZ,AZE,9942334,2020-04-13,AZ
12/04/2020,12,4,2020,67,1,Azerbaijan,AZ,AZE,9942334,2020-04-12,AZ
11/04/2020,11,4,2020,65,1,Azerbaijan,AZ,AZE,9942334,2020-04-11,AZ
10/04/2020,10,4,2020,104,1,Azerbaijan,AZ,AZE,9942334,2020-04-10,AZ
09/04/2020,9,4,2020,105,0,Azerbaijan,AZ,AZE,9942334,2020-04-09,AZ
08/04/2020,8,4,2020,76,1,Azerbaijan,AZ,AZE,9942334,2020-04-08,AZ
07/04/2020,7,4,2020,57,0,Azerbaijan,AZ,AZE,9942334,2020-04-07,AZ
06/04/2020,6,4,2020,63,2,Azerbaijan,AZ,AZE,9942334,2020-04-06,AZ
05/04/2020,5,4,2020,78,0,Azerbaijan,AZ,AZE,9942334,2020-04-05,AZ
04/04/2020,4,4,2020,43,0,Azerbaijan,AZ,AZE,9942334,2020-04-04,AZ
03/04/2020,3,4,2020,41,0,Azerbaijan,AZ,AZE,9942334,2020-04-03,AZ
02/04/2020,2,4,2020,61,0,Azerbaijan,AZ,AZE,9942334,2020-04-02,AZ
01/04/2020,1,4,2020,25,1,Azerbaijan,AZ,AZE,9942334,2020-04-01,AZ
31/03/2020,31,3,2020,64,0,Azerbaijan,AZ,AZE,9942334,2020-03-31,AZ
30/03/2020,30,3,2020,27,0,Azerbaijan,AZ,AZE,9942334,2020-03-30,AZ
29/03/2020,29,3,2020,17,1,Azerbaijan,AZ,AZE,9942334,2020-03-29,AZ
28/03/2020,28,3,2020,43,0,Azerbaijan,AZ,AZE,9942334,2020-03-28,AZ
27/03/2020,27,3,2020,29,1,Azerbaijan,AZ,AZE,9942334,2020-03-27,AZ
26/03/2020,26,3,2020,6,1,Azerbaijan,AZ,AZE,9942334,2020-03-26,AZ
25/03/2020,25,3,2020,15,0,Azerbaijan,AZ,AZE,9942334,2020-03-25,AZ
24/03/2020,24,3,2020,7,0,Azerbaijan,AZ,AZE,9942334,2020-03-24,AZ
23/03/2020,23,3,2020,12,0,Azerbaijan,AZ,AZE,9942334,2020-03-23,AZ
22/03/2020,22,3,2020,9,0,Azerbaijan,AZ,AZE,9942334,2020-03-22,AZ
21/03/2020,21,3,2020,0,1,Azerbaijan,AZ,AZE,9942334,2020-03-21,AZ
20/03/2020,20,3,2020,10,0,Azerbaijan,AZ,AZE,9942334,2020-03-20,AZ
19/03/2020,19,3,2020,6,0,Azerbaijan,AZ,AZE,9942334,2020-03-19,AZ
18/03/2020,18,3,2020,9,0,Azerbaijan,AZ,AZE,9942334,2020-03-18,AZ
17/03/2020,17,3,2020,0,0,Azerbaijan,AZ,AZE,9942334,2020-03-17,AZ
16/03/2020,16,3,2020,0,0,Azerbaijan,AZ,AZE,9942334,2020-03-16,AZ
15/03/2020,15,3,2020,6,0,Azerbaijan,AZ,AZE,9942334,2020-03-15,AZ
13/03/2020,13,3,2020,0,0,Azerbaijan,AZ,AZE,9942334,2020-03-13,AZ
12/03/2020,12,3,2020,2,0,Azerbaijan,AZ,AZE,9942334,2020-03-12,AZ
11/03/2020,11,3,2020,2,0,Azerbaijan,AZ,AZE,9942334,2020-03-11,AZ
07/03/2020,7,3,2020,3,0,Azerbaijan,AZ,AZE,9942334,2020-03-07,AZ
06/03/2020,6,3,2020,3,0,Azerbaijan,AZ,AZE,9942334,2020-03-06,AZ
02/03/2020,2,3,2020,2,0,Azerbaijan,AZ,AZE,9942334,2020-03-02,AZ
01/03/2020,1,3,2020,0,0,Azerbaijan,AZ,AZE,9942334,2020-03-01,AZ
29/02/2020,29,2,2020,1,0,Azerbaijan,AZ,AZE,9942334,2020-02-29,AZ
28/02/2020,28,2,2020,0,0,Azerbaijan,AZ,AZE,9942334,2020-02-28,AZ
27/02/2020,27,2,2020,0,0,Azerbaijan,AZ,AZE,9942334,2020-02-27,AZ
26/02/2020,26,2,2020,0,0,Azerbaijan,AZ,AZE,9942334,2020-02-26,AZ
25/02/2020,25,2,2020,0,0,Azerbaijan,AZ,AZE,9942334,2020-02-25,AZ
24/02/2020,24,2,2020,0,0,Azerbaijan,AZ,AZE,9942334,2020-02-24,AZ
23/02/2020,23,2,2020,0,0,Azerbaijan,AZ,AZE,9942334,2020-02-23,AZ
22/02/2020,22,2,2020,0,0,Azerbaijan,AZ,AZE,9942334,2020-02-22,AZ
21/02/2020,21,2,2020,0,0,Azerbaijan,AZ,AZE,9942334,2020-02-21,AZ
20/02/2020,20,2,2020,0,0,Azerbaijan,AZ,AZE,9942334,2020-02-20,AZ
19/02/2020,19,2,2020,0,0,Azerbaijan,AZ,AZE,9942334,2020-02-19,AZ
18/02/2020,18,2,2020,0,0,Azerbaijan,AZ,AZE,9942334,2020-02-18,AZ
17/02/2020,17,2,2020,0,0,Azerbaijan,AZ,AZE,9942334,2020-02-17,AZ
16/02/2020,16,2,2020,0,0,Azerbaijan,AZ,AZE,9942334,2020-02-16,AZ
15/02/2020,15,2,2020,0,0,Azerbaijan,AZ,AZE,9942334,2020-02-15,AZ
14/02/2020,14,2,2020,0,0,Azerbaijan,AZ,AZE,9942334,2020-02-14,AZ
13/02/2020,13,2,2020,0,0,Azerbaijan,AZ,AZE,9942334,2020-02-13,AZ
12/02/2020,12,2,2020,0,0,Azerbaijan,AZ,AZE,9942334,2020-02-12,AZ
11/02/2020,11,2,2020,0,0,Azerbaijan,AZ,AZE,9942334,2020-02-11,AZ
10/02/2020,10,2,2020,0,0,Azerbaijan,AZ,AZE,9942334,2020-02-10,AZ
09/02/2020,9,2,2020,0,0,Azerbaijan,AZ,AZE,9942334,2020-02-09,AZ
08/02/2020,8,2,2020,0,0,Azerbaijan,AZ,AZE,9942334,2020-02-08,AZ
07/02/2020,7,2,2020,0,0,Azerbaijan,AZ,AZE,9942334,2020-02-07,AZ
06/02/2020,6,2,2020,0,0,Azerbaijan,AZ,AZE,9942334,2020-02-06,AZ
05/02/2020,5,2,2020,0,0,Azerbaijan,AZ,AZE,9942334,2020-02-05,AZ
04/02/2020,4,2,2020,0,0,Azerbaijan,AZ,AZE,9942334,2020-02-04,AZ
03/02/2020,3,2,2020,0,0,Azerbaijan,AZ,AZE,9942334,2020-02-03,AZ
02/02/2020,2,2,2020,0,0,Azerbaijan,AZ,AZE,9942334,2020-02-02,AZ
01/02/2020,1,2,2020,0,0,Azerbaijan,AZ,AZE,9942334,2020-02-01,AZ
31/01/2020,31,1,2020,0,0,Azerbaijan,AZ,AZE,9942334,2020-01-31,AZ
30/01/2020,30,1,2020,0,0,Azerbaijan,AZ,AZE,9942334,2020-01-30,AZ
29/01/2020,29,1,2020,0,0,Azerbaijan,AZ,AZE,9942334,2020-01-29,AZ
28/01/2020,28,1,2020,0,0,Azerbaijan,AZ,AZE,9942334,2020-01-28,AZ
27/01/2020,27,1,2020,0,0,Azerbaijan,AZ,AZE,9942334,2020-01-27,AZ
26/01/2020,26,1,2020,0,0,Azerbaijan,AZ,AZE,9942334,2020-01-26,AZ
25/01/2020,25,1,2020,0,0,Azerbaijan,AZ,AZE,9942334,2020-01-25,AZ
24/01/2020,24,1,2020,0,0,Azerbaijan,AZ,AZE,9942334,2020-01-24,AZ
23/01/2020,23,1,2020,0,0,Azerbaijan,AZ,AZE,9942334,2020-01-23,AZ
22/01/2020,22,1,2020,0,0,Azerbaijan,AZ,AZE,9942334,2020-01-22,AZ
21/01/2020,21,1,2020,0,0,Azerbaijan,AZ,AZE,9942334,2020-01-21,AZ
20/01/2020,20,1,2020,0,0,Azerbaijan,AZ,AZE,9942334,2020-01-20,AZ
19/01/2020,19,1,2020,0,0,Azerbaijan,AZ,AZE,9942334,2020-01-19,AZ
18/01/2020,18,1,2020,0,0,Azerbaijan,AZ,AZE,9942334,2020-01-18,AZ
17/01/2020,17,1,2020,0,0,Azerbaijan,AZ,AZE,9942334,2020-01-17,AZ
16/01/2020,16,1,2020,0,0,Azerbaijan,AZ,AZE,9942334,2020-01-16,AZ
15/01/2020,15,1,2020,0,0,Azerbaijan,AZ,AZE,9942334,2020-01-15,AZ
14/01/2020,14,1,2020,0,0,Azerbaijan,AZ,AZE,9942334,2020-01-14,AZ
13/01/2020,13,1,2020,0,0,Azerbaijan,AZ,AZE,9942334,2020-01-13,AZ
12/01/2020,12,1,2020,0,0,Azerbaijan,AZ,AZE,9942334,2020-01-12,AZ
11/01/2020,11,1,2020,0,0,Azerbaijan,AZ,AZE,9942334,2020-01-11,AZ
10/01/2020,10,1,2020,0,0,Azerbaijan,AZ,AZE,9942334,2020-01-10,AZ
09/01/2020,9,1,2020,0,0,Azerbaijan,AZ,AZE,9942334,2020-01-09,AZ
08/01/2020,8,1,2020,0,0,Azerbaijan,AZ,AZE,9942334,2020-01-08,AZ
07/01/2020,7,1,2020,0,0,Azerbaijan,AZ,AZE,9942334,2020-01-07,AZ
06/01/2020,6,1,2020,0,0,Azerbaijan,AZ,AZE,9942334,2020-01-06,AZ
05/01/2020,5,1,2020,0,0,Azerbaijan,AZ,AZE,9942334,2020-01-05,AZ
04/01/2020,4,1,2020,0,0,Azerbaijan,AZ,AZE,9942334,2020-01-04,AZ
03/01/2020,3,1,2020,0,0,Azerbaijan,AZ,AZE,9942334,2020-01-03,AZ
02/01/2020,2,1,2020,0,0,Azerbaijan,AZ,AZE,9942334,2020-01-02,AZ
01/01/2020,1,1,2020,0,0,Azerbaijan,AZ,AZE,9942334,2020-01-01,AZ
31/12/2019,31,12,2019,0,0,Azerbaijan,AZ,AZE,9942334,2019-12-31,AZ
13/04/2020,13,4,2020,1,0,Bahamas,BS,BHS,385640,2020-04-13,BS
12/04/2020,12,4,2020,4,0,Bahamas,BS,BHS,385640,2020-04-12,BS
11/04/2020,11,4,2020,1,0,Bahamas,BS,BHS,385640,2020-04-11,BS
10/04/2020,10,4,2020,1,1,Bahamas,BS,BHS,385640,2020-04-10,BS
09/04/2020,9,4,2020,4,1,Bahamas,BS,BHS,385640,2020-04-09,BS
08/04/2020,8,4,2020,3,1,Bahamas,BS,BHS,385640,2020-04-08,BS
07/04/2020,7,4,2020,4,0,Bahamas,BS,BHS,385640,2020-04-07,BS
06/04/2020,6,4,2020,1,1,Bahamas,BS,BHS,385640,2020-04-06,BS
05/04/2020,5,4,2020,4,1,Bahamas,BS,BHS,385640,2020-04-05,BS
04/04/2020,4,4,2020,0,2,Bahamas,BS,BHS,385640,2020-04-04,BS
03/04/2020,3,4,2020,3,0,Bahamas,BS,BHS,385640,2020-04-03,BS
02/04/2020,2,4,2020,6,1,Bahamas,BS,BHS,385640,2020-04-02,BS
01/04/2020,1,4,2020,1,0,Bahamas,BS,BHS,385640,2020-04-01,BS
31/03/2020,31,3,2020,0,0,Bahamas,BS,BHS,385640,2020-03-31,BS
30/03/2020,30,3,2020,3,0,Bahamas,BS,BHS,385640,2020-03-30,BS
29/03/2020,29,3,2020,2,0,Bahamas,BS,BHS,385640,2020-03-29,BS
28/03/2020,28,3,2020,0,0,Bahamas,BS,BHS,385640,2020-03-28,BS
27/03/2020,27,3,2020,4,0,Bahamas,BS,BHS,385640,2020-03-27,BS
26/03/2020,26,3,2020,1,0,Bahamas,BS,BHS,385640,2020-03-26,BS
25/03/2020,25,3,2020,0,0,Bahamas,BS,BHS,385640,2020-03-25,BS
24/03/2020,24,3,2020,0,0,Bahamas,BS,BHS,385640,2020-03-24,BS
23/03/2020,23,3,2020,0,0,Bahamas,BS,BHS,385640,2020-03-23,BS
22/03/2020,22,3,2020,0,0,Bahamas,BS,BHS,385640,2020-03-22,BS
21/03/2020,21,3,2020,1,0,Bahamas,BS,BHS,385640,2020-03-21,BS
20/03/2020,20,3,2020,2,0,Bahamas,BS,BHS,385640,2020-03-20,BS
17/03/2020,17,3,2020,0,0,Bahamas,BS,BHS,385640,2020-03-17,BS
16/03/2020,16,3,2020,1,0,Bahamas,BS,BHS,385640,2020-03-16,BS
13/04/2020,13,4,2020,96,0,Bahrain,BH,BHR,1569439,2020-04-13,BH
12/04/2020,12,4,2020,42,0,Bahrain,BH,BHR,1569439,2020-04-12,BH
11/04/2020,11,4,2020,111,1,Bahrain,BH,BHR,1569439,2020-04-11,BH
10/04/2020,10,4,2020,64,0,Bahrain,BH,BHR,1569439,2020-04-10,BH
09/04/2020,9,4,2020,12,0,Bahrain,BH,BHR,1569439,2020-04-09,BH
08/04/2020,8,4,2020,55,1,Bahrain,BH,BHR,1569439,2020-04-08,BH
07/04/2020,7,4,2020,56,0,Bahrain,BH,BHR,1569439,2020-04-07,BH
06/04/2020,6,4,2020,12,0,Bahrain,BH,BHR,1569439,2020-04-06,BH
05/04/2020,5,4,2020,45,0,Bahrain,BH,BHR,1569439,2020-04-05,BH
04/04/2020,4,4,2020,0,0,Bahrain,BH,BHR,1569439,2020-04-04,BH
03/04/2020,3,4,2020,74,0,Bahrain,BH,BHR,1569439,2020-04-03,BH
02/04/2020,2,4,2020,2,0,Bahrain,BH,BHR,1569439,2020-04-02,BH
01/04/2020,1,4,2020,52,0,Bahrain,BH,BHR,1569439,2020-04-01,BH
31/03/2020,31,3,2020,15,0,Bahrain,BH,BHR,1569439,2020-03-31,BH
30/03/2020,30,3,2020,27,0,Bahrain,BH,BHR,1569439,2020-03-30,BH
29/03/2020,29,3,2020,7,0,Bahrain,BH,BHR,1569439,2020-03-29,BH
28/03/2020,28,3,2020,8,0,Bahrain,BH,BHR,1569439,2020-03-28,BH
27/03/2020,27,3,2020,39,1,Bahrain,BH,BHR,1569439,2020-03-27,BH
26/03/2020,26,3,2020,29,0,Bahrain,BH,BHR,1569439,2020-03-26,BH
25/03/2020,25,3,2020,51,1,Bahrain,BH,BHR,1569439,2020-03-25,BH
24/03/2020,24,3,2020,5,0,Bahrain,BH,BHR,1569439,2020-03-24,BH
23/03/2020,23,3,2020,28,1,Bahrain,BH,BHR,1569439,2020-03-23,BH
22/03/2020,22,3,2020,21,0,Bahrain,BH,BHR,1569439,2020-03-22,BH
21/03/2020,21,3,2020,16,0,Bahrain,BH,BHR,1569439,2020-03-21,BH
20/03/2020,20,3,2020,13,0,Bahrain,BH,BHR,1569439,2020-03-20,BH
19/03/2020,19,3,2020,19,0,Bahrain,BH,BHR,1569439,2020-03-19,BH
18/03/2020,18,3,2020,16,0,Bahrain,BH,BHR,1569439,2020-03-18,BH
17/03/2020,17,3,2020,7,1,Bahrain,BH,BHR,1569439,2020-03-17,BH
16/03/2020,16,3,2020,3,0,Bahrain,BH,BHR,1569439,2020-03-16,BH
15/03/2020,15,3,2020,1,0,Bahrain,BH,BHR,1569439,2020-03-15,BH
14/03/2020,14,3,2020,48,0,Bahrain,BH,BHR,1569439,2020-03-14,BH
13/03/2020,13,3,2020,0,0,Bahrain,BH,BHR,1569439,2020-03-13,BH
12/03/2020,12,3,2020,52,0,Bahrain,BH,BHR,1569439,2020-03-12,BH
11/03/2020,11,3,2020,1,0,Bahrain,BH,BHR,1569439,2020-03-11,BH
10/03/2020,10,3,2020,30,0,Bahrain,BH,BHR,1569439,2020-03-10,BH
09/03/2020,9,3,2020,16,0,Bahrain,BH,BHR,1569439,2020-03-09,BH
08/03/2020,8,3,2020,7,0,Bahrain,BH,BHR,1569439,2020-03-08,BH
07/03/2020,7,3,2020,4,0,Bahrain,BH,BHR,1569439,2020-03-07,BH
06/03/2020,6,3,2020,0,0,Bahrain,BH,BHR,1569439,2020-03-06,BH
05/03/2020,5,3,2020,3,0,Bahrain,BH,BHR,1569439,2020-03-05,BH
04/03/2020,4,3,2020,2,0,Bahrain,BH,BHR,1569439,2020-03-04,BH
02/03/2020,2,3,2020,6,0,Bahrain,BH,BHR,1569439,2020-03-02,BH
01/03/2020,1,3,2020,3,0,Bahrain,BH,BHR,1569439,2020-03-01,BH
29/02/2020,29,2,2020,5,0,Bahrain,BH,BHR,1569439,2020-02-29,BH
28/02/2020,28,2,2020,0,0,Bahrain,BH,BHR,1569439,2020-02-28,BH
27/02/2020,27,2,2020,10,0,Bahrain,BH,BHR,1569439,2020-02-27,BH
26/02/2020,26,2,2020,21,0,Bahrain,BH,BHR,1569439,2020-02-26,BH
25/02/2020,25,2,2020,1,0,Bahrain,BH,BHR,1569439,2020-02-25,BH
24/02/2020,24,2,2020,1,0,Bahrain,BH,BHR,1569439,2020-02-24,BH
23/02/2020,23,2,2020,0,0,Bahrain,BH,BHR,1569439,2020-02-23,BH
22/02/2020,22,2,2020,0,0,Bahrain,BH,BHR,1569439,2020-02-22,BH
21/02/2020,21,2,2020,0,0,Bahrain,BH,BHR,1569439,2020-02-21,BH
20/02/2020,20,2,2020,0,0,Bahrain,BH,BHR,1569439,2020-02-20,BH
19/02/2020,19,2,2020,0,0,Bahrain,BH,BHR,1569439,2020-02-19,BH
18/02/2020,18,2,2020,0,0,Bahrain,BH,BHR,1569439,2020-02-18,BH
17/02/2020,17,2,2020,0,0,Bahrain,BH,BHR,1569439,2020-02-17,BH
16/02/2020,16,2,2020,0,0,Bahrain,BH,BHR,1569439,2020-02-16,BH
15/02/2020,15,2,2020,0,0,Bahrain,BH,BHR,1569439,2020-02-15,BH
14/02/2020,14,2,2020,0,0,Bahrain,BH,BHR,1569439,2020-02-14,BH
13/02/2020,13,2,2020,0,0,Bahrain,BH,BHR,1569439,2020-02-13,BH
12/02/2020,12,2,2020,0,0,Bahrain,BH,BHR,1569439,2020-02-12,BH
11/02/2020,11,2,2020,0,0,Bahrain,BH,BHR,1569439,2020-02-11,BH
10/02/2020,10,2,2020,0,0,Bahrain,BH,BHR,1569439,2020-02-10,BH
09/02/2020,9,2,2020,0,0,Bahrain,BH,BHR,1569439,2020-02-09,BH
08/02/2020,8,2,2020,0,0,Bahrain,BH,BHR,1569439,2020-02-08,BH
07/02/2020,7,2,2020,0,0,Bahrain,BH,BHR,1569439,2020-02-07,BH
06/02/2020,6,2,2020,0,0,Bahrain,BH,BHR,1569439,2020-02-06,BH
05/02/2020,5,2,2020,0,0,Bahrain,BH,BHR,1569439,2020-02-05,BH
04/02/2020,4,2,2020,0,0,Bahrain,BH,BHR,1569439,2020-02-04,BH
03/02/2020,3,2,2020,0,0,Bahrain,BH,BHR,1569439,2020-02-03,BH
02/02/2020,2,2,2020,0,0,Bahrain,BH,BHR,1569439,2020-02-02,BH
01/02/2020,1,2,2020,0,0,Bahrain,BH,BHR,1569439,2020-02-01,BH
31/01/2020,31,1,2020,0,0,Bahrain,BH,BHR,1569439,2020-01-31,BH
30/01/2020,30,1,2020,0,0,Bahrain,BH,BHR,1569439,2020-01-30,BH
29/01/2020,29,1,2020,0,0,Bahrain,BH,BHR,1569439,2020-01-29,BH
28/01/2020,28,1,2020,0,0,Bahrain,BH,BHR,1569439,2020-01-28,BH
27/01/2020,27,1,2020,0,0,Bahrain,BH,BHR,1569439,2020-01-27,BH
26/01/2020,26,1,2020,0,0,Bahrain,BH,BHR,1569439,2020-01-26,BH
25/01/2020,25,1,2020,0,0,Bahrain,BH,BHR,1569439,2020-01-25,BH
24/01/2020,24,1,2020,0,0,Bahrain,BH,BHR,1569439,2020-01-24,BH
23/01/2020,23,1,2020,0,0,Bahrain,BH,BHR,1569439,2020-01-23,BH
22/01/2020,22,1,2020,0,0,Bahrain,BH,BHR,1569439,2020-01-22,BH
21/01/2020,21,1,2020,0,0,Bahrain,BH,BHR,1569439,2020-01-21,BH
20/01/2020,20,1,2020,0,0,Bahrain,BH,BHR,1569439,2020-01-20,BH
19/01/2020,19,1,2020,0,0,Bahrain,BH,BHR,1569439,2020-01-19,BH
18/01/2020,18,1,2020,0,0,Bahrain,BH,BHR,1569439,2020-01-18,BH
17/01/2020,17,1,2020,0,0,Bahrain,BH,BHR,1569439,2020-01-17,BH
16/01/2020,16,1,2020,0,0,Bahrain,BH,BHR,1569439,2020-01-16,BH
15/01/2020,15,1,2020,0,0,Bahrain,BH,BHR,1569439,2020-01-15,BH
14/01/2020,14,1,2020,0,0,Bahrain,BH,BHR,1569439,2020-01-14,BH
13/01/2020,13,1,2020,0,0,Bahrain,BH,BHR,1569439,2020-01-13,BH
12/01/2020,12,1,2020,0,0,Bahrain,BH,BHR,1569439,2020-01-12,BH
11/01/2020,11,1,2020,0,0,Bahrain,BH,BHR,1569439,2020-01-11,BH
10/01/2020,10,1,2020,0,0,Bahrain,BH,BHR,1569439,2020-01-10,BH
09/01/2020,9,1,2020,0,0,Bahrain,BH,BHR,1569439,2020-01-09,BH
08/01/2020,8,1,2020,0,0,Bahrain,BH,BHR,1569439,2020-01-08,BH
07/01/2020,7,1,2020,0,0,Bahrain,BH,BHR,1569439,2020-01-07,BH
06/01/2020,6,1,2020,0,0,Bahrain,BH,BHR,1569439,2020-01-06,BH
05/01/2020,5,1,2020,0,0,Bahrain,BH,BHR,1569439,2020-01-05,BH
04/01/2020,4,1,2020,0,0,Bahrain,BH,BHR,1569439,2020-01-04,BH
03/01/2020,3,1,2020,0,0,Bahrain,BH,BHR,1569439,2020-01-03,BH
02/01/2020,2,1,2020,0,0,Bahrain,BH,BHR,1569439,2020-01-02,BH
01/01/2020,1,1,2020,0,0,Bahrain,BH,BHR,1569439,2020-01-01,BH
31/12/2019,31,12,2019,0,0,Bahrain,BH,BHR,1569439,2019-12-31,BH
13/04/2020,13,4,2020,139,4,Bangladesh,BD,BGD,161356039,2020-04-13,BD
12/04/2020,12,4,2020,58,3,Bangladesh,BD,BGD,161356039,2020-04-12,BD
11/04/2020,11,4,2020,94,6,Bangladesh,BD,BGD,161356039,2020-04-11,BD
10/04/2020,10,4,2020,112,1,Bangladesh,BD,BGD,161356039,2020-04-10,BD
09/04/2020,9,4,2020,54,3,Bangladesh,BD,BGD,161356039,2020-04-09,BD
08/04/2020,8,4,2020,41,5,Bangladesh,BD,BGD,161356039,2020-04-08,BD
07/04/2020,7,4,2020,35,3,Bangladesh,BD,BGD,161356039,2020-04-07,BD
06/04/2020,6,4,2020,18,1,Bangladesh,BD,BGD,161356039,2020-04-06,BD
05/04/2020,5,4,2020,9,2,Bangladesh,BD,BGD,161356039,2020-04-05,BD
04/04/2020,4,4,2020,5,0,Bangladesh,BD,BGD,161356039,2020-04-04,BD
03/04/2020,3,4,2020,2,0,Bangladesh,BD,BGD,161356039,2020-04-03,BD
02/04/2020,2,4,2020,3,1,Bangladesh,BD,BGD,161356039,2020-04-02,BD
01/04/2020,1,4,2020,2,0,Bangladesh,BD,BGD,161356039,2020-04-01,BD
31/03/2020,31,3,2020,0,0,Bangladesh,BD,BGD,161356039,2020-03-31,BD
30/03/2020,30,3,2020,1,0,Bangladesh,BD,BGD,161356039,2020-03-30,BD
29/03/2020,29,3,2020,0,0,Bangladesh,BD,BGD,161356039,2020-03-29,BD
28/03/2020,28,3,2020,0,0,Bangladesh,BD,BGD,161356039,2020-03-28,BD
27/03/2020,27,3,2020,9,0,Bangladesh,BD,BGD,161356039,2020-03-27,BD
26/03/2020,26,3,2020,0,1,Bangladesh,BD,BGD,161356039,2020-03-26,BD
25/03/2020,25,3,2020,6,1,Bangladesh,BD,BGD,161356039,2020-03-25,BD
24/03/2020,24,3,2020,6,0,Bangladesh,BD,BGD,161356039,2020-03-24,BD
23/03/2020,23,3,2020,3,1,Bangladesh,BD,BGD,161356039,2020-03-23,BD
22/03/2020,22,3,2020,7,2,Bangladesh,BD,BGD,161356039,2020-03-22,BD
21/03/2020,21,3,2020,7,0,Bangladesh,BD,BGD,161356039,2020-03-21,BD
20/03/2020,20,3,2020,0,0,Bangladesh,BD,BGD,161356039,2020-03-20,BD
19/03/2020,19,3,2020,2,0,Bangladesh,BD,BGD,161356039,2020-03-19,BD
18/03/2020,18,3,2020,3,0,Bangladesh,BD,BGD,161356039,2020-03-18,BD
17/03/2020,17,3,2020,2,0,Bangladesh,BD,BGD,161356039,2020-03-17,BD
15/03/2020,15,3,2020,0,0,Bangladesh,BD,BGD,161356039,2020-03-15,BD
09/03/2020,9,3,2020,3,0,Bangladesh,BD,BGD,161356039,2020-03-09,BD
13/04/2020,13,4,2020,3,0,Barbados,BB,BRB,286641,2020-04-13,BB
12/04/2020,12,4,2020,1,0,Barbados,BB,BRB,286641,2020-04-12,BB
11/04/2020,11,4,2020,1,1,Barbados,BB,BRB,286641,2020-04-11,BB
10/04/2020,10,4,2020,3,0,Barbados,BB,BRB,286641,2020-04-10,BB
09/04/2020,9,4,2020,0,0,Barbados,BB,BRB,286641,2020-04-09,BB
08/04/2020,8,4,2020,3,1,Barbados,BB,BRB,286641,2020-04-08,BB
07/04/2020,7,4,2020,4,1,Barbados,BB,BRB,286641,2020-04-07,BB
06/04/2020,6,4,2020,5,1,Barbados,BB,BRB,286641,2020-04-06,BB
05/04/2020,5,4,2020,6,0,Barbados,BB,BRB,286641,2020-04-05,BB
04/04/2020,4,4,2020,0,0,Barbados,BB,BRB,286641,2020-04-04,BB
03/04/2020,3,4,2020,0,0,Barbados,BB,BRB,286641,2020-04-03,BB
02/04/2020,2,4,2020,11,0,Barbados,BB,BRB,286641,2020-04-02,BB
01/04/2020,1,4,2020,0,0,Barbados,BB,BRB,286641,2020-04-01,BB
31/03/2020,31,3,2020,1,0,Barbados,BB,BRB,286641,2020-03-31,BB
30/03/2020,30,3,2020,7,0,Barbados,BB,BRB,286641,2020-03-30,BB
29/03/2020,29,3,2020,2,0,Barbados,BB,BRB,286641,2020-03-29,BB
28/03/2020,28,3,2020,0,0,Barbados,BB,BRB,286641,2020-03-28,BB
27/03/2020,27,3,2020,6,0,Barbados,BB,BRB,286641,2020-03-27,BB
26/03/2020,26,3,2020,0,0,Barbados,BB,BRB,286641,2020-03-26,BB
25/03/2020,25,3,2020,1,0,Barbados,BB,BRB,286641,2020-03-25,BB
24/03/2020,24,3,2020,0,0,Barbados,BB,BRB,286641,2020-03-24,BB
23/03/2020,23,3,2020,3,0,Barbados,BB,BRB,286641,2020-03-23,BB
22/03/2020,22,3,2020,8,0,Barbados,BB,BRB,286641,2020-03-22,BB
21/03/2020,21,3,2020,4,0,Barbados,BB,BRB,286641,2020-03-21,BB
20/03/2020,20,3,2020,1,0,Barbados,BB,BRB,286641,2020-03-20,BB
19/03/2020,19,3,2020,0,0,Barbados,BB,BRB,286641,2020-03-19,BB
18/03/2020,18,3,2020,1,0,Barbados,BB,BRB,286641,2020-03-18,BB
13/04/2020,13,4,2020,352,3,Belarus,BY,BLR,9485386,2020-04-13,BY
12/04/2020,12,4,2020,245,4,Belarus,BY,BLR,9485386,2020-04-12,BY
11/04/2020,11,4,2020,495,3,Belarus,BY,BLR,9485386,2020-04-11,BY
10/04/2020,10,4,2020,420,3,Belarus,BY,BLR,9485386,2020-04-10,BY
09/04/2020,9,4,2020,205,0,Belarus,BY,BLR,9485386,2020-04-09,BY
08/04/2020,8,4,2020,161,0,Belarus,BY,BLR,9485386,2020-04-08,BY
07/04/2020,7,4,2020,136,5,Belarus,BY,BLR,9485386,2020-04-07,BY
06/04/2020,6,4,2020,170,3,Belarus,BY,BLR,9485386,2020-04-06,BY
05/04/2020,5,4,2020,43,1,Belarus,BY,BLR,9485386,2020-04-05,BY
04/04/2020,4,4,2020,97,0,Belarus,BY,BLR,9485386,2020-04-04,BY
03/04/2020,3,4,2020,102,4,Belarus,BY,BLR,9485386,2020-04-03,BY
02/04/2020,2,4,2020,0,0,Belarus,BY,BLR,9485386,2020-04-02,BY
01/04/2020,1,4,2020,47,0,Belarus,BY,BLR,9485386,2020-04-01,BY
31/03/2020,31,3,2020,11,0,Belarus,BY,BLR,9485386,2020-03-31,BY
30/03/2020,30,3,2020,0,0,Belarus,BY,BLR,9485386,2020-03-30,BY
29/03/2020,29,3,2020,0,0,Belarus,BY,BLR,9485386,2020-03-29,BY
28/03/2020,28,3,2020,8,0,Belarus,BY,BLR,9485386,2020-03-28,BY
27/03/2020,27,3,2020,0,0,Belarus,BY,BLR,9485386,2020-03-27,BY
26/03/2020,26,3,2020,5,0,Belarus,BY,BLR,9485386,2020-03-26,BY
25/03/2020,25,3,2020,0,0,Belarus,BY,BLR,9485386,2020-03-25,BY
24/03/2020,24,3,2020,5,0,Belarus,BY,BLR,9485386,2020-03-24,BY
23/03/2020,23,3,2020,0,0,Belarus,BY,BLR,9485386,2020-03-23,BY
22/03/2020,22,3,2020,19,0,Belarus,BY,BLR,9485386,2020-03-22,BY
21/03/2020,21,3,2020,0,0,Belarus,BY,BLR,9485386,2020-03-21,BY
20/03/2020,20,3,2020,11,0,Belarus,BY,BLR,9485386,2020-03-20,BY
19/03/2020,19,3,2020,10,0,Belarus,BY,BLR,9485386,2020-03-19,BY
18/03/2020,18,3,2020,0,0,Belarus,BY,BLR,9485386,2020-03-18,BY
17/03/2020,17,3,2020,9,0,Belarus,BY,BLR,9485386,2020-03-17,BY
16/03/2020,16,3,2020,6,0,Belarus,BY,BLR,9485386,2020-03-16,BY
13/03/2020,13,3,2020,9,0,Belarus,BY,BLR,9485386,2020-03-13,BY
12/03/2020,12,3,2020,3,0,Belarus,BY,BLR,9485386,2020-03-12,BY
11/03/2020,11,3,2020,3,0,Belarus,BY,BLR,9485386,2020-03-11,BY
05/03/2020,5,3,2020,2,0,Belarus,BY,BLR,9485386,2020-03-05,BY
04/03/2020,4,3,2020,3,0,Belarus,BY,BLR,9485386,2020-03-04,BY
02/03/2020,2,3,2020,0,0,Belarus,BY,BLR,9485386,2020-03-02,BY
01/03/2020,1,3,2020,0,0,Belarus,BY,BLR,9485386,2020-03-01,BY
29/02/2020,29,2,2020,0,0,Belarus,BY,BLR,9485386,2020-02-29,BY
28/02/2020,28,2,2020,1,0,Belarus,BY,BLR,9485386,2020-02-28,BY
27/02/2020,27,2,2020,0,0,Belarus,BY,BLR,9485386,2020-02-27,BY
26/02/2020,26,2,2020,0,0,Belarus,BY,BLR,9485386,2020-02-26,BY
25/02/2020,25,2,2020,0,0,Belarus,BY,BLR,9485386,2020-02-25,BY
24/02/2020,24,2,2020,0,0,Belarus,BY,BLR,9485386,2020-02-24,BY
23/02/2020,23,2,2020,0,0,Belarus,BY,BLR,9485386,2020-02-23,BY
22/02/2020,22,2,2020,0,0,Belarus,BY,BLR,9485386,2020-02-22,BY
21/02/2020,21,2,2020,0,0,Belarus,BY,BLR,9485386,2020-02-21,BY
20/02/2020,20,2,2020,0,0,Belarus,BY,BLR,9485386,2020-02-20,BY
19/02/2020,19,2,2020,0,0,Belarus,BY,BLR,9485386,2020-02-19,BY
18/02/2020,18,2,2020,0,0,Belarus,BY,BLR,9485386,2020-02-18,BY
17/02/2020,17,2,2020,0,0,Belarus,BY,BLR,9485386,2020-02-17,BY
16/02/2020,16,2,2020,0,0,Belarus,BY,BLR,9485386,2020-02-16,BY
15/02/2020,15,2,2020,0,0,Belarus,BY,BLR,9485386,2020-02-15,BY
14/02/2020,14,2,2020,0,0,Belarus,BY,BLR,9485386,2020-02-14,BY
13/02/2020,13,2,2020,0,0,Belarus,BY,BLR,9485386,2020-02-13,BY
12/02/2020,12,2,2020,0,0,Belarus,BY,BLR,9485386,2020-02-12,BY
11/02/2020,11,2,2020,0,0,Belarus,BY,BLR,9485386,2020-02-11,BY
10/02/2020,10,2,2020,0,0,Belarus,BY,BLR,9485386,2020-02-10,BY
09/02/2020,9,2,2020,0,0,Belarus,BY,BLR,9485386,2020-02-09,BY
08/02/2020,8,2,2020,0,0,Belarus,BY,BLR,9485386,2020-02-08,BY
07/02/2020,7,2,2020,0,0,Belarus,BY,BLR,9485386,2020-02-07,BY
06/02/2020,6,2,2020,0,0,Belarus,BY,BLR,9485386,2020-02-06,BY
05/02/2020,5,2,2020,0,0,Belarus,BY,BLR,9485386,2020-02-05,BY
04/02/2020,4,2,2020,0,0,Belarus,BY,BLR,9485386,2020-02-04,BY
03/02/2020,3,2,2020,0,0,Belarus,BY,BLR,9485386,2020-02-03,BY
02/02/2020,2,2,2020,0,0,Belarus,BY,BLR,9485386,2020-02-02,BY
01/02/2020,1,2,2020,0,0,Belarus,BY,BLR,9485386,2020-02-01,BY
31/01/2020,31,1,2020,0,0,Belarus,BY,BLR,9485386,2020-01-31,BY
30/01/2020,30,1,2020,0,0,Belarus,BY,BLR,9485386,2020-01-30,BY
29/01/2020,29,1,2020,0,0,Belarus,BY,BLR,9485386,2020-01-29,BY
28/01/2020,28,1,2020,0,0,Belarus,BY,BLR,9485386,2020-01-28,BY
27/01/2020,27,1,2020,0,0,Belarus,BY,BLR,9485386,2020-01-27,BY
26/01/2020,26,1,2020,0,0,Belarus,BY,BLR,9485386,2020-01-26,BY
25/01/2020,25,1,2020,0,0,Belarus,BY,BLR,9485386,2020-01-25,BY
24/01/2020,24,1,2020,0,0,Belarus,BY,BLR,9485386,2020-01-24,BY
23/01/2020,23,1,2020,0,0,Belarus,BY,BLR,9485386,2020-01-23,BY
22/01/2020,22,1,2020,0,0,Belarus,BY,BLR,9485386,2020-01-22,BY
21/01/2020,21,1,2020,0,0,Belarus,BY,BLR,9485386,2020-01-21,BY
20/01/2020,20,1,2020,0,0,Belarus,BY,BLR,9485386,2020-01-20,BY
19/01/2020,19,1,2020,0,0,Belarus,BY,BLR,9485386,2020-01-19,BY
18/01/2020,18,1,2020,0,0,Belarus,BY,BLR,9485386,2020-01-18,BY
17/01/2020,17,1,2020,0,0,Belarus,BY,BLR,9485386,2020-01-17,BY
16/01/2020,16,1,2020,0,0,Belarus,BY,BLR,9485386,2020-01-16,BY
15/01/2020,15,1,2020,0,0,Belarus,BY,BLR,9485386,2020-01-15,BY
14/01/2020,14,1,2020,0,0,Belarus,BY,BLR,9485386,2020-01-14,BY
13/01/2020,13,1,2020,0,0,Belarus,BY,BLR,9485386,2020-01-13,BY
12/01/2020,12,1,2020,0,0,Belarus,BY,BLR,9485386,2020-01-12,BY
11/01/2020,11,1,2020,0,0,Belarus,BY,BLR,9485386,2020-01-11,BY
10/01/2020,10,1,2020,0,0,Belarus,BY,BLR,9485386,2020-01-10,BY
09/01/2020,9,1,2020,0,0,Belarus,BY,BLR,9485386,2020-01-09,BY
08/01/2020,8,1,2020,0,0,Belarus,BY,BLR,9485386,2020-01-08,BY
07/01/2020,7,1,2020,0,0,Belarus,BY,BLR,9485386,2020-01-07,BY
06/01/2020,6,1,2020,0,0,Belarus,BY,BLR,9485386,2020-01-06,BY
05/01/2020,5,1,2020,0,0,Belarus,BY,BLR,9485386,2020-01-05,BY
04/01/2020,4,1,2020,0,0,Belarus,BY,BLR,9485386,2020-01-04,BY
03/01/2020,3,1,2020,0,0,Belarus,BY,BLR,9485386,2020-01-03,BY
02/01/2020,2,1,2020,0,0,Belarus,BY,BLR,9485386,2020-01-02,BY
01/01/2020,1,1,2020,0,0,Belarus,BY,BLR,9485386,2020-01-01,BY
31/12/2019,31,12,2019,0,0,Belarus,BY,BLR,9485386,2019-12-31,BY
13/04/2020,13,4,2020,1629,254,Belgium,BE,BEL,11422068,2020-04-13,BE
12/04/2020,12,4,2020,1351,327,Belgium,BE,BEL,11422068,2020-04-12,BE
11/04/2020,11,4,2020,1684,496,Belgium,BE,BEL,11422068,2020-04-11,BE
10/04/2020,10,4,2020,1580,283,Belgium,BE,BEL,11422068,2020-04-10,BE
09/04/2020,9,4,2020,1209,205,Belgium,BE,BEL,11422068,2020-04-09,BE
08/04/2020,8,4,2020,1380,403,Belgium,BE,BEL,11422068,2020-04-08,BE
07/04/2020,7,4,2020,1123,185,Belgium,BE,BEL,11422068,2020-04-07,BE
06/04/2020,6,4,2020,1260,164,Belgium,BE,BEL,11422068,2020-04-06,BE
05/04/2020,5,4,2020,1661,140,Belgium,BE,BEL,11422068,2020-04-05,BE
04/04/2020,4,4,2020,1422,132,Belgium,BE,BEL,11422068,2020-04-04,BE
03/04/2020,3,4,2020,1384,183,Belgium,BE,BEL,11422068,2020-04-03,BE
02/04/2020,2,4,2020,1189,123,Belgium,BE,BEL,11422068,2020-04-02,BE
01/04/2020,1,4,2020,876,192,Belgium,BE,BEL,11422068,2020-04-01,BE
31/03/2020,31,3,2020,1063,82,Belgium,BE,BEL,11422068,2020-03-31,BE
30/03/2020,30,3,2020,1702,78,Belgium,BE,BEL,11422068,2020-03-30,BE
29/03/2020,29,3,2020,1850,64,Belgium,BE,BEL,11422068,2020-03-29,BE
28/03/2020,28,3,2020,1049,69,Belgium,BE,BEL,11422068,2020-03-28,BE
27/03/2020,27,3,2020,1298,42,Belgium,BE,BEL,11422068,2020-03-27,BE
26/03/2020,26,3,2020,668,56,Belgium,BE,BEL,11422068,2020-03-26,BE
25/03/2020,25,3,2020,526,34,Belgium,BE,BEL,11422068,2020-03-25,BE
24/03/2020,24,3,2020,342,13,Belgium,BE,BEL,11422068,2020-03-24,BE
23/03/2020,23,3,2020,586,8,Belgium,BE,BEL,11422068,2020-03-23,BE
22/03/2020,22,3,2020,558,30,Belgium,BE,BEL,11422068,2020-03-22,BE
21/03/2020,21,3,2020,462,16,Belgium,BE,BEL,11422068,2020-03-21,BE
20/03/2020,20,3,2020,309,7,Belgium,BE,BEL,11422068,2020-03-20,BE
19/03/2020,19,3,2020,243,9,Belgium,BE,BEL,11422068,2020-03-19,BE
18/03/2020,18,3,2020,158,0,Belgium,BE,BEL,11422068,2020-03-18,BE
17/03/2020,17,3,2020,199,1,Belgium,BE,BEL,11422068,2020-03-17,BE
16/03/2020,16,3,2020,197,0,Belgium,BE,BEL,11422068,2020-03-16,BE
15/03/2020,15,3,2020,130,1,Belgium,BE,BEL,11422068,2020-03-15,BE
14/03/2020,14,3,2020,160,0,Belgium,BE,BEL,11422068,2020-03-14,BE
13/03/2020,13,3,2020,85,0,Belgium,BE,BEL,11422068,2020-03-13,BE
12/03/2020,12,3,2020,47,3,Belgium,BE,BEL,11422068,2020-03-12,BE
11/03/2020,11,3,2020,28,0,Belgium,BE,BEL,11422068,2020-03-11,BE
10/03/2020,10,3,2020,39,0,Belgium,BE,BEL,11422068,2020-03-10,BE
09/03/2020,9,3,2020,31,0,Belgium,BE,BEL,11422068,2020-03-09,BE
08/03/2020,8,3,2020,60,0,Belgium,BE,BEL,11422068,2020-03-08,BE
07/03/2020,7,3,2020,59,0,Belgium,BE,BEL,11422068,2020-03-07,BE
06/03/2020,6,3,2020,27,0,Belgium,BE,BEL,11422068,2020-03-06,BE
05/03/2020,5,3,2020,10,0,Belgium,BE,BEL,11422068,2020-03-05,BE
04/03/2020,4,3,2020,5,0,Belgium,BE,BEL,11422068,2020-03-04,BE
03/03/2020,3,3,2020,6,0,Belgium,BE,BEL,11422068,2020-03-03,BE
02/03/2020,2,3,2020,1,0,Belgium,BE,BEL,11422068,2020-03-02,BE
01/03/2020,1,3,2020,0,0,Belgium,BE,BEL,11422068,2020-03-01,BE
29/02/2020,29,2,2020,0,0,Belgium,BE,BEL,11422068,2020-02-29,BE
28/02/2020,28,2,2020,0,0,Belgium,BE,BEL,11422068,2020-02-28,BE
27/02/2020,27,2,2020,0,0,Belgium,BE,BEL,11422068,2020-02-27,BE
26/02/2020,26,2,2020,0,0,Belgium,BE,BEL,11422068,2020-02-26,BE
25/02/2020,25,2,2020,0,0,Belgium,BE,BEL,11422068,2020-02-25,BE
24/02/2020,24,2,2020,0,0,Belgium,BE,BEL,11422068,2020-02-24,BE
23/02/2020,23,2,2020,0,0,Belgium,BE,BEL,11422068,2020-02-23,BE
22/02/2020,22,2,2020,0,0,Belgium,BE,BEL,11422068,2020-02-22,BE
21/02/2020,21,2,2020,0,0,Belgium,BE,BEL,11422068,2020-02-21,BE
20/02/2020,20,2,2020,0,0,Belgium,BE,BEL,11422068,2020-02-20,BE
19/02/2020,19,2,2020,0,0,Belgium,BE,BEL,11422068,2020-02-19,BE
18/02/2020,18,2,2020,0,0,Belgium,BE,BEL,11422068,2020-02-18,BE
17/02/2020,17,2,2020,0,0,Belgium,BE,BEL,11422068,2020-02-17,BE
16/02/2020,16,2,2020,0,0,Belgium,BE,BEL,11422068,2020-02-16,BE
15/02/2020,15,2,2020,0,0,Belgium,BE,BEL,11422068,2020-02-15,BE
14/02/2020,14,2,2020,0,0,Belgium,BE,BEL,11422068,2020-02-14,BE
13/02/2020,13,2,2020,0,0,Belgium,BE,BEL,11422068,2020-02-13,BE
12/02/2020,12,2,2020,0,0,Belgium,BE,BEL,11422068,2020-02-12,BE
11/02/2020,11,2,2020,0,0,Belgium,BE,BEL,11422068,2020-02-11,BE
10/02/2020,10,2,2020,0,0,Belgium,BE,BEL,11422068,2020-02-10,BE
09/02/2020,9,2,2020,0,0,Belgium,BE,BEL,11422068,2020-02-09,BE
08/02/2020,8,2,2020,0,0,Belgium,BE,BEL,11422068,2020-02-08,BE
07/02/2020,7,2,2020,0,0,Belgium,BE,BEL,11422068,2020-02-07,BE
06/02/2020,6,2,2020,0,0,Belgium,BE,BEL,11422068,2020-02-06,BE
05/02/2020,5,2,2020,0,0,Belgium,BE,BEL,11422068,2020-02-05,BE
04/02/2020,4,2,2020,1,0,Belgium,BE,BEL,11422068,2020-02-04,BE
03/02/2020,3,2,2020,0,0,Belgium,BE,BEL,11422068,2020-02-03,BE
02/02/2020,2,2,2020,0,0,Belgium,BE,BEL,11422068,2020-02-02,BE
01/02/2020,1,2,2020,0,0,Belgium,BE,BEL,11422068,2020-02-01,BE
31/01/2020,31,1,2020,0,0,Belgium,BE,BEL,11422068,2020-01-31,BE
30/01/2020,30,1,2020,0,0,Belgium,BE,BEL,11422068,2020-01-30,BE
29/01/2020,29,1,2020,0,0,Belgium,BE,BEL,11422068,2020-01-29,BE
28/01/2020,28,1,2020,0,0,Belgium,BE,BEL,11422068,2020-01-28,BE
27/01/2020,27,1,2020,0,0,Belgium,BE,BEL,11422068,2020-01-27,BE
26/01/2020,26,1,2020,0,0,Belgium,BE,BEL,11422068,2020-01-26,BE
25/01/2020,25,1,2020,0,0,Belgium,BE,BEL,11422068,2020-01-25,BE
24/01/2020,24,1,2020,0,0,Belgium,BE,BEL,11422068,2020-01-24,BE
23/01/2020,23,1,2020,0,0,Belgium,BE,BEL,11422068,2020-01-23,BE
22/01/2020,22,1,2020,0,0,Belgium,BE,BEL,11422068,2020-01-22,BE
21/01/2020,21,1,2020,0,0,Belgium,BE,BEL,11422068,2020-01-21,BE
20/01/2020,20,1,2020,0,0,Belgium,BE,BEL,11422068,2020-01-20,BE
19/01/2020,19,1,2020,0,0,Belgium,BE,BEL,11422068,2020-01-19,BE
18/01/2020,18,1,2020,0,0,Belgium,BE,BEL,11422068,2020-01-18,BE
17/01/2020,17,1,2020,0,0,Belgium,BE,BEL,11422068,2020-01-17,BE
16/01/2020,16,1,2020,0,0,Belgium,BE,BEL,11422068,2020-01-16,BE
15/01/2020,15,1,2020,0,0,Belgium,BE,BEL,11422068,2020-01-15,BE
14/01/2020,14,1,2020,0,0,Belgium,BE,BEL,11422068,2020-01-14,BE
13/01/2020,13,1,2020,0,0,Belgium,BE,BEL,11422068,2020-01-13,BE
12/01/2020,12,1,2020,0,0,Belgium,BE,BEL,11422068,2020-01-12,BE
11/01/2020,11,1,2020,0,0,Belgium,BE,BEL,11422068,2020-01-11,BE
10/01/2020,10,1,2020,0,0,Belgium,BE,BEL,11422068,2020-01-10,BE
09/01/2020,9,1,2020,0,0,Belgium,BE,BEL,11422068,2020-01-09,BE
08/01/2020,8,1,2020,0,0,Belgium,BE,BEL,11422068,2020-01-08,BE
07/01/2020,7,1,2020,0,0,Belgium,BE,BEL,11422068,2020-01-07,BE
06/01/2020,6,1,2020,0,0,Belgium,BE,BEL,11422068,2020-01-06,BE
05/01/2020,5,1,2020,0,0,Belgium,BE,BEL,11422068,2020-01-05,BE
04/01/2020,4,1,2020,0,0,Belgium,BE,BEL,11422068,2020-01-04,BE
03/01/2020,3,1,2020,0,0,Belgium,BE,BEL,11422068,2020-01-03,BE
02/01/2020,2,1,2020,0,0,Belgium,BE,BEL,11422068,2020-01-02,BE
01/01/2020,1,1,2020,0,0,Belgium,BE,BEL,11422068,2020-01-01,BE
31/12/2019,31,12,2019,0,0,Belgium,BE,BEL,11422068,2019-12-31,BE
13/04/2020,13,4,2020,1,0,Belize,BZ,BLZ,383071,2020-04-13,BZ
12/04/2020,12,4,2020,3,0,Belize,BZ,BLZ,383071,2020-04-12,BZ
11/04/2020,11,4,2020,1,1,Belize,BZ,BLZ,383071,2020-04-11,BZ
10/04/2020,10,4,2020,1,0,Belize,BZ,BLZ,383071,2020-04-10,BZ
09/04/2020,9,4,2020,1,0,Belize,BZ,BLZ,383071,2020-04-09,BZ
08/04/2020,8,4,2020,0,0,Belize,BZ,BLZ,383071,2020-04-08,BZ
07/04/2020,7,4,2020,2,0,Belize,BZ,BLZ,383071,2020-04-07,BZ
06/04/2020,6,4,2020,1,1,Belize,BZ,BLZ,383071,2020-04-06,BZ
05/04/2020,5,4,2020,0,0,Belize,BZ,BLZ,383071,2020-04-05,BZ
04/04/2020,4,4,2020,1,0,Belize,BZ,BLZ,383071,2020-04-04,BZ
03/04/2020,3,4,2020,0,0,Belize,BZ,BLZ,383071,2020-04-03,BZ
02/04/2020,2,4,2020,0,0,Belize,BZ,BLZ,383071,2020-04-02,BZ
01/04/2020,1,4,2020,0,0,Belize,BZ,BLZ,383071,2020-04-01,BZ
31/03/2020,31,3,2020,1,0,Belize,BZ,BLZ,383071,2020-03-31,BZ
30/03/2020,30,3,2020,0,0,Belize,BZ,BLZ,383071,2020-03-30,BZ
29/03/2020,29,3,2020,0,0,Belize,BZ,BLZ,383071,2020-03-29,BZ
28/03/2020,28,3,2020,0,0,Belize,BZ,BLZ,383071,2020-03-28,BZ
27/03/2020,27,3,2020,0,0,Belize,BZ,BLZ,383071,2020-03-27,BZ
26/03/2020,26,3,2020,1,0,Belize,BZ,BLZ,383071,2020-03-26,BZ
25/03/2020,25,3,2020,0,0,Belize,BZ,BLZ,383071,2020-03-25,BZ
24/03/2020,24,3,2020,1,0,Belize,BZ,BLZ,383071,2020-03-24,BZ
13/04/2020,13,4,2020,0,0,Benin,BJ,BEN,11485048,2020-04-13,BJ
12/04/2020,12,4,2020,0,0,Benin,BJ,BEN,11485048,2020-04-12,BJ
11/04/2020,11,4,2020,5,0,Benin,BJ,BEN,11485048,2020-04-11,BJ
10/04/2020,10,4,2020,4,0,Benin,BJ,BEN,11485048,2020-04-10,BJ
09/04/2020,9,4,2020,0,0,Benin,BJ,BEN,11485048,2020-04-09,BJ
08/04/2020,8,4,2020,0,0,Benin,BJ,BEN,11485048,2020-04-08,BJ
07/04/2020,7,4,2020,4,1,Benin,BJ,BEN,11485048,2020-04-07,BJ
06/04/2020,6,4,2020,6,0,Benin,BJ,BEN,11485048,2020-04-06,BJ
05/04/2020,5,4,2020,0,0,Benin,BJ,BEN,11485048,2020-04-05,BJ
04/04/2020,4,4,2020,3,0,Benin,BJ,BEN,11485048,2020-04-04,BJ
03/04/2020,3,4,2020,0,0,Benin,BJ,BEN,11485048,2020-04-03,BJ
02/04/2020,2,4,2020,5,0,Benin,BJ,BEN,11485048,2020-04-02,BJ
01/04/2020,1,4,2020,2,0,Benin,BJ,BEN,11485048,2020-04-01,BJ
31/03/2020,31,3,2020,0,0,Benin,BJ,BEN,11485048,2020-03-31,BJ
30/03/2020,30,3,2020,0,0,Benin,BJ,BEN,11485048,2020-03-30,BJ
29/03/2020,29,3,2020,0,0,Benin,BJ,BEN,11485048,2020-03-29,BJ
28/03/2020,28,3,2020,0,0,Benin,BJ,BEN,11485048,2020-03-28,BJ
27/03/2020,27,3,2020,1,0,Benin,BJ,BEN,11485048,2020-03-27,BJ
26/03/2020,26,3,2020,0,0,Benin,BJ,BEN,11485048,2020-03-26,BJ
25/03/2020,25,3,2020,0,0,Benin,BJ,BEN,11485048,2020-03-25,BJ
24/03/2020,24,3,2020,3,0,Benin,BJ,BEN,11485048,2020-03-24,BJ
23/03/2020,23,3,2020,0,0,Benin,BJ,BEN,11485048,2020-03-23,BJ
22/03/2020,22,3,2020,0,0,Benin,BJ,BEN,11485048,2020-03-22,BJ
21/03/2020,21,3,2020,0,0,Benin,BJ,BEN,11485048,2020-03-21,BJ
20/03/2020,20,3,2020,1,0,Benin,BJ,BEN,11485048,2020-03-20,BJ
19/03/2020,19,3,2020,0,0,Benin,BJ,BEN,11485048,2020-03-19,BJ
18/03/2020,18,3,2020,0,0,Benin,BJ,BEN,11485048,2020-03-18,BJ
17/03/2020,17,3,2020,1,0,Benin,BJ,BEN,11485048,2020-03-17,BJ
13/04/2020,13,4,2020,7,0,Bermuda,BM,BMU,63968,2020-04-13,BM
12/04/2020,12,4,2020,2,0,Bermuda,BM,BMU,63968,2020-04-12,BM
11/04/2020,11,4,2020,0,0,Bermuda,BM,BMU,63968,2020-04-11,BM
10/04/2020,10,4,2020,9,1,Bermuda,BM,BMU,63968,2020-04-10,BM
09/04/2020,9,4,2020,0,1,Bermuda,BM,BMU,63968,2020-04-09,BM
08/04/2020,8,4,2020,0,0,Bermuda,BM,BMU,63968,2020-04-08,BM
07/04/2020,7,4,2020,2,2,Bermuda,BM,BMU,63968,2020-04-07,BM
06/04/2020,6,4,2020,0,0,Bermuda,BM,BMU,63968,2020-04-06,BM
05/04/2020,5,4,2020,2,0,Bermuda,BM,BMU,63968,2020-04-05,BM
04/04/2020,4,4,2020,0,0,Bermuda,BM,BMU,63968,2020-04-04,BM
03/04/2020,3,4,2020,3,0,Bermuda,BM,BMU,63968,2020-04-03,BM
02/04/2020,2,4,2020,0,0,Bermuda,BM,BMU,63968,2020-04-02,BM
01/04/2020,1,4,2020,5,0,Bermuda,BM,BMU,63968,2020-04-01,BM
31/03/2020,31,3,2020,5,0,Bermuda,BM,BMU,63968,2020-03-31,BM
30/03/2020,30,3,2020,0,0,Bermuda,BM,BMU,63968,2020-03-30,BM
29/03/2020,29,3,2020,5,0,Bermuda,BM,BMU,63968,2020-03-29,BM
28/03/2020,28,3,2020,2,0,Bermuda,BM,BMU,63968,2020-03-28,BM
27/03/2020,27,3,2020,9,0,Bermuda,BM,BMU,63968,2020-03-27,BM
26/03/2020,26,3,2020,0,0,Bermuda,BM,BMU,63968,2020-03-26,BM
25/03/2020,25,3,2020,0,0,Bermuda,BM,BMU,63968,2020-03-25,BM
24/03/2020,24,3,2020,0,0,Bermuda,BM,BMU,63968,2020-03-24,BM
23/03/2020,23,3,2020,4,0,Bermuda,BM,BMU,63968,2020-03-23,BM
22/03/2020,22,3,2020,0,0,Bermuda,BM,BMU,63968,2020-03-22,BM
21/03/2020,21,3,2020,0,0,Bermuda,BM,BMU,63968,2020-03-21,BM
20/03/2020,20,3,2020,2,0,Bermuda,BM,BMU,63968,2020-03-20,BM
13/04/2020,13,4,2020,0,0,Bhutan,BT,BTN,754394,2020-04-13,BT
12/04/2020,12,4,2020,0,0,Bhutan,BT,BTN,754394,2020-04-12,BT
11/04/2020,11,4,2020,0,0,Bhutan,BT,BTN,754394,2020-04-11,BT
10/04/2020,10,4,2020,0,0,Bhutan,BT,BTN,754394,2020-04-10,BT
09/04/2020,9,4,2020,0,0,Bhutan,BT,BTN,754394,2020-04-09,BT
08/04/2020,8,4,2020,0,0,Bhutan,BT,BTN,754394,2020-04-08,BT
07/04/2020,7,4,2020,0,0,Bhutan,BT,BTN,754394,2020-04-07,BT
06/04/2020,6,4,2020,0,0,Bhutan,BT,BTN,754394,2020-04-06,BT
05/04/2020,5,4,2020,0,0,Bhutan,BT,BTN,754394,2020-04-05,BT
04/04/2020,4,4,2020,0,0,Bhutan,BT,BTN,754394,2020-04-04,BT
03/04/2020,3,4,2020,0,0,Bhutan,BT,BTN,754394,2020-04-03,BT
02/04/2020,2,4,2020,1,0,Bhutan,BT,BTN,754394,2020-04-02,BT
01/04/2020,1,4,2020,0,0,Bhutan,BT,BTN,754394,2020-04-01,BT
31/03/2020,31,3,2020,0,0,Bhutan,BT,BTN,754394,2020-03-31,BT
30/03/2020,30,3,2020,0,0,Bhutan,BT,BTN,754394,2020-03-30,BT
29/03/2020,29,3,2020,1,0,Bhutan,BT,BTN,754394,2020-03-29,BT
28/03/2020,28,3,2020,0,0,Bhutan,BT,BTN,754394,2020-03-28,BT
27/03/2020,27,3,2020,0,0,Bhutan,BT,BTN,754394,2020-03-27,BT
26/03/2020,26,3,2020,1,0,Bhutan,BT,BTN,754394,2020-03-26,BT
25/03/2020,25,3,2020,0,0,Bhutan,BT,BTN,754394,2020-03-25,BT
24/03/2020,24,3,2020,0,0,Bhutan,BT,BTN,754394,2020-03-24,BT
23/03/2020,23,3,2020,0,0,Bhutan,BT,BTN,754394,2020-03-23,BT
22/03/2020,22,3,2020,0,0,Bhutan,BT,BTN,754394,2020-03-22,BT
21/03/2020,21,3,2020,1,0,Bhutan,BT,BTN,754394,2020-03-21,BT
20/03/2020,20,3,2020,0,0,Bhutan,BT,BTN,754394,2020-03-20,BT
19/03/2020,19,3,2020,0,0,Bhutan,BT,BTN,754394,2020-03-19,BT
18/03/2020,18,3,2020,0,0,Bhutan,BT,BTN,754394,2020-03-18,BT
17/03/2020,17,3,2020,0,0,Bhutan,BT,BTN,754394,2020-03-17,BT
15/03/2020,15,3,2020,0,0,Bhutan,BT,BTN,754394,2020-03-15,BT
13/03/2020,13,3,2020,0,0,Bhutan,BT,BTN,754394,2020-03-13,BT
06/03/2020,6,3,2020,1,0,Bhutan,BT,BTN,754394,2020-03-06,BT
13/04/2020,13,4,2020,30,3,Bolivia,BO,BOL,11353142,2020-04-13,BO
12/04/2020,12,4,2020,24,4,Bolivia,BO,BOL,11353142,2020-04-12,BO
11/04/2020,11,4,2020,8,1,Bolivia,BO,BOL,11353142,2020-04-11,BO
10/04/2020,10,4,2020,4,1,Bolivia,BO,BOL,11353142,2020-04-10,BO
09/04/2020,9,4,2020,54,3,Bolivia,BO,BOL,11353142,2020-04-09,BO
08/04/2020,8,4,2020,16,1,Bolivia,BO,BOL,11353142,2020-04-08,BO
07/04/2020,7,4,2020,11,3,Bolivia,BO,BOL,11353142,2020-04-07,BO
06/04/2020,6,4,2020,26,1,Bolivia,BO,BOL,11353142,2020-04-06,BO
05/04/2020,5,4,2020,18,0,Bolivia,BO,BOL,11353142,2020-04-05,BO
04/04/2020,4,4,2020,7,1,Bolivia,BO,BOL,11353142,2020-04-04,BO
03/04/2020,3,4,2020,9,1,Bolivia,BO,BOL,11353142,2020-04-03,BO
02/04/2020,2,4,2020,8,1,Bolivia,BO,BOL,11353142,2020-04-02,BO
01/04/2020,1,4,2020,8,1,Bolivia,BO,BOL,11353142,2020-04-01,BO
31/03/2020,31,3,2020,11,3,Bolivia,BO,BOL,11353142,2020-03-31,BO
30/03/2020,30,3,2020,15,3,Bolivia,BO,BOL,11353142,2020-03-30,BO
29/03/2020,29,3,2020,7,0,Bolivia,BO,BOL,11353142,2020-03-29,BO
28/03/2020,28,3,2020,13,0,Bolivia,BO,BOL,11353142,2020-03-28,BO
27/03/2020,27,3,2020,22,0,Bolivia,BO,BOL,11353142,2020-03-27,BO
26/03/2020,26,3,2020,7,0,Bolivia,BO,BOL,11353142,2020-03-26,BO
25/03/2020,25,3,2020,4,0,Bolivia,BO,BOL,11353142,2020-03-25,BO
24/03/2020,24,3,2020,1,0,Bolivia,BO,BOL,11353142,2020-03-24,BO
23/03/2020,23,3,2020,7,0,Bolivia,BO,BOL,11353142,2020-03-23,BO
22/03/2020,22,3,2020,1,0,Bolivia,BO,BOL,11353142,2020-03-22,BO
21/03/2020,21,3,2020,4,0,Bolivia,BO,BOL,11353142,2020-03-21,BO
20/03/2020,20,3,2020,3,0,Bolivia,BO,BOL,11353142,2020-03-20,BO
19/03/2020,19,3,2020,0,0,Bolivia,BO,BOL,11353142,2020-03-19,BO
18/03/2020,18,3,2020,1,0,Bolivia,BO,BOL,11353142,2020-03-18,BO
17/03/2020,17,3,2020,1,0,Bolivia,BO,BOL,11353142,2020-03-17,BO
15/03/2020,15,3,2020,0,0,Bolivia,BO,BOL,11353142,2020-03-15,BO
14/03/2020,14,3,2020,7,0,Bolivia,BO,BOL,11353142,2020-03-14,BO
13/03/2020,13,3,2020,1,0,Bolivia,BO,BOL,11353142,2020-03-13,BO
12/03/2020,12,3,2020,2,0,Bolivia,BO,BOL,11353142,2020-03-12,BO
13/04/2020,13,4,2020,1,0,"Bonaire, Saint Eustatius and Saba",BQ,,NA,2020-04-13,BQ
12/04/2020,12,4,2020,0,0,"Bonaire, Saint Eustatius and Saba",BQ,,NA,2020-04-12,BQ
11/04/2020,11,4,2020,0,0,"Bonaire, Saint Eustatius and Saba",BQ,,NA,2020-04-11,BQ
10/04/2020,10,4,2020,0,0,"Bonaire, Saint Eustatius and Saba",BQ,,NA,2020-04-10,BQ
09/04/2020,9,4,2020,0,0,"Bonaire, Saint Eustatius and Saba",BQ,,NA,2020-04-09,BQ
08/04/2020,8,4,2020,0,0,"Bonaire, Saint Eustatius and Saba",BQ,,NA,2020-04-08,BQ
07/04/2020,7,4,2020,0,0,"Bonaire, Saint Eustatius and Saba",BQ,,NA,2020-04-07,BQ
06/04/2020,6,4,2020,0,0,"Bonaire, Saint Eustatius and Saba",BQ,,NA,2020-04-06,BQ
05/04/2020,5,4,2020,0,0,"Bonaire, Saint Eustatius and Saba",BQ,,NA,2020-04-05,BQ
04/04/2020,4,4,2020,0,0,"Bonaire, Saint Eustatius and Saba",BQ,,NA,2020-04-04,BQ
03/04/2020,3,4,2020,0,0,"Bonaire, Saint Eustatius and Saba",BQ,,NA,2020-04-03,BQ
02/04/2020,2,4,2020,2,0,"Bonaire, Saint Eustatius and Saba",BQ,,NA,2020-04-02,BQ
13/04/2020,13,4,2020,59,1,Bosnia_and_Herzegovina,BA,BIH,3323929,2020-04-13,BA
12/04/2020,12,4,2020,47,0,Bosnia_and_Herzegovina,BA,BIH,3323929,2020-04-12,BA
11/04/2020,11,4,2020,26,1,Bosnia_and_Herzegovina,BA,BIH,3323929,2020-04-11,BA
10/04/2020,10,4,2020,59,1,Bosnia_and_Herzegovina,BA,BIH,3323929,2020-04-10,BA
09/04/2020,9,4,2020,35,3,Bosnia_and_Herzegovina,BA,BIH,3323929,2020-04-09,BA
08/04/2020,8,4,2020,86,4,Bosnia_and_Herzegovina,BA,BIH,3323929,2020-04-08,BA
07/04/2020,7,4,2020,32,4,Bosnia_and_Herzegovina,BA,BIH,3323929,2020-04-07,BA
06/04/2020,6,4,2020,31,3,Bosnia_and_Herzegovina,BA,BIH,3323929,2020-04-06,BA
05/04/2020,5,4,2020,46,3,Bosnia_and_Herzegovina,BA,BIH,3323929,2020-04-05,BA
04/04/2020,4,4,2020,54,1,Bosnia_and_Herzegovina,BA,BIH,3323929,2020-04-04,BA
03/04/2020,3,4,2020,68,4,Bosnia_and_Herzegovina,BA,BIH,3323929,2020-04-03,BA
02/04/2020,2,4,2020,51,1,Bosnia_and_Herzegovina,BA,BIH,3323929,2020-04-02,BA
01/04/2020,1,4,2020,60,4,Bosnia_and_Herzegovina,BA,BIH,3323929,2020-04-01,BA
31/03/2020,31,3,2020,30,2,Bosnia_and_Herzegovina,BA,BIH,3323929,2020-03-31,BA
30/03/2020,30,3,2020,66,1,Bosnia_and_Herzegovina,BA,BIH,3323929,2020-03-30,BA
29/03/2020,29,3,2020,28,2,Bosnia_and_Herzegovina,BA,BIH,3323929,2020-03-29,BA
28/03/2020,28,3,2020,48,0,Bosnia_and_Herzegovina,BA,BIH,3323929,2020-03-28,BA
27/03/2020,27,3,2020,0,0,Bosnia_and_Herzegovina,BA,BIH,3323929,2020-03-27,BA
26/03/2020,26,3,2020,19,1,Bosnia_and_Herzegovina,BA,BIH,3323929,2020-03-26,BA
25/03/2020,25,3,2020,33,1,Bosnia_and_Herzegovina,BA,BIH,3323929,2020-03-25,BA
24/03/2020,24,3,2020,4,0,Bosnia_and_Herzegovina,BA,BIH,3323929,2020-03-24,BA
23/03/2020,23,3,2020,33,0,Bosnia_and_Herzegovina,BA,BIH,3323929,2020-03-23,BA
22/03/2020,22,3,2020,48,1,Bosnia_and_Herzegovina,BA,BIH,3323929,2020-03-22,BA
21/03/2020,21,3,2020,0,0,Bosnia_and_Herzegovina,BA,BIH,3323929,2020-03-21,BA
20/03/2020,20,3,2020,8,0,Bosnia_and_Herzegovina,BA,BIH,3323929,2020-03-20,BA
19/03/2020,19,3,2020,15,0,Bosnia_and_Herzegovina,BA,BIH,3323929,2020-03-19,BA
18/03/2020,18,3,2020,0,0,Bosnia_and_Herzegovina,BA,BIH,3323929,2020-03-18,BA
17/03/2020,17,3,2020,3,0,Bosnia_and_Herzegovina,BA,BIH,3323929,2020-03-17,BA
16/03/2020,16,3,2020,15,0,Bosnia_and_Herzegovina,BA,BIH,3323929,2020-03-16,BA
13/03/2020,13,3,2020,0,0,Bosnia_and_Herzegovina,BA,BIH,3323929,2020-03-13,BA
12/03/2020,12,3,2020,1,0,Bosnia_and_Herzegovina,BA,BIH,3323929,2020-03-12,BA
06/03/2020,6,3,2020,2,0,Bosnia_and_Herzegovina,BA,BIH,3323929,2020-03-06,BA
13/04/2020,13,4,2020,0,0,Botswana,BW,BWA,2254126,2020-04-13,BW
12/04/2020,12,4,2020,0,0,Botswana,BW,BWA,2254126,2020-04-12,BW
11/04/2020,11,4,2020,0,0,Botswana,BW,BWA,2254126,2020-04-11,BW
10/04/2020,10,4,2020,6,0,Botswana,BW,BWA,2254126,2020-04-10,BW
09/04/2020,9,4,2020,1,0,Botswana,BW,BWA,2254126,2020-04-09,BW
08/04/2020,8,4,2020,0,0,Botswana,BW,BWA,2254126,2020-04-08,BW
07/04/2020,7,4,2020,0,0,Botswana,BW,BWA,2254126,2020-04-07,BW
06/04/2020,6,4,2020,2,0,Botswana,BW,BWA,2254126,2020-04-06,BW
05/04/2020,5,4,2020,0,0,Botswana,BW,BWA,2254126,2020-04-05,BW
04/04/2020,4,4,2020,0,0,Botswana,BW,BWA,2254126,2020-04-04,BW
03/04/2020,3,4,2020,0,0,Botswana,BW,BWA,2254126,2020-04-03,BW
02/04/2020,2,4,2020,1,1,Botswana,BW,BWA,2254126,2020-04-02,BW
01/04/2020,1,4,2020,3,0,Botswana,BW,BWA,2254126,2020-04-01,BW
13/04/2020,13,4,2020,1442,99,Brazil,BR,BRA,209469333,2020-04-13,BR
12/04/2020,12,4,2020,1089,68,Brazil,BR,BRA,209469333,2020-04-12,BR
11/04/2020,11,4,2020,1781,115,Brazil,BR,BRA,209469333,2020-04-11,BR
10/04/2020,10,4,2020,1930,141,Brazil,BR,BRA,209469333,2020-04-10,BR
09/04/2020,9,4,2020,2210,133,Brazil,BR,BRA,209469333,2020-04-09,BR
08/04/2020,8,4,2020,1661,114,Brazil,BR,BRA,209469333,2020-04-08,BR
07/04/2020,7,4,2020,926,67,Brazil,BR,BRA,209469333,2020-04-07,BR
06/04/2020,6,4,2020,852,54,Brazil,BR,BRA,209469333,2020-04-06,BR
05/04/2020,5,4,2020,1222,73,Brazil,BR,BRA,209469333,2020-04-05,BR
04/04/2020,4,4,2020,1146,60,Brazil,BR,BRA,209469333,2020-04-04,BR
03/04/2020,3,4,2020,1074,58,Brazil,BR,BRA,209469333,2020-04-03,BR
02/04/2020,2,4,2020,1119,40,Brazil,BR,BRA,209469333,2020-04-02,BR
01/04/2020,1,4,2020,1138,42,Brazil,BR,BRA,209469333,2020-04-01,BR
31/03/2020,31,3,2020,323,23,Brazil,BR,BRA,209469333,2020-03-31,BR
30/03/2020,30,3,2020,352,22,Brazil,BR,BRA,209469333,2020-03-30,BR
29/03/2020,29,3,2020,487,22,Brazil,BR,BRA,209469333,2020-03-29,BR
28/03/2020,28,3,2020,502,15,Brazil,BR,BRA,209469333,2020-03-28,BR
27/03/2020,27,3,2020,482,20,Brazil,BR,BRA,209469333,2020-03-27,BR
26/03/2020,26,3,2020,232,11,Brazil,BR,BRA,209469333,2020-03-26,BR
25/03/2020,25,3,2020,310,12,Brazil,BR,BRA,209469333,2020-03-25,BR
24/03/2020,24,3,2020,345,9,Brazil,BR,BRA,209469333,2020-03-24,BR
23/03/2020,23,3,2020,418,7,Brazil,BR,BRA,209469333,2020-03-23,BR
22/03/2020,22,3,2020,224,7,Brazil,BR,BRA,209469333,2020-03-22,BR
21/03/2020,21,3,2020,283,5,Brazil,BR,BRA,209469333,2020-03-21,BR
20/03/2020,20,3,2020,193,2,Brazil,BR,BRA,209469333,2020-03-20,BR
19/03/2020,19,3,2020,137,3,Brazil,BR,BRA,209469333,2020-03-19,BR
18/03/2020,18,3,2020,57,1,Brazil,BR,BRA,209469333,2020-03-18,BR
17/03/2020,17,3,2020,34,0,Brazil,BR,BRA,209469333,2020-03-17,BR
16/03/2020,16,3,2020,79,0,Brazil,BR,BRA,209469333,2020-03-16,BR
15/03/2020,15,3,2020,23,0,Brazil,BR,BRA,209469333,2020-03-15,BR
14/03/2020,14,3,2020,21,0,Brazil,BR,BRA,209469333,2020-03-14,BR
13/03/2020,13,3,2020,25,0,Brazil,BR,BRA,209469333,2020-03-13,BR
12/03/2020,12,3,2020,18,0,Brazil,BR,BRA,209469333,2020-03-12,BR
11/03/2020,11,3,2020,9,0,Brazil,BR,BRA,209469333,2020-03-11,BR
09/03/2020,9,3,2020,12,0,Brazil,BR,BRA,209469333,2020-03-09,BR
08/03/2020,8,3,2020,0,0,Brazil,BR,BRA,209469333,2020-03-08,BR
07/03/2020,7,3,2020,5,0,Brazil,BR,BRA,209469333,2020-03-07,BR
06/03/2020,6,3,2020,5,0,Brazil,BR,BRA,209469333,2020-03-06,BR
05/03/2020,5,3,2020,1,0,Brazil,BR,BRA,209469333,2020-03-05,BR
02/03/2020,2,3,2020,0,0,Brazil,BR,BRA,209469333,2020-03-02,BR
01/03/2020,1,3,2020,1,0,Brazil,BR,BRA,209469333,2020-03-01,BR
29/02/2020,29,2,2020,0,0,Brazil,BR,BRA,209469333,2020-02-29,BR
28/02/2020,28,2,2020,0,0,Brazil,BR,BRA,209469333,2020-02-28,BR
27/02/2020,27,2,2020,0,0,Brazil,BR,BRA,209469333,2020-02-27,BR
26/02/2020,26,2,2020,1,0,Brazil,BR,BRA,209469333,2020-02-26,BR
25/02/2020,25,2,2020,0,0,Brazil,BR,BRA,209469333,2020-02-25,BR
24/02/2020,24,2,2020,0,0,Brazil,BR,BRA,209469333,2020-02-24,BR
23/02/2020,23,2,2020,0,0,Brazil,BR,BRA,209469333,2020-02-23,BR
22/02/2020,22,2,2020,0,0,Brazil,BR,BRA,209469333,2020-02-22,BR
21/02/2020,21,2,2020,0,0,Brazil,BR,BRA,209469333,2020-02-21,BR
20/02/2020,20,2,2020,0,0,Brazil,BR,BRA,209469333,2020-02-20,BR
19/02/2020,19,2,2020,0,0,Brazil,BR,BRA,209469333,2020-02-19,BR
18/02/2020,18,2,2020,0,0,Brazil,BR,BRA,209469333,2020-02-18,BR
17/02/2020,17,2,2020,0,0,Brazil,BR,BRA,209469333,2020-02-17,BR
16/02/2020,16,2,2020,0,0,Brazil,BR,BRA,209469333,2020-02-16,BR
15/02/2020,15,2,2020,0,0,Brazil,BR,BRA,209469333,2020-02-15,BR
14/02/2020,14,2,2020,0,0,Brazil,BR,BRA,209469333,2020-02-14,BR
13/02/2020,13,2,2020,0,0,Brazil,BR,BRA,209469333,2020-02-13,BR
12/02/2020,12,2,2020,0,0,Brazil,BR,BRA,209469333,2020-02-12,BR
11/02/2020,11,2,2020,0,0,Brazil,BR,BRA,209469333,2020-02-11,BR
10/02/2020,10,2,2020,0,0,Brazil,BR,BRA,209469333,2020-02-10,BR
09/02/2020,9,2,2020,0,0,Brazil,BR,BRA,209469333,2020-02-09,BR
08/02/2020,8,2,2020,0,0,Brazil,BR,BRA,209469333,2020-02-08,BR
07/02/2020,7,2,2020,0,0,Brazil,BR,BRA,209469333,2020-02-07,BR
06/02/2020,6,2,2020,0,0,Brazil,BR,BRA,209469333,2020-02-06,BR
05/02/2020,5,2,2020,0,0,Brazil,BR,BRA,209469333,2020-02-05,BR
04/02/2020,4,2,2020,0,0,Brazil,BR,BRA,209469333,2020-02-04,BR
03/02/2020,3,2,2020,0,0,Brazil,BR,BRA,209469333,2020-02-03,BR
02/02/2020,2,2,2020,0,0,Brazil,BR,BRA,209469333,2020-02-02,BR
01/02/2020,1,2,2020,0,0,Brazil,BR,BRA,209469333,2020-02-01,BR
31/01/2020,31,1,2020,0,0,Brazil,BR,BRA,209469333,2020-01-31,BR
30/01/2020,30,1,2020,0,0,Brazil,BR,BRA,209469333,2020-01-30,BR
29/01/2020,29,1,2020,0,0,Brazil,BR,BRA,209469333,2020-01-29,BR
28/01/2020,28,1,2020,0,0,Brazil,BR,BRA,209469333,2020-01-28,BR
27/01/2020,27,1,2020,0,0,Brazil,BR,BRA,209469333,2020-01-27,BR
26/01/2020,26,1,2020,0,0,Brazil,BR,BRA,209469333,2020-01-26,BR
25/01/2020,25,1,2020,0,0,Brazil,BR,BRA,209469333,2020-01-25,BR
24/01/2020,24,1,2020,0,0,Brazil,BR,BRA,209469333,2020-01-24,BR
23/01/2020,23,1,2020,0,0,Brazil,BR,BRA,209469333,2020-01-23,BR
22/01/2020,22,1,2020,0,0,Brazil,BR,BRA,209469333,2020-01-22,BR
21/01/2020,21,1,2020,0,0,Brazil,BR,BRA,209469333,2020-01-21,BR
20/01/2020,20,1,2020,0,0,Brazil,BR,BRA,209469333,2020-01-20,BR
19/01/2020,19,1,2020,0,0,Brazil,BR,BRA,209469333,2020-01-19,BR
18/01/2020,18,1,2020,0,0,Brazil,BR,BRA,209469333,2020-01-18,BR
17/01/2020,17,1,2020,0,0,Brazil,BR,BRA,209469333,2020-01-17,BR
16/01/2020,16,1,2020,0,0,Brazil,BR,BRA,209469333,2020-01-16,BR
15/01/2020,15,1,2020,0,0,Brazil,BR,BRA,209469333,2020-01-15,BR
14/01/2020,14,1,2020,0,0,Brazil,BR,BRA,209469333,2020-01-14,BR
13/01/2020,13,1,2020,0,0,Brazil,BR,BRA,209469333,2020-01-13,BR
12/01/2020,12,1,2020,0,0,Brazil,BR,BRA,209469333,2020-01-12,BR
11/01/2020,11,1,2020,0,0,Brazil,BR,BRA,209469333,2020-01-11,BR
10/01/2020,10,1,2020,0,0,Brazil,BR,BRA,209469333,2020-01-10,BR
09/01/2020,9,1,2020,0,0,Brazil,BR,BRA,209469333,2020-01-09,BR
08/01/2020,8,1,2020,0,0,Brazil,BR,BRA,209469333,2020-01-08,BR
07/01/2020,7,1,2020,0,0,Brazil,BR,BRA,209469333,2020-01-07,BR
06/01/2020,6,1,2020,0,0,Brazil,BR,BRA,209469333,2020-01-06,BR
05/01/2020,5,1,2020,0,0,Brazil,BR,BRA,209469333,2020-01-05,BR
04/01/2020,4,1,2020,0,0,Brazil,BR,BRA,209469333,2020-01-04,BR
03/01/2020,3,1,2020,0,0,Brazil,BR,BRA,209469333,2020-01-03,BR
02/01/2020,2,1,2020,0,0,Brazil,BR,BRA,209469333,2020-01-02,BR
01/01/2020,1,1,2020,0,0,Brazil,BR,BRA,209469333,2020-01-01,BR
31/12/2019,31,12,2019,0,0,Brazil,BR,BRA,209469333,2019-12-31,BR
13/04/2020,13,4,2020,0,0,British_Virgin_Islands,VG,VGB,29802,2020-04-13,VG
12/04/2020,12,4,2020,0,0,British_Virgin_Islands,VG,VGB,29802,2020-04-12,VG
11/04/2020,11,4,2020,0,0,British_Virgin_Islands,VG,VGB,29802,2020-04-11,VG
10/04/2020,10,4,2020,0,0,British_Virgin_Islands,VG,VGB,29802,2020-04-10,VG
09/04/2020,9,4,2020,0,0,British_Virgin_Islands,VG,VGB,29802,2020-04-09,VG
08/04/2020,8,4,2020,0,0,British_Virgin_Islands,VG,VGB,29802,2020-04-08,VG
07/04/2020,7,4,2020,0,0,British_Virgin_Islands,VG,VGB,29802,2020-04-07,VG
06/04/2020,6,4,2020,0,0,British_Virgin_Islands,VG,VGB,29802,2020-04-06,VG
05/04/2020,5,4,2020,0,0,British_Virgin_Islands,VG,VGB,29802,2020-04-05,VG
04/04/2020,4,4,2020,0,0,British_Virgin_Islands,VG,VGB,29802,2020-04-04,VG
03/04/2020,3,4,2020,0,0,British_Virgin_Islands,VG,VGB,29802,2020-04-03,VG
02/04/2020,2,4,2020,0,0,British_Virgin_Islands,VG,VGB,29802,2020-04-02,VG
01/04/2020,1,4,2020,0,0,British_Virgin_Islands,VG,VGB,29802,2020-04-01,VG
31/03/2020,31,3,2020,1,0,British_Virgin_Islands,VG,VGB,29802,2020-03-31,VG
30/03/2020,30,3,2020,0,0,British_Virgin_Islands,VG,VGB,29802,2020-03-30,VG
29/03/2020,29,3,2020,0,0,British_Virgin_Islands,VG,VGB,29802,2020-03-29,VG
28/03/2020,28,3,2020,0,0,British_Virgin_Islands,VG,VGB,29802,2020-03-28,VG
27/03/2020,27,3,2020,2,0,British_Virgin_Islands,VG,VGB,29802,2020-03-27,VG
13/04/2020,13,4,2020,0,0,Brunei_Darussalam,BN,BRN,428962,2020-04-13,BN
12/04/2020,12,4,2020,0,0,Brunei_Darussalam,BN,BRN,428962,2020-04-12,BN
11/04/2020,11,4,2020,1,0,Brunei_Darussalam,BN,BRN,428962,2020-04-11,BN
10/04/2020,10,4,2020,0,0,Brunei_Darussalam,BN,BRN,428962,2020-04-10,BN
09/04/2020,9,4,2020,0,0,Brunei_Darussalam,BN,BRN,428962,2020-04-09,BN
08/04/2020,8,4,2020,0,0,Brunei_Darussalam,BN,BRN,428962,2020-04-08,BN
07/04/2020,7,4,2020,0,0,Brunei_Darussalam,BN,BRN,428962,2020-04-07,BN
06/04/2020,6,4,2020,0,0,Brunei_Darussalam,BN,BRN,428962,2020-04-06,BN
05/04/2020,5,4,2020,2,0,Brunei_Darussalam,BN,BRN,428962,2020-04-05,BN
04/04/2020,4,4,2020,0,0,Brunei_Darussalam,BN,BRN,428962,2020-04-04,BN
03/04/2020,3,4,2020,2,0,Brunei_Darussalam,BN,BRN,428962,2020-04-03,BN
02/04/2020,2,4,2020,2,0,Brunei_Darussalam,BN,BRN,428962,2020-04-02,BN
01/04/2020,1,4,2020,2,0,Brunei_Darussalam,BN,BRN,428962,2020-04-01,BN
31/03/2020,31,3,2020,1,0,Brunei_Darussalam,BN,BRN,428962,2020-03-31,BN
30/03/2020,30,3,2020,6,0,Brunei_Darussalam,BN,BRN,428962,2020-03-30,BN
29/03/2020,29,3,2020,5,1,Brunei_Darussalam,BN,BRN,428962,2020-03-29,BN
28/03/2020,28,3,2020,1,0,Brunei_Darussalam,BN,BRN,428962,2020-03-28,BN
27/03/2020,27,3,2020,7,0,Brunei_Darussalam,BN,BRN,428962,2020-03-27,BN
26/03/2020,26,3,2020,3,0,Brunei_Darussalam,BN,BRN,428962,2020-03-26,BN
25/03/2020,25,3,2020,13,0,Brunei_Darussalam,BN,BRN,428962,2020-03-25,BN
24/03/2020,24,3,2020,3,0,Brunei_Darussalam,BN,BRN,428962,2020-03-24,BN
23/03/2020,23,3,2020,5,0,Brunei_Darussalam,BN,BRN,428962,2020-03-23,BN
22/03/2020,22,3,2020,5,0,Brunei_Darussalam,BN,BRN,428962,2020-03-22,BN
21/03/2020,21,3,2020,5,0,Brunei_Darussalam,BN,BRN,428962,2020-03-21,BN
20/03/2020,20,3,2020,5,0,Brunei_Darussalam,BN,BRN,428962,2020-03-20,BN
19/03/2020,19,3,2020,12,0,Brunei_Darussalam,BN,BRN,428962,2020-03-19,BN
18/03/2020,18,3,2020,2,0,Brunei_Darussalam,BN,BRN,428962,2020-03-18,BN
17/03/2020,17,3,2020,4,0,Brunei_Darussalam,BN,BRN,428962,2020-03-17,BN
16/03/2020,16,3,2020,10,0,Brunei_Darussalam,BN,BRN,428962,2020-03-16,BN
15/03/2020,15,3,2020,3,0,Brunei_Darussalam,BN,BRN,428962,2020-03-15,BN
14/03/2020,14,3,2020,12,0,Brunei_Darussalam,BN,BRN,428962,2020-03-14,BN
13/03/2020,13,3,2020,14,0,Brunei_Darussalam,BN,BRN,428962,2020-03-13,BN
12/03/2020,12,3,2020,10,0,Brunei_Darussalam,BN,BRN,428962,2020-03-12,BN
10/03/2020,10,3,2020,1,0,Brunei_Darussalam,BN,BRN,428962,2020-03-10,BN
13/04/2020,13,4,2020,14,1,Bulgaria,BG,BGR,7024216,2020-04-13,BG
12/04/2020,12,4,2020,26,3,Bulgaria,BG,BGR,7024216,2020-04-12,BG
11/04/2020,11,4,2020,11,1,Bulgaria,BG,BGR,7024216,2020-04-11,BG
10/04/2020,10,4,2020,31,0,Bulgaria,BG,BGR,7024216,2020-04-10,BG
09/04/2020,9,4,2020,16,1,Bulgaria,BG,BGR,7024216,2020-04-09,BG
08/04/2020,8,4,2020,28,1,Bulgaria,BG,BGR,7024216,2020-04-08,BG
07/04/2020,7,4,2020,18,2,Bulgaria,BG,BGR,7024216,2020-04-07,BG
06/04/2020,6,4,2020,28,3,Bulgaria,BG,BGR,7024216,2020-04-06,BG
05/04/2020,5,4,2020,18,3,Bulgaria,BG,BGR,7024216,2020-04-05,BG
04/04/2020,4,4,2020,28,4,Bulgaria,BG,BGR,7024216,2020-04-04,BG
03/04/2020,3,4,2020,35,0,Bulgaria,BG,BGR,7024216,2020-04-03,BG
02/04/2020,2,4,2020,23,2,Bulgaria,BG,BGR,7024216,2020-04-02,BG
01/04/2020,1,4,2020,40,0,Bulgaria,BG,BGR,7024216,2020-04-01,BG
31/03/2020,31,3,2020,13,0,Bulgaria,BG,BGR,7024216,2020-03-31,BG
30/03/2020,30,3,2020,15,1,Bulgaria,BG,BGR,7024216,2020-03-30,BG
29/03/2020,29,3,2020,38,4,Bulgaria,BG,BGR,7024216,2020-03-29,BG
28/03/2020,28,3,2020,29,0,Bulgaria,BG,BGR,7024216,2020-03-28,BG
27/03/2020,27,3,2020,22,0,Bulgaria,BG,BGR,7024216,2020-03-27,BG
26/03/2020,26,3,2020,22,0,Bulgaria,BG,BGR,7024216,2020-03-26,BG
25/03/2020,25,3,2020,19,0,Bulgaria,BG,BGR,7024216,2020-03-25,BG
24/03/2020,24,3,2020,16,0,Bulgaria,BG,BGR,7024216,2020-03-24,BG
23/03/2020,23,3,2020,22,0,Bulgaria,BG,BGR,7024216,2020-03-23,BG
22/03/2020,22,3,2020,36,0,Bulgaria,BG,BGR,7024216,2020-03-22,BG
21/03/2020,21,3,2020,22,0,Bulgaria,BG,BGR,7024216,2020-03-21,BG
20/03/2020,20,3,2020,13,1,Bulgaria,BG,BGR,7024216,2020-03-20,BG
19/03/2020,19,3,2020,11,0,Bulgaria,BG,BGR,7024216,2020-03-19,BG
18/03/2020,18,3,2020,19,0,Bulgaria,BG,BGR,7024216,2020-03-18,BG
17/03/2020,17,3,2020,11,0,Bulgaria,BG,BGR,7024216,2020-03-17,BG
16/03/2020,16,3,2020,10,0,Bulgaria,BG,BGR,7024216,2020-03-16,BG
15/03/2020,15,3,2020,10,1,Bulgaria,BG,BGR,7024216,2020-03-15,BG
14/03/2020,14,3,2020,8,0,Bulgaria,BG,BGR,7024216,2020-03-14,BG
13/03/2020,13,3,2020,16,0,Bulgaria,BG,BGR,7024216,2020-03-13,BG
